account_name,taxonomy_account_name,account_code,values
เงินสดและรายการเทียบเท่าเงินสด,เงินสดและรายการเทียบเท่าเงินสด,110100,"['3,793,520', '2,450,313']"
ลูกหนี้การค้า,ลูกหนี้การค้า,112040,"['80,295,773', '77,290,640']"
ลูกหนี้อื่น,ลูกหนี้อื่น,113130,"['636,060', '492,102']"
ส่วนของเงินให้กู้ยืมระยะยาวแก่บริษัทย่อยที่ถึงกำหนดชำระภายในหนึ่งปี,ส่วนของเงินให้กู้ยืมระยะยาวแก่บริษัทย่อยที่ถึงกำหนดชำระภายในหนึ่งปี,112420,"['0.0', '27,820']"
เงินให้สินเชื่อจากการซื้อลูกหนี้ที่คาดว่าจะได้รับชำระภายในหนึ่งปี,เงินให้สินเชื่อจากการซื้อลูกหนี้ที่คาดว่าจะได้รับชำระภายในหนึ่งปี,112050,"['2,147', '0.0']"
จำนวนเงินส่วนร่วมในนิติบุคคลเฉพาะกิจเพื่อการแปลงสินทรัพย์เป็นหลักทรัพย์,จำนวนเงินส่วนร่วมในนิติบุคคลเฉพาะกิจเพื่อการแปลงสินทรัพย์เป็นหลักทรัพย์,113190,"['0.0', '276,045']"
ส่วนของสินทรัพย์อนุพันธ์ที่ถึงกำหนดชำระภายในหนึ่งปี,ส่วนของสินทรัพย์อนุพันธ์ที่ถึงกำหนดชำระภายในหนึ่งปี,113000,"['890,645', '890,645']"
สินทรัพย์หมุนเวียนอื่น,สินทรัพย์หมุนเวียนอื่น,119990,"['79,245', '43,722']"
รวมสินทรัพย์หมุนเวียน,รวมสินทรัพย์หมุนเวียน,119999,"['85,697,390', '81,471,287']"
ลูกหนี้การค้า,ลูกหนี้การค้า,122040,"['3,587,069', '1,635,439']"
ลูกหนี้อื่น,ลูกหนี้อื่น,123140,"['74,085', '74,085']"
เงินฝากประจำธนาคารที่มีภาระผูกพัน,เงินฝากประจำธนาคารที่มีภาระผูกพัน,120300,"['110,842', '0.0']"
เงินให้กู้ยืมระยะยาวแก่บริษัทย่อย,เงินให้กู้ยืมระยะยาวแก่บริษัทย่อย,122400,"['0.0', '83,459']"
เงินให้สินเชื่อจากการซื้อลูกหนี้,เงินให้สินเชื่อจากการซื้อลูกหนี้,122050,"['52,171', '0.0']"
เงินลงทุนในบริษัทย่อย,เงินลงทุนในบริษัทย่อย,122710,"['0.0', '1,235,909']"
ผ่านกำไรหรือขาดทุน,ผ่านกำไรหรือขาดทุน,121640,"['5,062', '5,062']"
ผ่านกำไรขาดทุนเบ็ดเสร็จอื่น,ผ่านกำไรขาดทุนเบ็ดเสร็จอื่น,121650,"['144,000', '144,000']"
เงินให้กู้ยืมประเภทด้อยสิทธิ,เงินให้กู้ยืมประเภทด้อยสิทธิ,122400,"['0.0', '84,074']"
ส่วนปรับปรุงอาคารเช่าและอุปกรณ์,ส่วนปรับปรุงอาคารเช่าและอุปกรณ์,123800,"['527,491', '419,048']"
สินทรัพย์สิทธิการใช้,สินทรัพย์สิทธิการใช้,123900,"['753,480', '644,009']"
สินทรัพย์ไม่มีตัวตนอื่นนอกจากค่าความนิยม,สินทรัพย์ไม่มีตัวตนอื่นนอกจากค่าความนิยม,124190,"['862,203', '723,475']"
สินทรัพย์อนุพันธ์,สินทรัพย์อนุพันธ์,123000,"['430,263', '430,263']"
สินทรัพย์ภาษีเงินได้รอการตัดบัญชี,สินทรัพย์ภาษีเงินได้รอการตัดบัญชี,124400,"['2,543,252', '2,468,457']"
สินทรัพย์ไม่หมุนเวียนอื่น,สินทรัพย์ไม่หมุนเวียนอื่น,129990,"['158,889', '141,736']"
รวมสินทรัพย์ไม่หมุนเวียน,รวมสินทรัพย์ไม่หมุนเวียน,129999,"['9,248,807', '8,089,016']"
รวมสินทรัพย์,รวมสินทรัพย์,109999,"['94,946,197', '89,560,303']"
เงินเบิกเกินบัญชีและเงินกู้ยืมระยะสั้นจากสถาบันการเงิน,เงินเบิกเกินบัญชีและเงินกู้ยืมระยะสั้นจากสถาบันการเงิน,210500,"['6,525,791', '4,750,000']"
เจ้าหนี้การค้า,เจ้าหนี้การค้า,211100,"['63,423', '50,833']"
เจ้าหนี้อื่น,เจ้าหนี้อื่น,211160,"['1,555,161', '1,477,246']"
เงินกู้ยืมระยะยาว,เงินกู้ยืมระยะยาว,211890,"['12,706,135', '12,706,135']"
หนี้สินอนุพันธ์,หนี้สินอนุพันธ์,212100,"['765,259', '765,259']"
หนี้สินตามสัญญาเช่า,หนี้สินตามสัญญาเช่า,212400,"['418,693', '365,896']"
ภาษีเงินได้ค้างจ่าย,ภาษีเงินได้ค้างจ่าย,213000,"['580,860', '531,566']"
หนี้สินหมุนเวียนอื่น,หนี้สินหมุนเวียนอื่น,219900,"['373,199', '393,377']"
รวมหนี้สินหมุนเวียน,รวมหนี้สินหมุนเวียน,219999,"['22,988,521', '21,040,312']"
เงินกู้ยืมระยะยาว,เงินกู้ยืมระยะยาว,221890,"['36,254,206', '34,066,374']"
เงินกู้ยืมระยะยาวภายใต้โครงการแปลงสินทรัพย์เป็นหลักทรัพย์,เงินกู้ยืมระยะยาวภายใต้โครงการแปลงสินทรัพย์เป็นหลักทรัพย์,221890,"['0.0', '1,184,157']"
หุ้นกู้ระยะยาว,หุ้นกู้ระยะยาว,221830,"['9,266,194', '7,793,112']"
หนี้สินอนุพันธ์,หนี้สินอนุพันธ์,222100,"['1,195,114', '1,195,114']"
หนี้สินตามสัญญาเช่า,หนี้สินตามสัญญาเช่า,222400,"['366,334', '310,502']"
เงินกู้ยืมประเภทด้อยสิทธิ,เงินกู้ยืมประเภทด้อยสิทธิ,221890,"['84,074', '0.0']"
ประมาณการหนี้สินสำหรับผลประโยชน์พนักงาน,ประมาณการหนี้สินสำหรับผลประโยชน์พนักงาน,222700,"['478,451', '435,929']"
หนี้สินไม่หมุนเวียนอื่น,หนี้สินไม่หมุนเวียนอื่น,229900,"['83,804', '72,198']"
รวมหนี้สินไม่หมุนเวียน,รวมหนี้สินไม่หมุนเวียน,229999,"['47,728,177', '45,057,386']"
รวมหนี้สิน,รวมหนี้สิน,209999,"['70,716,698', '66,097,698']"
หุ้นสามัญ{{number}}หุ้นมูลค่าหุ้นละ{{number}}บาท,หุ้นสามัญ{{number}}หุ้นมูลค่าหุ้นละ{{number}}บาท,310120,"['250,000', '250,000']"
หุ้นสามัญ{{number}}หุ้นมูลค่าหุ้นละ{{number}}บาทชำระครบแล้ว,หุ้นสามัญ{{number}}หุ้นมูลค่าหุ้นละ{{number}}บาทชำระครบแล้ว,310220,"['250,000', '250,000']"
ส่วนเกินมูลค่าหุ้นสามัญ,ส่วนเกินมูลค่าหุ้นสามัญ,310420,"['478,000', '478,000']"
ส่วนเกินทุนจากการจ่ายโดยใช้หุ้นเป็นเกณฑ์,ส่วนเกินทุนจากการจ่ายโดยใช้หุ้นเป็นเกณฑ์,319920,"['13,696', '12,503']"
ส่วนต่ำกว่าทุนจากการเปลี่ยนแปลงสัดส่วนการถือหุ้นในบริษัทย่อย,ส่วนเกิน (ต่ำกว่า) ทุนจากการเปลี่ยนแปลงส่วนได้เสียในความเป็นเจ้าของในบริษัทย่อย,319921,"['(16)', '0.0']"
ทุนสำรองตามกฎหมาย,ทุนสำรองตามกฎหมาย,310611,"['25,000', '25,000']"
ทุนสำรองเพื่อการขยายกิจการ,ทุนสำรองเพื่อการขยายกิจการ,310619,"['4,850,000', '4,850,000']"
ยังไม่ได้จัดสรร,ยังไม่ได้จัดสรร,310620,"['18,103,912', '17,867,587']"
ผลต่างของอัตราแลกเปลี่ยนจากการแปลงค่างบการเงินต่างประเทศ,ผลต่างของอัตราแลกเปลี่ยนจากการแปลงค่างบการเงินต่างประเทศ,319950,"['(63,952)', '0.0']"
ผลขาดทุนสะสมจากการป้องกันความเสี่ยงกระแสเงินสด,ผลขาดทุนสะสมจากการป้องกันความเสี่ยงกระแสเงินสด,319917,"['(20,485)', '(20,485)']"
รวมส่วนของผู้ถือหุ้นบริษัทใหญ่,รวมส่วนของผู้ถือหุ้นบริษัทใหญ่,319999,"['23,636,155', '23,462,605']"
ส่วนได้เสียที่ไม่มีอำนาจควบคุม,ส่วนได้เสียที่ไม่มีอำนาจควบคุม,320130,"['593,344', '0.0']"
รวมส่วนของผู้ถือหุ้น,รวมส่วนของผู้ถือหุ้น,309998,"['24,229,499', '23,462,605']"
รวมหนี้สินและส่วนของผู้ถือหุ้น,รวมหนี้สินและส่วนของผู้ถือหุ้น,309999,"['94,946,197', '89,560,303']"
รายได้จากบัตรเครดิต,รายได้จากบัตรเครดิต,410109,"['1,967,930', '1,927,439']"
รายได้จากการให้กู้ยืม,รายได้จากการให้กู้ยืม,410109,"['2,554,225', '2,484,297']"
รายได้จากการให้เช่าซื้อ,รายได้จากการให้เช่าซื้อ,410110,"['247,668', '64,117']"
หนี้สูญรับคืน,หนี้สูญรับคืน,430700,"['450,786', '436,313']"
กำไรจากการขายลูกหนี้ที่ตัดจำหน่ายแล้ว,กำไรจากการขายลูกหนี้ที่ตัดจำหน่ายแล้ว,439790,"['167,108', '167,108']"
รายได้จากการให้บริการติดตามหนี้,รายได้จากการให้บริการติดตามหนี้,410103,"['58,333', '0.0']"
รายได้จากธุรกิจนายหน้าประกันภัย,รายได้จากธุรกิจนายหน้าประกันภัย,410119,"['160,346', '160,346']"
อื่นๆ,อื่นๆ,410200,"['69,975', '40,382']"
ค่าใช้จ่ายในการดำเนินงานและการบริหาร,ค่าใช้จ่ายในการดำเนินงานและการบริหาร,422120,"['2,014,676', '1,833,790']"
ค่าตอบแทนกรรมการและผู้บริหาร,ค่าตอบแทนกรรมการและผู้บริหาร,422600,"['55,182', '45,811']"
ขาดทุนจากการขายและตัดจำหน่ายส่วนปรับปรุงอาคารเช่าและอุปกรณ์และสินทรัพย์ไม่มีตัวตนอื่นนอกจากค่าความนิยม,ขาดทุนจากการขายและตัดจำหน่ายส่วนปรับปรุงอาคารเช่าและอุปกรณ์และสินทรัพย์ไม่มีตัวตนอื่นนอกจากค่าความนิยม,439740,"['1,434', '1,422']"
ต้นทุนทางการเงิน,ต้นทุนทางการเงิน,429900,"['574,148', '540,170']"
ผลขาดทุนด้านเครดิตที่คาดว่าจะเกิดขึ้น,ผลขาดทุนด้านเครดิตที่คาดว่าจะเกิดขึ้น,430700,"['1,948,740', '1,901,078']"
ค่าใช้จ่ายภาษีเงินได้,ค่าใช้จ่ายภาษีเงินได้,439800,"['218,472', '190,154']"
กำไรสำหรับงวด,กำไรสำหรับงวด,409996,"['863,719', '767,577']"
ส่วนที่เป็นของบริษัทใหญ่,ส่วนที่เป็นของบริษัทใหญ่,460100,"['841,878', '767,577']"
ส่วนที่เป็นของส่วนได้เสียที่ไม่มีอำนาจควบคุม,ส่วนที่เป็นของส่วนได้เสียที่ไม่มีอำนาจควบคุม,460200,"['21,841', '0.0']"
กำไรต่อหุ้นขั้นพื้นฐาน,กำไรต่อหุ้นขั้นพื้นฐาน,480100,"['3.37', '3.07']"
-ส่วนที่เป็นของบริษัทใหญ่,-ส่วนที่เป็นของบริษัทใหญ่,440500,"['26,300', '0.0']"
-ส่วนที่เป็นของส่วนได้เสียที่ไม่มีอำนาจควบคุม,-ส่วนที่เป็นของส่วนได้เสียที่ไม่มีอำนาจควบคุม,440500,"['30,064', '0.0']"
ผลกำไร(ขาดทุน)จากการป้องกันความเสี่ยงกระแสเงินสด,ผลกำไร(ขาดทุน)จากการป้องกันความเสี่ยงกระแสเงินสด,440500,"['156,749', '156,749']"
กำไรเบ็ดเสร็จรวมสำหรับงวด,กำไรเบ็ดเสร็จรวมสำหรับงวด,409999,"['1,076,832', '924,326']"
ส่วนที่เป็นของบริษัทใหญ่,ส่วนที่เป็นของบริษัทใหญ่,470100,"['1,024,927', '924,326']"
ส่วนที่เป็นของส่วนได้เสียที่ไม่มีอำนาจควบคุม,ส่วนที่เป็นของส่วนได้เสียที่ไม่มีอำนาจควบคุม,470200,"['51,905', '0.0']"
รายได้จากบัตรเครดิต,รายได้จากบัตรเครดิต,410109,"['3,919,037', '3,837,550']"
รายได้จากการให้กู้ยืม,รายได้จากการให้กู้ยืม,410109,"['5,088,540', '4,996,614']"
รายได้จากการให้เช่าซื้อ,รายได้จากการให้เช่าซื้อ,410110,"['487,800', '124,942']"
หนี้สูญรับคืน,หนี้สูญรับคืน,430700,"['891,935', '862,353']"
กำไรจากการขายลูกหนี้ที่ตัดจำหน่ายแล้ว,กำไรจากการขายลูกหนี้ที่ตัดจำหน่ายแล้ว,439790,"['167,108', '167,108']"
รายได้จากการให้บริการติดตามหนี้,รายได้จากการให้บริการติดตามหนี้,410103,"['113,053', '0.0']"
รายได้จากธุรกิจนายหน้าประกันภัย,รายได้จากธุรกิจนายหน้าประกันภัย,410119,"['330,004', '330,004']"
รายได้จากเงินปันผล,รายได้จากเงินปันผล,410202,"['0.0', '140,600']"
อื่นๆ,อื่นๆ,410200,"['138,085', '68,996']"
ค่าใช้จ่ายในการดำเนินงานและการบริหาร,ค่าใช้จ่ายในการดำเนินงานและการบริหาร,422120,"['4,005,143', '3,662,101']"
ค่าตอบแทนกรรมการและผู้บริหาร,ค่าตอบแทนกรรมการและผู้บริหาร,422600,"['93,488', '73,804']"
ขาดทุนจากการด้อยค่าสินทรัพย์,ขาดทุนจากการด้อยค่าสินทรัพย์,430900,"['4,341', '4,341']"
ขาดทุนจากการขายและตัดจำหน่ายส่วนปรับปรุงอาคารเช่าและอุปกรณ์และสินทรัพย์ไม่มีตัวตนอื่นนอกจากค่าความนิยม,ขาดทุนจากการขายและตัดจำหน่ายส่วนปรับปรุงอาคารเช่าและอุปกรณ์และสินทรัพย์ไม่มีตัวตนอื่นนอกจากค่าความนิยม,439740,"['1,790', '1,931']"
ต้นทุนทางการเงิน,ต้นทุนทางการเงิน,429900,"['1,101,120', '1,081,517']"
ผลขาดทุนด้านเครดิตที่คาดว่าจะเกิดขึ้น,ผลขาดทุนด้านเครดิตที่คาดว่าจะเกิดขึ้น,430700,"['4,042,640', '3,944,881']"
ค่าใช้จ่ายภาษีเงินได้,ค่าใช้จ่ายภาษีเงินได้,439800,"['379,305', '322,238']"
กำไรสำหรับงวด,กำไรสำหรับงวด,409991,"['1,507,735', '1,437,354']"
ส่วนที่เป็นของบริษัทใหญ่,ส่วนที่เป็นของบริษัทใหญ่,460100,"['1,459,188', '1,437,354']"
ส่วนที่เป็นของส่วนได้เสียที่ไม่มีอำนาจควบคุม,ส่วนที่เป็นของส่วนได้เสียที่ไม่มีอำนาจควบคุม,460200,"['48,547', '0.0']"
กำไรต่อหุ้นขั้นพื้นฐาน,กำไรต่อหุ้นขั้นพื้นฐาน,480100,"['5.84', '5.75']"
-ส่วนที่เป็นของบริษัทใหญ่,-ส่วนที่เป็นของบริษัทใหญ่,440500,"['19,502', '0.0']"
-ส่วนที่เป็นของส่วนได้เสียที่ไม่มีอำนาจควบคุม,-ส่วนที่เป็นของส่วนได้เสียที่ไม่มีอำนาจควบคุม,440500,"['22,362', '0.0']"
ผลกำไรจากการป้องกันความเสี่ยงกระแสเงินสด,ผลกำไรจากการป้องกันความเสี่ยงกระแสเงินสด,440500,"['69,066', '69,066']"
กำไรเบ็ดเสร็จรวมสำหรับงวด,กำไรเบ็ดเสร็จรวมสำหรับงวด,409999,"['1,618,665', '1,506,420']"
ส่วนที่เป็นของบริษัทใหญ่,ส่วนที่เป็นของบริษัทใหญ่,470100,"['1,547,756', '1,506,420']"
ส่วนที่เป็นของส่วนได้เสียที่ไม่มีอำนาจควบคุม,ส่วนที่เป็นของส่วนได้เสียที่ไม่มีอำนาจควบคุม,470200,"['70,909', '0.0']"
กำไรสำหรับงวด,กำไรสำหรับงวด,510100,"['1,507,735', '1,437,354']"
ค่าใช้จ่ายภาษีเงินได้,ค่าใช้จ่ายภาษีเงินได้,514900,"['379,305', '322,238']"
ผลขาดทุนด้านเครดิตที่คาดว่าจะเกิดขึ้น,ผลขาดทุนด้านเครดิตที่คาดว่าจะเกิดขึ้น,510400,"['4,042,640', '3,944,881']"
ขาดทุนจากการด้อยค่าสินทรัพย์,ขาดทุนจากการด้อยค่าสินทรัพย์,511700,"['4,341', '4,341']"
ค่าเสื่อมราคาส่วนปรับปรุงอาคารเช่าและอุปกรณ์และสินทรัพย์สิทธิการใช้,ค่าเสื่อมราคาส่วนปรับปรุงอาคารเช่าและอุปกรณ์และสินทรัพย์สิทธิการใช้,510310,"['381,679', '330,621']"
ค่าตัดจำหน่ายสินทรัพย์ไม่มีตัวตนอื่นนอกจากค่าความนิยม,ค่าตัดจำหน่ายสินทรัพย์ไม่มีตัวตนอื่นนอกจากค่าความนิยม,510320,"['130,486', '107,812']"
ขาดทุนจากการขายและตัดจำหน่ายส่วนปรับปรุงอาคารเช่าและอุปกรณ์และสินทรัพย์ไม่มีตัวตนอื่นนอกจากค่าความนิยม,ขาดทุนจากการขายและตัดจำหน่ายส่วนปรับปรุงอาคารเช่าและอุปกรณ์และสินทรัพย์ไม่มีตัวตนอื่นนอกจากค่าความนิยม,511500,"['1,790', '1,931']"
ค่าใช้จ่ายผลประโยชน์พนักงาน,ค่าใช้จ่ายผลประโยชน์พนักงาน,514910,"['35,090', '31,188']"
ค่าใช้จ่ายโครงการสะสมหุ้นสําหรับพนักงาน,ค่าใช้จ่ายโครงการสะสมหุ้นสําหรับพนักงาน,510700,"['10,902', '8,937']"
กำไรจากการขายลูกหนี้ที่ตัดจำหน่ายแล้ว,กำไรจากการขายลูกหนี้ที่ตัดจำหน่ายแล้ว,511610,"['(167,108)', '(167,108)']"
