account_name,taxonomy_account_name,account_code,parent_account_code,values
เงินสดจ่ายชำระเงินกู้ยืมระยะสั้นจากสถาบันการเงิน,เงินสดจ่ายชำระเงินกู้ยืมระยะสั้นจากสถาบันการเงิน,530413,530410,"['(22,420,000)', '(13,420,000)']"
เจ้าหนี้ตั๋วแลกเงินเพิ่มขึ้น,เจ้าหนี้ตั๋วแลกเงินเพิ่มขึ้น,530700,539999,"['33,250,152', '33,250,152']"
เงินสดจ่ายชำระเจ้าหนี้ตั๋วแลกเงิน,เงินสดจ่ายชำระเจ้าหนี้ตั๋วแลกเงิน,530800,539999,"['(35,455,000)', '(35,455,000)']"
เงินกู้ยืมระยะยาวจากสถาบันการเงินเพิ่มขึ้น,เงินกู้ยืมระยะยาวจากสถาบันการเงินเพิ่มขึ้น,530333,530320,"['3,237,787', '-']"
เงินกู้ยืมระยะยาวจากสถาบันการเงินลดลง,เงินสดจ่ายชำระเงินกู้ยืมระยะยาว - สถาบันการเงิน,530423,530420,"['(1,613,367)', '-']"
เงินกู้ยืมระยะยาวจากบริษัทอื่นเงินเพิ่มขึ้น,เงินกู้ยืมระยะยาวจากบริษัทอื่นเงินเพิ่มขึ้น,530322,530320,"['381,114', '-']"
เงินกู้ยืมระยะสั้นจากกิจการที่เกี่ยวข้องกันเพิ่มขึ้น,เงินกู้ยืมระยะสั้นจากกิจการที่เกี่ยวข้องกันเพิ่มขึ้น,530210,530200,"['910,000', '1,092,000']"
เงินสดจ่ายชำระเงินกู้ยืมระยะสั้นจากกิจการที่เกี่ยวข้องกัน,เงินสดจ่ายชำระเงินกู้ยืมระยะสั้นจากกิจการที่เกี่ยวข้องกัน,530411,530410,"['-', '(19,625)']"
หุ้นกู้ระยะยาวเพิ่มขึ้น,หุ้นกู้ระยะยาวเพิ่มขึ้น,530700,539999,"['600,000', '600,000']"
เงินสดจ่ายจากการไถ่ถอนหุ้นกู้,เงินสดจ่ายจากการไถ่ถอนหุ้นกู้,530800,539999,"['(1,290,000)', '(1,290,000)']"
เงินสดจ่ายค่าใช้จ่ายในการออกหุ้นกู้,เงินสดจ่ายค่าใช้จ่ายในการออกหุ้นกู้,539900,539999,"['(745)', '(745)']"
เงินสดจ่ายค่าใช้จ่ายในการกู้เงิน,เงินสดจ่ายค่าใช้จ่ายในการกู้เงิน,539900,539999,"['(14,158)', '-']"
เงินสดจ่ายคืนหนี้สินตามสัญญาเช่า,เงินสดจ่ายคืนหนี้สินตามสัญญาเช่า,530500,539999,"['(119,870)', '(36,465)']"
เงินสดจ่ายซื้อเงินลงทุนในบริษัทย่อย,เงินสดจ่ายซื้อเงินลงทุนในบริษัทย่อย,531800,539999,"['(2,820,731)', '-']"
จ่ายเงินปันผล,จ่ายเงินปันผล,539800,539999,"['(2,101,385)', '(2,101,385)']"
เงินปันผลจ่ายของบริษัทย่อยให้แก่ส่วนได้เสียที่ไม่มีอำนาจควบคุมของบริษัทย่อย,เงินปันผลจ่ายของบริษัทย่อยให้แก่ส่วนได้เสียที่ไม่มีอำนาจควบคุมของบริษัทย่อย,539800,539999,"['(210,211)', '-']"
เงินสดรับจากส่วนได้เสียที่ไม่มีอำนาจควบคุมของบริษัทย่อยในการออกหุ้นสามัญของบริษัทย่อย,เงินสดรับจากส่วนได้เสียที่ไม่มีอำนาจควบคุมของบริษัทย่อยในการออกหุ้นสามัญของบริษัทย่อย,530900,539999,"['35,294', '-']"
เงินสดสุทธิจากกิจกรรมจัดหาเงิน,เงินสดสุทธิจากกิจกรรมจัดหาเงิน,539999,509999,"['3,788,880', '4,038,932']"
ผลกระทบจากอัตราแลกเปลี่ยนสำหรับรายการเงินสดและรายการเทียบเท่าเงินสด,ผลกระทบจากอัตราแลกเปลี่ยนสำหรับรายการเงินสดและรายการเทียบเท่าเงินสด,540100,599999,"['3,096', '3,096']"
เงินสดและรายการเทียบเท่าเงินสดต้นงวด,เงินสดและรายการเทียบเท่าเงินสดต้นงวด,599998,599999,"['10,291,672', '3,889,313']"
เงินสดและรายการเทียบเท่าเงินสดปลายงวด,เงินสดและรายการเทียบเท่าเงินสดปลายงวด,599999,,"['7,706,062', '1,075,094']"
