account_name,taxonomy_account_name,account_code,parent_account_code,values
ส่วนที่เป็นของผู้ถือหุ้นของบริษัทฯ,ส่วนที่เป็นของผู้ถือหุ้นของบริษัทฯ,460100,,"['257,048', '1,148,279']"
ส่วนที่เป็นของผู้มีส่วนได้เสียที่ไม่มีอำนาจควบคุมของบริษัทย่อย,ส่วนที่เป็นของผู้มีส่วนได้เสียที่ไม่มีอำนาจควบคุมของบริษัทย่อย,460200,,"['43,357', '']"
ส่วนที่เป็นของผู้ถือหุ้นของบริษัทฯ,ส่วนที่เป็นของผู้ถือหุ้นของบริษัทฯ,470100,,"['1,303,863', '1,122,819']"
ส่วนที่เป็นของผู้มีส่วนได้เสียที่ไม่มีอำนาจควบคุมของบริษัทย่อย,ส่วนที่เป็นของผู้มีส่วนได้เสียที่ไม่มีอำนาจควบคุมของบริษัทย่อย,470200,,"['247,325', '']"
กำไรส่วนที่เป็นของผู้ถือหุ้นบริษัทฯ,กำไรส่วนที่เป็นของผู้ถือหุ้นบริษัทฯ,480100,,"['0.020', '0.087']"
รายได้จากการบริการและการขาย,รายได้จากการบริการและการขาย,410101,410100,"['6,088,954', '132,480']"
รายได้จากการให้บริการรับเหมา,รายได้จากการให้บริการรับเหมา,410103,410100,"['2,889,600', '-']"
รายได้จากการให้เช่า,รายได้จากการให้เช่า,410106,410105,"['161,778', '12,304']"
รายได้เงินปันผล,รายได้เงินปันผล,410202,410300,"['96,427', '2,205,109']"
รายได้ดอกเบี้ย,รายได้ดอกเบี้ย,410108,410300,"['2,855,336', '364,458']"
และการร่วมค้า,รายได้จากการลงทุน,410114,410100,"['642,235', '371']"
อื่นๆ,อื่นๆ,410200,419999,"['69,711', '56,274']"
รวมรายได้,รวมรายได้,419999,409992,"['12,804,041', '2,770,996']"
ต้นทุนการบริการและการขาย,ต้นทุนการบริการและการขาย,420420,420400,"['3,716,892', '167,086']"
ต้นทุนการให้บริการรับเหมา,ต้นทุนการให้บริการรับเหมา,420420,420400,"['2,669,634', '-']"
ค่าใช้จ่ายในการขาย,ค่าใช้จ่ายในการขาย,422110,422100,"['393,853', '580']"
ค่าใช้จ่ายในการบริหาร,ค่าใช้จ่ายในการบริหาร,422120,422100,"['1,701,714', '733,097']"
ขาดทุนจากตราสารทางการเงิน,ขาดทุนจากตราสารทางการเงิน,429800,429999,"['296,831', '303,417']"
ขาดทุนจากการด้อยค่าของเงินลงทุนในบริษัทร่วม,ขาดทุนจากการด้อยค่าของเงินลงทุนในบริษัทร่วม,430900,429999,"['-', '740,797']"
รวมค่าใช้จ่าย,รวมค่าใช้จ่าย,429999,409992,"['8,778,924', '1,944,977']"
ส่วนแบ่งกำไร(ขาดทุน)จากเงินลงทุนในการร่วมค้า,ส่วนแบ่งกำไร(ขาดทุน)จากเงินลงทุนในการร่วมค้า,431100,409992,"['175,262', '-']"
ส่วนแบ่งกำไร(ขาดทุน)จากเงินลงทุนในบริษัทร่วม,ส่วนแบ่งกำไร(ขาดทุน)จากเงินลงทุนในบริษัทร่วม,431100,409992,"['(1,189,975)', '-']"
ต้นทุนทางการเงิน,ต้นทุนทางการเงิน,429900,409995,"['(2,644,078)', '(1,585,792)']"
ภาษีเงินได้,ภาษีเงินได้,439800,409995,"['(1,010,505)', '(155,872)']"
กำไร(ขาดทุน)สำหรับงวด,กำไร(ขาดทุน)สำหรับงวด,409991,409999,"['(644,179)', '(915,645)']"
ผลต่างของอัตราแลกเปลี่ยนจากการแปลงค่างบการเงินที่เป็นเงินตราต่างประเทศของบริษัทร่วม,ผลต่างของอัตราแลกเปลี่ยนจากการแปลงค่างบการเงินที่เป็นเงินตราต่างประเทศของบริษัทร่วม,440500,409998,"['74,524', '-']"
กำไรจากการป้องกันความเสี่ยงในกระแสเงินสด-สุทธิจากภาษีเงินได้,กำไรจากการป้องกันความเสี่ยงในกระแสเงินสด-สุทธิจากภาษีเงินได้,440200,409998,"['1,405,584', '-']"
ขาดทุนจากการป้องกันความเสี่ยงของเงินลงทุนสุทธิในหน่วยงานต่างประเทศ-สุทธิจากภาษีเงินได้,ขาดทุนจากการป้องกันความเสี่ยงของเงินลงทุนสุทธิในหน่วยงานต่างประเทศ-สุทธิจากภาษีเงินได้,440300,409998,"['(1,649)', '-']"
การเปลี่ยนแปลงสุทธิในต้นทุนป้องกันความเสี่ยง-สุทธิจากภาษีเงินได้,การเปลี่ยนแปลงสุทธิในต้นทุนป้องกันความเสี่ยง-สุทธิจากภาษีเงินได้,440200,409998,"['(5,011)', '-']"
มูลค่ายุติธรรมผ่านกำไรขาดทุนเบ็ดเสร็จอื่น-สุทธิจากภาษีเงินได้,มูลค่ายุติธรรมผ่านกำไรขาดทุนเบ็ดเสร็จอื่น-สุทธิจากภาษีเงินได้,450200,409998,"['(607,722)', '(346,395)']"
ส่วนแบ่งขาดทุนจากเงินลงทุนในตราสารทุนที่กำหนดให้วัดมูลค่าด้วยมูลค่ายุติธรรมผ่านกำไรขาดทุนเบ็ดเสร็จอื่นของบริษัทร่วม,ส่วนแบ่งขาดทุนจากเงินลงทุนในตราสารทุนที่กำหนดให้วัดมูลค่าด้วยมูลค่ายุติธรรมผ่านกำไรขาดทุนเบ็ดเสร็จอื่นของบริษัทร่วม,450500,409998,"['(105,888)', '-']"
ส่วนแบ่งขาดทุนจากการประมาณการตามหลักคณิตศาสตร์ประกันภัยของบริษัทร่วม,ส่วนแบ่งขาดทุนจากการประมาณการตามหลักคณิตศาสตร์ประกันภัยของบริษัทร่วม,450600,409998,"['(5,917)', '-']"
กำไรขาดทุนเบ็ดเสร็จอื่นสำหรับงวด,กำไรขาดทุนเบ็ดเสร็จอื่นสำหรับงวด,409998,409999,"['753,921', '(346,395)']"
กำไรขาดทุนเบ็ดเสร็จรวมสำหรับงวด,กำไรขาดทุนเบ็ดเสร็จรวมสำหรับงวด,409999,,"['109,742', '(1,262,040)']"
ส่วนที่เป็นของผู้ถือหุ้นของบริษัทฯ,ส่วนที่เป็นของผู้ถือหุ้นของบริษัทฯ,460100,,"['(515,380)', '(915,645)']"
ส่วนที่เป็นของผู้มีส่วนได้เสียที่ไม่มีอำนาจควบคุมของบริษัทย่อย,ส่วนที่เป็นของผู้มีส่วนได้เสียที่ไม่มีอำนาจควบคุมของบริษัทย่อย,460200,,"['(128,799)', '']"
ส่วนที่เป็นของผู้ถือหุ้นของบริษัทฯ,ส่วนที่เป็นของผู้ถือหุ้นของบริษัทฯ,470100,,"['(11,115)', '(1,262,040)']"
ส่วนที่เป็นของผู้มีส่วนได้เสียที่ไม่มีอำนาจควบคุมของบริษัทย่อย,ส่วนที่เป็นของผู้มีส่วนได้เสียที่ไม่มีอำนาจควบคุมของบริษัทย่อย,470200,,"['120,857', '']"
กำไร(ขาดทุน)ส่วนที่เป็นของผู้ถือหุ้นบริษัทฯ,กำไร(ขาดทุน)ส่วนที่เป็นของผู้ถือหุ้นบริษัทฯ,480100,,"['(0.039)', '(0.070)']"
กำไร(ขาดทุน)ก่อนภาษี,กำไร(ขาดทุน)ก่อนภาษี,510100,519997,"['366,326', '(759,773)']"
ค่าเสื่อมราคาและค่าตัดจำหน่าย,ค่าเสื่อมราคาและค่าตัดจำหน่าย,510300,519997,"['538,317', '84,817']"
ขาดทุน(กำไร)จากอัตราแลกเปลี่ยนที่ยังไม่เกิดขึ้นจริง,ขาดทุน(กำไร)จากอัตราแลกเปลี่ยนที่ยังไม่เกิดขึ้นจริง,510800,519997,"['29,157', '1,339']"
ขาดทุนจากการประมาณการหนี้สิน,ขาดทุนจากการประมาณการหนี้สิน,514920,519997,"['57,465', '-']"
การปรับลดสินค้าคงเหลือเป็นมูลค่าสุทธิที่จะได้รับ(โอนกลับ),(โอนกลับ) ขาดทุนจากการลดมูลค่าของสินค้าคงเหลือ,510500,519997,"['(2,527)', '-']"
ส่วนแบ่งขาดทุน(กำไร)จากเงินลงทุนในการร่วมค้า,ส่วนแบ่งขาดทุน(กำไร)จากเงินลงทุนในการร่วมค้า,510600,519997,"['(175,262)', '-']"
ส่วนแบ่งขาดทุน(กำไร)จากเงินลงทุนในบริษัทร่วม,ส่วนแบ่งขาดทุน(กำไร)จากเงินลงทุนในบริษัทร่วม,510600,519997,"['1,189,975', '-']"
ค่าเผื่อการด้อยค่าของสินทรัพย์(โอนกลับ),ค่าเผื่อการด้อยค่าของสินทรัพย์(โอนกลับ),511700,519997,"['(969)', '740,797']"
ค่าเผื่อผลขาดทุนของสินทรัพย์ทางการเงิน(โอนกลับ),ค่าเผื่อผลขาดทุนของสินทรัพย์ทางการเงิน(โอนกลับ),512100,519997,"['63,860', '(4,113)']"
สำรองผลประโยชน์ระยะยาวของพนักงาน,สำรองผลประโยชน์ระยะยาวของพนักงาน,514910,519997,"['104,118', '9,379']"
ขาดทุนจากการจำหน่ายสินทรัพย์/ตัดจำหน่ายสินทรัพย์,ขาดทุนจากการจำหน่ายสินทรัพย์/ตัดจำหน่ายสินทรัพย์,511520,511500,"['11,644', '6,815']"
รายได้เงินปันผล,รายได้เงินปันผล,514710,514700,"['(96,427)', '(2,205,109)']"
รายจ่ายโดยใช้หุ้นเป็นเกณฑ์,รายจ่ายโดยใช้หุ้นเป็นเกณฑ์,510700,519997,"['24,396', '548']"
และการร่วมค้า,(กำไร) ขาดทุนจากการขายเงินลงทุนในบริษัทย่อย บริษัทร่วม และการร่วมค้า,510900,519997,"['(642,235)', '(371)']"
ขาดทุนจากตราสารทางการเงิน,ขาดทุนจากตราสารทางการเงิน,511400,519997,"['296,831', '303,417']"
รับรู้รายได้รับล่วงหน้า,รับรู้รายได้รับล่วงหน้า,515000,519997,"['(18,492)', '-']"
ดอกเบี้ยรับ,ดอกเบี้ยรับ,514720,514700,"['(2,855,336)', '(364,458)']"
ค่าใช้จ่ายดอกเบี้ย,ค่าใช้จ่ายดอกเบี้ย,514800,519997,"['2,644,078', '1,585,792']"
กำไร(ขาดทุน)จากการดำเนินงานก่อนการเปลี่ยนแปลงในสินทรัพย์และหนี้สินดำเนินงาน,กำไร(ขาดทุน)จากการดำเนินงานก่อนการเปลี่ยนแปลงในสินทรัพย์และหนี้สินดำเนินงาน,519997,519998,"['1,534,919', '(600,920)']"
เงินฝากธนาคารสำหรับเงินรับล่วงหน้าจากผู้ถือบัตร,เงินฝากธนาคารสำหรับเงินรับล่วงหน้าจากผู้ถือบัตร,516600,519998,"['(29,731)', '-']"
ลูกหนี้การค้าและลูกหนี้อื่น,ลูกหนี้การค้าและลูกหนี้อื่น,515800,519998,"['106,129', '(9,134)']"
ภายใต้สัญญากับหน่วยงานของรัฐ,ภายใต้สัญญากับหน่วยงานของรัฐ,515810,519998,"['(807,206)', '-']"
รายได้ค้างรับ,รายได้ค้างรับ,516600,519998,"['(53,012)', '(6,840)']"
เงินจ่ายล่วงหน้าแก่ผู้รับเหมาและเพื่อซื้อสินทรัพย์,เงินจ่ายล่วงหน้าแก่ผู้รับเหมาและเพื่อซื้อสินทรัพย์,516600,519998,"['(116,646)', '-']"
สินทรัพย์หมุนเวียนอื่น,สินทรัพย์หมุนเวียนอื่น,516600,519998,"['(272,860)', '(13,848)']"
สินทรัพย์ไม่หมุนเวียนอื่น,สินทรัพย์ไม่หมุนเวียนอื่น,516600,519998,"['8,879', '(6,115)']"
เจ้าหนี้การค้าและเจ้าหนี้อื่น,เจ้าหนี้การค้าและเจ้าหนี้อื่น,517600,519998,"['(9,575)', '5,338']"
เงินรับล่วงหน้าจากผู้ถือบัตร,เงินรับล่วงหน้าจากผู้ถือบัตร,518300,519998,"['20,878', '-']"
เงินรับล่วงหน้าและรายได้รับล่วงหน้า,เงินรับล่วงหน้าและรายได้รับล่วงหน้า,518300,519998,"['363,970', '-']"
เจ้าหนี้เงินประกันผลงาน,เจ้าหนี้เงินประกันผลงาน,518300,519998,"['(10,909)', '(52)']"
รายได้ค่าโดยสารรอนำส่ง,รายได้ค่าโดยสารรอนำส่ง,518300,519998,"['(6,800)', '-']"
สำรองผลประโยชน์ระยะยาวของพนักงาน,สำรองผลประโยชน์ระยะยาวของพนักงาน,518700,519998,"['(51,140)', '(1,536)']"
ประมาณการหนี้สิน,ประมาณการหนี้สิน,518000,519998,"['1,559', '-']"
หนี้สินหมุนเวียนอื่น,หนี้สินหมุนเวียนอื่น,518300,519998,"['322,445', '(5,082)']"
จ่ายดอกเบี้ย,จ่ายดอกเบี้ย,519600,519999,"['(2,981,914)', '(1,358,733)']"
จ่ายภาษีเงินได้,จ่ายภาษีเงินได้,519900,519999,"['(1,022,664)', '(2,299)']"
รับคืนภาษีเงินได้,รับคืนภาษีเงินได้,519900,519999,"['172,183', '145,361']"
เงินสดสุทธิใช้ไปในกิจกรรมดำเนินงาน,เงินสดสุทธิใช้ไปในกิจกรรมดำเนินงาน,519999,509999,"['(2,831,495)', '(1,853,860)']"
เงินฝากที่มีภาระผูกพันลดลง(เพิ่มขึ้น),เงินฝากที่มีภาระผูกพันลดลง(เพิ่มขึ้น),522400,529999,"['5,707', '-']"
เงินให้กู้ยืมระยะสั้นแก่กิจการที่เกี่ยวข้องกันเพิ่มขึ้น,เงินให้กู้ยืมระยะสั้นแก่กิจการที่เกี่ยวข้องกันเพิ่มขึ้น,521320,521300,"['-', '(279,993)']"
รับชำระเงินให้กู้ยืมระยะสั้นแก่กิจการที่เกี่ยวข้องกัน,รับชำระเงินให้กู้ยืมระยะสั้นแก่กิจการที่เกี่ยวข้องกัน,521320,521300,"['-', '249,715']"
เงินให้กู้ยืมระยะยาวแก่กิจการที่เกี่ยวข้องกันเพิ่มขึ้น,เงินให้กู้ยืมระยะยาวแก่กิจการที่เกี่ยวข้องกันเพิ่มขึ้น,521421,521420,"['-', '(6,902,543)']"
รับชำระเงินให้กู้ยืมระยะยาวแก่กิจการที่เกี่ยวข้องกัน,รับชำระเงินให้กู้ยืมระยะยาวแก่กิจการที่เกี่ยวข้องกัน,521521,521520,"['100,000', '3,190,458']"
ดอกเบี้ยรับ,ดอกเบี้ยรับ,529500,529999,"['165,206', '106,849']"
เงินปันผลรับ,เงินปันผลรับ,529700,529999,"['287,306', '2,209,472']"
เงินสดจ่ายซื้อเงินลงทุนในสินทรัพย์ทางการเงิน,เงินสดจ่ายซื้อเงินลงทุนในสินทรัพย์ทางการเงิน,520300,529999,"['(12,557,389)', '(616,107)']"
เงินสดรับจากการขายเงินลงทุนในสินทรัพย์ทางการเงิน,เงินสดรับจากการขายเงินลงทุนในสินทรัพย์ทางการเงิน,520210,520200,"['12,416,411', '1,166,053']"
เงินสดรับจากเงินคืนทุนของบริษัทร่วม,เงินสดรับจากเงินคืนทุนของบริษัทร่วม,529900,529999,"['692,511', '692,511']"
เงินสดรับ(จ่าย)สุทธิเพื่อซื้อเงินลงทุนในบริษัทย่อย,เงินสดรับ(จ่าย)สุทธิเพื่อซื้อเงินลงทุนในบริษัทย่อย,521200,529999,"['-', '(3,261,467)']"
เงินสดจ่ายชำระเจ้าหนี้ค่าซื้อเงินลงทุนในบริษัทย่อย,เงินสดจ่ายชำระเจ้าหนี้ค่าซื้อเงินลงทุนในบริษัทย่อย,521200,529999,"['-', '(20,215)']"
เงินสดจ่ายเพื่อซื้อเงินลงทุนในการร่วมค้า,เงินสดจ่ายเพื่อซื้อเงินลงทุนในการร่วมค้า,521200,529999,"['(107,650)', '-']"
เงินสดรับจากการขายเงินลงทุนในการร่วมค้า,เงินสดรับจากการจำหน่ายเงินลงทุนในบริษัทย่อย บริษัทร่วม และการร่วมค้า,521100,529999,"['525,000', '-']"
เงินสดจ่ายเพื่อซื้อเงินลงทุนในบริษัทร่วม,เงินสดจ่ายเพื่อซื้อเงินลงทุนในบริษัทร่วม,521200,529999,"['(1,452,510)', '(1,450,040)']"
เงินสดจ่ายชำระเจ้าหนี้ค่าซื้อเงินลงทุนในบริษัทร่วม,เงินสดจ่ายชำระเจ้าหนี้ค่าซื้อเงินลงทุนในบริษัทร่วม,521200,529999,"['(126,671)', '(126,671)']"
เงินสดรับจากการขายเงินลงทุนในบริษัทร่วม,เงินสดรับจากการขายเงินลงทุนในบริษัทร่วม,521100,529999,"['222,103', '40,538']"
เงินสดจ่ายซื้อที่ดินอาคารและอุปกรณ์,เงินสดจ่ายซื้อที่ดินอาคารและอุปกรณ์,521710,521700,"['(380,565)', '(1,136)']"
เงินสดรับจากการจำหน่ายที่ดินอาคารและอุปกรณ์,เงินสดรับจากการจำหน่ายที่ดินอาคารและอุปกรณ์,521610,521600,"['703', '189']"
ต้นทุนโครงการรถไฟฟ้าเพิ่มขึ้น,ต้นทุนโครงการรถไฟฟ้าเพิ่มขึ้น,522300,529999,"['(1,825,157)', '-']"
เงินสดจ่ายซื้ออสังหาริมทรัพย์เพื่อการลงทุน,เงินสดจ่ายซื้ออสังหาริมทรัพย์เพื่อการลงทุน,521730,521700,"['(1,120,354)', '-']"
เงินสดจ่ายซื้อสินทรัพย์ไม่มีตัวตน,เงินสดจ่ายซื้อสินทรัพย์ไม่มีตัวตน,521720,521700,"['(390,788)', '-']"
เงินสดรับชำระจากการขายสินทรัพย์ไม่มีตัวตน,สินทรัพย์ไม่มีตัวตน,521620,521600,"['46', '-']"
เงินสดสุทธิใช้ไปในกิจกรรมลงทุน,เงินสดสุทธิใช้ไปในกิจกรรมลงทุน,529999,509999,"['(3,546,091)', '(5,002,387)']"
เงินกู้ยืมระยะสั้นจากสถาบันการเงินเพิ่มขึ้น,เงินกู้ยืมระยะสั้นจากสถาบันการเงินเพิ่มขึ้น,530100,539999,"['31,420,000', '21,420,000']"
