account_name,taxonomy_account_name,account_code,values
ขาดทุนจากการตัดจำหน่ายอาคารอุปกรณ์และสินทรัพย์ไม่มีตัวตน,ขาดทุนจากการตัดจำหน่ายอาคารอุปกรณ์และสินทรัพย์ไม่มีตัวตน,511520,"['341,715', '341,657']"
กำไรจากการเปลี่ยนแปลงเงื่อนไขและยกเลิกสัญญาเช่า,กำไรจากการเปลี่ยนแปลงเงื่อนไขและยกเลิกสัญญาเช่า,515000,"['(98,852)', '-']"
กำไรจากหนี้สินทางการเงินที่กำหนดให้แสดงด้วยมูลค่ายุติธรรม,กำไรจากหนี้สินทางการเงินที่กำหนดให้แสดงด้วยมูลค่ายุติธรรม,515000,"['(299,563,082)', '(299,563,082)']"
ดอกเบี้ยรับ,ดอกเบี้ยรับ,514720,"['(9,373,734,648)', '(8,186,076,730)']"
เงินปันผลรับ,เงินปันผลรับ,514710,"['(14,412,377)', '(14,412,377)']"
ค่าใช้จ่ายดอกเบี้ย,ค่าใช้จ่ายดอกเบี้ย,514800,"['4,634,316,860', '4,633,994,348']"
สินทรัพย์และหนี้สินดำเนินงาน,สินทรัพย์และหนี้สินดำเนินงาน,519997,"['(2,208,048,145)', '(2,123,577,032)']"
รายการระหว่างธนาคารและตลาดเงิน,รายการระหว่างธนาคารและตลาดเงิน,515200,"['476,191,703', '412,022,924']"
สินทรัพย์ทางการเงินที่วัดมูลค่าด้วยมูลค่ายุติธรรมผ่านกำไรหรือขาดทุน,สินทรัพย์ทางการเงินที่วัดมูลค่าด้วยมูลค่ายุติธรรมผ่านกำไรหรือขาดทุน,515300,"['(2,262,240,334)', '(2,262,240,334)']"
เงินให้สินเชื่อแก่ลูกหนี้,เงินให้สินเชื่อแก่ลูกหนี้,515800,"['(10,790,446,761)', '(7,949,187,934)']"
ทรัพย์สินรอการขาย,ทรัพย์สินรอการขาย,516400,"['1,819,012,449', '3,962,861']"
เงินวางหลักประกันของตราสารอนุพันธ์,เงินวางหลักประกันของตราสารอนุพันธ์,516600,"['(5,642,411,943)', '(5,642,411,943)']"
สินทรัพย์อื่น,สินทรัพย์อื่น,516600,"['(1,051,252,908)', '(995,736,631)']"
เงินรับฝาก,เงินรับฝาก,516800,"['11,462,069,138', '11,583,977,706']"
รายการระหว่างธนาคารและตลาดเงิน,รายการระหว่างธนาคารและตลาดเงิน,516900,"['(24,375,152,763)', '(24,375,152,763)']"
หนี้สินจ่ายคืนเมื่อทวงถาม,หนี้สินจ่ายคืนเมื่อทวงถาม,517000,"['143,164,049', '143,164,049']"
ประมาณการหนี้สิน,ประมาณการหนี้สิน,518000,"['(72,728,290)', '(68,064,730)']"
เงินรับหลักประกันของตราสารอนุพันธ์,เงินรับหลักประกันของตราสารอนุพันธ์,518300,"['3,651,820,060', '3,651,820,060']"
หนี้สินอื่น,หนี้สินอื่น,518300,"['(589,288,355)', '(786,282,356)']"
เงินสดใช้ไปในกิจกรรมดำเนินงาน,เงินสดใช้ไปในกิจกรรมดำเนินงาน,519998,"['(29,439,312,100)', '(28,407,706,123)']"
ดอกเบี้ยรับ,ดอกเบี้ยรับ,519500,"['8,330,525,484', '7,079,443,405']"
ดอกเบี้ยจ่าย,ดอกเบี้ยจ่าย,519600,"['(4,492,816,645)', '(4,492,816,645)']"
ภาษีจ่าย,ภาษีจ่าย,519900,"['(154,815,236)', '(153,866,520)']"
เงินสดสุทธิใช้ไปในกิจกรรมดำเนินงาน,เงินสดสุทธิใช้ไปในกิจกรรมดำเนินงาน,519999,"['(25,756,418,497)', '(25,974,945,883)']"
ผ่านกำไรขาดทุนเบ็ดเสร็จอื่น,ผ่านกำไรขาดทุนเบ็ดเสร็จอื่น,520300,"['(28,772,945,276)', '(28,772,945,276)']"
มูลค่ายุติธรรมผ่านกำไรขาดทุนเบ็ดเสร็จอื่น,มูลค่ายุติธรรมผ่านกำไรขาดทุนเบ็ดเสร็จอื่น,520200,"['54,339,092,511', '54,339,092,511']"
เงินสดจ่ายในการซื้อเงินลงทุนในตราสารหนี้ที่วัดมูลค่าด้วยราคาทุนตัดจำหน่าย,เงินสดจ่ายในการซื้อเงินลงทุนในตราสารหนี้ที่วัดมูลค่าด้วยราคาทุนตัดจำหน่าย,520300,"['(1,658,285,944)', '(1,458,928,622)']"
เงินสดรับจากการไถ่ถอนเงินลงทุนในตราสารหนี้ที่วัดมูลค่าด้วยราคาทุนตัดจำหน่าย,เงินสดรับจากการไถ่ถอนเงินลงทุนในตราสารหนี้ที่วัดมูลค่าด้วยราคาทุนตัดจำหน่าย,520200,"['4,400,000,000', '4,400,000,000']"
เงินสดจ่ายจากการซื้ออาคารและอุปกรณ์,เงินสดจ่ายจากการซื้ออาคารและอุปกรณ์,521710,"['(61,874,582)', '(57,359,937)']"
เงินสดรับจากการขายอาคารและอุปกรณ์,เงินสดรับจากการขายอาคารและอุปกรณ์,521610,"['3,357,896', '1,954,235']"
เงินสดจ่ายซื้อสินทรัพย์ไม่มีตัวตน,เงินสดจ่ายซื้อสินทรัพย์ไม่มีตัวตน,521720,"['(196,019,578)', '(190,645,456)']"
เงินปันผลรับ,เงินปันผลรับ,529700,"['14,412,377', '14,412,377']"
ดอกเบี้ยรับ,ดอกเบี้ยรับ,529900,"['1,364,007,001', '1,363,694,760']"
เงินสดสุทธิได้มาจากกิจกรรมลงทุน,เงินสดสุทธิได้มาจากกิจกรรมลงทุน,529999,"['29,431,744,405', '29,639,274,592']"
ผ่านกำไรหรือขาดทุนและการกู้ยืมเงิน,ผ่านกำไรหรือขาดทุนและการกู้ยืมเงิน,530620,"['5,961,030,957', '5,961,030,957']"
ผ่านกำไรหรือขาดทุนและการกู้ยืมเงิน,ผ่านกำไรหรือขาดทุนและการกู้ยืมเงิน,530610,"['(9,559,167,952)', '(9,559,167,952)']"
เงินสดจ่ายชำระหนี้สินตามสัญญาเช่า,เงินสดจ่ายชำระหนี้สินตามสัญญาเช่า,530500,"['(56,813,290)', '(45,781,092)']"
เงินสดสุทธิ(ใช้ไปใน)ได้มาจากกิจกรรมจัดหาเงิน,เงินสดสุทธิ(ใช้ไปใน)ได้มาจากกิจกรรมจัดหาเงิน,539999,"['(3,654,950,285)', '(3,643,918,087)']"
เงินสดและรายการเทียบเท่าเงินสดเพิ่มขึ้น(ลดลง)สุทธิ,เงินสดและรายการเทียบเท่าเงินสดเพิ่มขึ้น(ลดลง)สุทธิ,509999,"['20,375,623', '20,410,622']"
เงินสดและรายการเทียบเท่าเงินสดณวันต้นรอบระยะเวลา,เงินสดและรายการเทียบเท่าเงินสดณวันต้นรอบระยะเวลา,599998,"['905,364,960', '904,999,960']"
เงินสดและรายการเทียบเท่าเงินสดณวันปลายรอบระยะเวลา,เงินสดและรายการเทียบเท่าเงินสดณวันปลายรอบระยะเวลา,599999,"['925,740,583', '925,410,582']"
