account_name,taxonomy_account_name,account_code,values
เงินสดและรายการเทียบเท่าเงินสด,เงินสดและรายการเทียบเท่าเงินสด,100100,"['507,677,456', '128,745,806']"
หลักทรัพย์ซื้อโดยมีสัญญาขายคืน,หลักทรัพย์ซื้อโดยมีสัญญาขายคืน,100700,"['2,490,000,000', '2,490,000,000']"
ลูกหนี้สำนักหักบัญชีและบริษัทหลักทรัพย์,ลูกหนี้สำนักหักบัญชีและบริษัทหลักทรัพย์,100900,"['134,376,416', '134,376,416']"
ลูกหนี้ธุรกิจหลักทรัพย์และสัญญาซื้อขายล่วงหน้า,ลูกหนี้ธุรกิจหลักทรัพย์และสัญญาซื้อขายล่วงหน้า,101000,"['6,476,997,590', '6,476,997,590']"
รายได้ค่าธรรมเนียมและบริการค้างรับจากธุรกิจจัดการลงทุน,รายได้ค่าธรรมเนียมและบริการค้างรับจากธุรกิจจัดการลงทุน,101100,"['113,944,261', '-']"
สินทรัพย์อนุพันธ์,สินทรัพย์อนุพันธ์,103000,"['120,281,244', '120,281,244']"
เงินลงทุนที่ไม่ได้วางเป็นประกัน,เงินลงทุนที่ไม่ได้วางเป็นประกัน,101660,"['4,622,595,129', '4,076,812,085']"
เงินลงทุนที่วางเป็นประกันและไม่ได้ให้สิทธิผู้รับโอนขายหรือวางประกันอีกทอดหนึ่ง,เงินลงทุนที่วางเป็นประกันและไม่ได้ให้สิทธิผู้รับโอนขายหรือวางประกันอีกทอดหนึ่ง,101671,"['8,872,519', '-']"
เงินลงทุนที่วางเป็นประกันและให้สิทธิผู้รับโอนขายหรือวางประกันอีกทอดหนึ่ง,เงินลงทุนที่วางเป็นประกันและให้สิทธิผู้รับโอนขายหรือวางประกันอีกทอดหนึ่ง,101672,"['588,772,883', '588,772,883']"
เงินลงทุนในบริษัทย่อย,เงินลงทุนในบริษัทย่อย,102610,"['-', '3,258,046,935']"
ที่ดินอาคารและอุปกรณ์,ที่ดินอาคารและอุปกรณ์,103800,"['264,870,817', '256,242,501']"
สินทรัพย์สิทธิการใช้,สินทรัพย์สิทธิการใช้,103900,"['772,035,250', '737,976,545']"
สินทรัพย์ไม่มีตัวตน,สินทรัพย์ไม่มีตัวตน,104100,"['47,627,976', '26,548,215']"
ค่าความนิยม,ค่าความนิยม,104200,"['26,713,599', '-']"
ทรัพย์สินรอการขาย,ทรัพย์สินรอการขาย,104700,"['6,416,155', '6,416,155']"
สินทรัพย์ภาษีเงินได้รอการตัดบัญชี,สินทรัพย์ภาษีเงินได้รอการตัดบัญชี,104400,"['179,103,695', '165,807,953']"
สินทรัพย์อื่น,สินทรัพย์อื่น,109900,"['406,724,460', '378,810,999']"
รวมสินทรัพย์,รวมสินทรัพย์,109999,"['16,767,009,450', '18,845,835,327']"
หลักทรัพย์ขายโดยมีสัญญาซื้อคืน,หลักทรัพย์ขายโดยมีสัญญาซื้อคืน,200600,"['1,725,000,000', '1,725,000,000']"
เจ้าหนี้สำนักหักบัญชีและบริษัทหลักทรัพย์,เจ้าหนี้สำนักหักบัญชีและบริษัทหลักทรัพย์,200800,"['812,857,649', '812,857,649']"
เจ้าหนี้ธุรกิจหลักทรัพย์และสัญญาซื้อขายล่วงหน้า,เจ้าหนี้ธุรกิจหลักทรัพย์และสัญญาซื้อขายล่วงหน้า,200900,"['3,222,872,360', '3,222,872,360']"
ค่าธรรมเนียมและบริการค้างจ่ายจากธุรกิจจัดการลงทุน,ค่าธรรมเนียมและบริการค้างจ่ายจากธุรกิจจัดการลงทุน,201000,"['26,301,056', '-']"
หนี้สินทางการเงินที่กำหนดให้วัดมูลค่าด้วยมูลค่ายุติธรรม,หนี้สินทางการเงินที่กำหนดให้วัดมูลค่าด้วยมูลค่ายุติธรรม,200420,"['223,747,331', '223,747,331']"
หนี้สินอนุพันธ์,หนี้สินอนุพันธ์,202100,"['149,343,274', '149,343,274']"
ค่าใช้จ่ายค้างจ่าย,ค่าใช้จ่ายค้างจ่าย,202500,"['273,917,848', '206,508,440']"
ภาษีเงินได้ค้างจ่าย,ภาษีเงินได้ค้างจ่าย,203000,"['146,133,039', '129,561,325']"
ตราสารหนี้ที่ออกและเงินกู้ยืมอื่น,ตราสารหนี้ที่ออกและเงินกู้ยืมอื่น,201710,"['1,593,959,776', '1,593,959,776']"
หนี้สินตามสัญญาเช่า,หนี้สินตามสัญญาเช่า,202400,"['828,603,385', '793,380,886']"
เงินกู้ด้อยสิทธิจากบริษัทย่อย,เงินกู้ด้อยสิทธิจากบริษัทย่อย,201820,"['-', '2,282,541,003']"
สำรองผลประโยชน์ระยะยาวของพนักงาน,สำรองผลประโยชน์ระยะยาวของพนักงาน,202700,"['226,710,103', '175,122,590']"
ประมาณการหนี้สิน,ประมาณการหนี้สิน,202800,"['51,784,826', '47,736,326']"
หนี้สินอื่น,หนี้สินอื่น,209900,"['71,263,762', '71,961,853']"
รวมหนี้สิน,รวมหนี้สิน,209999,"['9,352,494,409', '11,434,592,813']"
ทุนจดทะเบียนทุนที่ออกและชำระแล้วหุ้นสามัญ{{number}}หุ้นมูลค่าหุ้นละ{{number}}บาท,ทุนจดทะเบียนทุนที่ออกและชำระแล้วหุ้นสามัญ{{number}}หุ้นมูลค่าหุ้นละ{{number}}บาท,310220,"['1,991,763,130', '1,991,763,130']"
ส่วนเกินมูลค่าหุ้นสามัญ,ส่วนเกินมูลค่าหุ้นสามัญ,310420,"['982,166,480', '982,166,480']"
ส่วนเกินทุนจากการไม่ใช้สิทธิของใบสำคัญแสดงสิทธิ,ส่วนเกินทุนจากการไม่ใช้สิทธิของใบสำคัญแสดงสิทธิ,319919,"['101,922,580', '101,922,580']"
จัดสรรแล้ว-ทุนสำรองตามกฎหมาย,จัดสรรแล้ว-ทุนสำรองตามกฎหมาย,310611,"['199,176,313', '199,176,313']"
ยังไม่ได้จัดสรร,ยังไม่ได้จัดสรร,310620,"['4,155,268,132', '4,155,268,132']"
องค์ประกอบอื่นของส่วนของเจ้าของ,องค์ประกอบอื่นของส่วนของเจ้าของ,319950,"['(19,054,121)', '(19,054,121)']"
ส่วนได้เสียที่ไม่มีอำนาจควบคุม,ส่วนได้เสียที่ไม่มีอำนาจควบคุม,320130,"['3,272,527', '-']"
รวมส่วนของเจ้าของ,รวมส่วนของเจ้าของ,309998,"['7,414,515,041', '7,411,242,514']"
รวมหนี้สินและส่วนของเจ้าของ,รวมหนี้สินและส่วนของเจ้าของ,309999,"['16,767,009,450', '18,845,835,327']"
รายได้ค่านายหน้า,รายได้ค่านายหน้า,410115,"['167,709,170', '167,709,170']"
รายได้ค่าธรรมเนียมและบริการ,รายได้ค่าธรรมเนียมและบริการ,410113,"['306,389,901', '48,429,844']"
รายได้ดอกเบี้ย,รายได้ดอกเบี้ย,410108,"['112,295,128', '109,344,637']"
กำไรและผลตอบแทนจากเครื่องมือทางการเงิน,กำไรและผลตอบแทนจากเครื่องมือทางการเงิน,430190,"['161,979,284', '172,518,259']"
ส่วนแบ่งกำไรจากเงินลงทุนในบริษัทย่อย,ส่วนแบ่งกำไรจากเงินลงทุนในบริษัทย่อย,431100,"['-', '74,027,131']"
รายได้อื่น,รายได้อื่น,410200,"['2,346,496', '744,397']"
รวมรายได้,รวมรายได้,419999,"['750,719,979', '572,773,438']"
ค่าใช้จ่ายผลประโยชน์พนักงาน,ค่าใช้จ่ายผลประโยชน์พนักงาน,422400,"['253,556,431', '164,469,553']"
ค่าธรรมเนียมและบริการจ่าย,ค่าธรรมเนียมและบริการจ่าย,422200,"['201,128,946', '132,970,834']"
ค่าใช้จ่ายดอกเบี้ย,ค่าใช้จ่ายดอกเบี้ย,429900,"['41,522,050', '41,349,152']"
ผลขาดทุนด้านเครดิตที่คาดว่าจะเกิดขึ้น(โอนกลับ),ผลขาดทุนด้านเครดิตที่คาดว่าจะเกิดขึ้น(โอนกลับ),430700,"['(382,639)', '(382,639)']"
ขาดทุนจากอัตราแลกเปลี่ยนจากเงินกู้ด้อยสิทธิที่ยังไม่เกิดขึ้น,ขาดทุนจากอัตราแลกเปลี่ยนจากเงินกู้ด้อยสิทธิที่ยังไม่เกิดขึ้น,429800,"['-', '24,204,700']"
ค่าใช้จ่ายอื่น,ค่าใช้จ่ายอื่น,429800,"['117,993,037', '89,241,306']"
รวมค่าใช้จ่าย,รวมค่าใช้จ่าย,429999,"['613,817,825', '451,852,906']"
กำไรก่อนภาษีเงินได้,กำไรก่อนภาษีเงินได้,409994,"['136,902,154', '120,920,532']"
ภาษีเงินได้,ภาษีเงินได้,439800,"['(24,273,899)', '(8,579,603)']"
กำไรสำหรับงวด,กำไรสำหรับงวด,409996,"['112,628,255', '112,340,929']"
เงินตราต่างประเทศ-สุทธิจากภาษีเงินได้,ผลต่างอัตราแลกเปลี่ยนจากการแปลงค่างบการเงิน,440500,"['2,829,129', '2,829,129']"
กำไรเบ็ดเสร็จรวมสำหรับงวด,กำไรเบ็ดเสร็จรวมสำหรับงวด,409999,"['115,457,384', '115,170,058']"
ส่วนที่เป็นของผู้ถือหุ้นบริษัทฯ,การแบ่งปันกำไร (ขาดทุน) สุทธิ : ผู้ถือหุ้นบริษัทใหญ่,460100,"['112,340,929', '112,340,929']"
ส่วนที่เป็นของส่วนได้เสียที่ไม่มีอำนาจควบคุม,การแบ่งปันกำไร (ขาดทุน) สุทธิ : ส่วนได้เสียที่ไม่มีอำนาจควบคุม,460200,"['287,326', '']"
ส่วนที่เป็นของผู้ถือหุ้นบริษัทฯ,การแบ่งปันกำไร (ขาดทุน) เบ็ดเสร็จรวม : ผู้ถือหุ้นบริษัทใหญ่,470100,"['115,170,058', '115,170,058']"
ส่วนที่เป็นของส่วนได้เสียที่ไม่มีอำนาจควบคุม,การแบ่งปันกำไร (ขาดทุน) เบ็ดเสร็จรวม : ส่วนได้เสียที่ไม่มีอำนาจควบคุม,470200,"['287,326', None]"
กำไรส่วนที่เป็นของผู้ถือหุ้นของบริษัทฯ,กำไร (ขาดทุน) ต่อหุ้นขั้นพื้นฐาน (บาท/หุ้น),480100,"['0.06', '0.06']"
รายได้ค่านายหน้า,รายได้ค่านายหน้า,410115,"['340,420,610', '340,420,610']"
รายได้ค่าธรรมเนียมและบริการ,รายได้ค่าธรรมเนียมและบริการ,410113,"['640,766,749', '104,942,828']"
รายได้ดอกเบี้ย,รายได้ดอกเบี้ย,410108,"['224,765,863', '219,833,624']"
กำไรและผลตอบแทนจากเครื่องมือทางการเงิน,กำไรและผลตอบแทนจากเครื่องมือทางการเงิน,430190,"['520,900,045', '523,733,469']"
ส่วนแบ่งกำไรจากเงินลงทุนในบริษัทย่อย,ส่วนแบ่งกำไรจากเงินลงทุนในบริษัทย่อย,431100,"['-', '284,029,763']"
รายได้อื่น,รายได้อื่น,410200,"['3,724,138', '1,563,683']"
รวมรายได้,รวมรายได้,419999,"['1,730,577,405', '1,474,523,977']"
ค่าใช้จ่ายผลประโยชน์พนักงาน,ค่าใช้จ่ายผลประโยชน์พนักงาน,422400,"['540,533,203', '364,991,624']"
ค่าธรรมเนียมและบริการจ่าย,ค่าธรรมเนียมและบริการจ่าย,422200,"['415,311,888', '263,735,885']"
ค่าใช้จ่ายดอกเบี้ย,ค่าใช้จ่ายดอกเบี้ย,429900,"['84,293,716', '83,924,130']"
ผลขาดทุนด้านเครดิตที่คาดว่าจะเกิดขึ้น(โอนกลับ),ผลขาดทุนด้านเครดิตที่คาดว่าจะเกิดขึ้น(โอนกลับ),430700,"['(739,916)', '(739,916)']"
ขาดทุนจากอัตราแลกเปลี่ยนจากเงินกู้ด้อยสิทธิที่ยังไม่เกิดขึ้น,ขาดทุนจากอัตราแลกเปลี่ยนจากเงินกู้ด้อยสิทธิที่ยังไม่เกิดขึ้น,429800,"['-', '162,964,667']"
ค่าใช้จ่ายอื่น,ค่าใช้จ่ายอื่น,429800,"['255,571,591', '196,547,942']"
รวมค่าใช้จ่าย,รวมค่าใช้จ่าย,429999,"['1,294,970,482', '1,071,424,332']"
กำไรก่อนภาษีเงินได้,กำไรก่อนภาษีเงินได้,409994,"['435,606,923', '403,099,645']"
ภาษีเงินได้,ภาษีเงินได้,439800,"['(56,321,673)', '(24,400,047)']"
กำไรสำหรับงวด,กำไรสำหรับงวด,409991,"['379,285,250', '378,699,598']"
เงินตราต่างประเทศ-สุทธิจากภาษีเงินได้,ผลต่างอัตราแลกเปลี่ยนจากการแปลงค่างบการเงิน,440500,"['19,968,950', '19,968,950']"
กำไรเบ็ดเสร็จรวมสำหรับงวด,กำไรเบ็ดเสร็จรวมสำหรับงวด,409999,"['399,254,200', '398,668,548']"
ส่วนที่เป็นของผู้ถือหุ้นบริษัทฯ,ส่วนที่เป็นของผู้ถือหุ้นบริษัทฯ,460100,"['378,699,598', '378,699,598']"
ส่วนที่เป็นของส่วนได้เสียที่ไม่มีอำนาจควบคุม,ส่วนที่เป็นของส่วนได้เสียที่ไม่มีอำนาจควบคุม,460200,"['585,652', '']"
ส่วนที่เป็นของผู้ถือหุ้นบริษัทฯ,ส่วนที่เป็นของผู้ถือหุ้นบริษัทฯ,470100,"['398,668,548', '398,668,548']"
ส่วนที่เป็นของส่วนได้เสียที่ไม่มีอำนาจควบคุม,ส่วนที่เป็นของส่วนได้เสียที่ไม่มีอำนาจควบคุม,470200,"['585,652', None]"
กำไรส่วนที่เป็นของผู้ถือหุ้นของบริษัทฯ,กำไรส่วนที่เป็นของผู้ถือหุ้นของบริษัทฯ,480100,"['0.19', '0.19']"
กำไรก่อนภาษีเงินได้,กำไรก่อนภาษีเงินได้,510200,"['435,606,923', '403,099,645']"
ส่วนแบ่งกำไรจากเงินลงทุนในบริษัทย่อย,ส่วนแบ่งกำไรจากเงินลงทุนในบริษัทย่อย,510600,"['-', '(284,029,763)']"
ค่าเสื่อมราคาและรายจ่ายตัดบัญชี,ค่าเสื่อมราคาและรายจ่ายตัดบัญชี,510300,"['108,761,974', '92,040,781']"
ผลขาดทุนด้านเครดิตที่คาดว่าจะเกิดขึ้น(โอนกลับ),ผลขาดทุนด้านเครดิตที่คาดว่าจะเกิดขึ้น(โอนกลับ),510400,"['(628,876)', '(628,876)']"
ขาดทุนจากการปรับมูลค่าเงินลงทุนตามวิธีมูลค่ายุติธรรมผ่านกำไรขาดทุนและตราสารอนุพันธ์,ขาดทุนจากการปรับมูลค่าเงินลงทุนตามวิธีมูลค่ายุติธรรมผ่านกำไรขาดทุนและตราสารอนุพันธ์,511400,"['124,034,741', '121,201,317']"
ส่วนเกินมูลค่าของเงินลงทุนในตราสารหนี้,ส่วนเกินมูลค่าของเงินลงทุนในตราสารหนี้,515000,"['24,011', '-']"
ขาดทุนจากการจำหน่ายและตัดจำหน่ายอุปกรณ์,ขาดทุนจากการจำหน่ายและตัดจำหน่ายอุปกรณ์,511500,"['3,331,917', '3,331,916']"
ขาดทุนจากอัตราแลกเปลี่ยนจากเงินกู้ด้อยสิทธิที่ยังไม่เกิดขึ้น,ขาดทุนจากอัตราแลกเปลี่ยนจากเงินกู้ด้อยสิทธิที่ยังไม่เกิดขึ้น,515000,"['-', '162,964,668']"
ค่าใช้จ่ายผลประโยชน์ระยะยาวของพนักงาน,ค่าใช้จ่ายผลประโยชน์ระยะยาวของพนักงาน,514910,"['17,818,392', '12,869,527']"
รายได้ดอกเบี้ยจากเงินฝากและเงินลงทุน,รายได้ดอกเบี้ยจากเงินฝากและเงินลงทุน,514720,"['(138,161,993)', '(133,205,743)']"
เงินปันผลรับ,เงินปันผลรับ,514710,"['(81,728,263)', '(81,728,263)']"
ค่าใช้จ่ายดอกเบี้ย,ค่าใช้จ่ายดอกเบี้ย,514800,"['84,293,716', '83,924,130']"
กำไรจากการดำเนินงานก่อนการเปลี่ยนแปลงในสินทรัพย์และหนี้สินดำเนินงาน,กำไรจากการดำเนินงานก่อนการเปลี่ยนแปลงในสินทรัพย์และหนี้สินดำเนินงาน,519997,"['553,352,542', '379,839,339']"
หลักทรัพย์ซื้อโดยมีสัญญาขายคืน,หลักทรัพย์ซื้อโดยมีสัญญาขายคืน,515400,"['4,857,183,770', '4,857,183,770']"
ลูกหนี้สำนักหักบัญชีและบริษัทหลักทรัพย์,ลูกหนี้สำนักหักบัญชีและบริษัทหลักทรัพย์,515500,"['834,029,919', '834,029,919']"
ลูกหนี้ธุรกิจหลักทรัพย์และสัญญาซื้อขายล่วงหน้า,ลูกหนี้ธุรกิจหลักทรัพย์และสัญญาซื้อขายล่วงหน้า,515600,"['522,013,933', '522,013,933']"
รายได้ค่าธรรมเนียมและบริการค้างรับจากธุรกิจจัดการลงทุน,รายได้ค่าธรรมเนียมและบริการค้างรับจากธุรกิจจัดการลงทุน,515700,"['22,713,875', '-']"
สินทรัพย์อนุพันธ์,สินทรัพย์อนุพันธ์,516000,"['(8,417,764)', '(8,417,764)']"
เงินลงทุนตามวิธีมูลค่ายุติธรรมผ่านกำไรหรือขาดทุน,เงินลงทุนตามวิธีมูลค่ายุติธรรมผ่านกำไรหรือขาดทุน,516100,"['905,033,731', '905,033,731']"
สินทรัพย์อื่น,สินทรัพย์อื่น,516600,"['318,107', '1,690,503']"
เงินกู้ยืมจากสถาบันการเงิน,เงินกู้ยืมจากสถาบันการเงิน,517100,"['(150,569,749)', '(150,569,749)']"
หลักทรัพย์ขายโดยมีสัญญาซื้อคืน,หลักทรัพย์ขายโดยมีสัญญาซื้อคืน,517200,"['(7,042,183,770)', '(7,042,183,770)']"
เจ้าหนี้สำนักหักบัญชีและบริษัทหลักทรัพย์,เจ้าหนี้สำนักหักบัญชีและบริษัทหลักทรัพย์,517300,"['710,263,447', '710,263,447']"
เจ้าหนี้ธุรกิจหลักทรัพย์และสัญญาซื้อขายล่วงหน้า,เจ้าหนี้ธุรกิจหลักทรัพย์และสัญญาซื้อขายล่วงหน้า,517400,"['(518,103,801)', '(518,103,801)']"
