account_name,taxonomy_account_name,account_code,values
ผ่านกำไรหรือขาดทุนเบ็ดเสร็จอื่น,ผ่านกำไรหรือขาดทุนเบ็ดเสร็จอื่น,520700,"['(1,313,078,456)', '(1,146,091,099)']"
เงินสดจ่ายเพื่อซื้อสินทรัพย์ทางการเงินหมุนเวียนอื่น,รายการอื่น ๆ (กิจกรรมลงทุน),529900,"['(9,901,149)', '(9,901,149)']"
เงินสดจ่ายเพื่อซื้อสินทรัพย์ทางการเงินไม่หมุนเวียนอื่น,เงินสดจ่ายเพื่อซื้อสินทรัพย์ทางการเงินไม่หมุนเวียนอื่น,529900,"['(7,331,762)', '(7,331,762)']"
เงินสดรับจากการขายอุปกรณ์,เงินสดรับจากการขายอุปกรณ์,521610,"['-', '1,040,980']"
เงินสดจ่ายซื้ออุปกรณ์,เงินสดจ่ายซื้ออุปกรณ์,521710,"['(4,025,512)', '(2,492,611)']"
เงินสดจ่ายซื้อสินทรัพย์ไม่มีตัวตน,เงินสดจ่ายซื้อสินทรัพย์ไม่มีตัวตน,521720,"['(7,080,065)', '(2,074,064)']"
ในหลักทรัพย์,ในหลักทรัพย์,529500,"['131,806,804', '131,341,410']"
เงินสดรับจากเงินปันผลในบริษัทร่วม,เงินสดรับจากเงินปันผลในบริษัทร่วม,529700,"['45,080,560', '45,080,560']"
เงินสดสุทธิได้มาจากกิจกรรมลงทุน,เงินสดสุทธิได้มาจากกิจกรรมลงทุน,529999,"['229,152,566', '262,110,368']"
เงินสดรับจากการเพิ่มทุนหุ้นสามัญ,เงินสดรับจากการเพิ่มทุนหุ้นสามัญ,530900,"['965,039,679', '965,039,679']"
เงินสดจ่ายเงินปันผล,เงินสดจ่ายเงินปันผล,539800,"['(6,188)', '(6,188)']"
เงินสดจ่ายหนี้สินสัญญาเช่า,เงินสดจ่ายหนี้สินสัญญาเช่า,530500,"['(8,474,748)', '(8,309,880)']"
เงินสดสุทธิได้มาจากกิจกรรมจัดหาเงิน,เงินสดสุทธิได้มาจากกิจกรรมจัดหาเงิน,539999,"['956,558,743', '956,723,611']"
เงินสดและรายการเทียบเท่าเงินสดต้นงวด,เงินสดและรายการเทียบเท่าเงินสดต้นงวด,599998,"['437,515,609', '192,322,712']"
เงินสดและรายการเทียบเท่าเงินสดปลายงวด,เงินสดและรายการเทียบเท่าเงินสดปลายงวด,599999,"['373,074,827', '98,532,584']"
