,query,set_code,item_in_taxonomy,reasoning,table_name,category,number_values
35,องค์ประกอบอื่นของส่วนของเจ้าของ,319990,องค์ประกอบอื่นของส่วนของผู้ถือหุ้น องค์ประกอบอื่นของส่วนของผู้ถือหุ้น - อื่นๆ,"The query 'องค์ประกอบอื่นของส่วนของเจ้าของ' matches the closest with the item 'องค์ประกอบอื่นของส่วนของผู้ถือหุ้น องค์ประกอบอื่นของส่วนของผู้ถือหุ้น - อื่นๆ' in the provided taxonomy list.  Both share similar wording and context, referring to other components of equity. Although the fs_category does not match the input metadata, it is better to use item_in_taxonomy in this case.",งบฐานะการเงิน (ต่อ),หนี้สินและส่วนของเจ้าของ,"[424649.0, 424649.0, 246282.0]"
36,ส่วนเกินทุนจากการเปลี่ยนแปลงมูลค่าเงินลงทุน,319914,ส่วนเกิน (ต่ำกว่า) ทุน ส่วนเกิน (ต่ำกว่า) ทุนจากการวัดมูลค่าเงินลงทุนในตราสารทุนด้วยมูลค่ายุติธรรมผ่านกำไรขาดทุนเบ็ดเสร็จอื่น,"The query mentions ""ส่วนเกินทุนจากการเปลี่ยนแปลงมูลค่าเงินลงทุน"" which closely resembles the definition of  ""ส่วนเกินหรือส่วนต่ำกว่า ทุนจากการวัดมูลค่าเงินลงทุนในตราสารทุนด้วยมูลค่ายุติธรรมผ่านกำไรขาดทุนเบ็ดเสร็จอื่น"" in the taxonomy list. Considering the input metadata specifies ""fs_category"" as ""หนี้สินและส่วนของเจ้าของ"", it aligns with the broader category of the selected taxonomy item.",งบฐานะการเงิน (ต่อ),หนี้สินและส่วนของเจ้าของ,"[424649.0, 424649.0, 246282.0]"
37,กำไรสะสม,310600,กำไร (ขาดทุน) สะสม,The input name 'กำไรสะสม' matches exactly with the item 'กำไร (ขาดทุน) สะสม' in the taxonomy list. And the fs_category information from input also matches the taxonomy list. ,งบฐานะการเงิน (ต่อ),หนี้สินและส่วนของเจ้าของ,"[20830696.0, 20830696.0, 21178482.0]"
38,จัดสรรแล้ว - สำรองตามกฎหมาย,310611,กำไรสะสม - จัดสรรแล้ว สำรองตามกฎหมาย,"The query mentions both ""จัดสรรแล้ว"" and ""สำรองตามกฎหมาย"", which directly corresponds to the item ""กำไรสะสม - จัดสรรแล้ว สำรองตามกฎหมาย"" in the taxonomy list. Although the provided fs_category is หนี้สินและส่วนของเจ้าของ, the correct fs_category for this item is ส่วนของผู้ถือหุ้น. Therefore, we use item_in_taxonomy instead of fs_category.",งบฐานะการเงิน (ต่อ),หนี้สินและส่วนของเจ้าของ,"[1622500.0, 1622500.0, 1622500.0]"
39,รายได้ดอกเบี้ย,410108,รายได้ดอกเบี้ย,"The input name 'รายได้ดอกเบี้ย' is an exact match with the item 'รายได้ดอกเบี้ย' in the provided taxonomy list. This item belongs to the 'กำไรขาดทุน' fs_category, which aligns with the input metadata fs_category 'กำไรขาดทุน:'. Therefore, the selected SET Code and Item in Taxonomy are accurate.",งบกำไรขาดทุนเบ็ดเสร็จ  สำหรับงวดสามเดือนสิ้นสุดวันที่ 30 มิถุนายน 2567 และ 2566,กำไรขาดทุน:,"[2577381.0, 2577381.0, 2239519.0]"
40,ค่าใช้จ่ายดอกเบี้ย,429900,ค่าใช้จ่ายดอกเบี้ย,"The query 'ค่าใช้จ่ายดอกเบี้ย' directly matches the 'item_in_taxonomy' in the Taxonomy list. Also, the  input metadata 'fs_category' is 'กำไรขาดทุน:' which is related to the 'fs_category' in the Taxonomy list. Therefore, the correct SET Code is '429900'.",งบกำไรขาดทุนเบ็ดเสร็จ  สำหรับงวดสามเดือนสิ้นสุดวันที่ 30 มิถุนายน 2567 และ 2566,กำไรขาดทุน:,"[802580.0, 802580.0, 722750.0]"
41,รายได้ดอกเบี้ยสุทธิ,400599,รายได้ดอกเบี้ยสุทธิ,"The query 'รายได้ดอกเบี้ยสุทธิ' is a perfect match with the 'item_in_taxonomy' field in the Taxonomy list. Also, the fs_category field with value 'กำไรขาดทุน' is aligned with the input metadata.",งบกำไรขาดทุนเบ็ดเสร็จ  สำหรับงวดสามเดือนสิ้นสุดวันที่ 30 มิถุนายน 2567 และ 2566,กำไรขาดทุน:,"[1774801.0, 1774801.0, 1516769.0]"
42,กำไรจากการขายทรัพย์สินรอการขาย,419781,กำไรสุทธิจากการขายทรัพย์สินรอการขาย,The query directly matches the meaning_of_taxonomy field 'หมายถึง กำไรจากการขายทรัพย์สินรอการขาย' in the Taxonomy list. And the value of fs_category is matched to the input metadata.,งบกำไรขาดทุนเบ็ดเสร็จ  สำหรับงวดสามเดือนสิ้นสุดวันที่ 30 มิถุนายน 2567 และ 2566,กำไรขาดทุน:,"[692657.0, 692657.0, 575233.0]"
43,กำไรจากการขายผ่อนชำระ,null,null,"There is no item in the provided taxonomy list that seems to closely relate to the input query ""กำไรจากการขายผ่อนชำระ"". Therefore, I cannot provide a suitable mapping.",งบกำไรขาดทุนเบ็ดเสร็จ  สำหรับงวดสามเดือนสิ้นสุดวันที่ 30 มิถุนายน 2567 และ 2566,กำไรขาดทุน:,"[100473.0, 100473.0, 275091.0]"
44,รายได้จากการดำเนินงานอื่น ๆ,410200,รายได้จากการดําเนินงานอื่น ๆ,The query 'รายได้จากการดำเนินงานอื่น ๆ' is an exact match with the 'item_in_taxonomy' in the Taxonomy list. And the fs_category is 'กำไรขาดทุน' which is related to 'กำไรขาดทุน:'.,งบกำไรขาดทุนเบ็ดเสร็จ  สำหรับงวดสามเดือนสิ้นสุดวันที่ 30 มิถุนายน 2567 และ 2566,กำไรขาดทุน:,"[22681.0, 22681.0, 13884.0]"
45,รวมรายได้จากการดำเนินงาน,409994,กำไร (ขาดทุน) จากการดำเนินงานก่อนภาษีเงินได้,"The query mentions 'รวมรายได้จากการดำเนินงาน' which closely translates to 'total revenue from operations'. This aligns with the definition of 'กำไร (ขาดทุน) จากการดำเนินงานก่อนภาษีเงินได้' (Profit (Loss) From Operating Before Income Tax Expense) in the taxonomy, which refers to total revenue less total expenses. The provided financial statement type also matches.",งบกำไรขาดทุนเบ็ดเสร็จ  สำหรับงวดสามเดือนสิ้นสุดวันที่ 30 มิถุนายน 2567 และ 2566,กำไรขาดทุน:,"[2590612.0, 2590612.0, 2380977.0]"
46,ค่าใช้จ่ายเกี่ยวกับพนักงาน,422400,ค่าใช้จ่ายในการดำเนินงานอื่น ค่าใช้จ่ายผลประโยชน์พนักงาน,"The input item name 'ค่าใช้จ่ายเกี่ยวกับพนักงาน' is related to employee benefits, and the input metadata specifies 'ค่าใช้จ่ายจากการดำเนินงานอื่น' as the fs_category. Therefore, the closest matching item in the taxonomy list is 'ค่าใช้จ่ายในการดำเนินงานอื่น ค่าใช้จ่ายผลประโยชน์พนักงาน' with SET Code '422400'.",งบกำไรขาดทุนเบ็ดเสร็จ  สำหรับงวดสามเดือนสิ้นสุดวันที่ 30 มิถุนายน 2567 และ 2566,ค่าใช้จ่ายจากการดำเนินงานอื่น,"[343394.0, 343394.0, 397095.0]"
47,ค่าตอบแทนกรรมการ,422600,ค่าใช้จ่ายในการดำเนินงานอื่น ค่าตอบแทนกรรมการและผู้บริหาร,"The input item name is ค่าตอบแทนกรรมการ,  the input financial_statement_type is งบกำไรขาดทุนเบ็ดเสร็จ  สำหรับงวดสามเดือนสิ้นสุดวันที่ 30 มิถุนายน 2567 และ 2566, and the input fs_category is ค่าใช้จ่ายจากการดำเนินงานอื่น. 

The best match from the Taxonomy list is item_in_taxonomy: ค่าใช้จ่ายในการดำเนินงานอื่น ค่าตอบแทนกรรมการและผู้บริหาร, financial_statement_type: PL, and set_code: 422600 because the item's name and fs_category are related to the input query, financial_statement_type, and fs_category.",งบกำไรขาดทุนเบ็ดเสร็จ  สำหรับงวดสามเดือนสิ้นสุดวันที่ 30 มิถุนายน 2567 และ 2566,ค่าใช้จ่ายจากการดำเนินงานอื่น,"[5755.0, 5755.0, 2069.0]"
48,ค่าใช้จ่ายเกี่ยวกับอาคาร สถานที่ และอุปกรณ์,429820,ค่าใช้จ่ายในการดำเนินงานอื่น ค่าใช้จ่ายเกี่ยวกับอาคารสถานที่และอุปกรณ์,The query \,งบกำไรขาดทุนเบ็ดเสร็จ  สำหรับงวดสามเดือนสิ้นสุดวันที่ 30 มิถุนายน 2567 และ 2566,ค่าใช้จ่ายจากการดำเนินงานอื่น,"[46187.0, 46187.0, 50698.0]"
49,ค่าภาษีอากร,429830,ค่าใช้จ่ายในการดำเนินงานอื่น ค่าภาษีอากร,"The INPUT is ค่าภาษีอากร and financial_statement_type is งบกำไรขาดทุนเบ็ดเสร็จ  สำหรับงวดสามเดือนสิ้นสุดวันที่ 30 มิถุนายน 2567 และ 2566, fs_category is ค่าใช้จ่ายจากการดำเนินงานอื่น. The most relevant item in the Taxonomy list is meaning_of_taxonomy: 'หมายถึง ค่าภาษีอากรต่าง ๆ เช่น ภาษีธุรกิจเฉพาะ ภาษีป้าย อากรแสตมป์ เป็นต้น แต่ไม่รวมถึงภาษีเงินได้นิติบุคคลซึ่งกำหนดให้แสดงไว้ในเลขอ้างอิงที่ 142 ภาษีเงินได้ และ ภาษีที่ดินและโรงเรือนสำหรับที่ทำการซึ่งกำหนดให้แสดงไว้ในเลขอ้างอิงที่ 134 ค่าใช้จ่ายเกี่ยวกับ อาคาร สถานที่ และอุปกรณ์'",งบกำไรขาดทุนเบ็ดเสร็จ  สำหรับงวดสามเดือนสิ้นสุดวันที่ 30 มิถุนายน 2567 และ 2566,ค่าใช้จ่ายจากการดำเนินงานอื่น,"[131585.0, 131585.0, 172482.0]"
50,ขาดทุนจากการด้อยค่าทรัพย์สินรอการขาย (โอนกลับ),432602,ค่าใช้จ่ายในการดำเนินงานอื่น (กลับรายการ) ขาดทุนจากการด้อยค่าทรัพย์สินรอการขาย,"The INPUT METADATA states that fs_category is ค่าใช้จ่ายจากการดำเนินงานอื่น. The query mentions both ""ขาดทุนจากการด้อยค่าทรัพย์สินรอการขาย"" and ""โอนกลับ"".  Therefore, the most relevant item in the Taxonomy list is ""ค่าใช้จ่ายในการดำเนินงานอื่น (กลับรายการ) ขาดทุนจากการด้อยค่าทรัพย์สินรอการขาย"" with SET Code 432602.",งบกำไรขาดทุนเบ็ดเสร็จ  สำหรับงวดสามเดือนสิ้นสุดวันที่ 30 มิถุนายน 2567 และ 2566,ค่าใช้จ่ายจากการดำเนินงานอื่น,"[66463.0, 66463.0, -22750.0]"
51,ค่าใช้จ่ายเกี่ยวกับทรัพย์สินรอการขาย,422601,ค่าใช้จ่ายในการดำเนินงานอื่น ขาดทุนสุทธิจากการขายทรัพย์สินรอการขาย,The most relevant item in the taxonomy list is ค่าใช้จ่ายในการดำเนินงานอื่น ขาดทุนสุทธิจากการขายทรัพย์สินรอการขาย based on the input 'ค่าใช้จ่ายเกี่ยวกับทรัพย์สินรอการขาย' and the provided context. The closest fs_category is 'กำไรขาดทุน' which is related to ค่าใช้จ่ายจากการดำเนินงานอื่น.,งบกำไรขาดทุนเบ็ดเสร็จ  สำหรับงวดสามเดือนสิ้นสุดวันที่ 30 มิถุนายน 2567 และ 2566,ค่าใช้จ่ายจากการดำเนินงานอื่น,"[36703.0, 36703.0, 54657.0]"
52,ค่าใช้จ่ายอื่น,429890,ค่าใช้จ่ายในการดำเนินงานอื่น ค่าใช้จ่ายอื่น - อื่น ๆ,The financial report's fs_category is ค่าใช้จ่ายจากการดำเนินงานอื่น.  The closest match in the taxonomy list is fs_category: ค่าใช้จ่ายในการดำเนินงานอื่น ค่าใช้จ่ายอื่น - อื่น ๆ,งบกำไรขาดทุนเบ็ดเสร็จ  สำหรับงวดสามเดือนสิ้นสุดวันที่ 30 มิถุนายน 2567 และ 2566,ค่าใช้จ่ายจากการดำเนินงานอื่น,"[99697.0, 99697.0, 87558.0]"
53,รวมค่าใช้จ่ายในการดำเนินงานอื่น,429800,ค่าใช้จ่ายในการดำเนินงานอื่น,"The INPUT, ""รวมค่าใช้จ่ายในการดำเนินงานอื่น"", is a broader term and maps to the higher level category in the taxonomy. Considering the INPUT METADATA financial_statement_type is งบกำไรขาดทุนเบ็ดเสร็จ  สำหรับงวดสามเดือนสิ้นสุดวันที่ 30 มิถุนายน 2567 และ 2566, the most relevant item from the Taxonomy list is identified as ""ค่าใช้จ่ายในการดำเนินงานอื่น"" with SET Code ""429800"".",งบกำไรขาดทุนเบ็ดเสร็จ  สำหรับงวดสามเดือนสิ้นสุดวันที่ 30 มิถุนายน 2567 และ 2566,ค่าใช้จ่ายจากการดำเนินงานอื่น,"[729784.0, 729784.0, 741809.0]"
54,ผลขาดทุนด้านเครดิตที่คาดว่าจะเกิดขึ้น,430700,ผลขาดทุนด้านเครดิตที่คาดว่าจะเกิดขึ้น,"The INPUT 'ผลขาดทุนด้านเครดิตที่คาดว่าจะเกิดขึ้น'  matches the closest meaning to item_in_taxonomy '(กลับรายการ) ผลขาดทุนด้านเครดิตที่คาดว่าจะเกิดขึ้น'. In this case, fs_category is 'กำไรขาดทุน', so using item_in_taxonomy instead of fs_category.",งบกำไรขาดทุนเบ็ดเสร็จ  สำหรับงวดสามเดือนสิ้นสุดวันที่ 30 มิถุนายน 2567 และ 2566,null,"[1295790.0, 1295790.0, 1125650.0]"
55,กำไรจากการดำเนินงานก่อนค่าใช้จ่ายภาษีเงินได้,409994,กำไร (ขาดทุน) จากการดำเนินงานก่อนภาษีเงินได้,"From the Taxonomy list, the item_in_taxonomy matching the query  ""กำไรจากการดำเนินงานก่อนค่าใช้จ่ายภาษีเงินได้"" is ""กำไร (ขาดทุน) จากการดำเนินงานก่อนภาษีเงินได้"" with the set_code 409994",งบกำไรขาดทุนเบ็ดเสร็จ  สำหรับงวดสามเดือนสิ้นสุดวันที่ 30 มิถุนายน 2567 และ 2566,null,"[565038.0, 565038.0, 513518.0]"
56,ค่าใช้จ่ายภาษีเงินได้,429830,ค่าภาษีเงินได้,"The most relevant item from the provided taxonomy list is 'ค่าภาษีอากร' because this is the closest match to the input query 'ค่าใช้จ่ายภาษีเงินได้'.

Although the input mentions 'ภาษีเงินได้', the taxonomy list does not contain a specific item for 'ค่าใช้จ่ายภาษีเงินได้'. Therefore, 'ค่าภาษีอากร' is chosen as the most suitable match.",งบกำไรขาดทุนเบ็ดเสร็จ  สำหรับงวดสามเดือนสิ้นสุดวันที่ 30 มิถุนายน 2567 และ 2566,null,"[-108914.0, -108914.0, -88348.0]"
57,กำไรสำหรับงวด,409991,กำไร (ขาดทุน) สุทธิ สำหรับงวด / กำไร (ขาดทุน) จากการดำเนินงานต่อเนื่อง,"The input name 'กำไรสำหรับงวด' closely resembles the item 'กำไร (ขาดทุน) สุทธิ สำหรับงวด / กำไร (ขาดทุน) จากการดำเนินงานต่อเนื่อง' in the taxonomy list, and the fs_category is related to null because the input metadata fs_category is null.",งบกำไรขาดทุนเบ็ดเสร็จ  สำหรับงวดสามเดือนสิ้นสุดวันที่ 30 มิถุนายน 2567 และ 2566,null,"[456124.0, 456124.0, 425170.0]"
58,รายการที่ไม่จัดประเภทรายการใหม่เข้าไปไว้ในกำไรหรือขาดทุนในภายหลัง กำไรจากการวัดมูลค่าเงินลงทุนในตราสารทุนที่กำหนดให้วัดมูลค่า  ด้วยมูลค่ายุติธรรมผ่านกำไรขาดทุนเบ็ดเสร็จอื่น,450200,กำไร (ขาดทุน) จากเงินลงทุนในตราสารทุนที่กำหนดให้วัดมูลค่าด้วยมูลค่ายุติธรรมผ่านกำไรขาดทุนเบ็ดเสร็จอื่น,"The input query explicitly mentions  กำไรจากการวัดมูลค่าเงินลงทุนในตราสารทุนที่กำหนดให้วัดมูลค่า  ด้วยมูลค่ายุติธรรมผ่านกำไรขาดทุนเบ็ดเสร็จอื่น, which perfectly matches the item_in_taxonomy: 'กำไร (ขาดทุน) จากเงินลงทุนในตราสารทุนที่กำหนดให้วัดมูลค่าด้วยมูลค่ายุติธรรมผ่านกำไรขาดทุนเบ็ดเสร็จอื่น'. This item's fs_category is related to 'กำไรขาดทุนเบ็ดเสร็จอื่น:', satisfying the instructions.",งบกำไรขาดทุนเบ็ดเสร็จ (ต่อ)  สำหรับงวดสามเดือนสิ้นสุดวันที่ 30 มิถุนายน 2567 และ 2566,กำไรขาดทุนเบ็ดเสร็จอื่น:,"[216111, 216111, 3352]"
59,ภาษีเงินได้ที่เกี่ยวข้อง,459900,ภาษีเงินได้ของรายการที่จะไม่จัดประเภทรายการใหม่เข้าไปไว้ในกำไรหรือขาดทุนในภายหลัง,The input mentions  'ภาษีเงินได้ที่เกี่ยวข้อง' related to 'กำไรขาดทุนเบ็ดเสร็จอื่น' in financial report. Several taxonomy items are related to 'ภาษีเงินได้' but considering the context of 'กำไรขาดทุนเบ็ดเสร็จอื่น' the closest match is 'ภาษีเงินได้ของรายการที่จะไม่จัดประเภทรายการใหม่เข้าไปไว้ในกำไรหรือขาดทุนในภายหลัง' with set code '459900'.,งบกำไรขาดทุนเบ็ดเสร็จ (ต่อ)  สำหรับงวดสามเดือนสิ้นสุดวันที่ 30 มิถุนายน 2567 และ 2566,กำไรขาดทุนเบ็ดเสร็จอื่น:,"[-43223, -43223, -671]"
