,query,set_code,item_in_taxonomy,reasoning,table_name,category,number_values
111,เงินทดรองจ่ายค่าธรรมเนียมในการซื้อทรัพย์และอื่น ๆ,539900,รายการอื่น ๆ (กิจกรรมจัดหาเงิน),"The INPUT's financial_statement_type is งบกระแสเงินสด  สำหรับงวดหกเดือนสิ้นสุดวันที่ 30 มิถุนายน 2567 และ 2566, so the output financial_statement_type is CF.  The INPUT's fs_category has no direct match in the Taxonomy list.  However, it is related to financing activities based on the input name. Therefore, the closest match in the Taxonomy list is {'form_no': 'F1', 'meaning_of_taxonomy': 'บางครั้งใช้ขื่อว่า เงินสดจ่ายค่าธรรมเนียมในการออกตราสารหนี้และเงินกู้ยืม ', 'item_in_taxonomy': 'รายการอื่น ๆ (กิจกรรมจัดหาเงิน)', 'data_type': 'N', 'indent': '0', 'fs_category': 'กิจกรรมจัดหาเงิน', 'mandatory_mapping': '', 'financial_statement_type': 'CF', 'item_in_taxonomy_en': 'Other Items (Financing Activities)', 'set_code': '539900', 'symbol': '123'}.",งบกระแสเงินสด  สำหรับงวดหกเดือนสิ้นสุดวันที่ 30 มิถุนายน 2567 และ 2566,สินทรัพย์ดำเนินงาน (เพิ่มขึ้น) ลดลง,"[-237133, -237133, -214899]"
112,สินทรัพย์อื่น,516600,สินทรัพย์ดำเนินงานอื่น (เพิ่มขึ้น) ลดลง,The closest match from the Taxonomy list to the input 'สินทรัพย์อื่น' is 'สินทรัพย์ดำเนินงานอื่น (เพิ่มขึ้น) ลดลง' with the condition that  fs_category is related to 'สินทรัพย์ดำเนินงาน (เพิ่มขึ้น) ลดลง'.,งบกระแสเงินสด  สำหรับงวดหกเดือนสิ้นสุดวันที่ 30 มิถุนายน 2567 และ 2566,สินทรัพย์ดำเนินงาน (เพิ่มขึ้น) ลดลง,"[-69867, -69867, -64535]"
113,ผลประโยชน์ระยะยาวของพนักงาน,518700,ประมาณการหนี้สินผลประโยชน์พนักงาน เพิ่มขึ้น (ลดลง),"The most relevant item from the taxonomy list is ""ประมาณการหนี้สินผลประโยชน์พนักงาน เพิ่มขึ้น (ลดลง)"" because the input mentions  'ผลประโยชน์ระยะยาวของพนักงาน' which closely relates to employee benefits. Considering the input metadata specifies 'fs_category' as  'หนี้สินดำเนินงานเพิ่มขึ้น (ลดลง)' which signifies a change in liabilities, the selected taxonomy item aligns with the context.",งบกระแสเงินสด  สำหรับงวดหกเดือนสิ้นสุดวันที่ 30 มิถุนายน 2567 และ 2566,หนี้สินดำเนินงานเพิ่มขึ้น (ลดลง),"[-61977, -61977, 0]"
114,หนี้สินอื่น,518300,หนี้สินดำเนินงานอื่น เพิ่มขึ้น (ลดลง),"The most relevant item from the taxonomy list is selected based on the following:
1. Input: หนี้สินอื่น
2. Input Metadata: fs_category is หนี้สินดำเนินงานเพิ่มขึ้น (ลดลง)
Therefore, the selected SET Code and Item in Taxonomy are 518300 and หนี้สินดำเนินงานอื่น เพิ่มขึ้น (ลดลง), respectively.",งบกระแสเงินสด  สำหรับงวดหกเดือนสิ้นสุดวันที่ 30 มิถุนายน 2567 และ 2566,หนี้สินดำเนินงานเพิ่มขึ้น (ลดลง),"[-145568, -145568, -254751]"
115,เงินสดจ่ายซื้อเงินลงทุนในการร่วมค้า,521200,เงินสดจ่ายซื้อเงินลงทุนในบริษัทย่อย บริษัทร่วม และการร่วมค้า,"The input mentions เงินสดจ่ายซื้อเงินลงทุน which implies cash outflow for investment. The context mentions matching financial statement type and fs_category.  Therefore, the most relevant item in the taxonomy is เงินสดจ่ายซื้อเงินลงทุนในบริษัทย่อย บริษัทร่วม และการร่วมค้า with SET Code 521200.",งบกระแสเงินสด  สำหรับงวดหกเดือนสิ้นสุดวันที่ 30 มิถุนายน 2567 และ 2566,กระแสเงินสดจากกิจกรรมลงทุน,"[-12500, -12500, 0]"
116,เงินสดจ่ายซื้อที่ดิน อาคารและอุปกรณ์,521710,เงินสดจ่ายจากการซื้อสินทรัพย์ถาวร ที่ดิน อาคาร และอุปกรณ์,"The query mentions ""เงินสดจ่ายซื้อที่ดิน อาคารและอุปกรณ์"" and the INPUT METADATA specifies the fs_category is กระแสเงินสดจากกิจกรรมลงทุน.  This matches the item ""เงินสดจ่ายจากการซื้อสินทรัพย์ถาวร ที่ดิน อาคาร และอุปกรณ์"" in the Taxonomy list with the fs_category ""กิจกรรมลงทุน"".",งบกระแสเงินสด  สำหรับงวดหกเดือนสิ้นสุดวันที่ 30 มิถุนายน 2567 และ 2566,กระแสเงินสดจากกิจกรรมลงทุน,"[-32429, -32429, -44872]"
117,เงินสดจ่ายซื้อสินทรัพย์ไม่มีตัวตน,521720,เงินสดจ่ายจากการซื้อสินทรัพย์ถาวร สินทรัพย์ไม่มีตัวตน,"The query mentions the cash payment for purchasing intangible assets. The input metadata specifies the financial statement type as ""งบกระแสเงินสด"" and the fs_category as ""กระแสเงินสดจากกิจกรรมลงทุน"". In the provided taxonomy list, the item ""เงินสดจ่ายจากการซื้อสินทรัพย์ถาวร สินทรัพย์ไม่มีตัวตน"" with SET Code ""521720"" aligns with the query and input metadata most closely. Therefore, the selected SET Code is ""521720"" and the item in the taxonomy is ""เงินสดจ่ายจากการซื้อสินทรัพย์ถาวร สินทรัพย์ไม่มีตัวตน"".",งบกระแสเงินสด  สำหรับงวดหกเดือนสิ้นสุดวันที่ 30 มิถุนายน 2567 และ 2566,กระแสเงินสดจากกิจกรรมลงทุน,"[-10832, -10832, -43187]"
118,เงินสดรับจากการขายที่ดิน อาคาร และอุปกรณ์,521610,เงินสดรับจากการขายสินทรัพย์ถาวร ที่ดิน อาคาร และอุปกรณ์,"The input name 'เงินสดรับจากการขายที่ดิน อาคาร และอุปกรณ์' is related to the item 'เงินสดรับจากการขายสินทรัพย์ถาวร ที่ดิน อาคาร และอุปกรณ์' in the taxonomy list, and the fs_category is matched with input metadata 'กระแสเงินสดจากกิจกรรมลงทุน'.",งบกระแสเงินสด  สำหรับงวดหกเดือนสิ้นสุดวันที่ 30 มิถุนายน 2567 และ 2566,กระแสเงินสดจากกิจกรรมลงทุน,"[111, 111, 172]"
119,เงินสดรับจากการคืนทุนเงินลงทุน,529900,รายการอื่น ๆ (กิจกรรมลงทุน),"The input item is similar to meaning_of_taxonomy in the first item of the Taxonomy list. Thus, the model selects the SET code and Item in Taxonomy from that item.",งบกระแสเงินสด  สำหรับงวดหกเดือนสิ้นสุดวันที่ 30 มิถุนายน 2567 และ 2566,กระแสเงินสดจากกิจกรรมลงทุน,"[1057, 1057, 0]"
120,เงินสดรับจากตราสารหนี้ที่ออกและเงินกู้ยืม,530620,เงินสดรับจากตราสารหนี้ที่ออกและเงินกู้ยืม,"The query 'เงินสดรับจากตราสารหนี้ที่ออกและเงินกู้ยืม' is an exact match with the 'item_in_taxonomy' in the Taxonomy list. Thus, the set_code 530620 is selected.",งบกระแสเงินสด  สำหรับงวดหกเดือนสิ้นสุดวันที่ 30 มิถุนายน 2567 และ 2566,กระแสเงินสดจากกิจกรรมจัดหาเงิน,"[20010000, 20010000, 10850000]"
121,เงินสดจ่ายชำระคืนตราสารหนี้ที่ออกและเงินกู้ยืม,530610,เงินสดจ่ายชำระคืนตราสารหนี้ที่ออกและเงินกู้ยืม,The input query 'เงินสดจ่ายชำระคืนตราสารหนี้ที่ออกและเงินกู้ยืม' matches exactly with 'item_in_taxonomy' in the Taxonomy list. And the fs_category 'กิจกรรมจัดหาเงิน' is matched the context in input metadata 'กระแสเงินสดจากกิจกรรมจัดหาเงิน',งบกระแสเงินสด  สำหรับงวดหกเดือนสิ้นสุดวันที่ 30 มิถุนายน 2567 และ 2566,กระแสเงินสดจากกิจกรรมจัดหาเงิน,"[-18694680, -18694680, -10618608]"
122,เงินสดจ่ายค่าธรรมเนียมในการออกตราสารหนี้และเงินกู้ยืม,539900,รายการอื่น ๆ (กิจกรรมจัดหาเงิน),"The input mentions fees related to debt issuance, and the input metadata specifies 'กระแสเงินสดจากกิจกรรมจัดหาเงิน' (Cash flows from financing activities) as the category. The closest match in the taxonomy list is 'รายการอื่น ๆ (กิจกรรมจัดหาเงิน)' (Other Items (Financing Activities)) with SET Code 539900, as it captures miscellaneous financing activities.",งบกระแสเงินสด  สำหรับงวดหกเดือนสิ้นสุดวันที่ 30 มิถุนายน 2567 และ 2566,กระแสเงินสดจากกิจกรรมจัดหาเงิน,"[-6022, -6022, 0]"
123,เงินสดจ่ายเงินปันผลให้แก่ผู้ถือหุ้น,539800,จ่ายเงินปันผล,"The input name suggests that it is related to cash dividend payment. The input metadata specified that the financial_statement_type is CF and fs_category is กระแสเงินสดจากกิจกรรมจัดหาเงิน.  Therefore, the most relevant item in the Taxonomy list is {fs_category: 'กิจกรรมจัดหาเงิน', data_type: 'N', form_no: 'F1', item_in_taxonomy: 'จ่ายเงินปันผล', set_code: '539800', symbol: '123', financial_statement_type: 'CF'}.",งบกระแสเงินสด  สำหรับงวดหกเดือนสิ้นสุดวันที่ 30 มิถุนายน 2567 และ 2566,กระแสเงินสดจากกิจกรรมจัดหาเงิน,"[-1228160, -1228160, -1777600]"
124,เงินสดจ่ายหนี้สินตามสัญญาเช่า,530500,เงินสดจ่ายชำระหนี้สินตามสัญญาเช่า,"The query ""เงินสดจ่ายหนี้สินตามสัญญาเช่า"" matches  ""item_in_taxonomy"": ""เงินสดจ่ายชำระหนี้สินตามสัญญาเช่า"" in the taxonomy list, and the value of property 'fs_category' in the taxonomy list item is related to ""กระแสเงินสดจากกิจกรรมจัดหาเงิน"". Therefore, the correct SET Code is 530500.",งบกระแสเงินสด  สำหรับงวดหกเดือนสิ้นสุดวันที่ 30 มิถุนายน 2567 และ 2566,กระแสเงินสดจากกิจกรรมจัดหาเงิน,"[0, 0, -406]"
125,กำไรจากการดำเนินงานก่อนการเปลี่ยนแปลงในสินทรัพย์ และหนี้สินดำเนินงาน,519997,กำไร (ขาดทุน) จากการดำเนินงานก่อนการเปลี่ยนแปลงในสินทรัพย์และหนี้สินดำเนินงาน,The query matches the item in taxonomy list with fs_category related to กระแสเงินสดจากกิจกรรมดำเนินงาน.,งบกระแสเงินสด (ต่อ)  สำหรับงวดหกเดือนสิ้นสุดวันที่ 30 มิถุนายน 2567 และ 2566,กระแสเงินสดจากกิจกรรมดำเนินงาน,"[649941, 649941, 297773]"
126,เงินสดสุทธิใช้ไปในกิจกรรมดำเนินงาน,519999,เงินสดสุทธิได้มาจาก (ใช้ไปใน) กิจกรรมดำเนินงาน,The input name 'เงินสดสุทธิใช้ไปในกิจกรรมดำเนินงาน' is related to the fs_category 'กระแสเงินสดจากกิจกรรมดำเนินงาน' from the input metadata.  The closest matching item in the taxonomy list is 'เงินสดสุทธิได้มาจาก (ใช้ไปใน) กิจกรรมดำเนินงาน' with the set code '519999'.,งบกระแสเงินสด (ต่อ)  สำหรับงวดหกเดือนสิ้นสุดวันที่ 30 มิถุนายน 2567 และ 2566,กระแสเงินสดจากกิจกรรมดำเนินงาน,"[-676356, -676356, -4026244]"
127,เงินสดสุทธิใช้ไปในกิจกรรมลงทุน,529999,เงินสดสุทธิได้มาจาก (ใช้ไปใน) กิจกรรมลงทุน,"The input mentions 'เงินสดสุทธิใช้ไปในกิจกรรมลงทุน' and the input metadata specifies 'fs_category' as 'กระแสเงินสดจากกิจกรรมลงทุน'. Therefore, the most relevant item in the taxonomy is 'เงินสดสุทธิได้มาจาก (ใช้ไปใน) กิจกรรมลงทุน' with SET Code '529999', as it directly corresponds to the input query and specified financial statement category.",งบกระแสเงินสด (ต่อ)  สำหรับงวดหกเดือนสิ้นสุดวันที่ 30 มิถุนายน 2567 และ 2566,กระแสเงินสดจากกิจกรรมลงทุน,"[-54593, -54593, -87887]"
128,เงินสดสุทธิได้มาจาก (ใช้ไปใน) กิจกรรมจัดหาเงิน,539999,เงินสดสุทธิได้มาจาก (ใช้ไปใน) กิจกรรมจัดหาเงิน,"The query's fs_category is กระแสเงินสดจากกิจกรรมจัดหาเงิน and financial_statement_type is งบกระแสเงินสด (ต่อ)  สำหรับงวดหกเดือนสิ้นสุดวันที่ 30 มิถุนายน 2567 และ 2566, indicating a match with the provided taxonomy list.",งบกระแสเงินสด (ต่อ)  สำหรับงวดหกเดือนสิ้นสุดวันที่ 30 มิถุนายน 2567 และ 2566,กระแสเงินสดจากกิจกรรมจัดหาเงิน,"[81138, 81138, -1546614]"
129,เงินสดและรายการเทียบเท่าเงินสดลดลงสุทธิ,509999,เงินสด เพิ่มขึ้น (ลดลง) สุทธิ,The input's fs_category is เงินสดและรายการเทียบเท่าเงินสดลดลงสุทธิ and financial_statement_type is งบกระแสเงินสด (ต่อ)  สำหรับงวดหกเดือนสิ้นสุดวันที่ 30 มิถุนายน 2567 และ 2566.  The closest meaning in the taxonomy list is item_in_taxonomy: เงินสด เพิ่มขึ้น (ลดลง) สุทธิ and meaning_of_taxonomy: เงินสด เพิ่มขึ้นหรือลดลง สุทธิ บางครั้งใช้ขื่อว่า เงินสดและรายการเทียบเท่าเงินสดลดลงสุทธิ  with set_code 509999,งบกระแสเงินสด (ต่อ)  สำหรับงวดหกเดือนสิ้นสุดวันที่ 30 มิถุนายน 2567 และ 2566,เงินสดและรายการเทียบเท่าเงินสดลดลงสุทธิ,"[-649811, -649811, -5660745]"
130,ค่าเผื่อผลขาดทุนด้านเครดิตที่คาดว่าจะเกิดขึ้นลดลง - เงินฝากสถาบันการเงิน,540300,รายการอื่น ๆ,"The INPUT's fs_category matched the meaning_of_taxonomy in the Taxonomy list. Thus, the selected SET Code and Item in Taxonomy are correct.",งบกระแสเงินสด (ต่อ)  สำหรับงวดหกเดือนสิ้นสุดวันที่ 30 มิถุนายน 2567 และ 2566,ค่าเผื่อผลขาดทุนด้านเครดิตที่คาดว่าจะเกิดขึ้นลดลง - เงินฝากสถาบันการเงิน,"[0, 0, 1231]"
131,เงินสดและรายการเทียบเท่าเงินสด ณ วันต้นงวด,599998,เงินสดและรายการเทียบเท่าเงินสด ต้นงวด,"From the Taxonomy list, fs_category is matched with  'เงินสดและรายการเทียบเท่าเงินสด ณ วันต้นงวด'  and financial_statement_type is matched with งบกระแสเงินสด (ต่อ)  สำหรับงวดหกเดือนสิ้นสุดวันที่ 30 มิถุนายน 2567 และ 2566..  Therefore, the SET Code should be 599998 and Item in Taxonomy should be เงินสดและรายการเทียบเท่าเงินสด ต้นงวด",งบกระแสเงินสด (ต่อ)  สำหรับงวดหกเดือนสิ้นสุดวันที่ 30 มิถุนายน 2567 และ 2566,เงินสดและรายการเทียบเท่าเงินสด ณ วันต้นงวด,"[1730034, 1730034, 6729411]"
132,เงินสดและรายการเทียบเท่าเงินสด ณ วันสิ้นงวด (หมายเหตุ 3),599999,เงินสดและรายการเทียบเท่าเงินสด สิ้นงวด,"The query mentions 'เงินสดและรายการเทียบเท่าเงินสด ณ วันสิ้นงวด' which directly corresponds to the fs_category 'เงินสดและรายการเทียบเท่า' and item_in_taxonomy 'เงินสดและรายการเทียบเท่าเงินสด สิ้นงวด' in the taxonomy list. Thus, the SET code 599999 is chosen.",งบกระแสเงินสด (ต่อ)  สำหรับงวดหกเดือนสิ้นสุดวันที่ 30 มิถุนายน 2567 และ 2566,เงินสดและรายการเทียบเท่าเงินสด ณ วันสิ้นงวด (หมายเหตุ 3),"[1080223, 1080223, 1069897]"
133,ซื้อเงินให้สินเชื่อจากการซื้อลูกหนี้,515800,เงินให้สินเชื่อแก่ลูกหนี้ (เพิ่มขึ้น) ลดลง,"The INPUT, 'ซื้อเงินให้สินเชื่อจากการซื้อลูกหนี้' suggests a transaction related to changes in loans. Although the INPUT's fs_category is 'ข้อมูลกระแสเงินสดเปิดเผยเพิ่มเติม รายการที่ไม่ใช่เงินสด',  'เงินให้สินเชื่อแก่ลูกหนี้ (เพิ่มขึ้น) ลดลง' is the most relevant item in the taxonomy. Therefore, the SET Code '515800' and Item in Taxonomy 'เงินให้สินเชื่อแก่ลูกหนี้ (เพิ่มขึ้น) ลดลง' are selected.",งบกระแสเงินสด (ต่อ)  สำหรับงวดหกเดือนสิ้นสุดวันที่ 30 มิถุนายน 2567 และ 2566,ข้อมูลกระแสเงินสดเปิดเผยเพิ่มเติม รายการที่ไม่ใช่เงินสด,"[2245618, 2245618, 1127259]"
134,ซื้อที่ดิน อาคารและอุปกรณ์,521710,เงินสดจ่ายจากการซื้อสินทรัพย์ถาวร ที่ดิน อาคาร และอุปกรณ์,"The INPUT METADATA states that fs_category is ข้อมูลกระแสเงินสดเปิดเผยเพิ่มเติม รายการที่ไม่ใช่เงินสด.  There are no taxonomy item's fs_category with this value.  Therefore, we will use the item_in_taxonomy instead.  The item_in_taxonomy value of เงินสดจ่ายจากการซื้อสินทรัพย์ถาวร ที่ดิน อาคาร และอุปกรณ์  most closely matches the INPUT. ",งบกระแสเงินสด (ต่อ)  สำหรับงวดหกเดือนสิ้นสุดวันที่ 30 มิถุนายน 2567 และ 2566,ข้อมูลกระแสเงินสดเปิดเผยเพิ่มเติม รายการที่ไม่ใช่เงินสด,"[342, 342, 2248]"
