,query,set_code,item_in_taxonomy,reasoning,table_name,category,number_values
37,รายได้ค่าธรรมเนียมและบริการ,410113,รายได้ค่าธรรมเนียมและบริการ,"The input name 'รายได้ค่าธรรมเนียมและบริการ' is an exact match to the item_in_taxonomy 'รายได้ค่าธรรมเนียมและบริการ' in the taxonomy list. Thus, the set_code 410113 is used.",งบกำไรขาดทุนและกำไรขาดทุนเบ็ดเสร็จอื่น (ไม่ได้ตรวจสอบ),รายได้ (ค่าใช้จ่าย) จากการดำเนินงาน,"[10434498, 11692351.0, 579671, 0.0]"
38,ค่าใช้จ่ายค่าธรรมเนียมและบริการ,422200,ค่าใช้จ่ายค่าธรรมเนียมและบริการ,"The input item name ค่าใช้จ่ายค่าธรรมเนียมและบริการ  matches exactly with item_in_taxonomy ค่าใช้จ่ายค่าธรรมเนียมและบริการ in the Taxonomy list. And the financial_statement_type งบกำไรขาดทุนและกำไรขาดทุนเบ็ดเสร็จอื่น (ไม่ได้ตรวจสอบ) is matched with PL. Thus, the correct SET Code is 422200.",งบกำไรขาดทุนและกำไรขาดทุนเบ็ดเสร็จอื่น (ไม่ได้ตรวจสอบ),รายได้ (ค่าใช้จ่าย) จากการดำเนินงาน,"[2905099, 3183261.0, 384, 240.0]"
39,รายได้ค่าธรรมเนียมและบริการสุทธิ,400699,รายได้ค่าธรรมเนียมและบริการสุทธิ,"The input item name is รายได้ค่าธรรมเนียมและบริการสุทธิ and fs_category is รายได้ (ค่าใช้จ่าย) จากการดำเนินงาน. Found the exact match with item_in_taxonomy รายได้ค่าธรรมเนียมและบริการสุทธิ in the Taxonomy list.  Therefore, the correct SET Code is 400699 and Item in Taxonomy is รายได้ค่าธรรมเนียมและบริการสุทธิ",งบกำไรขาดทุนและกำไรขาดทุนเบ็ดเสร็จอื่น (ไม่ได้ตรวจสอบ),รายได้ (ค่าใช้จ่าย) จากการดำเนินงาน,"[7529399, 8509090.0, 579287, -240.0]"
40,กำไร (ขาดทุน) สุทธิจากเครื่องมือทางการเงินที่วัดมูลค่าด้วยมูลค่ายุติธรรมผ่านกำไรหรือขาดทุน,431390,กำไร (ขาดทุน) สุทธิจากเครื่องมือทางการเงินที่วัดมูลค่าด้วยมูลค่ายุติธรรมผ่านกำไรหรือขาดทุน กำไร (ขาดทุน) สุทธิจากเครื่องมือทางการเงินที่วัดมูลค่าด้วยมูลค่ายุติธรรมผ่านกำไรหรือขาดทุน - อื่น ๆ,"The query matches the meaning of taxonomy in the list. Also, financial_statement_type from INPUT METADATA matches the Taxonomy list. And the value of property fs_category in the correct Taxonomy list item is related to รายได้ (ค่าใช้จ่าย) จากการดำเนินงาน.",งบกำไรขาดทุนและกำไรขาดทุนเบ็ดเสร็จอื่น (ไม่ได้ตรวจสอบ),รายได้ (ค่าใช้จ่าย) จากการดำเนินงาน,"[1922939, 3717357.0, -500957, -203174.0]"
41,กำไร (ขาดทุน) สุทธิจากเงินลงทุน,431400,กำไร (ขาดทุน) สุทธิจากเงินลงทุน,"The query 'กำไร (ขาดทุน) สุทธิจากเงินลงทุน' is an exact match to the 'item_in_taxonomy' in the Taxonomy list. Although the fs_category does not match, we will use 'item_in_taxonomy' instead as instructed.",งบกำไรขาดทุนและกำไรขาดทุนเบ็ดเสร็จอื่น (ไม่ได้ตรวจสอบ),รายได้ (ค่าใช้จ่าย) จากการดำเนินงาน,"[-33254, 12376.0, -7565415, 0.0]"
42,ส่วนแบ่งกำไรจากเงินลงทุนในบริษัทร่วมและการร่วมค้า,431100,ส่วนแบ่งกำไร (ขาดทุน) จากเงินลงทุนตามวิธีส่วนได้เสีย,"The input mentions ""profit sharing from investments in associates and joint ventures"", which aligns with the definition of ""Share Of Profit (Loss) From Investments Accounted For Using The Equity Method"" in the taxonomy list. Considering the input metadata specifies 'รายได้ (ค่าใช้จ่าย) จากการดำเนินงาน' (Revenue (Expenses) from Operating Activities),  'ส่วนแบ่งกำไร (ขาดทุน) จากเงินลงทุนตามวิธีส่วนได้เสีย' is chosen as it represents the appropriate accounting treatment for such investments under the equity method.",งบกำไรขาดทุนและกำไรขาดทุนเบ็ดเสร็จอื่น (ไม่ได้ตรวจสอบ),รายได้ (ค่าใช้จ่าย) จากการดำเนินงาน,"[121192, 90593.0, 0, 0.0]"
43,รายได้เงินปันผล,410202,รายได้เงินปันผล,"From the Taxonomy list, รายได้เงินปันผล item's meaning matched the query, and fs_category of รายได้เงินปันผล is matched the fs_category from INPUT METADATA.",งบกำไรขาดทุนและกำไรขาดทุนเบ็ดเสร็จอื่น (ไม่ได้ตรวจสอบ),รายได้ (ค่าใช้จ่าย) จากการดำเนินงาน,"[141813, 75337.0, 0, 684224.0]"
44,รายได้จากการดำเนินงานอื่น ๆ,410200,รายได้จากการดําเนินงานอื่น ๆ,"The query 'รายได้จากการดำเนินงานอื่น ๆ' directly matches the 'item_in_taxonomy' field in the taxonomy list. Also, the fs_category of the selected choice is 'กำไรขาดทุน' which is related to the input metadata 'รายได้ (ค่าใช้จ่าย) จากการดำเนินงาน'.",งบกำไรขาดทุนและกำไรขาดทุนเบ็ดเสร็จอื่น (ไม่ได้ตรวจสอบ),รายได้ (ค่าใช้จ่าย) จากการดำเนินงาน,"[995457, 1120012.0, 12366, 7651.0]"
45,รวมรายได้ (ค่าใช้จ่าย) จากการดำเนินงาน,409994,กำไร (ขาดทุน) จากการดำเนินงานก่อนภาษีเงินได้,The input's fs_category is รวมรายได้ (ค่าใช้จ่าย) จากการดำเนินงาน and financial_statement_type is งบกำไรขาดทุนและกำไรขาดทุนเบ็ดเสร็จอื่น (ไม่ได้ตรวจสอบ) which maps to PL. The most relevant item in the Taxonomy list is กำไร (ขาดทุน) จากการดำเนินงานก่อนภาษีเงินได้ with SET Code 409994.,งบกำไรขาดทุนและกำไรขาดทุนเบ็ดเสร็จอื่น (ไม่ได้ตรวจสอบ),รวมรายได้ (ค่าใช้จ่าย) จากการดำเนินงาน,"[43253230, 44316148.0, -7489678, 181920.0]"
46,ค่าใช้จ่ายเกี่ยวกับพนักงาน,422400,ค่าใช้จ่ายในการดำเนินงานอื่น ค่าใช้จ่ายผลประโยชน์พนักงาน,The input query ค่าใช้จ่ายเกี่ยวกับพนักงาน  matches the meaning of taxonomy ค่าตอบแทนที่จ่ายให้พนักงานและลูกจ้าง เช่น เงินเดือน ค่าจ้าง ค่าล่วงเวลา โบนัส เงินบำเหน็จ เงินเพิ่มค่าครองชีพ ค่าสวัสดิการ เงินสมทบของสถาบันการเงินที่ต้องจ่ายเข้ากองทุนสำรองเลี้ยงชีพ ภาษีเงินได้ที่สถาบันการเงินออกให้ เป็นต้น and fs_category ค่าใช้จ่ายจากการดำเนินงานอื่น ๆ is matched in the Taxonomy list.,งบกำไรขาดทุนและกำไรขาดทุนเบ็ดเสร็จอื่น (ไม่ได้ตรวจสอบ),ค่าใช้จ่ายจากการดำเนินงานอื่น ๆ,"[9052011, 8449118.0, 490347, 117464.0]"
47,ค่าตอบแทนกรรมการ,422600,ค่าใช้จ่ายในการดำเนินงานอื่น ค่าตอบแทนกรรมการและผู้บริหาร,"The input name 'ค่าตอบแทนกรรมการ' is related to director's remuneration. 
The input metadata financial_statement_type is งบกำไรขาดทุนและกำไรขาดทุนเบ็ดเสร็จอื่น (ไม่ได้ตรวจสอบ) which maps to 'PL'.
The input metadata fs_category is ค่าใช้จ่ายจากการดำเนินงานอื่น ๆ which maps to 'ค่าใช้จ่ายในการดำเนินงานอื่น'.
Therefore, the most relevant item_in_taxonomy is 'ค่าใช้จ่ายในการดำเนินงานอื่น ค่าตอบแทนกรรมการและผู้บริหาร' with set_code '422600'.",งบกำไรขาดทุนและกำไรขาดทุนเบ็ดเสร็จอื่น (ไม่ได้ตรวจสอบ),ค่าใช้จ่ายจากการดำเนินงานอื่น ๆ,"[56398, 25631.0, 24337, -12549.0]"
48,ค่าใช้จ่ายเกี่ยวกับอาคารสถานที่และอุปกรณ์,429820,ค่าใช้จ่ายในการดำเนินงานอื่น ค่าใช้จ่ายเกี่ยวกับอาคารสถานที่และอุปกรณ์,"The query 'ค่าใช้จ่ายเกี่ยวกับอาคารสถานที่และอุปกรณ์' is a close match to the 'item_in_taxonomy' field 'ค่าใช้จ่ายในการดำเนินงานอื่น ค่าใช้จ่ายเกี่ยวกับอาคารสถานที่และอุปกรณ์' in the taxonomy list. The fs_category field does not match the input metadata. Thus, we use item_in_taxonomy instead of fs_category.",งบกำไรขาดทุนและกำไรขาดทุนเบ็ดเสร็จอื่น (ไม่ได้ตรวจสอบ),ค่าใช้จ่ายจากการดำเนินงานอื่น ๆ,"[3085762, 3036539.0, 28239, 20326.0]"
49,ค่าภาษีอากร,429830,ค่าใช้จ่ายในการดำเนินงานอื่น ค่าภาษีอากร,"The INPUT is ค่าภาษีอากร and financial_statement_type is งบกำไรขาดทุนและกำไรขาดทุนเบ็ดเสร็จอื่น (ไม่ได้ตรวจสอบ) which is matched to PL. The fs_category extracted from the Taxonomy list is กำไรขาดทุน, which is not related to the input metadata 'ค่าใช้จ่ายจากการดำเนินงานอื่น ๆ'.  Therefore, we use item_in_taxonomy,  'ค่าใช้จ่ายในการดำเนินงานอื่น ค่าภาษีอากร' from the Taxonomy list. ",งบกำไรขาดทุนและกำไรขาดทุนเบ็ดเสร็จอื่น (ไม่ได้ตรวจสอบ),ค่าใช้จ่ายจากการดำเนินงานอื่น ๆ,"[1359234, 1260808.0, 67, 16.0]"
50,ค่าใช้จ่ายอื่น ๆ,429890,ค่าใช้จ่ายในการดำเนินงานอื่น ค่าใช้จ่ายอื่น - อื่น ๆ,The INPUT's fs_category is ค่าใช้จ่ายจากการดำเนินงานอื่น ๆ. Found item in Taxonomy with related fs_category. ,งบกำไรขาดทุนและกำไรขาดทุนเบ็ดเสร็จอื่น (ไม่ได้ตรวจสอบ),ค่าใช้จ่ายจากการดำเนินงานอื่น ๆ,"[5014599, 4243962.0, 298365, 366337.0]"
51,รวมค่าใช้จ่ายจากการดำเนินงานอื่น ๆ,429890,ค่าใช้จ่ายในการดำเนินงานอื่น ค่าใช้จ่ายอื่น - อื่น ๆ,"The input fs_category is รวมค่าใช้จ่ายจากการดำเนินงานอื่น ๆ.  The Taxonomy list item with fs_category value containing  ""กำไรขาดทุน""  is the most related, and its set code is 429890 and item in taxonomy is ค่าใช้จ่ายในการดำเนินงานอื่น ค่าใช้จ่ายอื่น - อื่น ๆ",งบกำไรขาดทุนและกำไรขาดทุนเบ็ดเสร็จอื่น (ไม่ได้ตรวจสอบ),รวมค่าใช้จ่ายจากการดำเนินงานอื่น ๆ,"[18568004, 17016058.0, 841355, 491594.0]"
52,ผลขาดทุนด้านเครดิตที่คาดว่าจะเกิดขึ้น,430700,**(กลับรายการ) ผลขาดทุนด้านเครดิตที่คาดว่าจะเกิดขึ้น**,The query 'ผลขาดทุนด้านเครดิตที่คาดว่าจะเกิดขึ้น' is an exact match to multiple items in the taxonomy list where financial_statement_type is 'PL'.  Selecting the item based on the closest lexical match to the input query and the fs_category.,งบกำไรขาดทุนและกำไรขาดทุนเบ็ดเสร็จอื่น (ไม่ได้ตรวจสอบ),ผลขาดทุนด้านเครดิตที่คาดว่าจะเกิดขึ้น,"[11626322, 12097640.0, -59976, 55768.0]"
53,กำไร (ขาดทุน) จากการดำเนินงานก่อนภาษีเงินได้,409994,กำไร (ขาดทุน) จากการดำเนินงานก่อนภาษีเงินได้,"The query 'กำไร (ขาดทุน) จากการดำเนินงานก่อนภาษีเงินได้' is an exact match with the 'item_in_taxonomy' in the Taxonomy list. Thus, the set_code 409994 is selected.",งบกำไรขาดทุนและกำไรขาดทุนเบ็ดเสร็จอื่น (ไม่ได้ตรวจสอบ),กำไร (ขาดทุน) จากการดำเนินงานก่อนภาษีเงินได้,"[13058904, 15202450.0, -8271057, -365442.0]"
54,ภาษีเงินได้,439800,ภาษีเงินได้,"From the Taxonomy list, the item 'ภาษีเงินได้' with fs_category 'กำไรขาดทุน' matches the query 'ภาษีเงินได้' and the provided fs_category 'ภาษีเงินได้' in the INPUT METADATA. Therefore, the correct SET Code is 439800 and the item in Taxonomy is 'ภาษีเงินได้'.",งบกำไรขาดทุนและกำไรขาดทุนเบ็ดเสร็จอื่น (ไม่ได้ตรวจสอบ),ภาษีเงินได้,"[2907934, 3288702.0, 0, 0.0]"
55,กำไร (ขาดทุน) สุทธิ,409996,กำไร (ขาดทุน) สุทธิ สำหรับงวด,"The input name's fs_category is กำไร (ขาดทุน) สุทธิ and financial_statement_type is งบกำไรขาดทุนและกำไรขาดทุนเบ็ดเสร็จอื่น (ไม่ได้ตรวจสอบ) which means the correct item in the Taxonomy should have fs_category related to กำไร (ขาดทุน) สุทธิ and financial_statement_type is PL. Found one item in the Taxonomy list with fs_category กำไรขาดทุน, item_in_taxonomy กำไร (ขาดทุน) สุทธิ สำหรับงวด and set_code 409996. ",งบกำไรขาดทุนและกำไรขาดทุนเบ็ดเสร็จอื่น (ไม่ได้ตรวจสอบ),กำไร (ขาดทุน) สุทธิ,"[10150970, 11913748.0, -8271057, -365442.0]"
56,รายได้ดอกเบี้ย,410108,รายได้ดอกเบี้ย,"The query directly matches the item ""รายได้ดอกเบี้ย"" in the taxonomy list. Although no item in the taxonomy list has fs_category as รายได้ (ค่าใช้จ่าย) จากการดำเนินงาน, this item is selected because the financial_statement_type is งบกำไรขาดทุนและกำไรขาดทุนเบ็ดเสร็จอื่น (ไม่ได้ตรวจสอบ) and it's most likely to be correct.",งบกำไรขาดทุนและกำไรขาดทุนเบ็ดเสร็จอื่น (ไม่ได้ตรวจสอบ),รายได้ (ค่าใช้จ่าย) จากการดำเนินงาน,"[83785607, 76611616.0, 2283146, 626922.0]"
57,ค่าใช้จ่ายดอกเบี้ย,429900,ค่าใช้จ่ายดอกเบี้ย,"The input item name is ค่าใช้จ่ายดอกเบี้ย and the input metadata financial_statement_type is งบกำไรขาดทุนและกำไรขาดทุนเบ็ดเสร็จอื่น (ไม่ได้ตรวจสอบ) which maps to PL. From the Taxonomy list,  SET Code 429900 with item_in_taxonomy ค่าใช้จ่ายดอกเบี้ย matched the input query and financial_statement_type.",งบกำไรขาดทุนและกำไรขาดทุนเบ็ดเสร็จอื่น (ไม่ได้ตรวจสอบ),รายได้ (ค่าใช้จ่าย) จากการดำเนินงาน,"[19448765, 16877831.0, 2365019, 1287300.0]"
58,รายได้ดอกเบี้ยสุทธิ,400599,รายได้ดอกเบี้ยสุทธิ,รายได้ดอกเบี้ยสุทธิ best match  item_in_taxonomy: รายได้ดอกเบี้ยสุทธิ,งบกำไรขาดทุนและกำไรขาดทุนเบ็ดเสร็จอื่น (ไม่ได้ตรวจสอบ),รายได้ (ค่าใช้จ่าย) จากการดำเนินงาน,"[64336842, 59733785.0, -81873, -660378.0]"
59,รายได้ค่าธรรมเนียมและบริการ,410113,รายได้ค่าธรรมเนียมและบริการ,The input item name is รายได้ค่าธรรมเนียมและบริการ and fs_category is รายได้ (ค่าใช้จ่าย) จากการดำเนินงาน. Found the item รายได้ค่าธรรมเนียมและบริการ with related fs_category  กำไรขาดทุน in the Taxonomy list. ,งบกำไรขาดทุนและกำไรขาดทุนเบ็ดเสร็จอื่น (ไม่ได้ตรวจสอบ),รายได้ (ค่าใช้จ่าย) จากการดำเนินงาน,"[21602568, 23613591.0, 1196852, 0.0]"
60,ค่าใช้จ่ายค่าธรรมเนียมและบริการ,422200,ค่าใช้จ่ายค่าธรรมเนียมและบริการ,"The query perfectly matches the item ""ค่าใช้จ่ายค่าธรรมเนียมและบริการ"" in the taxonomy list. Although no item in the provided taxonomy list has fs_category related to รายได้ (ค่าใช้จ่าย) จากการดำเนินงาน, we can use the item_in_taxonomy instead.",งบกำไรขาดทุนและกำไรขาดทุนเบ็ดเสร็จอื่น (ไม่ได้ตรวจสอบ),รายได้ (ค่าใช้จ่าย) จากการดำเนินงาน,"[6176335, 6195586.0, 384, 540.0]"
61,รายได้ค่าธรรมเนียมและบริการสุทธิ,400699,รายได้ค่าธรรมเนียมและบริการสุทธิ,The query 'รายได้ค่าธรรมเนียมและบริการสุทธิ' best matches the 'รายได้ค่าธรรมเนียมและบริการสุทธิ' in the taxonomy list.  The financial_statement_type is 'งบกำไรขาดทุนและกำไรขาดทุนเบ็ดเสร็จอื่น (ไม่ได้ตรวจสอบ)' which mapped to 'PL'.,งบกำไรขาดทุนและกำไรขาดทุนเบ็ดเสร็จอื่น (ไม่ได้ตรวจสอบ),รายได้ (ค่าใช้จ่าย) จากการดำเนินงาน,"[15426233, 17418005.0, 1196468, -540.0]"
62,กำไร (ขาดทุน) สุทธิจากเครื่องมือทางการเงินที่วัดมูลค่าด้วย มูลค่ายุติธรรมผ่านกำไรหรือขาดทุน,431390,กำไร (ขาดทุน) สุทธิจากเครื่องมือทางการเงินที่วัดมูลค่าด้วยมูลค่ายุติธรรมผ่านกำไรหรือขาดทุน กำไร (ขาดทุน) สุทธิจากเครื่องมือทางการเงินที่วัดมูลค่าด้วยมูลค่ายุติธรรมผ่านกำไรหรือขาดทุน - อื่น ๆ,"From the Taxonomy list, the item_in_taxonomy best matched to the query after considering the fs_category and financial_statement_type is กำไร (ขาดทุน) สุทธิจากเครื่องมือทางการเงินที่วัดมูลค่าด้วยมูลค่ายุติธรรมผ่านกำไรหรือขาดทุน กำไร (ขาดทุน) สุทธิจากเครื่องมือทางการเงินที่วัดมูลค่าด้วยมูลค่ายุติธรรมผ่านกำไรหรือขาดทุน - อื่น ๆ. ",งบกำไรขาดทุนและกำไรขาดทุนเบ็ดเสร็จอื่น (ไม่ได้ตรวจสอบ),รายได้ (ค่าใช้จ่าย) จากการดำเนินงาน,"[4639547, 6070583.0, -1720121, 190139.0]"
