,query,set_code,item_in_taxonomy,reasoning,table_name,category,number_values
0,เงินสด,100100,เงินสด,"The query ""เงินสด"" matches directly with the 'item_in_taxonomy' ""เงินสด"" in the taxonomy list.  The financial_statement_type is ""BS_A"" which is extracted from the input metadata. ",งบฐานะการเงินรวม,สินทรัพย์ (ไม่ได้ตรวจสอบ),"[35478716, 40675704, 0, 0]"
1,รายการระหว่างธนาคารและตลาดเงินสุทธิ,100200,รายการระหว่างธนาคารและตลาดเงิน - สุทธิ,"INPUT: รายการระหว่างธนาคารและตลาดเงินสุทธิ
financial_statement_type is งบฐานะการเงินรวม, using BS_A
fs_category is สินทรัพย์ (ไม่ได้ตรวจสอบ), using fs_category: สินทรัพย์
This input matches item_in_taxonomy: รายการระหว่างธนาคารและตลาดเงิน - สุทธิ",งบฐานะการเงินรวม,สินทรัพย์ (ไม่ได้ตรวจสอบ),"[459883199, 436797171, 12661712, 3410933]"
2,สินทรัพย์ทางการเงินที่วัดมูลค่าด้วยมูลค่ายุติธรรม ผ่านกำไรหรือขาดทุน,100600,สินทรัพย์ทางการเงินที่วัดมูลค่าด้วยมูลค่ายุติธรรมผ่านกำไรหรือขาดทุน,"The user is looking for the right SET Code and Item in Taxonomy for ""สินทรัพย์ทางการเงินที่วัดมูลค่าด้วยมูลค่ายุติธรรม ผ่านกำไรหรือขาดทุน"" with financial_statement_type is งบฐานะการเงินรวม and fs_category is สินทรัพย์ (ไม่ได้ตรวจสอบ). 
The most relevant item from the Taxonomy list is where financial_statement_type: BS_A, fs_category: สินทรัพย์, and item_in_taxonomy: สินทรัพย์ทางการเงินที่วัดมูลค่าด้วยมูลค่ายุติธรรมผ่านกำไรหรือขาดทุน. Therefore, the correct SET Code is 100600.",งบฐานะการเงินรวม,สินทรัพย์ (ไม่ได้ตรวจสอบ),"[138367442, 92534166, 13633673, 12292301]"
3,สินทรัพย์อนุพันธ์,103000,สินทรัพย์อนุพันธ์,"The input name ""สินทรัพย์อนุพันธ์"" matches directly with the item_in_taxonomy ""สินทรัพย์อนุพันธ์"" in the taxonomy list. And the  fs_category ""สินทรัพย์"" is also a match. Therefore, the set_code should be 103000.",งบฐานะการเงินรวม,สินทรัพย์ (ไม่ได้ตรวจสอบ),"[53733094, 46981694, 40924, 788077]"
4,เงินลงทุนสุทธิ,101600,เงินลงทุน - สุทธิ,"The input query 'เงินลงทุนสุทธิ' matches the meaning of taxonomy in the provided context. Also, financial_statement_type and fs_category from INPUT METADATA match the context.",งบฐานะการเงินรวม,สินทรัพย์ (ไม่ได้ตรวจสอบ),"[346881082, 386162469, 0, 0]"
5,เงินลงทุนในบริษัทย่อย บริษัทร่วมและการร่วมค้าสุทธิ,102600,เงินลงทุนในบริษัทย่อย บริษัทร่วม และการร่วมค้า ที่บันทึกโดยวิธีส่วนได้เสีย - สุทธิ,"The input name 'เงินลงทุนในบริษัทย่อย บริษัทร่วมและการร่วมค้าสุทธิ' is a close match to the item 'เงินลงทุนในบริษัทย่อย บริษัทร่วม และการร่วมค้า ที่บันทึกโดยวิธีส่วนได้เสีย - สุทธิ' in the taxonomy list. Both refer to investments in subsidiaries, associates, and joint ventures. The taxonomy item's definition confirms that it encompasses investments in all three entities. Therefore, this is the most appropriate match.",งบฐานะการเงินรวม,สินทรัพย์ (ไม่ได้ตรวจสอบ),"[1810075, 1970054, 507448947, 514995206]"
6,เงินให้สินเชื่อแก่ลูกหนี้และดอกเบี้ยค้างรับสุทธิ,102000,เงินให้สินเชื่อแก่ลูกหนี้และดอกเบี้ยค้างรับ - สุทธิ,"The query 'เงินให้สินเชื่อแก่ลูกหนี้และดอกเบี้ยค้างรับสุทธิ' is a close match to the item 'เงินให้สินเชื่อแก่ลูกหนี้และดอกเบี้ยค้างรับ - สุทธิ' in the taxonomy list. The fs_category property of this item is 'สินทรัพย์', which is related to the input metadata 'สินทรัพย์ (ไม่ได้ตรวจสอบ)'.",งบฐานะการเงินรวม,สินทรัพย์ (ไม่ได้ตรวจสอบ),"[2312513705, 2301044123, 145872187, 132731456]"
7,ทรัพย์สินรอการขายสุทธิ,103500,ทรัพย์สินรอการขาย - สุทธิ,The query 'ทรัพย์สินรอการขายสุทธิ' is an exact match to the 'item_in_taxonomy' field 'ทรัพย์สินรอการขาย - สุทธิ' in the taxonomy list. financial_statement_type งบฐานะการเงินรวม maps to BS_A.,งบฐานะการเงินรวม,สินทรัพย์ (ไม่ได้ตรวจสอบ),"[27011483, 25930818, 0, 0]"
8,อสังหาริมทรัพย์เพื่อการลงทุนสุทธิ,103700,อสังหาริมทรัพย์เพื่อการลงทุน - สุทธิ,"The query ""อสังหาริมทรัพย์เพื่อการลงทุนสุทธิ"" is an exact match to the item ""อสังหาริมทรัพย์เพื่อการลงทุน - สุทธิ"" in the provided taxonomy list.  The financial statement type is confirmed to be BS_A and the fs_category is confirmed to be สินทรัพย์ (ไม่ได้ตรวจสอบ).",งบฐานะการเงินรวม,สินทรัพย์ (ไม่ได้ตรวจสอบ),"[478032, 486264, 0, 0]"
9,ที่ดิน อาคารและอุปกรณ์สุทธิ,103800,ที่ดิน อาคาร และอุปกรณ์ - สุทธิ,"The query 'ที่ดิน อาคารและอุปกรณ์สุทธิ' is a close match to the item 'ที่ดิน อาคาร และอุปกรณ์ - สุทธิ' in the provided taxonomy list. Both terms refer to tangible assets used in a business's operations, net of accumulated depreciation and impairment. Therefore, the SET code '103800' is selected.",งบฐานะการเงินรวม,สินทรัพย์ (ไม่ได้ตรวจสอบ),"[45314686, 45987817, 37971, 42233]"
10,ค่าความนิยมและสินทรัพย์ไม่มีตัวตนอื่นสุทธิ,104000,ค่าความนิยมและสินทรัพย์ไม่มีตัวตนอื่น - สุทธิ,The input name 'ค่าความนิยมและสินทรัพย์ไม่มีตัวตนอื่นสุทธิ' is directly matched with the item 'ค่าความนิยมและสินทรัพย์ไม่มีตัวตนอื่น - สุทธิ' in the taxonomy list. And the input metadata 'fs_category' is 'สินทรัพย์ (ไม่ได้ตรวจสอบ)' is aligned with the taxonomy's 'fs_category' of 'สินทรัพย์'.,งบฐานะการเงินรวม,สินทรัพย์ (ไม่ได้ตรวจสอบ),"[20747458, 21691664, 635119, 483466]"
11,สินทรัพย์ภาษีเงินได้รอตัดบัญชี,104400,สินทรัพย์ภาษีเงินได้รอตัดบัญชี,"Found an exact match for the input query 'สินทรัพย์ภาษีเงินได้รอตัดบัญชี' in the Taxonomy list.  The fs_category of the matched item is 'สินทรัพย์', which is related to the input metadata 'สินทรัพย์ (ไม่ได้ตรวจสอบ)'.",งบฐานะการเงินรวม,สินทรัพย์ (ไม่ได้ตรวจสอบ),"[6010657, 6138907, 0, 0]"
12,สินทรัพย์อื่นสุทธิ,109900,สินทรัพย์อื่น - สุทธิ,"The query 'สินทรัพย์อื่นสุทธิ' is a close match to the item 'สินทรัพย์อื่น - สุทธิ' in the taxonomy list. The financial statement type 'งบฐานะการเงินรวม' corresponds to 'BS_A', and the fs_category 'สินทรัพย์ (ไม่ได้ตรวจสอบ)' matches the 'สินทรัพย์' category of the selected taxonomy item.",งบฐานะการเงินรวม,สินทรัพย์ (ไม่ได้ตรวจสอบ),"[36084554, 32321079, 1484368, 2400058]"
13,รวมสินทรัพย์,109999,รวมสินทรัพย์,The query 'รวมสินทรัพย์' is an exact match with the 'item_in_taxonomy' field in the taxonomy list.  The corresponding 'set_code' is '109999'.,งบฐานะการเงินรวม,สินทรัพย์ (ไม่ได้ตรวจสอบ),"[3484314183, 3438721930, 681814901, 667143730]"
14,เงินรับฝาก,200100,เงินรับฝาก,"The query ""เงินรับฝาก"" matches the item_in_taxonomy ""เงินรับฝาก"" in the taxonomy list. The fs_category also matches the input metadata.",งบฐานะการเงินรวม,หนี้สิน,"[2457273819, 2442859865, 0, 0]"
15,รายการระหว่างธนาคารและตลาดเงิน,200200,รายการระหว่างธนาคารและตลาดเงิน,The input item name 'รายการระหว่างธนาคารและตลาดเงิน' matched with item_in_taxonomy 'รายการระหว่างธนาคารและตลาดเงิน' in the Taxonomy list. And the  financial_statement_type is 'BS_L' which is matched the input metadata.,งบฐานะการเงินรวม,หนี้สิน,"[249082172, 221458781, 84101524, 96081476]"
16,หนี้สินจ่ายคืนเมื่อทวงถาม,200300,หนี้สินจ่ายคืนเมื่อทวงถาม,The input item name 'หนี้สินจ่ายคืนเมื่อทวงถาม' is directly matched to taxonomy item 'หนี้สินจ่ายคืนเมื่อทวงถาม' with the same name in the taxonomy list. And the value of property 'fs_category' is matched to the input metadata 'fs_category'.,งบฐานะการเงินรวม,หนี้สิน,"[16159506, 13005055, 0, 0]"
17,หนี้สินทางการเงินที่วัดมูลค่าด้วยมูลค่ายุติธรรมผ่านกำไรหรือขาดทุน,200400,หนี้สินทางการเงินที่วัดมูลค่าด้วยมูลค่ายุติธรรมผ่านกำไรหรือขาดทุน,"The query's wording directly matches the item ""หนี้สินทางการเงินที่วัดมูลค่าด้วยมูลค่ายุติธรรมผ่านกำไรหรือขาดทุน"" in the taxonomy list, and other criteria such as fs_category and financial_statement_type also align.",งบฐานะการเงินรวม,หนี้สิน,"[1973031, 1910818, 0, 0]"
18,หนี้สินอนุพันธ์,202100,หนี้สินอนุพันธ์,"The user is looking for the taxonomy item that corresponds to หนี้สินอนุพันธ์. Based on the provided taxonomy list, the closest match is within the item with set code 202100, where both 'fs_category' and 'item_in_taxonomy' are หนี้สินอนุพันธ์. ",งบฐานะการเงินรวม,หนี้สิน,"[54633399, 42952427, 1946830, 0]"
19,ตราสารหนี้ที่ออกและเงินกู้ยืม,202000,ตราสารหนี้ที่ออกและเงินกู้ยืม,"The query perfectly matches the item ""ตราสารหนี้ที่ออกและเงินกู้ยืม"" in the taxonomy list. Considering the fs_category is หนี้สิน,  set_code 202000 and item_in_taxonomy from the same matched item should be used.",งบฐานะการเงินรวม,หนี้สิน,"[118866333, 109910607, 83374604, 49843096]"
20,ประมาณการหนี้สิน,202800,ประมาณการหนี้สิน,"The query 'ประมาณการหนี้สิน' is a direct match to the 'item_in_taxonomy' field in the Taxonomy list, and other properties also match.",งบฐานะการเงินรวม,หนี้สิน,"[18096585, 20125958, 129752, 97210]"
21,หนี้สินภาษีเงินได้รอตัดบัญชี,203200,หนี้สินภาษีเงินได้รอตัดบัญชี,"The query 'หนี้สินภาษีเงินได้รอตัดบัญชี' is an exact match with the 'item_in_taxonomy' in the Taxonomy list.  Also, the fs_category matched the input metadata fs_category, indicating that this is the correct classification.",งบฐานะการเงินรวม,หนี้สิน,"[1176677, 991717, 0, 0]"
22,หนี้สินอื่น,209900,หนี้สินอื่น,The input query 'หนี้สินอื่น' and financial_statement_type งบฐานะการเงินรวม directly match with item_in_taxonomy 'หนี้สินอื่น' and financial_statement_type 'BS_L' in the taxonomy list. ,งบฐานะการเงินรวม,หนี้สิน,"[88553782, 101773387, 1826775, 1701690]"
23,รวมหนี้สิน,209999,รวมหนี้สิน,"The query matches the item_in_taxonomy ""รวมหนี้สิน"" in the Taxonomy list. financial_statement_type and fs_category also match the input metadata.",งบฐานะการเงินรวม,หนี้สิน,"[3005815304, 2954988615, 171379485, 147723472]"
24,"ทุนเรือนหุ้นทุนจดทะเบียนหุ้นสามัญ 3,399,192,198 หุ้น มูลค่าหุ้นละ 10 บาท",310120,ทุนจดทะเบียน หุ้นสามัญจดทะเบียน,"The input query mentions ทุนจดทะเบียน and หุ้นสามัญ which is similar to  item_in_taxonomy: ทุนจดทะเบียน หุ้นสามัญจดทะเบียน in the taxonomy list. Thus, the set_code should be 310120",งบฐานะการเงินรวม,ส่วนของเจ้าของ,"[33991922, 33991922, 33991922, 33991922]"
25,"ทุนที่ออกและชำระแล้วหุ้นสามัญ 3,367,107,286 หุ้น มูลค่าหุ้นละ 10 บาท",310220,ทุนที่ออกและชำระแล้ว หุ้นสามัญชำระแล้ว,The input mentions 'ทุนที่ออกและชำระแล้ว' and 'หุ้นสามัญ' which directly corresponds to the item 'ทุนที่ออกและชำระแล้ว หุ้นสามัญชำระแล้ว' in the taxonomy.  The context also has matching fs_category.,งบฐานะการเงินรวม,ส่วนของเจ้าของ,"[33671073, 33671073, 33671073, 33671073]"
26,ส่วนเกินมูลค่าหุ้นสามัญ,310420,ส่วนเกิน (ต่ำกว่า) มูลค่าหุ้น ส่วนเกิน (ต่ำกว่า) มูลค่าหุ้นสามัญ,"The query mentions ""ส่วนเกินมูลค่าหุ้นสามัญ"" which directly corresponds to the item ""ส่วนเกิน (ต่ำกว่า) มูลค่าหุ้น ส่วนเกิน (ต่ำกว่า) มูลค่าหุ้นสามัญ"" in the taxonomy. The taxonomy's definition confirms its relevance to the query. Thus, this item is the most appropriate match.",งบฐานะการเงินรวม,ส่วนของเจ้าของ,"[11019190, 11019190, 407069914, 407069914]"
27,องค์ประกอบอื่นของส่วนของเจ้าของ,319900,องค์ประกอบอื่นของส่วนของผู้ถือหุ้น,"The query 'องค์ประกอบอื่นของส่วนของเจ้าของ' is very similar to the 'item_in_taxonomy' field 'องค์ประกอบอื่นของส่วนของผู้ถือหุ้น' in the taxonomy list, and the 'fs_category' field 'ส่วนของผู้ถือหุ้น' matched the criteria related to 'ส่วนของเจ้าของ'.",งบฐานะการเงินรวม,ส่วนของเจ้าของ,"[20425561, 20833387, 0, 0]"
28,กำไรสะสมจัดสรรแล้วทุนสำรองตามกฎหมาย,310611,กำไรสะสม - จัดสรรแล้ว สำรองตามกฎหมาย,"The query mentions ""กำไรสะสมจัดสรรแล้ว"" and ""ทุนสำรองตามกฎหมาย"", which directly match the item ""กำไรสะสม - จัดสรรแล้ว สำรองตามกฎหมาย"" in the taxonomy.  The taxonomy item's fs_category is also a match with the input metadata.",งบฐานะการเงินรวม,ส่วนของเจ้าของ,"[3400000, 3400000, 3400000, 3400000]"
29,ยังไม่ได้จัดสรร,310620,กำไร (ขาดทุน) สะสม กำไร (ขาดทุน) สะสม - ยังไม่ได้จัดสรร,"The INPUT is ยังไม่ได้จัดสรร and financial_statement_type is งบฐานะการเงินรวม, fs_category is ส่วนของเจ้าของ.  The most related item_in_taxonomy from the Taxonomy list is กำไร (ขาดทุน) สะสม กำไร (ขาดทุน) สะสม - ยังไม่ได้จัดสรร",งบฐานะการเงินรวม,ส่วนของเจ้าของ,"[404255057, 409158569, 66294429, 75279271]"
30,รวมส่วนของบริษัทใหญ่,319999,รวมส่วนของผู้ถือหุ้นของบริษัทใหญ่,The input name 'รวมส่วนของบริษัทใหญ่' is directly mentioned in one of the taxonomy list items with matching financial_statement_type and fs_category. ,งบฐานะการเงินรวม,ส่วนของเจ้าของ,"[472770881, 478082219, 510435416, 519420258]"
31,ส่วนได้เสียที่ไม่มีอำนาจควบคุม,320130,ส่วนได้เสียที่ไม่มีอำนาจควบคุม,"The query matches the item_in_taxonomy ""ส่วนได้เสียที่ไม่มีอำนาจควบคุม"" in the Taxonomy list. And the fs_category also matched with ส่วนของเจ้าของ in the INPUT METADATA. Thus, the SET Code should be 320130.",งบฐานะการเงินรวม,ส่วนของเจ้าของ,"[5727998, 5651096, 0, 0]"
32,รวมส่วนของเจ้าของ,309999,รวมหนี้สินและส่วนของผู้ถือหุ้น,"The input query 'รวมส่วนของเจ้าของ' is related to the item 'รวมหนี้สินและส่วนของผู้ถือหุ้น' in the taxonomy list. Both share similar wording and meaning, indicating a strong match.",งบฐานะการเงินรวม,ส่วนของเจ้าของ,"[478498879, 483733315, 510435416, 519420258]"
33,รวมหนี้สินและส่วนของเจ้าของ,309999,รวมหนี้สินและส่วนของผู้ถือหุ้น,The input query 'รวมหนี้สินและส่วนของเจ้าของ' matches the closest with item 'รวมหนี้สินและส่วนของผู้ถือหุ้น' in the taxonomy list.  The fs_category information from the input metadata 'ส่วนของเจ้าของ' also matches the fs_category in the taxonomy list 'ส่วนของผู้ถือหุ้น'.,งบฐานะการเงินรวม,ส่วนของเจ้าของ,"[3484314183, 3438721930, 681814901, 667143730]"
34,รายได้ดอกเบี้ย,410108,รายได้ดอกเบี้ย,"The query matches the item_in_taxonomy ""รายได้ดอกเบี้ย"" in the taxonomy list.  The fs_category of the matched item is ""กำไรขาดทุน"", but the input metadata specifies ""รายได้ (ค่าใช้จ่าย) จากการดำเนินงาน"". Thus, use item_in_taxonomy instead of fs_category.",งบกำไรขาดทุนและกำไรขาดทุนเบ็ดเสร็จอื่น (ไม่ได้ตรวจสอบ),รายได้ (ค่าใช้จ่าย) จากการดำเนินงาน,"[42405740, 39519442.0, 1184224, 383734.0]"
35,ค่าใช้จ่ายดอกเบี้ย,429900,ค่าใช้จ่ายดอกเบี้ย,"The query 'ค่าใช้จ่ายดอกเบี้ย' directly matches the item 'ค่าใช้จ่ายดอกเบี้ย' in the taxonomy list. This item's fs_category is 'กำไรขาดทุน', which is related to the input metadata 'รายได้ (ค่าใช้จ่าย) จากการดำเนินงาน'.",งบกำไรขาดทุนและกำไรขาดทุนเบ็ดเสร็จอื่น (ไม่ได้ตรวจสอบ),รายได้ (ค่าใช้จ่าย) จากการดำเนินงาน,"[9830056, 8728059.0, 1199183, 690275.0]"
36,รายได้ดอกเบี้ยสุทธิ,400599,รายได้ดอกเบี้ยสุทธิ,"The query 'รายได้ดอกเบี้ยสุทธิ' matches exactly with 'รายได้ดอกเบี้ยสุทธิ' in the provided taxonomy list.  Also, its fs_category is 'กำไรขาดทุน', which is related to the input metadata 'รายได้ (ค่าใช้จ่าย) จากการดำเนินงาน'.",งบกำไรขาดทุนและกำไรขาดทุนเบ็ดเสร็จอื่น (ไม่ได้ตรวจสอบ),รายได้ (ค่าใช้จ่าย) จากการดำเนินงาน,"[32575684, 30791383.0, -14959, -306541.0]"
