,query,set_code,item_in_taxonomy,reasoning,table_name,category,number_values
111,รายได้เงินปันผล,519700,รับเงินปันผล,"The input query 'รายได้เงินปันผล' matches the item 'รับเงินปันผล' in the taxonomy list.  The fs_category does not match the criteria, but item_in_taxonomy is used instead. Therefore, the set code is 519700.",งบกระแสเงินสด (ไม่ได้ตรวจสอบ),กระแสเงินสดจากกิจกรรมดำเนินงาน,"[-176272, -111359.0, -26998555, -38137106.0]"
112,เงินสดรับดอกเบี้ย,519500,รับดอกเบี้ย,"The input 'เงินสดรับดอกเบี้ย' matches the meaning_of_taxonomy 'บางครั้งใช้ขื่อว่า เงินสดรับดอกเบี้ย เงินสดรับดอกเบี้ย' in the Taxonomy list.  The input metadata specifies 'fs_category' as กระแสเงินสดจากกิจกรรมดำเนินงาน, which corresponds to 'fs_category' กิจกรรมดำเนินงาน in the Taxonomy list.",งบกระแสเงินสด (ไม่ได้ตรวจสอบ),กระแสเงินสดจากกิจกรรมดำเนินงาน,"[82767864, 72543776.0, 2254697, 662369.0]"
113,เงินสดจ่ายดอกเบี้ย,519600,จ่ายดอกเบี้ย,The input name 'เงินสดจ่ายดอกเบี้ย' matches the meaning_of_taxonomy 'บางครั้งใช้ขื่อว่า เงินสดจ่ายดอกเบี้ย เงินสดจ่ายดอกเบี้ย' and fs_category matches the context.,งบกระแสเงินสด (ไม่ได้ตรวจสอบ),กระแสเงินสดจากกิจกรรมดำเนินงาน,"[-18691025, -13421970.0, -2963038, -1460085.0]"
114,เงินสดรับเงินปันผล,519700,รับเงินปันผล,"The financial report line item name is เงินสดรับเงินปันผล and  fs_category is กระแสเงินสดจากกิจกรรมดำเนินงาน.  The Taxonomy list item with item_in_taxonomy  as รับเงินปันผล  and financial_statement_type as CF has fs_category as กิจกรรมดำเนินงาน, which is related. Therefore, the correct SET Code is 519700 and Item in Taxonomy is รับเงินปันผล.",งบกระแสเงินสด (ไม่ได้ตรวจสอบ),กระแสเงินสดจากกิจกรรมดำเนินงาน,"[605487, 368795.0, 26998555, 38137106.0]"
115,เงินสดจ่ายภาษีเงินได้,514900,ภาษีเงินได้,The input name 'เงินสดจ่ายภาษีเงินได้' is similar to 'ภาษีเงินได้' and both belong to the same fs_category 'กิจกรรมดำเนินงาน' in the Taxonomy list.,งบกระแสเงินสด (ไม่ได้ตรวจสอบ),กระแสเงินสดจากกิจกรรมดำเนินงาน,"[-8086165, -6010988.0, 0, 0.0]"
116,กำไรจากการดำเนินงานก่อนการเปลี่ยนแปลงในสินทรัพย์และหนี้สินดำเนินงาน,519997,กำไร (ขาดทุน) จากการดำเนินงานก่อนการเปลี่ยนแปลงในสินทรัพย์และหนี้สินดำเนินงาน,"The query matches the item_in_taxonomy ""กำไร (ขาดทุน) จากการดำเนินงานก่อนการเปลี่ยนแปลงในสินทรัพย์และหนี้สินดำเนินงาน"" in the Taxonomy list. Although there's no exact match for fs_category ""กระแสเงินสดจากกิจกรรมดำเนินงาน"", this item's fs_category ""กิจกรรมดำเนินงาน"" is closely related and considered a broader category. Therefore, it's chosen as the most appropriate match.",งบกระแสเงินสด (ไม่ได้ตรวจสอบ),กระแสเงินสดจากกิจกรรมดำเนินงาน,"[46710999, 54246665.0, 25112505, 36650296.0]"
117,รายการระหว่างธนาคารและตลาดเงิน,515200,รายการระหว่างธนาคารและตลาดเงิน (เพิ่มขึ้น) ลดลง,"The query \""รายการระหว่างธนาคารและตลาดเงิน\"" matches the item_in_taxonomy \""รายการระหว่างธนาคารและตลาดเงิน (เพิ่มขึ้น) ลดลง\"" in the Taxonomy list.  The property fs_category in the Taxonomy list item is \""กิจกรรมดำเนินงาน\"" which is related to กระแสเงินสดจากกิจกรรมดำเนินงาน in the input metadata.",งบกระแสเงินสด (ไม่ได้ตรวจสอบ),กระแสเงินสดจากกิจกรรมดำเนินงาน,"[-23153558, 33389728.0, -9239204, -34212981.0]"
118,สินทรัพย์อนุพันธ์,515300,สินทรัพย์ทางการเงินที่วัดมูลค่าด้วยมูลค่ายุติธรรมผ่านกำไรหรือขาดทุน (เพิ่มขึ้น) ลดลง,The most relevant item from the provided taxonomy list is  'สินทรัพย์ทางการเงินที่วัดมูลค่าด้วยมูลค่ายุติธรรมผ่านกำไรหรือขาดทุน (เพิ่มขึ้น) ลดลง' because this is the closest match to the input 'สินทรัพย์อนุพันธ์'.,งบกระแสเงินสด (ไม่ได้ตรวจสอบ),กระแสเงินสดจากกิจกรรมดำเนินงาน,"[-7435915, 3916207.0, 759625, -178168.0]"
119,สินทรัพย์ทางการเงินที่วัดมูลค่าด้วยมูลค่ายุติธรรมผ่านกำไรหรือขาดทุน,515300,สินทรัพย์ทางการเงินที่วัดมูลค่าด้วยมูลค่ายุติธรรมผ่านกำไรหรือขาดทุน (เพิ่มขึ้น) ลดลง,"The query 'สินทรัพย์ทางการเงินที่วัดมูลค่าด้วยมูลค่ายุติธรรมผ่านกำไรหรือขาดทุน' best matches the item 'สินทรัพย์ทางการเงินที่วัดมูลค่าด้วยมูลค่ายุติธรรมผ่านกำไรหรือขาดทุน (เพิ่มขึ้น) ลดลง' in the provided taxonomy list. Both refer to financial assets measured at fair value through profit or loss. Thus, the SET code '515300' is selected.",งบกระแสเงินสด (ไม่ได้ตรวจสอบ),กระแสเงินสดจากกิจกรรมดำเนินงาน,"[-43049685, -11097930.0, -397129, -3801193.0]"
120,เงินให้สินเชื่อแก่ลูกหนี้,515800,เงินให้สินเชื่อแก่ลูกหนี้ (เพิ่มขึ้น) ลดลง,"The query 'เงินให้สินเชื่อแก่ลูกหนี้' is related to changes in loans provided to customers, which aligns with the item 'เงินให้สินเชื่อแก่ลูกหนี้ (เพิ่มขึ้น) ลดลง' in the taxonomy. This item falls under the fs_category 'กิจกรรมดำเนินงาน' which is related to the input metadata 'กระแสเงินสดจากกิจกรรมดำเนินงาน'.",งบกระแสเงินสด (ไม่ได้ตรวจสอบ),กระแสเงินสดจากกิจกรรมดำเนินงาน,"[-44625307, -70406940.0, -13125000, -17250000.0]"
121,ทรัพย์สินรอการขาย,516400,ทรัพย์สินรอการขาย (เพิ่มขึ้น) ลดลง,"The query 'ทรัพย์สินรอการขาย' matches the item 'ทรัพย์สินรอการขาย (เพิ่มขึ้น) ลดลง' in the taxonomy list.  The fs_category does not match the criteria, so we use item_in_taxonomy instead.",งบกระแสเงินสด (ไม่ได้ตรวจสอบ),กระแสเงินสดจากกิจกรรมดำเนินงาน,"[5919372, 5005714.0, 0, 0.0]"
122,สินทรัพย์อื่น,516600,สินทรัพย์ดำเนินงานอื่น (เพิ่มขึ้น) ลดลง,The input 'สินทรัพย์อื่น' matches the meaning of taxonomy 'สินทรัพย์ดำเนินงานอื่น เพิ่มขึ้นหรือลดลง บางครั้งใช้ขื่อว่า สินทรัพย์อื่น สินทรัพย์อื่น เพิ่มขึ้น หรือลดลง' and the fs_category is related to 'กระแสเงินสดจากกิจกรรมดำเนินงาน'.,งบกระแสเงินสด (ไม่ได้ตรวจสอบ),กระแสเงินสดจากกิจกรรมดำเนินงาน,"[-4063830, -16444839.0, -1790765, 1926186.0]"
123,เงินรับฝาก,516800,เงินรับฝาก เพิ่มขึ้น (ลดลง),The query 'เงินรับฝาก' matches the meaning of taxonomy 'เงินรับฝาก เพิ่มขึ้นหรือลดลง บางครั้งใช้ขื่อว่า เงินรับฝาก ' in the provided taxonomy list. And the  financial_statement_type and fs_category also matched.,งบกระแสเงินสด (ไม่ได้ตรวจสอบ),กระแสเงินสดจากกิจกรรมดำเนินงาน,"[14413954, -87641027.0, 0, 0.0]"
124,รายการระหว่างธนาคารและตลาดเงิน,516900,รายการระหว่างธนาคารและตลาดเงิน เพิ่มขึ้น (ลดลง),"From the Taxonomy list, found three items with a meaning related to รายการระหว่างธนาคารและตลาดเงิน.  Selected  'รายการระหว่างธนาคารและตลาดเงิน เพิ่มขึ้น (ลดลง)' with set code '516900' because the fs_category field matches the input metadata.",งบกระแสเงินสด (ไม่ได้ตรวจสอบ),กระแสเงินสดจากกิจกรรมดำเนินงาน,"[28618342, 21829574.0, -10936168, -11478277.0]"
125,หนี้สินจ่ายคืนเมื่อทวงถาม,517000,หนี้สินจ่ายคืนเมื่อทวงถาม เพิ่มขึ้น (ลดลง),"The input 'หนี้สินจ่ายคืนเมื่อทวงถาม' matches with the item 'หนี้สินจ่ายคืนเมื่อทวงถาม เพิ่มขึ้น (ลดลง)' in the taxonomy list. Also, the fs_category is matched with the input metadata 'กระแสเงินสดจากกิจกรรมดำเนินงาน'.",งบกระแสเงินสด (ไม่ได้ตรวจสอบ),กระแสเงินสดจากกิจกรรมดำเนินงาน,"[3154451, 3738241.0, 0, 0.0]"
126,หนี้สินทางการเงินที่วัดมูลค่าด้วยมูลค่ายุติธรรมผ่านกำไรหรือขาดทุน,517110,หนี้สินทางการเงินที่วัดมูลค่าด้วยมูลค่ายุติธรรมผ่านกำไรหรือขาดทุน เพิ่มขึ้น (ลดลง),The query matches with meaning_of_taxonomy: 'หนี้สินทางการเงินที่วัดมูลค่าด้วยมูลค่ายุติธรรมผ่านกำไรหรือขาดทุน เพิ่มขึ้นหรือลดลง บางครั้งใช้ขื่อว่า หนี้สินทางการเงินที่วัดมูลค่าด้วยมูลค่ายุติธรรมผ่านกำไรหรือขาดทุน ' and  fs_category is related to 'กระแสเงินสดจากกิจกรรมดำเนินงาน',งบกระแสเงินสด (ไม่ได้ตรวจสอบ),กระแสเงินสดจากกิจกรรมดำเนินงาน,"[62213, -30330.0, 0, 0.0]"
127,หนี้สินอนุพันธ์,517110,หนี้สินทางการเงินที่วัดมูลค่าด้วยมูลค่ายุติธรรมผ่านกำไรหรือขาดทุน เพิ่มขึ้น (ลดลง),"The most relevant item from the provided taxonomy list is 'หนี้สินทางการเงินที่วัดมูลค่าด้วยมูลค่ายุติธรรมผ่านกำไรหรือขาดทุน เพิ่มขึ้น (ลดลง)' because it refers to financial liabilities and fair value adjustments, which aligns with the input 'หนี้สินอนุพันธ์'. ",งบกระแสเงินสด (ไม่ได้ตรวจสอบ),กระแสเงินสดจากกิจกรรมดำเนินงาน,"[11757778, 3862956.0, 1946830, -639377.0]"
128,ตราสารหนี้ที่ออกและเงินกู้ยืมระยะสั้น,518500,เงินกู้ยืม เพิ่มขึ้น (ลดลง),"The input name 'ตราสารหนี้ที่ออกและเงินกู้ยืมระยะสั้น' appears in the meaning_of_taxonomy of the Taxonomy list item with SET Code '518500'.
This item's fs_category is related to กระแสเงินสดจากกิจกรรมดำเนินงาน, thus we select this item.",งบกระแสเงินสด (ไม่ได้ตรวจสอบ),กระแสเงินสดจากกิจกรรมดำเนินงาน,"[-1568823, 1420691.0, 0, 0.0]"
129,หนี้สินอื่น,518300,หนี้สินดำเนินงานอื่น เพิ่มขึ้น (ลดลง),"The closest match in the taxonomy list to the input ""หนี้สินอื่น"" is ""หนี้สินดำเนินงานอื่น เพิ่มขึ้น (ลดลง)"". Although the input does not specify increase/decrease, this item's meaning ""หนี้สินดำเนินงานอื่น เพิ่มขึ้นหรือลดลง บางครั้งใช้ขื่อว่า หนี้สินอื่น"" suggests that it can cover cases without specifying increase/decrease. Therefore, this item is chosen.",งบกระแสเงินสด (ไม่ได้ตรวจสอบ),กระแสเงินสดจากกิจกรรมดำเนินงาน,"[-12329620, -9306203.0, 36447, 195158.0]"
130,เงินสดสุทธิใช้ไปในกิจกรรมดำเนินงาน,519999,เงินสดสุทธิได้มาจาก (ใช้ไปใน) กิจกรรมดำเนินงาน,"The input query 'เงินสดสุทธิใช้ไปในกิจกรรมดำเนินงาน' is related to fs_category 'กระแสเงินสดจากกิจกรรมดำเนินงาน' from the input metadata. 
              The closest matching item from the Taxonomy list is 'เงินสดสุทธิได้มาจาก (ใช้ไปใน) กิจกรรมดำเนินงาน' with set code '519999'.",งบกระแสเงินสด (ไม่ได้ตรวจสอบ),กระแสเงินสดจากกิจกรรมดำเนินงาน,"[-25589629, -67517493.0, -7632859, -28788356.0]"
131,เงินสดจ่ายในการซื้อหลักทรัพย์ที่วัดมูลค่ายุติธรรมผ่านกำไรขาดทุนเบ็ดเสร็จอื่น,520300,เงินสดจ่ายซื้อเงินลงทุน,"The input keywords ""เงินสดจ่ายในการซื้อ"" and ""เงินลงทุน"" strongly suggest a relation to the item ""เงินสดจ่ายซื้อเงินลงทุน"" in the taxonomy. This item's fs_category, ""กิจกรรมลงทุน"", aligns with the input metadata's fs_category, ""กระแสเงินสดจากกิจกรรมลงทุน"".",งบกระแสเงินสด (ไม่ได้ตรวจสอบ),กระแสเงินสดจากกิจกรรมลงทุน,"[-52966906, -58094378.0, 0, 0.0]"
132,เงินสดรับจากการขายหลักทรัพย์ที่วัดมูลค่ายุติธรรมผ่านกำไรขาดทุนเบ็ดเสร็จอื่น,520200,เงินสดรับจากเงินลงทุน,"The INPUT METADATA states that fs_category is กระแสเงินสดจากกิจกรรมลงทุน.  The closest match from the Taxonomy list is 'เงินสดรับจากเงินลงทุน' with set_code '520200', because the meaning_of_taxonomy is 'บางครั้งใช้ขื่อว่า มูลค่ายุติธรรมผ่านกำไรขาดทุนเบ็ดเสร็จอื่น ' indicating this item's relation to fair value changes.",งบกระแสเงินสด (ไม่ได้ตรวจสอบ),กระแสเงินสดจากกิจกรรมลงทุน,"[87402321, 100255071.0, 0, 0.0]"
133,เงินสดจ่ายในการซื้อหลักทรัพย์ที่วัดมูลค่าด้วยราคาทุนตัดจำหน่าย,520300,เงินสดจ่ายซื้อเงินลงทุน,The input name suggests purchasing investment securities. The taxonomy list item 'เงินสดจ่ายซื้อเงินลงทุน' matches the input as it refers to cash outflow for investment purchases. And the fs_category is related to 'กระแสเงินสดจากกิจกรรมลงทุน'.,งบกระแสเงินสด (ไม่ได้ตรวจสอบ),กระแสเงินสดจากกิจกรรมลงทุน,"[-1415772, -3679242.0, 0, 0.0]"
134,เงินสดรับจากการไถ่ถอนหลักทรัพย์ที่วัดมูลค่าด้วยราคาทุนตัดจำหน่าย,520220,เงินสดรับจากเงินลงทุน เงินสดรับจากการไถ่ถอนเงินลงทุนในตราสารหนี้,"The input keywords ""เงินสดรับจากการไถ่ถอน"" and financial_statement_type งบกระแสเงินสด (ไม่ได้ตรวจสอบ) strongly suggest the item ""เงินสดรับจากเงินลงทุน เงินสดรับจากการไถ่ถอนเงินลงทุนในตราสารหนี้"" with SET Code 520220. ",งบกระแสเงินสด (ไม่ได้ตรวจสอบ),กระแสเงินสดจากกิจกรรมลงทุน,"[7905786, 5145444.0, 0, 1472358.0]"
135,เงินสดจ่ายในการลงทุนในบริษัทย่อย บริษัทร่วมและการร่วมค้า,521200,เงินสดจ่ายซื้อเงินลงทุนในบริษัทย่อย บริษัทร่วม และการร่วมค้า,"The input mentions outflow for investment in subsidiaries, associates and joint ventures. The input's financial statement type and fs category also match the selected item in taxonomy. ",งบกระแสเงินสด (ไม่ได้ตรวจสอบ),กระแสเงินสดจากกิจกรรมลงทุน,"[-19157, -1232992.0, -19157, -7220192.0]"
136,เงินสดรับจากการคืนทุนในบริษัทย่อย,529900,รายการอื่น ๆ (กิจกรรมลงทุน),The meaning_of_taxonomy: บางครั้งใช้ขื่อว่า เงินสดรับจากการคืนทุนในบริษัทย่อย  matched the query. And the fs_category: กิจกรรมลงทุน matched the input metadata.,งบกระแสเงินสด (ไม่ได้ตรวจสอบ),กระแสเงินสดจากกิจกรรมลงทุน,"[0, 0.0, 0, 2016000.0]"
137,เงินสดจ่ายในการซื้อที่ดิน อาคารและอุปกรณ์,521710,เงินสดจ่ายจากการซื้อสินทรัพย์ถาวร ที่ดิน อาคาร และอุปกรณ์,"The input mentions ""เงินสดจ่ายในการซื้อที่ดิน อาคารและอุปกรณ์"" and the input metadata specifies 'กระแสเงินสดจากกิจกรรมลงทุน' as the fs_category. In the taxonomy list, the closest match is where the 'item_in_taxonomy' is ""เงินสดจ่ายจากการซื้อสินทรัพย์ถาวร ที่ดิน อาคาร และอุปกรณ์"" and 'fs_category' is ""กิจกรรมลงทุน"".",งบกระแสเงินสด (ไม่ได้ตรวจสอบ),กระแสเงินสดจากกิจกรรมลงทุน,"[-432973, -374127.0, -3524, -459.0]"
138,เงินสดรับจากการขายที่ดิน อาคารและอุปกรณ์,521610,เงินสดรับจากการขายสินทรัพย์ถาวร ที่ดิน อาคาร และอุปกรณ์,The input query 'เงินสดรับจากการขายที่ดิน อาคารและอุปกรณ์' matches the meaning of taxonomy 'บางครั้งใช้ขื่อว่า เงินสดรับจากการขายที่ดินอาคารและอุปกรณ์' in the context provided.  The financial statement type is 'งบกระแสเงินสด (ไม่ได้ตรวจสอบ)' which matches 'CF' in the context. And the fs_category is 'กระแสเงินสดจากกิจกรรมลงทุน' which is related to 'กิจกรรมลงทุน' in the context.,งบกระแสเงินสด (ไม่ได้ตรวจสอบ),กระแสเงินสดจากกิจกรรมลงทุน,"[8724, 5018.0, 0, 0.0]"
