,query,set_code,item_in_taxonomy,reasoning,table_name,category,number_values
110,ส่วนที่เป็นของส่วนได้เสียที่ไม่มีอำนาจควบคุม,460200,การแบ่งปันกำไร (ขาดทุน) สุทธิ : ส่วนได้เสียที่ไม่มีอำนาจควบคุม,The input item name 'ส่วนที่เป็นของส่วนได้เสียที่ไม่มีอำนาจควบคุม' is related to the item in the taxonomy 'การแบ่งปันกำไร (ขาดทุน) สุทธิ : ส่วนได้เสียที่ไม่มีอำนาจควบคุม' with fs_category 'การแบ่งปันกำไรขาดทุน' which is related to the input metadata fs_category 'การแบ่งปันกำไรสุทธิ'.,งบกำไรขาดทุนเบ็ดเสร็จ สำหรับรอบระยะเวลาหกเดือนสิ้นสุดวันที่ 30 มิถุนายน พ.ศ. 2567,การแบ่งปันกำไรสุทธิ,"[72753, 196906, 0, 0]"
111,null,null,null,"I am sorry, I cannot locate the taxonomy information provided in the context. Therefore, I cannot suggest a suitable SET Code and Item in Taxonomy.",งบกำไรขาดทุนเบ็ดเสร็จ สำหรับรอบระยะเวลาหกเดือนสิ้นสุดวันที่ 30 มิถุนายน พ.ศ. 2567,การแบ่งปันกำไรสุทธิ,"[2598908, 2543670, 342742, 1578860]"
112,ส่วนที่เป็นของผู้เป็นเจ้าของของบริษัทใหญ่,470100,การแบ่งปันกำไร (ขาดทุน) เบ็ดเสร็จรวม : ผู้ถือหุ้นบริษัทใหญ่,The input financial report line item name  'ส่วนที่เป็นของผู้เป็นเจ้าของของบริษัทใหญ่' is related to the meaning of taxonomy in the second item of the Taxonomy list: 'การแบ่งปันกำไรหรือขาดทุน เบ็ดเสร็จรวม : ผู้ถือหุ้นบริษัทใหญ่ บางครั้งใช้ชื่อว่า ส่วนที่เป็นของบริษัทใหญ่ หรือ ส่วนที่เป็นของผู้ถือหุ้นของบริษัทฯ หรือ ส่วนของผู้เป็นเจ้าของของบริษัท หรือ ขาดทุนเบ็ดเสร็จรวมสำหรับงวด' and the input metadata financial_statement_type 'งบกำไรขาดทุนเบ็ดเสร็จ สำหรับรอบระยะเวลาหกเดือนสิ้นสุดวันที่ 30 มิถุนายน พ.ศ. 2567' and fs_category 'การแบ่งปันกำไรเบ็ดเสร็จรวม' are matched to the properties in the second item of the Taxonomy list. ,งบกำไรขาดทุนเบ็ดเสร็จ สำหรับรอบระยะเวลาหกเดือนสิ้นสุดวันที่ 30 มิถุนายน พ.ศ. 2567,การแบ่งปันกำไรเบ็ดเสร็จรวม,"[2552219, 2363249, 343519, 1578020]"
113,ส่วนที่เป็นของส่วนได้เสียที่ไม่มีอำนาจควบคุม,470200,การแบ่งปันกำไร (ขาดทุน) เบ็ดเสร็จรวม : ส่วนได้เสียที่ไม่มีอำนาจควบคุม,"The input mentions 'ส่วนที่เป็นของส่วนได้เสียที่ไม่มีอำนาจควบคุม' and the financial statement type is 'งบกำไรขาดทุนเบ็ดเสร็จ'.  This closely matches the item 'การแบ่งปันกำไร (ขาดทุน) เบ็ดเสร็จรวม : ส่วนได้เสียที่ไม่มีอำนาจควบคุม' in the taxonomy list, which falls under the 'การแบ่งปันกำไรขาดทุนเบ็ดเสร็จ' fs_category.",งบกำไรขาดทุนเบ็ดเสร็จ สำหรับรอบระยะเวลาหกเดือนสิ้นสุดวันที่ 30 มิถุนายน พ.ศ. 2567,การแบ่งปันกำไรเบ็ดเสร็จรวม,"[79430, 204169, 0, 0]"
114,null,null,null,"I am sorry, I cannot locate the Taxonomy information. Therefore, I cannot provide an appropriate SET Code and Item in Taxonomy.",งบกำไรขาดทุนเบ็ดเสร็จ สำหรับรอบระยะเวลาหกเดือนสิ้นสุดวันที่ 30 มิถุนายน พ.ศ. 2567,การแบ่งปันกำไรเบ็ดเสร็จรวม,"[2631649, 2567418, 343519, 1578020]"
115,กำไรต่อหุ้นขั้นพื้นฐาน (บาทต่อหุ้น),480100,กำไร (ขาดทุน) ต่อหุ้นขั้นพื้นฐาน (บาท/หุ้น),"The query mentions ""กำไรต่อหุ้นขั้นพื้นฐาน"" which directly translates to ""Basic Earnings Per Share"".  This aligns with the item ""กำไร (ขาดทุน) ต่อหุ้นขั้นพื้นฐาน (บาท/หุ้น)"" in the taxonomy, which translates to ""Basic Earnings (Loss) Per Share (Baht/Share)"". Thus, this is the most appropriate match.",งบกำไรขาดทุนเบ็ดเสร็จ สำหรับรอบระยะเวลาหกเดือนสิ้นสุดวันที่ 30 มิถุนายน พ.ศ. 2567,กำไรต่อหุ้น,"[1.67, 1.55, 0.23, 1.05]"
116,กำไรก่อนค่าใช้จ่ายภาษีเงินได้,510200,กำไร (ขาดทุน) ก่อนต้นทุนทางการเงิน และ/หรือ ภาษีเงินได้,"The input name 'กำไรก่อนค่าใช้จ่ายภาษีเงินได้' is directly mentioned in the meaning_of_taxonomy field of one of the provided taxonomy items. Thus, the set_code 510200 and item_in_taxonomy 'กำไร (ขาดทุน) ก่อนต้นทุนทางการเงิน และ/หรือ ภาษีเงินได้' are selected.",งบกระแสเงินสด สำหรับรอบระยะเวลาหกเดือนสิ้นสุดวันที่ 30 มิถุนายน พ.ศ. 2567,กระแสเงินสดจากกิจกรรมดำเนินงาน,"[3318203, 3210774, 358908, 1591206]"
117,ขาดทุน (กำไร) จากการเปลี่ยนแปลงมูลค่ายุติธรรมของสินทรัพย์ทางการเงิน10,511400, (กำไร) ขาดทุนจากการเปลี่ยนแปลงมูลค่ายุติธรรมของเงินลงทุน,"The INPUT, 'ขาดทุน (กำไร) จากการเปลี่ยนแปลงมูลค่ายุติธรรมของสินทรัพย์ทางการเงิน10' suggests a financial item related to gains or losses from fair value adjustments, specifically of financial assets. Within the provided Taxonomy list, the item '(กำไร) ขาดทุนจากการเปลี่ยนแปลงมูลค่ายุติธรรมของเงินลงทุน' aligns best with the input query. This item also corresponds to the specified 'fs_category' of 'กิจกรรมดำเนินงาน' which is related to the input metadata 'กระแสเงินสดจากกิจกรรมดำเนินงาน'. Therefore, the most fitting SET Code from the Taxonomy list is '511400'.",งบกระแสเงินสด สำหรับรอบระยะเวลาหกเดือนสิ้นสุดวันที่ 30 มิถุนายน พ.ศ. 2567,กระแสเงินสดจากกิจกรรมดำเนินงาน,"[6775, 4914, -60, -27]"
118,ส่วนแบ่งกําไรของบริษัทร่วมตามวิธีส่วนได้เสีย,510600,ส่วนแบ่ง (กำไร) ขาดทุนจากเงินลงทุนตามวิธีส่วนได้เสีย,The most relevant item from the provided taxonomy list is 'ส่วนแบ่ง (กำไร) ขาดทุนจากเงินลงทุนตามวิธีส่วนได้เสีย' because its meaning closely aligns with the input query. The meaning mentions 'ส่วนแบ่งกำไรจากเงินลงทุนในบริษัทร่วม' which directly corresponds to the input 'ส่วนแบ่งกําไรของบริษัทร่วมตามวิธีส่วนได้เสีย'.,งบกระแสเงินสด สำหรับรอบระยะเวลาหกเดือนสิ้นสุดวันที่ 30 มิถุนายน พ.ศ. 2567,กระแสเงินสดจากกิจกรรมดำเนินงาน,"[0, -25811, 0, 0]"
119,ค่าเสื่อมราคาและค่าตัดจำหน่าย,510300,ค่าเสื่อมราคาและค่าตัดจำหน่าย,"The INPUT matches the item 'ค่าเสื่อมราคาและค่าตัดจำหน่าย' in the Taxonomy list, and the fs_category 'กิจกรรมดำเนินงาน' is related to 'กระแสเงินสดจากกิจกรรมดำเนินงาน' in the INPUT METADATA.",งบกระแสเงินสด สำหรับรอบระยะเวลาหกเดือนสิ้นสุดวันที่ 30 มิถุนายน พ.ศ. 2567,กระแสเงินสดจากกิจกรรมดำเนินงาน,"[499346, 437623, 1724, 1519]"
120,ค่าตัดจำหน่ายต้นทุนในการออกหุ้นกู้15,515000,รายการปรับปรุงอื่น ๆ,"The input line item name ค่าตัดจำหน่ายต้นทุนในการออกหุ้นกู้ is related to 'ค่าตัดจำหน่ายต้นทุนในการออกหุ้นกู้' in  meaning_of_taxonomy of รายการปรับปรุงอื่น ๆ in the taxonomy list. Thus, the selected SET Code is 515000 and Item in Taxonomy is รายการปรับปรุงอื่น ๆ",งบกระแสเงินสด สำหรับรอบระยะเวลาหกเดือนสิ้นสุดวันที่ 30 มิถุนายน พ.ศ. 2567,กระแสเงินสดจากกิจกรรมดำเนินงาน,"[42205, 25693, 35550, 25693]"
121,ขาดทุนจากการตัดจำหน่ายอุปกรณ์และสินทรัพย์ไม่มีตัวตน,511520,ขาดทุนจากการตัดจำหน่ายสินทรัพย์ถาวร,"The input mentions losses from write-off of equipment and intangible assets. The closest match from the taxonomy list considering the input financial statement type and fs category is  ""(Gains) Losses On Disposal And Write-Off Of Fixed Assets Loss On Write-Off Of Fixed Assets"" with SET Code 511520.  Therefore, the selected SET code is 511520 and the item is ขาดทุนจากการตัดจำหน่ายสินทรัพย์ถาวร",งบกระแสเงินสด สำหรับรอบระยะเวลาหกเดือนสิ้นสุดวันที่ 30 มิถุนายน พ.ศ. 2567,กระแสเงินสดจากกิจกรรมดำเนินงาน,"[1098, 1441, 0, 0]"
122,กำไรจากการจำหน่ายอุปกรณ์,511510, (กำไร) ขาดทุนจากการขายและตัดจำหน่ายสินทรัพย์ถาวร,"The input name suggests gain on disposal of equipment. The context contains similar item in taxonomy ""กำไรหรือขาดทุนจากการขายสินทรัพย์ถาวร บางครั้งใช้ชื่อว่า ขาดทุน(กำไร)จากการจำหน่าย/ตัดจำหน่ายอุปกรณ์ หรือ ขาดทุนจากการขายส่วนปรับปรุงอาคารเช่าและอุปกรณ์ หรือ กำไรจากการจำหน่ายสินทรัพย์ที่มีไว้เพื่อให้เช่า หรือ กำไรจากการจำหน่ายอุปกรณ์ หรือ กำไรจากการจำหน่ายส่วนปรับปรุงอาคารเช่าและอุปกรณ์"" with set code 511510. And the fs_category of this item is กิจกรรมดำเนินงาน, which is related to the input metadata fs_category กระแสเงินสดจากกิจกรรมดำเนินงาน.",งบกระแสเงินสด สำหรับรอบระยะเวลาหกเดือนสิ้นสุดวันที่ 30 มิถุนายน พ.ศ. 2567,กระแสเงินสดจากกิจกรรมดำเนินงาน,"[-19, -2597, 0, 0]"
123,กำไรจากการยกเลิกสัญญาเช่า,515000,รายการปรับปรุงอื่น ๆ,"The input line item name 'กำไรจากการยกเลิกสัญญาเช่า' is found in the meaning_of_taxonomy of the provided Taxonomy list. Thus, the SET Code should be '515000' and Item in Taxonomy should be 'รายการปรับปรุงอื่น ๆ'.",งบกระแสเงินสด สำหรับรอบระยะเวลาหกเดือนสิ้นสุดวันที่ 30 มิถุนายน พ.ศ. 2567,กระแสเงินสดจากกิจกรรมดำเนินงาน,"[-5089, -9749, 0, 0]"
124,ขาดทุนจากการด้อยค่าของทรัพย์สินรอการขาย,null,null,"There is no item in the taxonomy list that matches the query and fs_category. Therefore, return null.",งบกระแสเงินสด สำหรับรอบระยะเวลาหกเดือนสิ้นสุดวันที่ 30 มิถุนายน พ.ศ. 2567,กระแสเงินสดจากกิจกรรมดำเนินงาน,"[7463, 93220, 0, 0]"
125,ขาดทุนจากการขายทรัพย์สินรอการขาย,511200,((กำไร) ขาดทุนจากการขายทรัพย์สินรอการขาย,The input item name matches the item in taxonomy '(กำไร) ขาดทุนจากการขายทรัพย์สินรอการขาย' and the fs_category is related to กระแสเงินสดจากกิจกรรมดำเนินงาน.,งบกระแสเงินสด สำหรับรอบระยะเวลาหกเดือนสิ้นสุดวันที่ 30 มิถุนายน พ.ศ. 2567,กระแสเงินสดจากกิจกรรมดำเนินงาน,"[964453, 206836, 0, 0]"
126,ภาระผูกพันผลประโยชน์พนักงาน,518700,ประมาณการหนี้สินผลประโยชน์พนักงาน เพิ่มขึ้น (ลดลง),"The input name 'ภาระผูกพันผลประโยชน์พนักงาน' appears in the meaning of taxonomy items that map to SET code '518700'.

The input metadata specifies 'fs_category' as กระแสเงินสดจากกิจกรรมดำเนินงาน, and the selected taxonomy item's 'fs_category' is กิจกรรมดำเนินงาน, which is related. Therefore, the most relevant SET code is 518700 and the item is 'ประมาณการหนี้สินผลประโยชน์พนักงาน เพิ่มขึ้น (ลดลง)'.",งบกระแสเงินสด สำหรับรอบระยะเวลาหกเดือนสิ้นสุดวันที่ 30 มิถุนายน พ.ศ. 2567,กระแสเงินสดจากกิจกรรมดำเนินงาน,"[8940, 4817, 1204, 1923]"
127,ต้นทุนค่ารื้อถอน,514920, (กลับรายการ) ประมาณการหนี้สิน,The input name 'ต้นทุนค่ารื้อถอน' matches the meaning_of_taxonomy 'กลับรายการประมาณการหนี้สิน หรือ ประมาณการหนี้สิน บางครั้งใช้ชื่อว่า ต้นทุนค่ารื้อถอน' in the taxonomy list. And the input metadata financial_statement_type 'งบกระแสเงินสด สำหรับรอบระยะเวลาหกเดือนสิ้นสุดวันที่ 30 มิถุนายน พ.ศ. 2567' and fs_category 'กระแสเงินสดจากกิจกรรมดำเนินงาน' match the taxonomy list item properties financial_statement_type 'CF' and fs_category 'กิจกรรมดำเนินงาน'.,งบกระแสเงินสด สำหรับรอบระยะเวลาหกเดือนสิ้นสุดวันที่ 30 มิถุนายน พ.ศ. 2567,กระแสเงินสดจากกิจกรรมดำเนินงาน,"[825, 904, 11, 11]"
128,เงินปันผลรับ,514710,เงินปันผลและดอกเบี้ยรับ รายได้เงินปันผล,The input name 'เงินปันผลรับ' is similar to 'เงินปันผลและดอกเบี้ยรับ รายได้เงินปันผล' and the fs_category matched the context.,งบกระแสเงินสด สำหรับรอบระยะเวลาหกเดือนสิ้นสุดวันที่ 30 มิถุนายน พ.ศ. 2567,กระแสเงินสดจากกิจกรรมดำเนินงาน,"[-715, -17, -278781, -1529475]"
129,รายได้ดอกเบี้ย,514720,รายได้ดอกเบี้ย,The input query 'รายได้ดอกเบี้ย' matches directly with item 'รายได้ดอกเบี้ย' in the taxonomy list.  The fs_category in the input metadata 'กระแสเงินสดจากกิจกรรมดำเนินงาน' is related to 'กิจกรรมดำเนินงาน' in the taxonomy list.,งบกระแสเงินสด สำหรับรอบระยะเวลาหกเดือนสิ้นสุดวันที่ 30 มิถุนายน พ.ศ. 2567,กระแสเงินสดจากกิจกรรมดำเนินงาน,"[-9265762, -8030602, -1304405, -834524]"
130,ค่าใช้จ่ายดอกเบี้ย,519600,จ่ายดอกเบี้ย,The input name 'ค่าใช้จ่ายดอกเบี้ย' is related to cash outflow for interest payment. The context's financial_statement_type is 'งบกระแสเงินสด' (CF) and fs_category is 'กระแสเงินสดจากกิจกรรมดำเนินงาน'. The closest matched item in the Taxonomy list is 'จ่ายดอกเบี้ย' with set_code '519600' under 'กิจกรรมดำเนินงาน'.,งบกระแสเงินสด สำหรับรอบระยะเวลาหกเดือนสิ้นสุดวันที่ 30 มิถุนายน พ.ศ. 2567,กระแสเงินสดจากกิจกรรมดำเนินงาน,"[1539629, 784380, 1144871, 718911]"
131,เงินให้สินเชื่อแก่ลูกหนี้และดอกเบี้ยค้างรับ - สุทธิ,515800,ลูกหนี้การค้า และลูกหนี้เงินให้สินเชื่อ (เพิ่มขึ้น) ลดลง,The input name 'เงินให้สินเชื่อแก่ลูกหนี้และดอกเบี้ยค้างรับ - สุทธิ' is related to changes in receivables. The closest match in the taxonomy list with the correct fs_category is 'ลูกหนี้การค้า และลูกหนี้เงินให้สินเชื่อ (เพิ่มขึ้น) ลดลง' with SET Code '515800'.,งบกระแสเงินสด สำหรับรอบระยะเวลาหกเดือนสิ้นสุดวันที่ 30 มิถุนายน พ.ศ. 2567,กระแสเงินสดจากกิจกรรมดำเนินงาน,"[-4677584, -17838071, 0, 0]"
132,ลูกหนี้อื่น,516600,สินทรัพย์ดำเนินงานอื่น (เพิ่มขึ้น) ลดลง,The most relevant item from the provided taxonomy list is 'สินทรัพย์ดำเนินงานอื่น (เพิ่มขึ้น) ลดลง' (Other Operating Assets (Increase) Decrease) with SET code '516600'. This is because the input term 'ลูกหนี้อื่น' (Other receivables) is a broader term and can be categorized under 'Other Operating Assets' in the context of cash flow statement. ,งบกระแสเงินสด สำหรับรอบระยะเวลาหกเดือนสิ้นสุดวันที่ 30 มิถุนายน พ.ศ. 2567,กระแสเงินสดจากกิจกรรมดำเนินงาน,"[-122205, -438068, -15696, -3177]"
133,ทรัพย์สินรอการขาย - สุทธิ,516400,ทรัพย์สินรอการขาย (เพิ่มขึ้น) ลดลง,"The most relevant item from the taxonomy list is ""ทรัพย์สินรอการขาย (เพิ่มขึ้น) ลดลง"" with SET Code ""516400"" because the input query mentions ""ทรัพย์สินรอการขาย"" and the input metadata specifies the financial statement type as ""งบกระแสเงินสด"" and fs_category as ""กระแสเงินสดจากกิจกรรมดำเนินงาน"" which aligns with the taxonomy item's meaning and fs_category.",งบกระแสเงินสด สำหรับรอบระยะเวลาหกเดือนสิ้นสุดวันที่ 30 มิถุนายน พ.ศ. 2567,กระแสเงินสดจากกิจกรรมดำเนินงาน,"[1279221, 566519, 0, 0]"
134,สินทรัพย์หมุนเวียนอื่น,516600,สินทรัพย์ดำเนินงานอื่น (เพิ่มขึ้น) ลดลง,"The input name 'สินทรัพย์หมุนเวียนอื่น' appears in the meaning_of_taxonomy of the selected item.  The fs_category is กิจกรรมดำเนินงาน, which is related to the input metadata fs_category กระแสเงินสดจากกิจกรรมดำเนินงาน.",งบกระแสเงินสด สำหรับรอบระยะเวลาหกเดือนสิ้นสุดวันที่ 30 มิถุนายน พ.ศ. 2567,กระแสเงินสดจากกิจกรรมดำเนินงาน,"[13804, 229875, 0, -1]"
