,query,set_code,item_in_taxonomy,reasoning,table_name,category,number_values
84,1314381,410112,รายได้ดอกเบี้ย จากอื่น ๆ,"Although there's no direct match for the input '1314381', the provided taxonomy list doesn't have any item related to 'การแบ่งปันกำไรเบ็ดเสร็จรวม' in  'fs_category'. Therefore, returning the only item in the provided taxonomy list.",งบกำไรขาดทุนเบ็ดเสร็จ สำหรับรอบระยะเวลาสามเดือนสิ้นสุดวันที่ 30 มิถุนายน พ.ศ. 2567,การแบ่งปันกำไรเบ็ดเสร็จรวม,"[1238101, 45425, 794037]"
85,กำไรต่อหุ้นขั้นพื้นฐาน (บาทต่อหุ้น),480100,กำไร (ขาดทุน) ต่อหุ้นขั้นพื้นฐาน (บาท/หุ้น),"The query mentions 'กำไรต่อหุ้น' (earnings per share) and 'ขั้นพื้นฐาน' (basic), directly matching the item 'กำไร (ขาดทุน) ต่อหุ้นขั้นพื้นฐาน (บาท/หุ้น)' (Basic Earnings (Loss) Per Share (Baht/Share)) in the taxonomy. The financial statement type is 'งบกำไรขาดทุนเบ็ดเสร็จ' (Statement of Comprehensive Income), which corresponds to 'PL' in the taxonomy.",งบกำไรขาดทุนเบ็ดเสร็จ สำหรับรอบระยะเวลาสามเดือนสิ้นสุดวันที่ 30 มิถุนายน พ.ศ. 2567,กำไรต่อหุ้น,"[0.84, 0.76, 0.03, 0.53]"
86,รายได้ดอกเบี้ย,410108,รายได้ดอกเบี้ย,"The input query directly matches the item ""รายได้ดอกเบี้ย"" in the taxonomy list.  The fs_category of the matched item is กำไรขาดทุน, which is related to รายได้ in the input metadata. Therefore, the set code is 410108.",งบกำไรขาดทุนเบ็ดเสร็จ สำหรับรอบระยะเวลาสามเดือนสิ้นสุดวันที่ 30 มิถุนายน พ.ศ. 2567,รายได้,"[5328253, 4389765, 675192, 1263443]"
87,null,null,null,"I am sorry, I cannot locate the Taxonomy information. Therefore, I cannot provide an appropriate SET Code and Item in Taxonomy.",งบกำไรขาดทุนเบ็ดเสร็จ สำหรับรอบระยะเวลาสามเดือนสิ้นสุดวันที่ 30 มิถุนายน พ.ศ. 2567,การแบ่งปันกำไรสุทธิ,"[1320766, 1222792, 45425, 794037]"
88,null,null,null,"I am sorry, I cannot locate the Taxonomy information, therefore I cannot provide an answer.",งบกำไรขาดทุนเบ็ดเสร็จ สำหรับรอบระยะเวลาสามเดือนสิ้นสุดวันที่ 30 มิถุนายน พ.ศ. 2567,การแบ่งปันกำไรเบ็ดเสร็จรวม,"[1314381, 1238101, 45425, 794037]"
89,รายได้ดอกเบี้ย,410108,รายได้ดอกเบี้ย,"The input query 'รายได้ดอกเบี้ย' is a general term, and there are more specific terms in the taxonomy list. However, the instruction specifies that if fs_category is not related to 'รายได้', then use 'item_in_taxonomy' instead. Therefore, the most appropriate match is the item with 'item_in_taxonomy' as 'รายได้ดอกเบี้ย'.",งบกำไรขาดทุนเบ็ดเสร็จ สำหรับรอบระยะเวลาหกเดือนสิ้นสุดวันที่ 30 มิถุนายน พ.ศ. 2567,รายได้,"[9257186, 6551404, 1301550, 827574]"
90,เงินปันผลรับ,410202,รายได้เงินปันผล,"The INPUT 'เงินปันผลรับ' is related to dividend income, and after reviewing the CONTEXT, the most relevant item is 'รายได้เงินปันผล' with SET Code '410202'. This item's meaning aligns with dividend income and also matches the financial statement type and fs category.",งบกำไรขาดทุนเบ็ดเสร็จ สำหรับรอบระยะเวลาหกเดือนสิ้นสุดวันที่ 30 มิถุนายน พ.ศ. 2567,รายได้,"[715, 17, 278781, 1529475]"
91,รายได้อื่น,410200,รายได้อื่น,"The query 'รายได้อื่น' matches the item 'รายได้อื่น' in the taxonomy list. Both the input and the taxonomy item share the same fs_category 'รายได้'. Therefore, the set_code '410200' is selected.",งบกำไรขาดทุนเบ็ดเสร็จ สำหรับรอบระยะเวลาหกเดือนสิ้นสุดวันที่ 30 มิถุนายน พ.ศ. 2567,รายได้,"[1482915, 1798189, 5876, 22419]"
92,รวมรายได้,409996,กำไร (ขาดทุน) สุทธิ สำหรับงวด,"The input query 'รวมรายได้' suggests a total revenue figure in the financial report. After examining the provided taxonomy list, the closest match is 'กำไร (ขาดทุน) สุทธิ สำหรับงวด' (Net Profit (Loss) For The Period) with SET Code '409996'. This is because net profit is calculated by subtracting total expenses from total revenues, making it the most relevant item representing the overall revenue performance.",งบกำไรขาดทุนเบ็ดเสร็จ สำหรับรอบระยะเวลาหกเดือนสิ้นสุดวันที่ 30 มิถุนายน พ.ศ. 2567,รายได้,"[10740816, 8349610, 1586207, 2379468]"
93,ค่าใช้จ่ายในการบริการ,422200,ค่าใช้จ่ายค่าธรรมเนียมและบริการ,The input name 'ค่าใช้จ่ายในการบริการ' is a general term. The closest match from the provided taxonomy list is 'ค่าใช้จ่ายค่าธรรมเนียมและบริการ' with the meaning 'บางครั้งใช้ชื่อว่า ค่าธรรมเนียมและบริการจ่าย หรือ ค่าใช้จ่ายในการบริการ'.,งบกำไรขาดทุนเบ็ดเสร็จ สำหรับรอบระยะเวลาหกเดือนสิ้นสุดวันที่ 30 มิถุนายน พ.ศ. 2567,ค่าใช้จ่าย,"[862313, 676455, 64, 149]"
94,ค่าใช้จ่ายในการบริหาร,422120,ค่าใช้จ่ายในการบริหาร,"From the Taxonomy list,  'fs_category' matched with the input metadata 'fs_category' and 'item_in_taxonomy' matched with the input query. ",งบกำไรขาดทุนเบ็ดเสร็จ สำหรับรอบระยะเวลาหกเดือนสิ้นสุดวันที่ 30 มิถุนายน พ.ศ. 2567,ค่าใช้จ่าย,"[3954818, 2878295, 46803, 43500]"
95,ผลขาดทุนด้านเครดิตที่คาดว่าจะเกิดขึ้น,null,null,There is no item in the taxonomy that matches the query and fs_category.,งบกำไรขาดทุนเบ็ดเสร็จ สำหรับรอบระยะเวลาหกเดือนสิ้นสุดวันที่ 30 มิถุนายน พ.ศ. 2567,ค่าใช้จ่าย,"[1022823, 783115, 0, 0]"
96,รวมค่าใช้จ่าย,429999,รวมต้นทุนและค่าใช้จ่าย,"The query mentions 'รวมค่าใช้จ่าย' and the input metadata specifies 'fs_category' as 'ค่าใช้จ่าย'. In the taxonomy list, the closest match is 'รวมต้นทุนและค่าใช้จ่าย' with 'meaning_of_taxonomy' as 'บางครั้งใช้ชื่อว่า รวมค่าใช้จ่าย'. Therefore, this is the most appropriate match.",งบกำไรขาดทุนเบ็ดเสร็จ สำหรับรอบระยะเวลาหกเดือนสิ้นสุดวันที่ 30 มิถุนายน พ.ศ. 2567,ค่าใช้จ่าย,"[5839954, 4337865, 46867, 43649]"
97,กำไรก่อนต้นทุนทางการเงินและค่าใช้จ่ายภาษีเงินได้,409992,กำไร (ขาดทุน) ก่อนต้นทุนทางการเงิน และภาษีเงินได้,"The query 'กำไรก่อนต้นทุนทางการเงินและค่าใช้จ่ายภาษีเงินได้' is an exact match to the 'item_in_taxonomy' field  'กำไร (ขาดทุน) ก่อนต้นทุนทางการเงิน และภาษีเงินได้' in the Taxonomy list. Thus, the 'set_code' is '409992'.",งบกำไรขาดทุนเบ็ดเสร็จ สำหรับรอบระยะเวลาหกเดือนสิ้นสุดวันที่ 30 มิถุนายน พ.ศ. 2567,กำไรก่อนต้นทุนทางการเงินและค่าใช้จ่ายภาษีเงินได้,"[4900862, 4011745, 1539340, 2335819]"
98,ต้นทุนทางการเงิน,429900,ต้นทุนทางการเงิน,"The input item name ต้นทุนทางการเงิน exists in the Taxonomy list with the same name.  The input metadata financial_statement_type งบกำไรขาดทุนเบ็ดเสร็จ สำหรับรอบระยะเวลาหกเดือนสิ้นสุดวันที่ 30 มิถุนายน พ.ศ. 2567 is matched to financial_statement_type PL in the Taxonomy list. We found the fs_category ต้นทุนทางการเงิน from  input metadata fs_category is matched to item_in_taxonomy ต้นทุนทางการเงิน in the Taxonomy list. Thus, the SET Code should be 429900.",งบกำไรขาดทุนเบ็ดเสร็จ สำหรับรอบระยะเวลาหกเดือนสิ้นสุดวันที่ 30 มิถุนายน พ.ศ. 2567,ต้นทุนทางการเงิน,"[-1582659, -826782, -1180432, -744613]"
99,ส่วนแบ่งกำไรจากเงินลงทุนในบริษัทร่วมตามวิธีส่วนได้เสีย,431100,ส่วนแบ่งกำไร (ขาดทุน) จากเงินลงทุนตามวิธีส่วนได้เสีย,The query mentions 'ส่วนแบ่งกำไรจากเงินลงทุนในบริษัทร่วมตามวิธีส่วนได้เสีย' which is related to the calculation of profit sharing from investments using the equity method. The closest match in the taxonomy list is 'ส่วนแบ่งกำไร (ขาดทุน) จากเงินลงทุนตามวิธีส่วนได้เสีย' with SET Code '431100'.,งบกำไรขาดทุนเบ็ดเสร็จ สำหรับรอบระยะเวลาหกเดือนสิ้นสุดวันที่ 30 มิถุนายน พ.ศ. 2567,ส่วนแบ่งกำไรจากเงินลงทุนในบริษัทร่วมตามวิธีส่วนได้เสีย,"[0, 25811, 0, 0]"
100,กำไรก่อนภาษีเงินได้,409992,กำไร (ขาดทุน) ก่อนต้นทุนทางการเงิน และภาษีเงินได้,"The input item name is กำไรก่อนภาษีเงินได้ and the input metadata financial_statement_type is งบกำไรขาดทุนเบ็ดเสร็จ สำหรับรอบระยะเวลาหกเดือนสิ้นสุดวันที่ 30 มิถุนายน พ.ศ. 2567, fs_category is กำไรก่อนภาษีเงินได้. The best match from the Taxonomy list is item_in_taxonomy: กำไร (ขาดทุน) ก่อนต้นทุนทางการเงิน และภาษีเงินได้, and set_code: 409992 because the fs_category is closely related to the input item name, and financial_statement_type is PL.",งบกำไรขาดทุนเบ็ดเสร็จ สำหรับรอบระยะเวลาหกเดือนสิ้นสุดวันที่ 30 มิถุนายน พ.ศ. 2567,กำไรก่อนภาษีเงินได้,"[3318203, 3210774, 358908, 1591206]"
101,ค่าใช้จ่ายภาษีเงินได้,439800,ภาษีเงินได้,The closest match from the Taxonomy list is 'ภาษีเงินได้' with fs_category 'กำไรขาดทุน' which is related to 'ค่าใช้จ่ายภาษีเงินได้' from the input.,งบกำไรขาดทุนเบ็ดเสร็จ สำหรับรอบระยะเวลาหกเดือนสิ้นสุดวันที่ 30 มิถุนายน พ.ศ. 2567,ค่าใช้จ่ายภาษีเงินได้,"[-719295, -667104, -16166, -12346]"
102,กำไรสำหรับรอบระยะเวลา,409996,กำไร (ขาดทุน) สุทธิ สำหรับงวด,"The input query and financial statement type indicate that the item is related to net profit for the period.  Therefore, the most relevant item from the taxonomy list is 'กำไร (ขาดทุน) สุทธิ สำหรับงวด' with SET Code '409996'.",งบกำไรขาดทุนเบ็ดเสร็จ สำหรับรอบระยะเวลาหกเดือนสิ้นสุดวันที่ 30 มิถุนายน พ.ศ. 2567,กำไรสำหรับรอบระยะเวลา,"[2598908, 2543670, 342742, 1578860]"
103,การวัดมูลค่าใหม่ของภาระผูกพันผลประโยชน์หลังออกจากงาน,450600,กำไร (ขาดทุน) จากการประมาณการตามหลักคณิตศาสตร์ประกันภัยสำหรับโครงการผลประโยชน์พนักงาน,"The query ""การวัดมูลค่าใหม่ของภาระผูกพันผลประโยชน์หลังออกจากงาน"" is related to actuarial gain or loss for employee benefit, which matches the meaning of taxonomy in the first item. Thus, the set code should be 450600 and the item in taxonomy should be กำไร (ขาดทุน) จากการประมาณการตามหลักคณิตศาสตร์ประกันภัยสำหรับโครงการผลประโยชน์พนักงาน",งบกำไรขาดทุนเบ็ดเสร็จ สำหรับรอบระยะเวลาหกเดือนสิ้นสุดวันที่ 30 มิถุนายน พ.ศ. 2567,รายการที่จะไม่จัดประเภทรายการใหม่เข้าไปไว้ในกำไรหรือขาดทุนในภายหลัง,"[12353, 5407, 971, -1050]"
104,ภาษีเงินได้ที่เกี่ยวกับรายการจะไม่จัดประเภทรายการใหม่เข้าไปไว้ในกำไรหรือขาดทุนในภายหลัง,459900,ภาษีเงินได้ของรายการที่จะไม่จัดประเภทรายการใหม่เข้าไปไว้ในกำไรหรือขาดทุนในภายหลัง,"The query mentions 'ภาษีเงินได้' and 'รายการที่จะไม่จัดประเภทรายการใหม่เข้าไปไว้ในกำไรหรือขาดทุนในภายหลัง', which closely match the item 'ภาษีเงินได้ของรายการที่จะไม่จัดประเภทรายการใหม่เข้าไปไว้ในกำไรหรือขาดทุนในภายหลัง' in the taxonomy list. Additionally, the fs_category 'รายการที่จะไม่จัดประเภทรายการใหม่เข้าไปไว้ในกำไรหรือขาดทุนในภายหลัง' is related to the input metadata.",งบกำไรขาดทุนเบ็ดเสร็จ สำหรับรอบระยะเวลาหกเดือนสิ้นสุดวันที่ 30 มิถุนายน พ.ศ. 2567,รายการที่จะไม่จัดประเภทรายการใหม่เข้าไปไว้ในกำไรหรือขาดทุนในภายหลัง,"[-2425, -1081, -194, 210]"
105,รวมรายการที่จะไม่จัดประเภทรายการใหม่เข้าไปไว้ในกำไรหรือขาดทุนในภายหลัง,459800,องค์ประกอบอื่นของกำไรขาดทุนเบ็ดเสร็จอื่นที่จะไม่จัดประเภทรายการใหม่เข้าไปไว้ในกำไรหรือขาดทุนในภายหลัง,"The query mentions items that will not be reclassified to profit or loss later, which closely matches the definition of ""องค์ประกอบอื่นของกำไรขาดทุนเบ็ดเสร็จอื่นที่จะไม่จัดประเภทรายการใหม่เข้าไปไว้ในกำไรหรือขาดทุนในภายหลัง"" (Other Comprehensive Income That Will Not Be Subsequently Reclassified To Profit Or Loss) in the taxonomy list.",งบกำไรขาดทุนเบ็ดเสร็จ สำหรับรอบระยะเวลาหกเดือนสิ้นสุดวันที่ 30 มิถุนายน พ.ศ. 2567,รายการที่จะไม่จัดประเภทรายการใหม่เข้าไปไว้ในกำไรหรือขาดทุนในภายหลัง,"[9928, 4326, 777, -840]"
106,ผลต่างของอัตราแลกเปลี่ยนจากการแปลงค่างบการเงิน,440500,ผลต่างอัตราแลกเปลี่ยนจากการแปลงค่างบการเงิน,"The query mentions ""ผลต่างของอัตราแลกเปลี่ยนจากการแปลงค่างบการเงิน"" which directly corresponds to the item ""ผลต่างอัตราแลกเปลี่ยนจากการแปลงค่างบการเงิน"" in the taxonomy. Additionally, the input metadata specifies the fs_category as ""รายการที่จะจัดประเภทรายการใหม่เข้าไปไว้ในกำไรหรือขาดทุนในภายหลัง"", which aligns with the fs_category ""กำไรขาดทุนเบ็ดเสร็จอื่น-จัดประเภทในภายหลัง"" associated with the selected taxonomy item.",งบกำไรขาดทุนเบ็ดเสร็จ สำหรับรอบระยะเวลาหกเดือนสิ้นสุดวันที่ 30 มิถุนายน พ.ศ. 2567,รายการที่จะจัดประเภทรายการใหม่เข้าไปไว้ในกำไรหรือขาดทุนในภายหลัง,"[22813, 19422, 0, 0]"
107,รวมรายการที่จะจัดประเภทรายการใหม่เข้าไปไว้ในกำไรหรือขาดทุนในภายหลัง,440900,ส่วนแบ่งกำไร (ขาดทุน) เบ็ดเสร็จอื่นในบริษัทย่อย บริษัทร่วม และการร่วมค้า (ภายใต้วิธีส่วนได้เสีย) สำหรับรายการที่จัดประเภทรายการใหม่เข้าไปไว้ในกำไรหรือขาดทุนในภายหลัง,"The INPUT query and fs_category  mention about รายการที่จะจัดประเภทรายการใหม่เข้าไปไว้ในกำไรหรือขาดทุนในภายหลัง. Thus, the selected taxonomy item should also contain similar keywords, which are found in both item_in_taxonomy and meaning_of_taxonomy. Although there are multiple qualified items, the item with the most keyword match is selected.",งบกำไรขาดทุนเบ็ดเสร็จ สำหรับรอบระยะเวลาหกเดือนสิ้นสุดวันที่ 30 มิถุนายน พ.ศ. 2567,รายการที่จะจัดประเภทรายการใหม่เข้าไปไว้ในกำไรหรือขาดทุนในภายหลัง,"[22813, 19422, 0, 0]"
108,กำไรเบ็ดเสร็จรวมสำหรับรอบระยะเวลา,409999,กำไร (ขาดทุน) เบ็ดเสร็จรวม สำหรับงวด,"The input name 'กำไรเบ็ดเสร็จรวมสำหรับรอบระยะเวลา' is a possible match to the item 'กำไร (ขาดทุน) เบ็ดเสร็จรวม สำหรับงวด' in the taxonomy list.  The input fs_category 'กำไรเบ็ดเสร็จรวมสำหรับรอบระยะเวลา' is also related to the fs_category 'กำไรขาดทุนเบ็ดเสร็จอื่น' in the taxonomy list. Thus, the SET Code 409999 and item in taxonomy 'กำไร (ขาดทุน) เบ็ดเสร็จรวม สำหรับงวด' are selected.",งบกำไรขาดทุนเบ็ดเสร็จ สำหรับรอบระยะเวลาหกเดือนสิ้นสุดวันที่ 30 มิถุนายน พ.ศ. 2567,กำไรเบ็ดเสร็จรวมสำหรับรอบระยะเวลา,"[2631649, 2567418, 343519, 1578020]"
109,ส่วนของผู้เป็นเจ้าของของบริษัทใหญ่,460100,การแบ่งปันกำไร (ขาดทุน) สุทธิ : ผู้ถือหุ้นบริษัทใหญ่,"The input query 'ส่วนของผู้เป็นเจ้าของของบริษัทใหญ่' is related to net profit attributable to owners of the parent company. 
The input metadata specified the fs_category as 'การแบ่งปันกำไรสุทธิ'.
Therefore, the selected taxonomy item is 'การแบ่งปันกำไร (ขาดทุน) สุทธิ : ผู้ถือหุ้นบริษัทใหญ่' with SET Code '460100'.",งบกำไรขาดทุนเบ็ดเสร็จ สำหรับรอบระยะเวลาหกเดือนสิ้นสุดวันที่ 30 มิถุนายน พ.ศ. 2567,การแบ่งปันกำไรสุทธิ,"[2526155, 2346764, 342742, 1578860]"
