,query,set_code,item_in_taxonomy,reasoning,table_name,category,number_values
0,เงินสดและรายการเทียบเท่าเงินสด,110100,เงินสดและรายการเทียบเท่าเงินสด,The input name 'เงินสดและรายการเทียบเท่าเงินสด' is an exact match with the item 'เงินสดและรายการเทียบเท่าเงินสด' in the taxonomy list. And the fs_category matched the input metadata.,งบฐานะการเงิน,สินทรัพย์,"[5256461, 3962372, 237185, 1560574]"
1,สินทรัพย์ทางการเงินที่วัดมูลค่าด้วยวิธีราคาทุนตัดจำหน่าย,111630,เงินลงทุนในตราสารหนี้ที่วัดมูลค่าด้วยราคาทุนตัดจำหน่าย - สุทธิ,The input name can be mapped to multiple taxonomies.  The most relavant taxonomy is meaning_of_taxonomy 'หมายถึง เงินลงทุนในตราสารหนี้ซึ่งบริษัทคาดว่าจะถือครองไม่เกิน 12 เดือนที่ถือไว้เพื่อรับชำระกระแสเงินสดจากเงินต้นและดอกเบี้ย (Held to collect) ซึ่งตราสารหนี้ที่บริษัทไปลงทุนดังกล่าวจะต้องผ่านเงื่อนไขการจ่ายชำระด้วยเงินต้นและดอกเบี้ย (Solely payments of principal and interest หรือ SPPI test) คือ เงินสดที่จะได้รับชำระจะต้องมีเพียงองค์ประกอบของเงินต้นและดอกเบี้ยเท่านั้น โดยแสดงมูลค่าสุทธิหลังจากหักค่าเผื่อผลขาดทุนด้านเครดิตที่คาดว่าจะเกิดขึ้นของเงินลงทุน ' with set_code 111630 and item_in_taxonomy เงินลงทุนในตราสารหนี้ที่วัดมูลค่าด้วยราคาทุนตัดจำหน่าย - สุทธิ,งบฐานะการเงิน,สินทรัพย์,"[530, 529, 0, 0]"
2,ที่ถึงกำหนดชำระภายในหนึ่งปี - สุทธิ,112000,ลูกหนี้การค้า และลูกหนี้เงินให้สินเชื่อส่วนที่ถึงกำหนดชำระภายในหนึ่งปี - สุทธิ,"The input name mentions ""ที่ถึงกำหนดชำระภายในหนึ่งปี - สุทธิ"" and the input metadata specifies financial_statement_type as งบฐานะการเงิน and fs_category as สินทรัพย์. The closest matching item in the taxonomy list is ""ลูกหนี้การค้า และลูกหนี้เงินให้สินเชื่อส่วนที่ถึงกำหนดชำระภายในหนึ่งปี - สุทธิ"" with set code 112000, which falls under financial_statement_type BS_A and fs_category สินทรัพย์หมุนเวียน.",งบฐานะการเงิน,สินทรัพย์,"[8, 61243019, 59287195, 0, 0]"
3,เงินให้กู้ยืมระยะสั้นแก่กิจการที่เกี่ยวข้องกันและดอกเบี้ยค้างรับ,112320,เงินให้กู้ยืมระยะสั้นและดอกเบี้ยค้างรับ บุคคลหรือกิจการที่เกี่ยวข้องกัน,The input query explicitly mentions short-term loans and accrued interest related to related parties.  This aligns perfectly with the definition provided in the taxonomy list for 'เงินให้กู้ยืมระยะสั้นและดอกเบี้ยค้างรับ บุคคลหรือกิจการที่เกี่ยวข้องกัน' (Short-Term Loan And Interest Receivables Related Parties).,งบฐานะการเงิน,สินทรัพย์,"[0, 0, 50730996, 43529464]"
4,ที่ถึงกำหนดชำระภายในหนึ่งปี,null,null,"There is no item in the taxonomy list with the property fs_category related to สินทรัพย์. Therefore, I cannot provide a suitable SET Code and Item in Taxonomy.",งบฐานะการเงิน,สินทรัพย์,"[0, 0, 3570000, 6562200]"
5,ดอกเบี้ยค้างรับจากเงินให้กู้ยืมระยะยาวแก่กิจการที่เกี่ยวข้องกัน,122420,เงินให้กู้ยืมระยะยาวและดอกเบี้ยค้างรับ - ส่วนที่ถึงกำหนดชำระเกินกว่าหนึ่งปี บุคคลหรือกิจการที่เกี่ยวข้องกัน,"The input query indicates an item related to long-term loan receivables from related parties. Although the input mentions interest specifically, the most appropriate category in the taxonomy encompasses both principal and interest. Considering the input's financial statement type is BS_A, the closest match is 'เงินให้กู้ยืมระยะยาวและดอกเบี้ยค้างรับ - ส่วนที่ถึงกำหนดชำระเกินกว่าหนึ่งปี บุคคลหรือกิจการที่เกี่ยวข้องกัน' with SET Code '122420'.",งบฐานะการเงิน,สินทรัพย์,"[0, 0, 15212, 27644]"
6,ลูกหนี้อื่น,113130,สินทรัพย์ทางการเงินหมุนเวียนอื่น ลูกหนี้หมุนเวียนอื่น,"The input name 'ลูกหนี้อื่น' matches the meaning_of_taxonomy 'บางครั้งใช้ชื่อว่า ลูกหนี้อื่น' in the Taxonomy list. The input metadata financial_statement_type งบฐานะการเงิน matches BS_A and fs_category สินทรัพย์ matches สินทรัพย์หมุนเวียน in the Taxonomy list. Thus, the SET Code should be 113130 and Item in Taxonomy should be สินทรัพย์ทางการเงินหมุนเวียนอื่น ลูกหนี้หมุนเวียนอื่น",งบฐานะการเงิน,สินทรัพย์,"[3197288, 3081864, 21396, 11673]"
7,ทรัพย์สินรอการขาย - สุทธิ,113500,ทรัพย์สินรอการขาย - สุทธิ,"The query 'ทรัพย์สินรอการขาย - สุทธิ' matched with item_in_taxonomy 'ทรัพย์สินรอการขาย - สุทธิ' in the Taxonomy list.  The value of fs_category in the Taxonomy list item is สินทรัพย์หมุนเวียน, which is related to the input metadata fs_category: สินทรัพย์.",งบฐานะการเงิน,สินทรัพย์,"[1909898, 1650328, 0, 0]"
8,สินทรัพย์หมุนเวียนอื่น,119900,สินทรัพย์หมุนเวียนอื่น,The input query 'สินทรัพย์หมุนเวียนอื่น' and financial_statement_type งบฐานะการเงิน directly match the item_in_taxonomy 'สินทรัพย์หมุนเวียนอื่น' in the Taxonomy list. ,งบฐานะการเงิน,สินทรัพย์,"[214215, 228019, 1701, 1701]"
9,รวมสินทรัพย์หมุนเวียน,119999,รวมสินทรัพย์หมุนเวียน,The query 'รวมสินทรัพย์หมุนเวียน' is a perfect match with the 'item_in_taxonomy' in the Taxonomy list.  The 'fs_category' ('สินทรัพย์หมุนเวียน') is also related to the input metadata 'fs_category' ('สินทรัพย์').,งบฐานะการเงิน,สินทรัพย์,"[71821411, 68210307, 54576490, 51693256]"
10,ผ่านกำไรหรือขาดทุน,121640,เงินลงทุนในตราสารทุนที่วัดมูลค่าด้วยมูลค่ายุติธรรมผ่านกำไรขาดทุน,"The INPUT METADATA states that the financial_statement_type is งบฐานะการเงิน and fs_category is สินทรัพย์. The provided context includes an item in the taxonomy that contains the same phrase as the input query: 'บางครั้งใช้ชื่อว่า ผ่านกำไรหรือขาดทุน หรือ เงินลงทุนในตราสารทุนที่วัดมูลค่าด้วยมูลค่ายุติธรรมผ่านกำไรหรือขาดทุน'. Therefore, the selected SET Code is 121640 and the item in the taxonomy is 'เงินลงทุนในตราสารทุนที่วัดมูลค่าด้วยมูลค่ายุติธรรมผ่านกำไรขาดทุน'.",งบฐานะการเงิน,สินทรัพย์,"[25503, 32278, 6004, 5944]"
11,ผ่านกำไรขาดทุนเบ็ดเสร็จอื่น,121620,เงินลงทุนในตราสารหนี้ที่วัดมูลค่าด้วยมูลค่ายุติธรรมผ่านกำไรขาดทุนเบ็ดเสร็จอื่น - สุทธิ,"The INPUT's financial_statement_type งบฐานะการเงิน maps to BS_A and fs_category สินทรัพย์ means asset. An item in the Taxonomy list with set_code 121620 states financial_statement_type as BS_A and fs_category as สินทรัพย์ไม่หมุนเวียน, which closely aligns with the input metadata. Additionally, its meaning statement includes ""บางครั้งใช้ขื่อว่า สินทรัพย์ทางการเงินที่วัดมูลค่าด้วยมูลค่ายุติธรรมผ่านกำไรขาดทุนเบ็ดเสร็จอื่น"" which is related to the input query. Therefore, the most relevant SET Code is 121620 and Item in Taxonomy is เงินลงทุนในตราสารหนี้ที่วัดมูลค่าด้วยมูลค่ายุติธรรมผ่านกำไรขาดทุนเบ็ดเสร็จอื่น - สุทธิ.",งบฐานะการเงิน,สินทรัพย์,"[35204, 35868, 0, 0]"
12,เงินลงทุนในบริษัทย่อย - สุทธิ,122710,เงินลงทุนในบริษัทย่อย,The input name 'เงินลงทุนในบริษัทย่อย - สุทธิ' is an exact match with the meaning_of_taxonomy field 'บางครั้งใช้ชื่อว่า เงินลงทุนในบริษัทย่อย-สุทธิ'.  The input metadata financial_statement_type งบฐานะการเงิน maps to BS_A and fs_category สินทรัพย์ maps to fs_category สินทรัพย์ไม่หมุนเวียน.,งบฐานะการเงิน,สินทรัพย์,"[0, 0, 14484017, 14483017]"
13,เงินให้สินเชื่อแก่ลูกหนี้และดอกเบี้ยค้างรับ - สุทธิ,122050,ลูกหนี้เงินให้สินเชื่อ,"From the Taxonomy list, the closet match for the query ""เงินให้สินเชื่อแก่ลูกหนี้และดอกเบี้ยค้างรับ - สุทธิ"" is  ""ลูกหนี้เงินให้สินเชื่อ"" with set code 122050. Therefore, the financial_statement_type is BS_A, item_in_taxonomy is ลูกหนี้เงินให้สินเชื่อ and set_code is 122050.",งบฐานะการเงิน,สินทรัพย์,"[38502858, 39281316, 0, 0]"
14,ที่ดิน อาคารและอุปกรณ์ - สุทธิ,123800,ที่ดิน อาคาร และอุปกรณ์ - สุทธิ,"The query 'ที่ดิน อาคารและอุปกรณ์ - สุทธิ' is a direct match to the 'item_in_taxonomy' field in the taxonomy list. And the value of fs_category in the correct Taxonomy list item is related to สินทรัพย์. Therefore, the correct SET Code is 123800.",งบฐานะการเงิน,สินทรัพย์,"[755687, 764257, 19549, 12613]"
15,สินทรัพย์สิทธิการใช้ - สุทธิ,123900,สินทรัพย์สิทธิการใช้ - สุทธิ,"The query 'สินทรัพย์สิทธิการใช้ - สุทธิ' directly matches the 'item_in_taxonomy' field in the taxonomy list, and the 'financial_statement_type' and 'fs_category' ('สินทรัพย์') from the input metadata also align with the corresponding fields in the taxonomy list.",งบฐานะการเงิน,สินทรัพย์,"[1373265, 1415631, 20763, 21601]"
16,สินทรัพย์ไม่มีตัวตน - สุทธิ,124100,สินทรัพย์ไม่มีตัวตน - สุทธิ,The INPUT matches exactly with  item_in_taxonomy in the Taxonomy list. And the value of financial_statement_type from INPUT METADATA matches the Taxonomy list. ,งบฐานะการเงิน,สินทรัพย์,"[1210002, 1208848, 1272, 1459]"
17,สินทรัพย์ภาษีเงินได้รอการตัดบัญชี,124400,สินทรัพย์ภาษีเงินได้รอตัดบัญชี,"The query 'สินทรัพย์ภาษีเงินได้รอการตัดบัญชี' is an exact match to the 'item_in_taxonomy' in the Taxonomy list. Thus, the set_code is '124400'.",งบฐานะการเงิน,สินทรัพย์,"[289387, 246779, 0, 0]"
18,สินทรัพย์ไม่หมุนเวียนอื่น,129900,สินทรัพย์ไม่หมุนเวียนอื่น,The input name 'สินทรัพย์ไม่หมุนเวียนอื่น' is an exact match with the item 'สินทรัพย์ไม่หมุนเวียนอื่น' in the taxonomy list.  The fs_category is 'สินทรัพย์ไม่หมุนเวียน' which is related to the input metadata fs_category 'สินทรัพย์'.,งบฐานะการเงิน,สินทรัพย์,"[274952, 269374, 3286, 3287]"
19,รวมสินทรัพย์ไม่หมุนเวียน,129999,รวมสินทรัพย์ไม่หมุนเวียน,The query 'รวมสินทรัพย์ไม่หมุนเวียน' is an exact match to the 'item_in_taxonomy' field in the Taxonomy list.  The financial statement type is 'งบฐานะการเงิน' which maps to 'BS_A'.,งบฐานะการเงิน,สินทรัพย์,"[42466858, 43254351, 14534891, 14527921]"
20,รวมสินทรัพย์,109999,รวมสินทรัพย์,"The query 'รวมสินทรัพย์' is an exact match with the 'item_in_taxonomy' field in the Taxonomy list. The 'fs_category' field also matches the input metadata. Therefore, the correct SET Code is 109999 and the item is 'รวมสินทรัพย์'.",งบฐานะการเงิน,สินทรัพย์,"[114288269, 111464658, 69111381, 66221177]"
21,เงินกู้ยืมระยะสั้นจากบุคคลที่เกี่ยวข้องกัน,211720,เงินกู้ยืมระยะสั้น บุคคลหรือกิจการที่เกี่ยวข้องกัน,"The input query 'เงินกู้ยืมระยะสั้นจากบุคคลที่เกี่ยวข้องกัน' matches the closest with the item_in_taxonomy 'เงินกู้ยืมระยะสั้น บุคคลหรือกิจการที่เกี่ยวข้องกัน' in the taxonomy list. Both refer to short-term borrowings from related parties. Considering the financial_statement_type is BS_L and fs_category is หนี้สินและส่วนของเจ้าของ, the most appropriate match is set_code '211720'.",งบฐานะการเงิน,หนี้สินและส่วนของเจ้าของ,"[40000, 1000000, 0, 0]"
22,เงินกู้ยืมระยะสั้นจากสถาบันการเงิน,210500,เงินเบิกเกินบัญชีและเงินกู้ยืมระยะสั้นจากสถาบันการเงิน,"The query \""เงินกู้ยืมระยะสั้นจากสถาบันการเงิน\"" best matches the item \""เงินเบิกเกินบัญชีและเงินกู้ยืมระยะสั้นจากสถาบันการเงิน\"" in the taxonomy list. Considering the provided fs_category \""หนี้สินและส่วนของเจ้าของ\"", it aligns with the broader category of the matched item. Therefore, the SET code \""210500\"" and the item \""เงินเบิกเกินบัญชีและเงินกู้ยืมระยะสั้นจากสถาบันการเงิน\"" are selected.",งบฐานะการเงิน,หนี้สินและส่วนของเจ้าของ,"[10487577, 12084572, 9767664, 11384572]"
23,ส่วนของเงินกู้ยืมระยะยาวจากสถาบันการเงินที่ถึงกำหนดชำระภายในหนึ่งปี,211860,ส่วนของหนี้สินระยะยาวส่วนที่ถึงกำหนดชำระภายในหนึ่งปี สถาบันการเงิน,"The input query explicitly mentions debts with financial institutions due within one year, which perfectly matches the definition provided in the taxonomy list for 'Current Portion Of Long-Term Debts Financial Institutions'.",งบฐานะการเงิน,หนี้สินและส่วนของเจ้าของ,"[10749139, 13306778, 1790268, 1626467]"
24,หนี้สินตามสัญญาเช่าส่วนที่ถึงกำหนดชำระภายในหนึ่งปี,212400,หนี้สินตามสัญญาเช่า - ส่วนที่ถึงกำหนดชำระภายในหนึ่งปี,"The query \""หนี้สินตามสัญญาเช่าส่วนที่ถึงกำหนดชำระภายในหนึ่งปี\"" best matches the item \""หนี้สินตามสัญญาเช่า - ส่วนที่ถึงกำหนดชำระภายในหนึ่งปี\"" in the taxonomy list. Both refer to lease liabilities due within one year. Although there is no exact match for fs_category \""หนี้สินและส่วนของเจ้าของ\"", this item's fs_category \""หนี้สินหมุนเวียน\"" is a subcategory of it.",งบฐานะการเงิน,หนี้สินและส่วนของเจ้าของ,"[694023, 690074, 1421, 1382]"
25,เจ้าหนี้อื่น,211100,เจ้าหนี้การค้าและเจ้าหนี้หมุนเวียนอื่น,"The input query 'เจ้าหนี้อื่น' is a broader term and can be mapped to 'เจ้าหนี้การค้าและเจ้าหนี้หมุนเวียนอื่น' in the taxonomy list. Considering the fs_category 'หนี้สินและส่วนของเจ้าของ' from the input metadata, it aligns with the broader category of the selected taxonomy item.",งบฐานะการเงิน,หนี้สินและส่วนของเจ้าของ,"[1786974, 1895770, 267152, 249402]"
26,ส่วนของหุ้นกู้ไม่ด้อยสิทธิที่ถึงกำหนดชำระภายในหนึ่งปี,211830,ส่วนของหนี้สินระยะยาวส่วนที่ถึงกำหนดชำระภายในหนึ่งปี หุ้นกู้,The query mentions 'หุ้นกู้' and 'ถึงกำหนดชำระภายในหนึ่งปี' which directly corresponds to the item 'ส่วนของหนี้สินระยะยาวส่วนที่ถึงกำหนดชำระภายในหนึ่งปี หุ้นกู้' in the taxonomy. We also confirmed the fs_category  'หนี้สินหมุนเวียน' is matched with INPUT METADATA fs_category 'หนี้สินและส่วนของเจ้าของ'.,งบฐานะการเงิน,หนี้สินและส่วนของเจ้าของ,"[17875521, 9833334, 16207908, 9833334]"
27,ภาษีเงินได้นิติบุคคลค้างจ่าย,213000,ภาษีเงินได้นิติบุคคลค้างจ่าย,The query 'ภาษีเงินได้นิติบุคคลค้างจ่าย' is an exact match with the 'item_in_taxonomy' in the Taxonomy list.  The 'financial_statement_type' is 'BS_L' which is related to the input metadata 'งบฐานะการเงิน'.,งบฐานะการเงิน,หนี้สินและส่วนของเจ้าของ,"[701473, 835916, 3436, 0]"
28,หนี้สินหมุนเวียนอื่น,219900,หนี้สินหมุนเวียนอื่น,The input item's fs_category matched with Taxonomy list's fs_category and the input item name also matched the item in Taxonomy.,งบฐานะการเงิน,หนี้สินและส่วนของเจ้าของ,"[950144, 956968, 17729, 19905]"
29,รวมหนี้สินหมุนเวียน,219999,รวมหนี้สินหมุนเวียน,"The query 'รวมหนี้สินหมุนเวียน' is an exact match to an 'item_in_taxonomy' in the provided taxonomy list.  The category 'หนี้สินหมุนเวียน' is related to the input metadata 'fs_category' ('หนี้สินและส่วนของเจ้าของ'). Therefore, the correct SET Code and Item in Taxonomy are extracted from the matched item in the taxonomy list.",งบฐานะการเงิน,หนี้สินและส่วนของเจ้าของ,"[43284851, 40603412, 28055578, 23115062]"
30,เงินกู้ยืมระยะยาวจากสถาบันการเงิน,221860,หนี้สินระยะยาว - ส่วนที่ถึงกำหนดชำระเกินกว่าหนึ่งปี สถาบันการเงิน,"The query mentions ""long-term loans from financial institutions"" and the financial statement type is balance sheet. Thus, the appropriate category is Non-Current Liabilities. The closest matching item from the taxonomy list is ""หนี้สินระยะยาว - ส่วนที่ถึงกำหนดชำระเกินกว่าหนึ่งปี สถาบันการเงิน"" with SET Code 221860, which represents the portion of long-term loans from financial institutions due in more than one year.",งบฐานะการเงิน,หนี้สินและส่วนของเจ้าของ,"[1802726, 4475198, 1217678, 1529400]"
