,query,set_code,item_in_taxonomy,reasoning,table_name,category,number_values
0,เงินลงทุนที่แสดงด้วยมูลค่ายุติธรรมผ่านกำไรหรือขาดทุน,100400,เงินลงทุนที่แสดงด้วยมูลค่ายุติธรรมผ่านกำไรหรือขาดทุน,"The query 'เงินลงทุนที่แสดงด้วยมูลค่ายุติธรรมผ่านกำไรหรือขาดทุน' is an exact match to the 'item_in_taxonomy' in the Taxonomy list. The 'financial_statement_type' is 'BS_A' and 'fs_category' is 'สินทรัพย์', which aligns with the input metadata.",งบฐานะการเงิน,สินทรัพย์,"[277700248, 0]"
1,เงินลงทุนในอสังหาริมทรัพย์ตามมูลค่ายุติธรรม,100500,เงินลงทุนในอสังหาริมทรัพย์ตามมูลค่ายุติธรรม,"The query \""เงินลงทุนในอสังหาริมทรัพย์ตามมูลค่ายุติธรรม\"" is an exact match for the \""item_in_taxonomy\"" in the taxonomy list. The financial statement type is BS_A and the set code is 100500.",งบฐานะการเงิน,สินทรัพย์,"[3278377343, 3198129368]"
2,เงินสดและรายการเทียบเท่าเงินสด,100100,เงินสดและรายการเทียบเท่าเงินสด,"The input directly matches the item ""เงินสดและรายการเทียบเท่าเงินสด"" in the taxonomy list. And the input metadata financial_statement_type งบฐานะการเงิน is equal to BS_A and fs_category สินทรัพย์ is matched in the taxonomy list.",งบฐานะการเงิน,สินทรัพย์,"[122021407, 387726396]"
3,ลูกหนี้ค่าเช่า - สุทธิ,102081,ลูกหนี้จากการให้เช่าและบริการ ลูกหนี้จากการให้เช่า,"The query mentions ลูกหนี้ค่าเช่า which is similar to ลูกหนี้จากการให้เช่า. Also, the INPUT METADATA specifies the fs_category as สินทรัพย์, and the closest match in the Taxonomy list is ลูกหนี้จากการให้เช่าและบริการ ลูกหนี้จากการให้เช่า with SET Code 102081.",งบฐานะการเงิน,สินทรัพย์,"[11542079, 16941887]"
4,รายได้ค้างรับ,103200,สินทรัพย์ที่เกิดจากสัญญา,"รายได้ค้างรับ in the context of financial statements usually refers to revenue that has been earned but not yet received. This aligns with the definition of 'สินทรัพย์ที่เกิดจากสัญญา' (Contract Assets) in the taxonomy list, which represents the right to receive consideration for goods or services that have been transferred to a customer, but payment is contingent on future performance.",งบฐานะการเงิน,สินทรัพย์,"[15656007, 15567768]"
5,ลูกหนี้อื่น,102090,ลูกหนี้การค้าและลูกหนี้อื่น - สุทธิ ลูกหนี้อื่น,"The input query 'ลูกหนี้อื่น' matches the item 'ลูกหนี้การค้าและลูกหนี้อื่น - สุทธิ ลูกหนี้อื่น' in the taxonomy list. This item's fs_category is 'สินทรัพย์', aligning with the input metadata. Therefore, the correct SET Code is 102090, and the item is 'ลูกหนี้การค้าและลูกหนี้อื่น - สุทธิ ลูกหนี้อื่น'.",งบฐานะการเงิน,สินทรัพย์,"[1731442, 920019]"
6,ค่าใช้จ่ายรอการตัดบัญชี,102100,ค่าใช้จ่ายรอการตัดบัญชี,The input item name ค่าใช้จ่ายรอการตัดบัญชี exists in the Taxonomy list with the same name.  The input metadata financial_statement_type งบฐานะการเงิน is aligned with BS_A. And the input metadata fs_category สินทรัพย์ is aligned with the same value in the Taxonomy list.,งบฐานะการเงิน,สินทรัพย์,"[7775682, 7879250]"
7,สินทรัพย์อื่น,109990,สินทรัพย์อื่น - สุทธิ สินทรัพย์อื่น - อื่น ๆ,"The closest match from the provided taxonomy list is 'สินทรัพย์อื่น - สุทธิ สินทรัพย์อื่น - อื่น ๆ' with set code '109990', as it closely aligns with the input 'สินทรัพย์อื่น' and input metadata fs_category 'สินทรัพย์'.",งบฐานะการเงิน,สินทรัพย์,"[4893621, 2364938]"
8,รวมสินทรัพย์,109999,รวมสินทรัพย์,"The input query's fs_category is รวมสินทรัพย์ and financial_statement_type is งบฐานะการเงิน,  matching the criteria specified in the instructions. Thus, the most relevant SET Code from the provided Taxonomy list is 109999 and the corresponding Item in Taxonomy is รวมสินทรัพย์.",งบฐานะการเงิน,รวมสินทรัพย์,"[3719697829, 3629529626]"
9,เจ้าหนี้อื่น,201160,เจ้าหนี้การค้าและเจ้าหนี้อื่น เจ้าหนี้อื่น,Found the exact match in item_in_taxonomy with fs_category related to หนี้สิน.,งบฐานะการเงิน,หนี้สิน,"[30349685, 26102246]"
10,เงินมัดจำรับจากผู้เช่า,202210,หนี้สินทางการเงินอื่น เงินมัดจำ,"The input query ""เงินมัดจำรับจากผู้เช่า"" matches the meaning of taxonomy in the Taxonomy list with set code 202210,  ""บางครั้งใช้ขื่อว่า เงินมัดจำรับจากลูกค้า หมายถึง เงินมัดจำที่กองทุนได้รับมา และต้องจ่ายชำระคืนในอนาคตตามเงื่อนไขของสัญญา"".",งบฐานะการเงิน,หนี้สิน,"[95568596, 95611415]"
11,ภาษีเงินได้หัก ณ ที่จ่ายค้างชำระ,204010,เจ้าหนี้ที่เกิดจากภาษีอื่นหรือรายการอื่นภายใต้กฎหมาย เจ้าหนี้ภาษีค้างจ่าย,"The input mentions  'ภาษีเงินได้หัก ณ ที่จ่ายค้างชำระ' and the input metadata specifies 'financial_statement_type' as 'งบฐานะการเงิน' and 'fs_category' as 'หนี้สิน'. In the taxonomy list, the item 'เจ้าหนี้ที่เกิดจากภาษีอื่นหรือรายการอื่นภายใต้กฎหมาย เจ้าหนี้ภาษีค้างจ่าย' with set code '204010' aligns with the input as it refers to outstanding tax payables, including withholding tax, and falls under liabilities in the balance sheet.",งบฐานะการเงิน,หนี้สิน,"[3514181, 2983659]"
12,หนี้สินตามสัญญาเช่า,202400,หนี้สินตามสัญญาเช่า,The query 'หนี้สินตามสัญญาเช่า' from financial report with fs_category 'หนี้สิน' can be matched to taxonomy item 'หนี้สินตามสัญญาเช่า' with set code '202400'.,งบฐานะการเงิน,หนี้สิน,"[39533348, 44097134]"
13,หนี้สินอื่น,209900,หนี้สินอื่น,The query 'หนี้สินอื่น' is an exact match with the 'item_in_taxonomy' field in the Taxonomy list.  The financial statement type is 'BS_L'.,งบฐานะการเงิน,หนี้สิน,"[4679691, 4848815]"
14,รวมหนี้สิน,209999,รวมหนี้สิน,"The input query's fs_category is รวมหนี้สิน and financial_statement_type is งบฐานะการเงิน, which maps to BS_L. Thus, the most relevant item in the taxonomy is  Set Code 209999, Item: รวมหนี้สิน.",งบฐานะการเงิน,รวมหนี้สิน,"[173645501, 173643269]"
15,สินทรัพย์สุทธิ,309998,รวมสินทรัพย์สุทธิ,The input query 'สินทรัพย์สุทธิ' matches the item_in_taxonomy 'รวมสินทรัพย์สุทธิ' in the taxonomy list. The fs_category in the taxonomy list is 'ส่วนของผู้ถือหุ้น' which is related to the input metadata fs_category 'สินทรัพย์สุทธิ'.,งบฐานะการเงิน,สินทรัพย์สุทธิ,"[3546052328, 3455886357]"
16,ทุนที่ได้รับจากผู้ถือหน่วยลงทุน,310200,ทุนที่ได้รับจากผู้ถือหน่วยลงทุน,The query 'ทุนที่ได้รับจากผู้ถือหน่วยลงทุน' is an exact match with item_in_taxonomy 'ทุนที่ได้รับจากผู้ถือหน่วยลงทุน' in the taxonomy list.  The financial_statement_type is 'BS_OE' which is aligned with the input metadata 'งบฐานะการเงิน'.,งบฐานะการเงิน,สินทรัพย์สุทธิประกอบด้วย,"[3234000000, 3234000000]"
17,กำไรสะสม,310600,กำไร (ขาดทุน) สะสม,The input 'กำไรสะสม' matches the item_in_taxonomy 'กำไร (ขาดทุน) สะสม'.  The financial_statement_type is 'BS_OE' which is extracted from input metadata. ,งบฐานะการเงิน,สินทรัพย์สุทธิประกอบด้วย,"[312052328, 221886357]"
18,สินทรัพย์สุทธิต่อหน่วย,330101,สินทรัพย์สุทธิต่อหน่วย (บาท/หน่วย),"The query 'สินทรัพย์สุทธิต่อหน่วย' matches the meaning and the name of the item 'สินทรัพย์สุทธิต่อหน่วย (บาท/หน่วย)' in the taxonomy list. financial_statement_type is BS_OE, so the correct SET Code is 330101.",งบฐานะการเงิน,,"[10.7456, 10.4723]"
19,จำนวนหน่วยลงทุนที่จำหน่ายแล้วทั้งหมด ณ วันสิ้นงวด (หน่วย),330201,จำนวนหน่วยลงทุนที่จำหน่ายแล้วทั้งหมด ณ วันสิ้นงวด/ปี (พันหน่วย),Taxonomy list item with set code 330201 ('จำนวนหน่วยลงทุนที่จำหน่ายแล้วทั้งหมด ณ วันสิ้นงวด/ปี (พันหน่วย)') is found to have similar meaning to the query after removing stop words. financial_statement_type of the selected taxonomy list item matched with the query metadata.,งบฐานะการเงิน,,"[330000000, 330000000]"
20,รายได้ค่าเช่าและบริการ,410123,รายได้ค่าเช่าและบริการ,"The input query 'รายได้ค่าเช่าและบริการ'  matches exactly with  item_in_taxonomy:'รายได้ค่าเช่าและบริการ' in the Taxonomy list. Thus, the set_code: 410123 is selected.",งบกำไรขาดทุนเบ็ดเสร็จ (ยังไม่ได้ตรวจสอบ),รายได้,"[79561738, 76894712, 157320597, 147825690]"
21,รายได้ดอกเบี้ย,410108,รายได้ดอกเบี้ย,The query 'รายได้ดอกเบี้ย' matches directly with item_in_taxonomy 'รายได้ดอกเบี้ย' in the taxonomy list.  This item also has fs_category as กำไรขาดทุน which is related to รายได้ in the INPUT METADATA.,งบกำไรขาดทุนเบ็ดเสร็จ (ยังไม่ได้ตรวจสอบ),รายได้,"[1699322, 434269, 2185974, 782737]"
22,รายได้อื่น,410200,รายได้อื่น,"The input item name is รายได้อื่น and the input metadata financial_statement_type is งบกำไรขาดทุนเบ็ดเสร็จ (ยังไม่ได้ตรวจสอบ) which is similar to PL.  The value of property fs_category in the correct Taxonomy list item should be related to รายได้, and we found a perfect match with fs_category รายได้.",งบกำไรขาดทุนเบ็ดเสร็จ (ยังไม่ได้ตรวจสอบ),รายได้,"[556394, 500433, 1095521, 1132841]"
23,รวมรายได้,419999,รวมรายได้,"The input query 'รวมรายได้' matches exactly with item 'รวมรายได้' in the taxonomy list. Also, the fs_category of both input and matched taxonomy item is related to 'รายได้'.",งบกำไรขาดทุนเบ็ดเสร็จ (ยังไม่ได้ตรวจสอบ),รายได้,"[81817454, 77829414, 160602092, 149741268]"
24,ต้นทุนการให้เช่าและบริการ,420700,ต้นทุนค่าเช่าและค่าบริการ,"The query ""ต้นทุนการให้เช่าและบริการ"" closely matches the item ""ต้นทุนค่าเช่าและค่าบริการ"" in the taxonomy list. Both terms refer to costs related to rental and services. Additionally, the fs_category ""กำไรขาดทุน"" aligns with the input metadata's fs_category ""ค่าใช้จ่าย"".",งบกำไรขาดทุนเบ็ดเสร็จ (ยังไม่ได้ตรวจสอบ),ค่าใช้จ่าย,"[10761030, 11854157, 20557255, 22237534]"
25,ค่าธรรมเนียมการจัดการ,421300,ค่าธรรมเนียมการจัดการ,"From the Taxonomy list, ค่าธรรมเนียมการจัดการ with set code 421300 is matched to the query ค่าธรรมเนียมการจัดการ. ",งบกำไรขาดทุนเบ็ดเสร็จ (ยังไม่ได้ตรวจสอบ),ค่าใช้จ่าย,"[1095802, 1066530, 2184247, 2128999]"
26,ค่าธรรมเนียมผู้ดูแลผลประโยชน์,421400,ค่าธรรมเนียมผู้ดูแลผลประโยชน์ ค่าธรรมเนียมทรัสตี,"The query 'ค่าธรรมเนียมผู้ดูแลผลประโยชน์' is related to the item 'ค่าธรรมเนียมผู้ดูแลผลประโยชน์ ค่าธรรมเนียมทรัสตี' in the taxonomy list. Thus, the set code '421400' is selected.",งบกำไรขาดทุนเบ็ดเสร็จ (ยังไม่ได้ตรวจสอบ),ค่าใช้จ่าย,"[273951, 266633, 546062, 532250]"
27,ค่าธรรมเนียมนายทะเบียน,421600,ค่าธรรมเนียมนายทะเบียน,The query 'ค่าธรรมเนียมนายทะเบียน' matched directly with item_in_taxonomy in the Taxonomy list.  The financial_statement_type is 'PL' which is related to the input metadata financial_statement_type งบกำไรขาดทุนเบ็ดเสร็จ (ยังไม่ได้ตรวจสอบ).,งบกำไรขาดทุนเบ็ดเสร็จ (ยังไม่ได้ตรวจสอบ),ค่าใช้จ่าย,"[456584, 444388, 910103, 887083]"
28,ค่าธรรมเนียมผู้บริหารอสังหาริมทรัพย์,421700,ค่าธรรมเนียมบริหารอสังหาริมทรัพย์,"The query mentions 'ค่าธรรมเนียมผู้บริหารอสังหาริมทรัพย์' which directly corresponds to the 'ค่าธรรมเนียมบริหารอสังหาริมทรัพย์' item in the taxonomy. Both terms refer to fees associated with property management. Thus, the 'set_code' is '421700', aligning with this item.",งบกำไรขาดทุนเบ็ดเสร็จ (ยังไม่ได้ตรวจสอบ),ค่าใช้จ่าย,"[7474382, 7157111, 14337188, 15356638]"
29,ค่าธรรมเนียมวิชาชีพ,421500,ค่าธรรมเนียมวิชาชีพ,The query directly matches multiple item_in_taxonomy in the taxonomy list.  Selecting the item with matching fs_category from INPUT METADATA. ,งบกำไรขาดทุนเบ็ดเสร็จ (ยังไม่ได้ตรวจสอบ),ค่าใช้จ่าย,"[360651, 299178, 659012, 1536233]"
30,ค่าใช้จ่ายในการดำเนินโครงการ,422120,ค่าใช้จ่ายในการขายและบริหาร ค่าใช้จ่ายในการบริหาร,"The input item name 'ค่าใช้จ่ายในการดำเนินโครงการ' closely resembles the meaning of 'ค่าใช้จ่ายในการบริหาร' in the taxonomy list. Both refer to general expenses incurred in operations, such as office rent and utilities. Therefore, 'ค่าใช้จ่ายในการขายและบริหาร ค่าใช้จ่ายในการบริหาร' is the most appropriate match.",งบกำไรขาดทุนเบ็ดเสร็จ (ยังไม่ได้ตรวจสอบ),ค่าใช้จ่าย,"[2879770, 2102169, 4743314, 4452216]"
31,ผลขาดทุนด้านเครดิตที่คาดว่าจะเกิดขึ้น (กลับรายการ),430700, (กลับรายการ) ผลขาดทุนด้านเครดิตที่คาดว่าจะเกิดขึ้น,"The input refers to a reversal of expected credit losses. After examining the provided taxonomy list, the closest match is  ""(กลับรายการ) ผลขาดทุนด้านเครดิตที่คาดว่าจะเกิดขึ้น"" with SET Code 430700. This item aligns with the input's meaning and the specified financial statement type, 'งบกำไรขาดทุนเบ็ดเสร็จ (ยังไม่ได้ตรวจสอบ)' which translates to 'PL'.",งบกำไรขาดทุนเบ็ดเสร็จ (ยังไม่ได้ตรวจสอบ),ค่าใช้จ่าย,"[0, -239361, 0, -1914835]"
32,ค่าใช้จ่ายในการประกันภัย,422120,ค่าใช้จ่ายในการบริหาร,The input query ค่าใช้จ่ายในการประกันภัย is related to general expense. And the closest item in taxonomy  is ค่าใช้จ่ายในการบริหาร in the context.,งบกำไรขาดทุนเบ็ดเสร็จ (ยังไม่ได้ตรวจสอบ),ค่าใช้จ่าย,"[1093926, 1253939, 2347687, 2225671]"
33,ค่าใช้จ่ายอื่น,429800,ค่าใช้จ่ายอื่น,The query 'ค่าใช้จ่ายอื่น' matches directly with the 'item_in_taxonomy' field in the taxonomy list.  The 'fs_category' field  'กำไรขาดทุน' is also a broader match to the input metadata 'fs_category' of 'ค่าใช้จ่าย'.,งบกำไรขาดทุนเบ็ดเสร็จ (ยังไม่ได้ตรวจสอบ),ค่าใช้จ่าย,"[1859500, 1175608, 3150039, 2129596]"
34,ต้นทุนทางการเงิน,429900,ต้นทุนทางการเงิน,"The query 'ต้นทุนทางการเงิน' is an exact match with the 'item_in_taxonomy' in the Taxonomy list.  Also, the fs_category ค่าใช้จ่าย matched the input metadata.",งบกำไรขาดทุนเบ็ดเสร็จ (ยังไม่ได้ตรวจสอบ),ค่าใช้จ่าย,"[813511, 984867, 1674758, 2009096]"
35,รวมค่าใช้จ่าย,429999,รวมค่าใช้จ่าย,"The query ""รวมค่าใช้จ่าย"" matches directly with item_in_taxonomy ""รวมค่าใช้จ่าย"" in the taxonomy list. And the fs_category of this item is related to ""ค่าใช้จ่าย"".",งบกำไรขาดทุนเบ็ดเสร็จ (ยังไม่ได้ตรวจสอบ),ค่าใช้จ่าย,"[27069107, 26365219, 51109665, 51580481]"
36,กำไรจากการลงทุนสุทธิ,409993,รายได้จากการลงทุนสุทธิ,"The input name is similar to item meaning in the taxonomy list, and the input financial statement type is matched to the taxonomy list.",งบกำไรขาดทุนเบ็ดเสร็จ (ยังไม่ได้ตรวจสอบ),null,"[54748347, 51464195, 109492427, 98160787]"
37,รายการกำไร (ขาดทุน) สุทธิจากเงินลงทุน,439701,กำไร (ขาดทุน) สุทธิจากเงินลงทุน,"The query 'รายการกำไร (ขาดทุน) สุทธิจากเงินลงทุน' is an exact match to the 'item_in_taxonomy' field in the taxonomy list.  The 'financial_statement_type' in the metadata is งบกำไรขาดทุนเบ็ดเสร็จ (ยังไม่ได้ตรวจสอบ) which means Statement of Comprehensive Income (Unaudited), so financial_statement_type is 'PL'.",งบกำไรขาดทุนเบ็ดเสร็จ (ยังไม่ได้ตรวจสอบ),null,"[8016663, -26410337, 74558544, -60723071]"
38,รายการกำไร (ขาดทุน) จากการเปลี่ยนแปลง,439702,กำไร (ขาดทุน) จากการเปลี่ยนแปลงมูลค่ายุติธรรมของเงินลงทุน,"The query mentions ""รายการกำไร (ขาดทุน) จากการเปลี่ยนแปลง"" which closely resembles the item ""กำไร (ขาดทุน) จากการเปลี่ยนแปลงมูลค่ายุติธรรมของเงินลงทุน"" in the taxonomy list. Considering the provided financial statement type is ""งบกำไรขาดทุนเบ็ดเสร็จ (ยังไม่ได้ตรวจสอบ)"" and fs_category is null, the most relevant match is the taxonomy item with the set code 439702.",งบกำไรขาดทุนเบ็ดเสร็จ (ยังไม่ได้ตรวจสอบ),null,"[8016663, -26410337, 74558544, -60723071]"
