,query,set_code,item_in_taxonomy,reasoning,table_name,category,number_values
39,ในมูลค่ายุติธรรมของเงินลงทุน,439702,กำไร (ขาดทุน) อื่น กำไร (ขาดทุน) จากการเปลี่ยนแปลงมูลค่ายุติธรรมของเงินลงทุน,"The input query mentions ""มูลค่ายุติธรรมของเงินลงทุน"" which directly corresponds to the item ""กำไร (ขาดทุน) อื่น กำไร (ขาดทุน) จากการเปลี่ยนแปลงมูลค่ายุติธรรมของเงินลงทุน"" in the taxonomy list. Therefore, this item is the most appropriate match.",งบกำไรขาดทุนเบ็ดเสร็จ (ยังไม่ได้ตรวจสอบ),null,"[8016663, -26410337, 74558544, -60723071]"
40,รวมรายการกำไร (ขาดทุน) สุทธิจากเงินลงทุน,439701,กำไร (ขาดทุน) สุทธิจากเงินลงทุน,"The query mentions ""รวมรายการกำไร (ขาดทุน) สุทธิจากเงินลงทุน"" which directly translates to Total net profit (loss) from investments, aligning with the item in taxonomy ""กำไร (ขาดทุน) สุทธิจากเงินลงทุน"" and its definition.",งบกำไรขาดทุนเบ็ดเสร็จ (ยังไม่ได้ตรวจสอบ),null,"[8016663, -26410337, 74558544, -60723071]"
41,การเพิ่มขึ้นในสินทรัพย์สุทธิจากการดำเนินงาน,409991,การเพิ่มขึ้น (ลดลง) ในสินทรัพย์สุทธิจากการดำเนินงาน,"The query 'การเพิ่มขึ้นในสินทรัพย์สุทธิจากการดำเนินงาน' best matches the item 'การเพิ่มขึ้น (ลดลง) ในสินทรัพย์สุทธิจากการดำเนินงาน' in the taxonomy list. Although multiple matching items exist, the input metadata specifies 'fs_category' as null, and we prioritize 'item_in_taxonomy' over 'fs_category' when 'fs_category' is null in the context.",งบกำไรขาดทุนเบ็ดเสร็จ (ยังไม่ได้ตรวจสอบ),null,"[62765010, 25053858, 184050971, 37437716]"
42,การเพิ่มขึ้นในสินทรัพย์สุทธิจากการดำเนินงานในระหว่างงวด,560090,การเพิ่มขึ้น (ลดลง) ในสินทรัพย์สุทธิจากการดำเนินงาน,The query mentions 'การเพิ่มขึ้นในสินทรัพย์สุทธิจากการดำเนินงาน' which directly corresponds to the item 'การเพิ่มขึ้น (ลดลง) ในสินทรัพย์สุทธิจากการดำเนินงาน' in the taxonomy.  The fs_category 'กิจกรรมดำเนินงาน' also aligns with the input metadata 'กระแสเงินสดจากกิจกรรมดำเนินงาน'.,งบกระแสเงินสด (ยังไม่ได้ตรวจสอบ) (ต่อ),กระแสเงินสดจากกิจกรรมดำเนินงาน,"[184050971, 37437716]"
43,ค่าตัดจำหน่ายส่วนลดรับจากเงินลงทุน,560330,การจำหน่ายเงินลงทุน,"The most relevant item from the provided taxonomy list is  'การจำหน่ายเงินลงทุน' (Disposal Of Investments) with SET Code '560330'. Although the input mentions 'ค่าตัดจำหน่าย' (amortization), it relates to a discount received from an investment, suggesting a disposal of an investment. Therefore, 'การจำหน่ายเงินลงทุน' is chosen as the most appropriate match.",งบกระแสเงินสด (ยังไม่ได้ตรวจสอบ) (ต่อ),กระแสเงินสดจากกิจกรรมดำเนินงาน,"[-1493486, 0]"
44,ขาดทุนจากการจำหน่ายอสังหาริมทรัพย์เพื่อการลงทุน,565000,รายการปรับปรุงอื่น ๆ,"The input name suggests that it should be classified as other reconciliation items, as it does not fit into other specific categories in the provided taxonomy. Therefore, the most appropriate mapping based on meaning is 'รายการปรับปรุงอื่น ๆ' with SET Code '565000'.",งบกระแสเงินสด (ยังไม่ได้ตรวจสอบ) (ต่อ),กระแสเงินสดจากกิจกรรมดำเนินงาน,"[83821, 123063]"
45,**(กำไร) ขาดทุนสุทธิที่ยังไม่เกิดขึ้นจากการเปลี่ยนเปลงในมูลค่ายุติธรรมของเงินลงทุน**,null,null,There is no item in the taxonomy that matches the query with the correct fs_category.,งบกระแสเงินสด (ยังไม่ได้ตรวจสอบ) (ต่อ),กระแสเงินสดจากกิจกรรมดำเนินงาน,"[-74558544, 60723071]"
46,กลับรายการผลขาดทุนด้านเครดิตที่คาดว่าจะเกิดขึ้น,564920, (กลับรายการ) ประมาณการหนี้สิน,"The most relevant item from the provided taxonomy list is  (กลับรายการ) ประมาณการหนี้สิน as it closely aligns with the concept of reversing provisions, which is conceptually similar to reversing expected credit losses. ",งบกระแสเงินสด (ยังไม่ได้ตรวจสอบ) (ต่อ),กระแสเงินสดจากกิจกรรมดำเนินงาน,"[0, -1914835]"
47,การซื้อเงินลงทุน,560440,การซื้อเงินลงทุน,The input query 'การซื้อเงินลงทุน' matches directly with item 'การซื้อเงินลงทุน' in the Taxonomy list.  The fs_category property 'กิจกรรมดำเนินงาน' is also related to the input metadata 'กระแสเงินสดจากกิจกรรมดำเนินงาน'.,งบกระแสเงินสด (ยังไม่ได้ตรวจสอบ) (ต่อ),กระแสเงินสดจากกิจกรรมดำเนินงาน,"[-281987015, -11901964]"
48,การขายเงินลงทุน,560330,การจำหน่ายเงินลงทุน,"The input query ""การขายเงินลงทุน"" is similar to the item_in_taxonomy ""การจำหน่ายเงินลงทุน"" and the fs_category ""กิจกรรมดำเนินงาน"" matches the input metadata fs_category ""กระแสเงินสดจากกิจกรรมดำเนินงาน"".",งบกระแสเงินสด (ยังไม่ได้ตรวจสอบ) (ต่อ),กระแสเงินสดจากกิจกรรมดำเนินงาน,"[7000, 1869]"
49,ลูกหนี้ค่าเช่าลดลง,565800,ลูกหนี้การค้าและลูกหนี้อื่น (เพิ่มขึ้น) ลดลง,"The input mentions 'ลูกหนี้ค่าเช่าลดลง' which maps to decrease in receivables. The taxonomy list provides a close match with 'ลูกหนี้การค้าและลูกหนี้อื่น (เพิ่มขึ้น) ลดลง' which means '(Increase) Decrease In Trade And Other Receivables'. Considering the financial statement type 'งบกระแสเงินสด' and fs category 'กระแสเงินสดจากกิจกรรมดำเนินงาน', this taxonomy item aligns with the input.",งบกระแสเงินสด (ยังไม่ได้ตรวจสอบ) (ต่อ),กระแสเงินสดจากกิจกรรมดำเนินงาน,"[5399808, 19398994]"
50,รายได้ค้างรับเพิ่มขึ้น,568901,รายได้รอการรับรู้ เพิ่มขึ้น (ลดลง),"The input 'รายได้ค้างรับเพิ่มขึ้น' closely translates to 'Increase in Deferred Income', which aligns with the item 'รายได้รอการรับรู้ เพิ่มขึ้น (ลดลง)' in the taxonomy. Additionally, the input's financial statement category is 'กระแสเงินสดจากกิจกรรมดำเนินงาน', matching the taxonomy item's category 'กิจกรรมดำเนินงาน'.",งบกระแสเงินสด (ยังไม่ได้ตรวจสอบ) (ต่อ),กระแสเงินสดจากกิจกรรมดำเนินงาน,"[-88239, -284795]"
51,ลูกหนี้อื่นเพิ่มขึ้น,566910,ลูกหนี้ที่เกิดจากภาษีอื่นหรือรายการอื่นภายใต้กฎหมาย (เพิ่มขึ้น) ลดลง,The most relevant item from the provided taxonomy list is 'ลูกหนี้ที่เกิดจากภาษีอื่นหรือรายการอื่นภายใต้กฎหมาย (เพิ่มขึ้น) ลดลง' because it closely aligns with the input 'ลูกหนี้อื่นเพิ่มขึ้น'.,งบกระแสเงินสด (ยังไม่ได้ตรวจสอบ) (ต่อ),กระแสเงินสดจากกิจกรรมดำเนินงาน,"[-811423, -75765]"
52,ค่าใช้จ่ายรอการตัดบัญชีลดลง,568900,ค่าใช้จ่ายค้างจ่าย เพิ่มขึ้น (ลดลง),"The input name ""ค่าใช้จ่ายรอการตัดบัญชีลดลง"" is a close match to the meaning of taxonomy ""ค่าใช้จ่ายค้างจ่าย เพิ่มขึ้นหรือลดลง บางครั้งใช้ขื่อว่า ค่าใช้จ่ายรอการตัดบัญชีลดลง "" and the fs_category ""กิจกรรมดำเนินงาน"" is a close match to the context ""กระแสเงินสดจากกิจกรรมดำเนินงาน"".",งบกระแสเงินสด (ยังไม่ได้ตรวจสอบ) (ต่อ),กระแสเงินสดจากกิจกรรมดำเนินงาน,"[103568, 64656]"
53,สินทรัพย์อื่นเพิ่มขึ้น,566600,สินทรัพย์อื่น (เพิ่มขึ้น) ลดลง,The query \,งบกระแสเงินสด (ยังไม่ได้ตรวจสอบ) (ต่อ),กระแสเงินสดจากกิจกรรมดำเนินงาน,"[-2547852, -2679449]"
54,เจ้าหนี้อื่นเพิ่มขึ้น,567600,เจ้าหนี้การค้าและเจ้าหนี้อื่น เพิ่มขึ้น (ลดลง),"The query mentions an increase in other payables, which aligns with the description of 'เจ้าหนี้การค้าและเจ้าหนี้อื่น เพิ่มขึ้น (ลดลง)' (Increase (Decrease) In Trade And Other Payables) in the taxonomy list. The fs_category 'กิจกรรมดำเนินงาน' also matches the input metadata.",งบกระแสเงินสด (ยังไม่ได้ตรวจสอบ) (ต่อ),กระแสเงินสดจากกิจกรรมดำเนินงาน,"[4247439, 8848027]"
55,เงินมัดจำรับจากลูกค้าเพิ่มขึ้น (ลดลง),568902,เงินมัดจำ เพิ่มขึ้น (ลดลง),"The meaning_of_taxonomy states ""เงินมัดจำ เพิ่มขึ้นหรือลดลง บางครั้งใช้ขื่อว่า เงินมัดจำรับจากลูกค้าเพิ่มขึ้น(ลดลง)"" which aligns with the input query. And the input metadata financial_statement_type งบกระแสเงินสด (ยังไม่ได้ตรวจสอบ) (ต่อ) maps to CF, and fs_category กระแสเงินสดจากกิจกรรมดำเนินงาน maps to กิจกรรมดำเนินงาน in the taxonomy list.",งบกระแสเงินสด (ยังไม่ได้ตรวจสอบ) (ต่อ),กระแสเงินสดจากกิจกรรมดำเนินงาน,"[-42819, 2619570]"
56,ภาษีเงินได้หัก ณ ที่จ่ายค้างจ่ายเพิ่มขึ้น,568800,เจ้าหนี้ที่เกิดจากภาษีอื่นหรือรายการอื่นภายใต้กฎหมาย เพิ่มขึ้น (ลดลง),The input mentions 'ภาษีเงินได้หัก ณ ที่จ่าย' which implies to withholding tax payable. The closest match in the taxonomy list is 'เจ้าหนี้ที่เกิดจากภาษีอื่นหรือรายการอื่นภายใต้กฎหมาย เพิ่มขึ้น (ลดลง)' with the meaning 'Increase (Decrease) In Other Tax Or Other Payables Under Law And Regulations'.,งบกระแสเงินสด (ยังไม่ได้ตรวจสอบ) (ต่อ),กระแสเงินสดจากกิจกรรมดำเนินงาน,"[530522, 2763320]"
57,หนี้สินอื่นเพิ่มขึ้น (ลดลง),568300,หนี้สินอื่น เพิ่มขึ้น (ลดลง),"The query \""หนี้สินอื่นเพิ่มขึ้น (ลดลง)\"" matches item_in_taxonomy \""หนี้สินอื่น เพิ่มขึ้น (ลดลง)\"" in the taxonomy list.  The fs_category is กิจกรรมดำเนินงาน which is related to กระแสเงินสดจากกิจกรรมดำเนินงาน in the input metadata. Therefore, the correct SET Code is 568300.",งบกระแสเงินสด (ยังไม่ได้ตรวจสอบ) (ต่อ),กระแสเงินสดจากกิจกรรมดำเนินงาน,"[-169124, 460775]"
58,ต้นทุนทางการเงิน,564800,ต้นทุนทางการเงิน,"The query ""ต้นทุนทางการเงิน"" matches the item_in_taxonomy ""ต้นทุนทางการเงิน"" in the taxonomy list.  The fs_category is กิจกรรมดำเนินงาน which is related to กระแสเงินสดจากกิจกรรมดำเนินงาน in the input metadata.",งบกระแสเงินสด (ยังไม่ได้ตรวจสอบ) (ต่อ),กระแสเงินสดจากกิจกรรมดำเนินงาน,"[1674758, 2009096]"
59,รายได้ดอกเบี้ย,569500,รับดอกเบี้ย,"The input query 'รายได้ดอกเบี้ย' is similar to 'รายได้ดอกเบี้ย เงินสดรับดอกเบี้ย' in the 'meaning_of_taxonomy' field in the Taxonomy list.  The input metadata 'fs_category' is กระแสเงินสดจากกิจกรรมดำเนินงาน, which is related to 'กิจกรรมดำเนินงาน'. Thus, the most relevant item in the Taxonomy list is {'meaning_of_taxonomy': 'บางครั้งใช้ขื่อว่า รายได้ดอกเบี้ย เงินสดรับดอกเบี้ย', 'item_in_taxonomy_en': 'Interest Received', 'form_no': 'F5', 'item_in_taxonomy': 'รับดอกเบี้ย', 'mandatory_mapping': '', 'set_code': '569500', 'financial_statement_type': 'CF', 'symbol': '23', 'indent': '0', 'data_type': 'N', 'fs_category': 'กิจกรรมดำเนินงาน'}.",งบกระแสเงินสด (ยังไม่ได้ตรวจสอบ) (ต่อ),กระแสเงินสดจากกิจกรรมดำเนินงาน,"[-791580, -782738]"
60,ดอกเบี้ยรับ,569500,รับดอกเบี้ย,"The closest match from the Taxonomy list is ""รับดอกเบี้ย"" with SET Code ""569500"". This item's meaning aligns with the input query, and its fs_category is ""กิจกรรมดำเนินงาน"", which is related to the input metadata's fs_category ""กระแสเงินสดจากกิจกรรมดำเนินงาน"".",งบกระแสเงินสด (ยังไม่ได้ตรวจสอบ) (ต่อ),กระแสเงินสดจากกิจกรรมดำเนินงาน,"[810750, 778208]"
61,เงินสดสุทธิได้มา (ใช้ไป) จากกิจกรรมดำเนินงาน,569999,เงินสดสุทธิได้มาจาก (ใช้ไปใน) กิจกรรมดำเนินงาน,The input line item name 'เงินสดสุทธิได้มา (ใช้ไป) จากกิจกรรมดำเนินงาน' is a close match to the item 'เงินสดสุทธิได้มาจาก (ใช้ไปใน) กิจกรรมดำเนินงาน' in the provided taxonomy list. Both refer to the net cash flow from operating activities.  The financial statement type is 'งบกระแสเงินสด (ยังไม่ได้ตรวจสอบ) (ต่อ)' which maps to 'CF' in the taxonomy list.,งบกระแสเงินสด (ยังไม่ได้ตรวจสอบ) (ต่อ),กระแสเงินสดจากกิจกรรมดำเนินงาน,"[-165581445, 117588819]"
62,เงินสดจ่ายชำระหนี้สินตามสัญญาเช่า,530500,เงินสดจ่ายชำระหนี้สินตามสัญญาเช่า,The query 'เงินสดจ่ายชำระหนี้สินตามสัญญาเช่า' from the financial report's งบกระแสเงินสด (ยังไม่ได้ตรวจสอบ) (ต่อ) section under the กระแสเงินสดจากกิจกรรมจัดหาเงิน category perfectly matches the 'item_in_taxonomy' of 'เงินสดจ่ายชำระหนี้สินตามสัญญาเช่า' with the set code '530500' in the taxonomy list. ,งบกระแสเงินสด (ยังไม่ได้ตรวจสอบ) (ต่อ),กระแสเงินสดจากกิจกรรมจัดหาเงิน,"[-4563786, -3861244]"
63,เงินสดจ่ายดอกเบี้ย,539600,จ่ายดอกเบี้ย,"The input name is เงินสดจ่ายดอกเบี้ย and the fs_category is กระแสเงินสดจากกิจกรรมจัดหาเงิน.  From the Taxonomy list, the closest match is set_code 539600 and item_in_taxonomy จ่ายดอกเบี้ย because the meaning_of_taxonomy is เงินสดจ่ายดอกเบี้ย and fs_category is กิจกรรมจัดหาเงิน and financial_statement_type is CF",งบกระแสเงินสด (ยังไม่ได้ตรวจสอบ) (ต่อ),กระแสเงินสดจากกิจกรรมจัดหาเงิน,"[-1674758, -2009096]"
64,จ่ายเงินปันผล,539800,การแบ่งปันส่วนทุนให้ผู้ถือหน่วยลงทุน,"The input query 'จ่ายเงินปันผล' is related to 'การแบ่งปันส่วนทุนให้ผู้ถือหน่วยลงทุน' in the taxonomy list.  The fs_category in taxonomy list item is 'กิจกรรมจัดหาเงิน' which is related to 'กระแสเงินสดจากกิจกรรมจัดหาเงิน' in the input metadata. Thus, the SET code is '539800'.",งบกระแสเงินสด (ยังไม่ได้ตรวจสอบ) (ต่อ),กระแสเงินสดจากกิจกรรมจัดหาเงิน,"[-93885000, -41910000]"
65,จ่ายคืนทุน,531000,เงินสดจ่ายมูลค่าหน่วยลงทุนจากการลดทุน,"The input query 'จ่ายคืนทุน' closely translates to 'Payments for Capital Reduction' which aligns with the item 'เงินสดจ่ายมูลค่าหน่วยลงทุนจากการลดทุน' in the provided taxonomy list. Additionally, the fs_category 'กิจกรรมจัดหาเงิน' matches the input metadata 'กระแสเงินสดจากกิจกรรมจัดหาเงิน'.",งบกระแสเงินสด (ยังไม่ได้ตรวจสอบ) (ต่อ),กระแสเงินสดจากกิจกรรมจัดหาเงิน,"[0, -33000000]"
66,เงินสดสุทธิใช้ไปในกิจกรรมจัดหาเงิน,539999,เงินสดสุทธิได้มาจาก (ใช้ไปใน) กิจกรรมจัดหาเงิน,"The input query's fs_category is กระแสเงินสดจากกิจกรรมจัดหาเงิน,  and it's related to the fs_category กิจกรรมจัดหาเงิน in the Taxonomy list. Thus the extracted SET Code is 539999 and Item in Taxonomy is เงินสดสุทธิได้มาจาก (ใช้ไปใน) กิจกรรมจัดหาเงิน",งบกระแสเงินสด (ยังไม่ได้ตรวจสอบ) (ต่อ),กระแสเงินสดจากกิจกรรมจัดหาเงิน,"[-100123544, -80780340]"
67,เงินสดและรายการเทียบเท่าเงินสดเพิ่มขึ้น (ลดลง) สุทธิ,509999,เงินสดและรายการเทียบเท่าเงินสด เพิ่มขึ้น (ลดลง) สุทธิ,"The query matches the meaning of taxonomy in the first item of the provided taxonomy list. Thus, the set code and item in taxonomy are extracted from the item.",งบกระแสเงินสด (ยังไม่ได้ตรวจสอบ) (ต่อ),null,"[-265704989, 36808479]"
68,เงินสดและรายการเทียบเท่าเงินสดต้นงวด,599998,เงินสดและรายการเทียบเท่าเงินสด ต้นงวด,"Taxonomy list item with item_in_taxonomy 'เงินสดและรายการเทียบเท่าเงินสด ต้นงวด' was found. Its fs_category is 'เงินสดและรายการเทียบเท่า' which is related to null.  Therefore, the set_code '599998' and item_in_taxonomy 'เงินสดและรายการเทียบเท่าเงินสด ต้นงวด' from the same Taxonomy list item are selected.",งบกระแสเงินสด (ยังไม่ได้ตรวจสอบ) (ต่อ),null,"[387726396, 336396808]"
