taxonomy_account_name,ai_account_code,ai_acc_name,prod_account_name,prod_account_code,prod_parent_account_code,is_match,is_match_parent,unmatch_remark
สินทรัพย์ทางการเงินที่วัดมูลค่าด้วยมูลค่ายุติธรรมผ่านกำไรหรือขาดทุน,100600,สินทรัพย์ทางการเงินที่วัดมูลค่าด้วยมูลค่ายุติธรรมผ่านกำไรหรือขาดทุน,สินทรัพย์ทางการเงินที่วัดมูลค่าด้วยมูลค่ายุติธรรมผ่านกำไรหรือขาดทุน,100690,100600,False,True,
ตราสารหนี้ที่ออกและเงินกู้ยืม,202000,ตราสารหนี้ที่ออกและเงินกู้ยืม,ตราสารหนี้ที่ออกและเงินกู้ยืม,202090,202000,False,True,
รวมหนี้สิน,,,รวมหนี้สิน,209999,309999,False,False,
รวมหนี้สินและส่วนของเจ้าของ,,,รวมหนี้สินและส่วนของเจ้าของ,309999,,False,False,
หนี้สูญรับคืน,,,หนี้สูญรับคืน,430700,409994,False,False,"410200-หนี้สูญรับคืน-รายได้จากการดําเนินงานอื่น ๆ-The meaning_of_taxonomy for SET Code 410200 contains ""บางครั้งใช้ชื่อว่า หนี้สูญรับคืน"". Although the fs_category does not match, we will use item_in_taxonomy instead according to the instructions. | 410200-หนี้สูญรับคืน-รายได้จากการดําเนินงานอื่น ๆ-The meaning_of_taxonomy for set_code '410200' and item_in_taxonomy 'รายได้จากการดําเนินงานอื่น ๆ' includes  'บางครั้งใช้ชื่อว่า หนี้สูญรับคืน'. | "
ผลขาดทุนด้านเครดิตที่คาดว่าจะเกิดขึ้น,409994,ผลขาดทุนด้านเครดิตที่คาดว่าจะเกิดขึ้น,ผลขาดทุนด้านเครดิตที่คาดว่าจะเกิดขึ้น,430700,409994,False,True,
หนี้สูญรับคืน,,,หนี้สูญรับคืน,430700,409994,False,False,"410200-หนี้สูญรับคืน-รายได้จากการดําเนินงานอื่น ๆ-The meaning_of_taxonomy for SET Code 410200 contains ""บางครั้งใช้ชื่อว่า หนี้สูญรับคืน"". Although the fs_category does not match, we will use item_in_taxonomy instead according to the instructions. | 410200-หนี้สูญรับคืน-รายได้จากการดําเนินงานอื่น ๆ-The meaning_of_taxonomy for set_code '410200' and item_in_taxonomy 'รายได้จากการดําเนินงานอื่น ๆ' includes  'บางครั้งใช้ชื่อว่า หนี้สูญรับคืน'. | "
ผลขาดทุนด้านเครดิตที่คาดว่าจะเกิดขึ้น,409994,ผลขาดทุนด้านเครดิตที่คาดว่าจะเกิดขึ้น,ผลขาดทุนด้านเครดิตที่คาดว่าจะเกิดขึ้น,430700,409994,False,True,
กำไรจากการดำเนินงานก่อนภาษีเงินได้,519997,กำไรจากการดำเนินงานก่อนภาษีเงินได้,กำไรจากการดำเนินงานก่อนภาษีเงินได้,510200,519997,False,True,
ผลขาดทุนด้านเครดิตที่คาดว่าจะเกิดขึ้น,,,ผลขาดทุนด้านเครดิตที่คาดว่าจะเกิดขึ้น,510400,519997,False,False,"409994-ผลขาดทุนด้านเครดิตที่คาดว่าจะเกิดขึ้น-กำไร (ขาดทุน) จากการดำเนินงานก่อนภาษีเงินได้-The input item name ผลขาดทุนด้านเครดิตที่คาดว่าจะเกิดขึ้น is related to operating profit, but there is no exact match in the provided taxonomy list. Using the closest match based on fs_category and meaning, the selected item is กำไร (ขาดทุน) จากการดำเนินงานก่อนภาษีเงินได้ with SET Code 409994. This item's meaning mentions deducting expected credit losses before calculating operating profit. | 430700-ผลขาดทุนด้านเครดิตที่คาดว่าจะเกิดขึ้น-**(กลับรายการ) ผลขาดทุนด้านเครดิตที่คาดว่าจะเกิดขึ้น**-The most relevant item from the provided taxonomy list is '**(กลับรายการ) ผลขาดทุนด้านเครดิตที่คาดว่าจะเกิดขึ้น**' (Reversal Of) Expected Credit Losses, which aligns with the input query. Although the input explicitly mentions 'ผลขาดทุนด้านเครดิตที่คาดว่าจะเกิดขึ้น' (expected credit losses), the context does not provide a direct match for this specific term. Therefore, we choose the closest matching item. | 540300-ผลขาดทุนด้านเครดิตที่คาดว่าจะเกิดขึ้น-รายการอื่น ๆ-The INPUT's financial_statement_type งบกระแสเงินสด (ต่อ) สำหรับงวดหกเดือนสิ้นสุดวันที่ 30 มิถุนายน 2567 matches to financial_statement_type: 'CF'.
The INPUT's fs_category กระแสเงินสดจากการดำเนินงาน is similar to fs_category: 'กิจกรรมดำเนินงาน', but there is no item related to the INPUT.  So the closest match from the Taxonomy list is  item_in_taxonomy: 'รายการอื่น ๆ' and set_code: '540300'. | "
ขาดทุนจากเงินลงทุน,,,ขาดทุนจากเงินลงทุน,512300,519997,False,False,"510600-ขาดทุนจากเงินลงทุน-ส่วนแบ่ง (กำไร) ขาดทุนจากเงินลงทุนตามวิธีส่วนได้เสีย-The INPUT's fs_category is กระแสเงินสดจากการดำเนินงาน, so we should look for the item in Taxonomy list with fs_category value equal to กิจกรรมดำเนินงาน. Found three potential candidates with set_code 511000, 510600, and 510900. From the meaning_of_taxonomy of each candidate, 510600's meaning_of_taxonomy 'ส่วนแบ่ง กำไรหรือขาดทุนจากเงินลงทุนตามวิธีส่วนได้เสีย บางครั้งใช้ขื่อว่า (กำไร)ขาดทุนจากเงินลงทุน ' best matches the query ""ขาดทุนจากเงินลงทุน"". | "
ส่วนเกินมูลค่าเงินทุนในตราสารหนี้ตัดจำหน่าย,,,ส่วนเกินมูลค่าเงินทุนในตราสารหนี้ตัดจำหน่าย,514800,514500,False,False,"515000-ส่วนเกินมูลค่าเงินทุนในตราสารหนี้ตัดจำหน่าย-รายการปรับปรุงอื่น ๆ-The input item name 'ส่วนเกินมูลค่าเงินทุนในตราสารหนี้ตัดจำหน่าย' appears in the meaning_of_taxonomy of the Taxonomy list item with SET Code '515000'.

The fs_category of the selected Taxonomy list item is 'กิจกรรมดำเนินงาน' which is related to the input's fs_category 'กระแสเงินสดจากการดำเนินงาน'. | 515000-ส่วนเกินมูลค่าเงินทุนในตราสารหนี้ตัดจำหน่าย-รายการปรับปรุงอื่น ๆ-The INPUT's fs_category is กระแสเงินสดจากการดำเนินงาน and the closest meaning in the Taxonomy list is 'รายการปรับปรุงอื่น ๆ' with SET code '515000', which falls under fs_category 'กิจกรรมดำเนินงาน'. | "
ขาดทุนจากการด้อยค่าของทรัพย์สินรอการขาย,,,ขาดทุนจากการด้อยค่าของทรัพย์สินรอการขาย,512000,519997,False,False,"511200-ขาดทุนจากการด้อยค่าของทรัพย์สินรอการขาย- (กำไร) ขาดทุนจากการขายทรัพย์สินรอการขาย-The INPUT is related to loss from asset classified as held for sale. Thus, the closest item in taxonomy is (กำไร) ขาดทุนจากการขายทรัพย์สินรอการขาย.  The financial_statement_type from INPUT METADATA is งบกระแสเงินสด, so financial_statement_type is CF. | <NA>-ขาดทุนจากการด้อยค่าของทรัพย์สินรอการขาย-nan-There is no item in the taxonomy list that belongs to fs_category กระแสเงินสดจากการดำเนินงาน and matches the query ขาดทุนจากการด้อยค่าของทรัพย์สินรอการขาย | "
สำรองอื่นเพิ่มขึ้น,,,สำรองอื่นเพิ่มขึ้น,514920,519997,False,False,518000-สำรองอื่นเพิ่มขึ้น-ประมาณการหนี้สิน เพิ่มขึ้น (ลดลง)-The input name 'สำรองอื่นเพิ่มขึ้น' appears in the meaning of taxonomy of 'ประมาณการหนี้สิน เพิ่มขึ้น (ลดลง)' and the fs_category is matched with the context. | 515000-สำรองอื่นเพิ่มขึ้น-รายการปรับปรุงอื่น ๆ-The input contains the keyword 'สำรองอื่นเพิ่มขึ้น' which directly appears in the meaning of taxonomy of the selected item.  | 
รายการระหว่างธนาคารและตลาดเงิน,,,รายการระหว่างธนาคารและตลาดเงิน,516900,519998,False,False,"200200-รายการระหว่างธนาคารและตลาดเงิน-รายการระหว่างธนาคารและตลาดเงิน-The query 'รายการระหว่างธนาคารและตลาดเงิน' is a close match to the item 'รายการระหว่างธนาคารและตลาดเงิน' in the taxonomy list. The financial_statement_type is 'BS_L' because the input fs_category is หนี้สินและส่วนของเจ้าของ. | 200200-รายการระหว่างธนาคารและตลาดเงิน-รายการระหว่างธนาคารและตลาดเงิน-The query matches the Item in Taxonomy ""รายการระหว่างธนาคารและตลาดเงิน"" with fs_category ""หนี้สิน"" which is related to the input metadata fs_category ""หนี้สินและส่วนของเจ้าของ"". | 515200-รายการระหว่างธนาคารและตลาดเงิน-รายการระหว่างธนาคารและตลาดเงิน (เพิ่มขึ้น) ลดลง-The input item matches  meaning_of_taxonomy: 'รายการระหว่างธนาคารและตลาดเงิน เพิ่มขึ้นหรือลดลง บางครั้งใช้ชื่อว่า รายการระหว่างธนาคารและตลาดเงิน' in the Taxonomy list. Thus, the correct SET Code is 515200 and Item in Taxonomy is รายการระหว่างธนาคารและตลาดเงิน (เพิ่มขึ้น) ลดลง | 515200-รายการระหว่างธนาคารและตลาดเงิน-รายการระหว่างธนาคารและตลาดเงิน (เพิ่มขึ้น) ลดลง-The input item name 'รายการระหว่างธนาคารและตลาดเงิน' matches exactly with the meaning_of_taxonomy field in the Taxonomy list.  The input metadata financial_statement_type is 'งบกระแสเงินสด สำหรับงวดหกเดือนสิ้นสุดวันที่ 30 มิถุนายน 2567' which mapped to 'CF' and fs_category is 'กระแสเงินสดจากการดำเนินงาน' which mapped to 'กิจกรรมดำเนินงาน' in the Taxonomy list.  | 515200-รายการระหว่างธนาคารและตลาดเงิน-รายการระหว่างธนาคารและตลาดเงิน (เพิ่มขึ้น) ลดลง-The query 'รายการระหว่างธนาคารและตลาดเงิน' matches the meaning_of_taxonomy field in the Taxonomy list. 
The financial_statement_type from INPUT METADATA is งบกระแสเงินสด (ต่อ) สำหรับงวดหกเดือนสิ้นสุดวันที่ 30 มิถุนายน 2567, which maps to 'CF'.
The fs_category from INPUT METADATA is กระแสเงินสดจากการดำเนินงาน, which maps to 'กิจกรรมดำเนินงาน' in the Taxonomy list. | 515200-รายการระหว่างธนาคารและตลาดเงิน-รายการระหว่างธนาคารและตลาดเงิน (เพิ่มขึ้น) ลดลง-The input item name 'รายการระหว่างธนาคารและตลาดเงิน' matches exactly with the meaning_of_taxonomy field in the Taxonomy list.  Also, using the fs_category from the input metadata, we can pinpoint the correct item in the Taxonomy list. Therefore, the correct SET Code is 515200 and the item name is 'รายการระหว่างธนาคารและตลาดเงิน (เพิ่มขึ้น) ลดลง'. | "
