taxonomy_account_name,ai_account_code,ai_acc_name,prod_account_name,prod_account_code,prod_parent_account_code,is_match,is_match_parent,unmatch_remark
ลูกหนี้หมุนเวียนอื่น,,,ลูกหนี้หมุนเวียนอื่น,112040,112000,False,False,"113130-ลูกหนี้หมุนเวียนอื่น-สินทรัพย์ทางการเงินหมุนเวียนอื่น ลูกหนี้หมุนเวียนอื่น-The query ""ลูกหนี้หมุนเวียนอื่น"" matches with item_in_taxonomy ""สินทรัพย์ทางการเงินหมุนเวียนอื่น ลูกหนี้หมุนเวียนอื่น"" in the taxonomy list. Both financial_statement_type and fs_category criteria are met. | 113130-ลูกหนี้หมุนเวียนอื่น-สินทรัพย์ทางการเงินหมุนเวียนอื่น ลูกหนี้หมุนเวียนอื่น-The INPUT, ลูกหนี้หมุนเวียนอื่น, directly matches the item_in_taxonomy, สินทรัพย์ทางการเงินหมุนเวียนอื่น ลูกหนี้หมุนเวียนอื่น, in the Taxonomy list. The fs_category, สินทรัพย์หมุนเวียน, is also related to the INPUT METADATA fs_category, สินทรัพย์. Thus, the SET Code should be 113130. | 516910-ลูกหนี้หมุนเวียนอื่น-ลูกหนี้ที่เกิดจากภาษีอื่นหรือรายการอื่นภายใต้กฎหมาย (เพิ่มขึ้น) ลดลง-The most relevant item from the provided taxonomy list is 'ลูกหนี้ที่เกิดจากภาษีอื่นหรือรายการอื่นภายใต้กฎหมาย (เพิ่มขึ้น) ลดลง' because it broadly encompasses various types of receivables. Considering the input 'ลูกหนี้หมุนเวียนอื่น' likely falls under other receivables, this selection seems most appropriate. | "
เงินให้กู้ยืมแก่บริษัทอื่นที่ผิดนัดชำระหนี้หมุนเวียน-สุทธิ,112300,เงินให้กู้ยืมแก่บริษัทอื่นที่ผิดนัดชำระหนี้หมุนเวียน-สุทธิ,เงินให้กู้ยืมแก่บริษัทอื่นที่ผิดนัดชำระหนี้หมุนเวียน-สุทธิ,112310,112300,False,True,
สินทรัพย์หมุนเวียนอื่น - อื่น ๆ,,,สินทรัพย์ภาษีเงินได้ของงวดปัจจุบัน,119990,119900,False,False,"124400-สินทรัพย์ภาษีเงินได้ของงวดปัจจุบัน-สินทรัพย์ภาษีเงินได้รอตัดบัญชี-The query 'สินทรัพย์ภาษีเงินได้ของงวดปัจจุบัน' closely resembles the meaning of 'สินทรัพย์ภาษีเงินได้รอตัดบัญชี' in the taxonomy list. Considering the input metadata specifies 'fs_category' as 'สินทรัพย์', the closest match within the provided context is 'สินทรัพย์ภาษีเงินได้รอตัดบัญชี' with SET Code '124400'. | 124400-สินทรัพย์ภาษีเงินได้ของงวดปัจจุบัน-สินทรัพย์ภาษีเงินได้รอตัดบัญชี-The most relevant meaning in the taxonomy list to the query is ""สินทรัพย์ภาษีเงินได้รอตัดบัญชี"" with the set code ""124400"". Although the query mentions ""งวดปัจจุบัน"" (current period), the taxonomy focuses on ""รอตัดบัญชี"" (deferred), which aligns with the concept of deferred tax assets. | "
สินทรัพย์ทางการเงินหมุนเวียนอื่น,113100,สินทรัพย์ทางการเงินหมุนเวียนอื่น,สินทรัพย์ทางการเงินหมุนเวียนอื่น,113190,113100,False,True,
สินทรัพย์ทางการเงินไม่หมุนเวียนอื่น,123100,สินทรัพย์ทางการเงินไม่หมุนเวียนอื่น,สินทรัพย์ทางการเงินไม่หมุนเวียนอื่น,123190,123100,False,True,
เงินลงทุนในบริษัทย่อย-สุทธิ,,,เงินลงทุนในบริษัทย่อย-สุทธิ,122710,122700,False,False,"122610-เงินลงทุนในบริษัทย่อย-สุทธิ-เงินลงทุนในบริษัทย่อย บริษัทร่วม และการร่วมค้า ที่บันทึกโดยวิธีส่วนได้เสีย - สุทธิ เงินลงทุนในบริษัทย่อย-The query mentions ""เงินลงทุนในบริษัทย่อย"" which directly matches the item ""เงินลงทุนในบริษัทย่อย บริษัทร่วม และการร่วมค้า ที่บันทึกโดยวิธีส่วนได้เสีย - สุทธิ เงินลงทุนในบริษัทย่อย"" in the taxonomy list. The  ""- สุทธิ""  part in the query also suggests looking for an item that reflects a net value, aligning with the taxonomy item's inclusion of ""สุทธิ"". | "
ลูกหนี้จากการรับซื้อสิทธิเรียกร้องไม่หมุนเวียน-สุทธิ,,,ลูกหนี้จากการรับซื้อสิทธิเรียกร้องไม่หมุนเวียน-สุทธิ,122040,122000,False,False,"122050-ลูกหนี้จากการรับซื้อสิทธิเรียกร้องไม่หมุนเวียน-สุทธิ-ลูกหนี้เงินให้สินเชื่อ-The input name mentions factoring, which is similar to lending. And the input also mentions non-current, so the closest meaning in the taxonomy is  'ลูกหนี้เงินให้สินเชื่อ' with set code 122050 | 122050-ลูกหนี้จากการรับซื้อสิทธิเรียกร้องไม่หมุนเวียน-สุทธิ-ลูกหนี้เงินให้สินเชื่อ-The query mentions 'ลูกหนี้จากการรับซื้อสิทธิเรียกร้อง' and 'ไม่หมุนเวียน' which closely matches the meaning of 'ลูกหนี้เงินให้สินเชื่อ' in the taxonomy list. This taxonomy item also falls under the 'สินทรัพย์ไม่หมุนเวียน' category, aligning with the input metadata. | "
รวมหนี้สิน,309999,รวมหนี้สิน,รวมหนี้สิน,209999,309999,False,True,
หุ้นสามัญ{{number}}หุ้นมูลค่าหุ้นละ{{number}}บาท,,,หุ้นสามัญหุ้นมูลค่าหุ้นละบาท,310120,310100,False,False,
หุ้นสามัญ{{number}}หุ้นมูลค่าหุ้นละ{{number}}บาท,,,หุ้นสามัญหุ้นมูลค่าหุ้นละบาท,310220,310200,False,False,
ส่วนเกินมูลค่าหุ้นสามัญ,310400,ส่วนเกินมูลค่าหุ้นสามัญ,ส่วนเกินมูลค่าหุ้นสามัญ,310420,310400,False,True,
องค์ประกอบอื่นของส่วนของผู้ถือหุ้น,319900,องค์ประกอบอื่นของส่วนของผู้ถือหุ้น,องค์ประกอบอื่นของส่วนของผู้ถือหุ้น,319990,319900,False,True,
ขาดทุนสำหรับงวด,,,ขาดทุนสำหรับงวด,409991,409999,False,False,"409996-ขาดทุนสำหรับงวด-กำไร (ขาดทุน) สุทธิ สำหรับงวด-The input query 'ขาดทุนสำหรับงวด' maps to the fs_category 'กำไรขาดทุน' in the taxonomy list. Therefore, the selected SET Code is '409996' and the Item in Taxonomy is 'กำไร (ขาดทุน) สุทธิ สำหรับงวด'. | 409996-ขาดทุนสำหรับงวด-กำไร (ขาดทุน) สุทธิ สำหรับงวด-The closest match from the provided taxonomy list is  กำไร (ขาดทุน) สุทธิ สำหรับงวด based on the input query and financial statement type. | "
ค่าใช้จ่ายอื่น,,,เงินให้กู้ยืมแก่บริษัทอื่น,429800,429999,False,False,
ขาดทุนสำหรับงวด,,,ขาดทุนสำหรับงวด,510100,519997,False,False,"409996-ขาดทุนสำหรับงวด-กำไร (ขาดทุน) สุทธิ สำหรับงวด-The input query 'ขาดทุนสำหรับงวด' maps to the fs_category 'กำไรขาดทุน' in the taxonomy list. Therefore, the selected SET Code is '409996' and the Item in Taxonomy is 'กำไร (ขาดทุน) สุทธิ สำหรับงวด'. | 409996-ขาดทุนสำหรับงวด-กำไร (ขาดทุน) สุทธิ สำหรับงวด-The closest match from the provided taxonomy list is  กำไร (ขาดทุน) สุทธิ สำหรับงวด based on the input query and financial statement type. | "
กำไรจากการจำหน่ายสินทรัพย์ทางการเงินหมุนเวียนอื่น,,,กำไรจากการจำหน่ายสินทรัพย์ทางการเงินหมุนเวียนอื่น,511000,519997,False,False,"515000-กำไรจากการจำหน่ายสินทรัพย์ทางการเงินหมุนเวียนอื่น-รายการปรับปรุงอื่น ๆ-The input line item name matches the meaning_of_taxonomy in the third item of the Taxonomy list. Because the fs_category does not match the input metadata, we use item_in_taxonomy instead. | "
(กำไร)ขาดทุนที่ยังไม่เกิดขึ้นจากการเปลี่ยนแปลงมูลค่าสินทรัพย์ทางการเงินหมุนเวียนอื่น,,,(กำไร)ขาดทุนที่ยังไม่เกิดขึ้นจากการเปลี่ยนแปลงมูลค่าสินทรัพย์ทางการเงินหมุนเวียนอื่น,511100,519997,False,False,"516100-(กำไร)ขาดทุนที่ยังไม่เกิดขึ้นจากการเปลี่ยนแปลงมูลค่าสินทรัพย์ทางการเงินหมุนเวียนอื่น-เงินลงทุนตามวิธีมูลค่ายุติธรรมผ่านกำไรหรือขาดทุนที่ไม่ได้วางเป็นหลักประกัน (เพิ่มขึ้น) ลดลง-The input mentions unrealized gains and losses from changes in the value of other current financial assets, and the context closest match is  'เงินลงทุนตามวิธีมูลค่ายุติธรรมผ่านกำไรหรือขาดทุนที่ไม่ได้วางเป็นหลักประกัน (เพิ่มขึ้น) ลดลง' because the meaning includes ' บางครั้งใช้ชื่อว่า สินทรัพย์ทางการเงินหมุนเวียนอื่น ' | 515000-(กำไร)ขาดทุนที่ยังไม่เกิดขึ้นจากการเปลี่ยนแปลงมูลค่าสินทรัพย์ทางการเงินหมุนเวียนอื่น-รายการปรับปรุงอื่น ๆ-The most relevant item from the provided taxonomy list is 'รายการปรับปรุงอื่น ๆ' (Other Reconciliation Items) with SET code '515000'. Although no perfect match exists, this item's description includes similar phrases like 'กำไรจากการจำหน่ายสินทรัพย์ทางการเงินหมุนเวียนอื่น' (Gain on Disposal of Other Current Financial Assets), which aligns with the input query's reference to unrealized gains/losses from changes in the value of other current financial assets. | "
กำไรจากการวัดมูลค่ายุติธรรมของอสังหาริมทรัพย์เพื่อการลงทุน,,,กำไรจากการวัดมูลค่ายุติธรรมของอสังหาริมทรัพย์เพื่อการลงทุน,511300,519997,False,False,"439750-กำไรจากการวัดมูลค่ายุติธรรมของอสังหาริมทรัพย์เพื่อการลงทุน-กำไร (ขาดทุน) อื่น กำไร (ขาดทุน) จากการเปลี่ยนแปลงมูลค่ายุติธรรมของสินทรัพย์ที่ไม่ใช่สินทรัพย์ทางการเงิน-The query mentions 'กำไรจากการวัดมูลค่ายุติธรรมของอสังหาริมทรัพย์เพื่อการลงทุน' which matches the definition of 'กำไร (ขาดทุน) อื่น กำไร (ขาดทุน) จากการเปลี่ยนแปลงมูลค่ายุติธรรมของสินทรัพย์ที่ไม่ใช่สินทรัพย์ทางการเงิน' in the taxonomy list. Although no item's fs_category in the taxonomy list is related to the input metadata fs_category, this item is the most relevant to the query. | 439750-กำไรจากการวัดมูลค่ายุติธรรมของอสังหาริมทรัพย์เพื่อการลงทุน-กำไร (ขาดทุน) จากการเปลี่ยนแปลงมูลค่ายุติธรรมของสินทรัพย์ที่ไม่ใช่สินทรัพย์ทางการเงิน-The closest match is found by analyzing the meaning_of_taxonomy field. 
The terms  'กำไรจากการวัดมูลค่ายุติธรรมของอสังหาริมทรัพย์เพื่อการลงทุน' in the query and meaning_of_taxonomy suggest a match. 
Although the input financial_statement_type is งบกำไรขาดทุนเบ็ดเสร็จ สำหรับงวดหกเดือนสิ้นสุดวันที่ 30 มิถุนายน 2567, the closest matched item's financial_statement_type is PL. | 515000-กำไรจากการวัดมูลค่ายุติธรรมของอสังหาริมทรัพย์เพื่อการลงทุน-รายการปรับปรุงอื่น ๆ-The INPUT METADATA specifies the fs_category as กระแสเงินสดจากกิจกรรมดำเนินงาน. However, there is no perfect match in the provided Taxonomy list.  The closest match is 'กำไรจากการรับโอนอสังหาริมทรัพย์เพื่อการลงทุนในการรับชำระหนี้' which is part of 'รายการปรับปรุงอื่น ๆ' with SET Code '515000' in the Taxonomy list. Therefore, we choose this as the most appropriate match. | "
กำไรจากการปลดภาระหนี้,,,กำไรจากการปลดภาระหนี้,515000,519997,False,False,"512400-กำไรจากการปลดภาระหนี้-กำไร (ขาดทุน) จากการเปลี่ยนเงื่อนไขตราสารหนี้-The most relevant item in the taxonomy list to describe กำไรจากการปลดภาระหนี้  is กำไร (ขาดทุน) จากการเปลี่ยนเงื่อนไขตราสารหนี้ which is in the category กิจกรรมดำเนินงาน matched the fs_category from INPUT METADATA. Therefore, the selected SET Code is 512400. | "
ประมาณการหนี้สินไม่หมุนเวียนสำหรับผลประโยชน์พนักงาน,,,ประมาณการหนี้สินไม่หมุนเวียนสำหรับผลประโยชน์พนักงาน,514910,519997,False,False,"222700-ประมาณการหนี้สินไม่หมุนเวียนสำหรับผลประโยชน์พนักงาน-ประมาณการหนี้สินผลประโยชน์พนักงาน - ไม่หมุนเวียน-The query mentions 'ประมาณการหนี้สิน' related to employee benefits and 'ไม่หมุนเวียน', indicating non-current liabilities. This aligns with the item 'ประมาณการหนี้สินผลประโยชน์พนักงาน - ไม่หมุนเวียน' (Provisions for Employee Benefit Obligations - Non-Current) in the taxonomy. | 222700-ประมาณการหนี้สินไม่หมุนเวียนสำหรับผลประโยชน์พนักงาน-ประมาณการหนี้สินผลประโยชน์พนักงาน - ไม่หมุนเวียน-The query mentions ""ประมาณการหนี้สิน"" and ""ผลประโยชน์พนักงาน"" which strongly suggests this is related to employee benefits. Additionally, it specifies ""ไม่หมุนเวียน"" meaning  non-current. Therefore, the closest match in the taxonomy is ""ประมาณการหนี้สินผลประโยชน์พนักงาน - ไม่หมุนเวียน"". | 518700-ประมาณการหนี้สินไม่หมุนเวียนสำหรับผลประโยชน์พนักงาน-ประมาณการหนี้สินผลประโยชน์พนักงาน เพิ่มขึ้น (ลดลง)-The most relevant item from the provided taxonomy list is ""ประมาณการหนี้สินผลประโยชน์พนักงาน เพิ่มขึ้น (ลดลง)"" as it directly relates to employee benefit obligations and their changes, aligning with the input query. The financial statement type is CF and fs_category is กิจกรรมดำเนินงาน, as specified in the input metadata. | "
ดอกเบี้ยจ่ายหุ้นกู้,,,ดอกเบี้ยจ่ายหุ้นกู้,514800,519997,False,False,"519600-ดอกเบี้ยจ่ายหุ้นกู้-จ่ายดอกเบี้ย-The input maps to the item ""จ่ายดอกเบี้ย"" in the taxonomy list because the input name suggests the cash outflow for interest expenses. The fs_category from the metadata matches the fs_category in the taxonomy list. Therefore, the SET Code is 519600. | "
ต้นทุนทางการเงิน,,,ดอกเบี้ยจ่ายเงินกู้ยืมบุคคลอื่น,514800,519997,False,False,"539600-ดอกเบี้ยจ่ายเงินกู้ยืมบุคคลอื่น-จ่ายดอกเบี้ย-The most relevant item from the provided taxonomy list is ""จ่ายดอกเบี้ย"" (Interest Paid) with SET Code 539600. Although the input mentions 'other parties,' the taxonomy item broadly covers interest paid, aligning with the input's meaning. Since no item specifically addresses interest paid on loans from other parties within the context of operating activities, this is the closest match. | "
ต้นทุนทางการเงิน,,,ดอกเบี้ยจ่ายเงินกู้ยืมบริษัทที่เกี่ยวข้องกัน,514800,519997,False,False,"539600-ดอกเบี้ยจ่ายเงินกู้ยืมบริษัทที่เกี่ยวข้องกัน-จ่ายดอกเบี้ย-The most relevant item from the provided taxonomy list is 'จ่ายดอกเบี้ย' (Interest Paid) with SET Code '539600'. Although the input mentions 'บริษัทที่เกี่ยวข้องกัน' (related parties), there's no direct match for interest expenses related to related parties within the 'กระแสเงินสดจากกิจกรรมดำเนินงาน' (Cash flows from operating activities) category in the taxonomy. Therefore, we choose the broader 'จ่ายดอกเบี้ย' to accommodate this input. | "
ดอกเบี้ยจ่ายตามสัญญาเช่า,,,ดอกเบี้ยจ่ายตามสัญญาเช่า,514800,519997,False,False,"519600-ดอกเบี้ยจ่ายตามสัญญาเช่า-จ่ายดอกเบี้ย-The input 'ดอกเบี้ยจ่ายตามสัญญาเช่า' is related to finance costs, and the provided financial statement type is 'งบกระแสเงินสด สำหรับงวดหกเดือนสิ้นสุดวันที่ 30 มิถุนายน 2567' which means Cash Flow Statement. Thus, the closest matching item in the taxonomy list is 'จ่ายดอกเบี้ย' with SET Code '519600' under  'กิจกรรมดำเนินงาน' in Cash Flow Statement. | "
