account_name,taxonomy_account_name,account_code,parent_account_code,values
ส่วนที่เป็นของผู้มีส่วนได้เสียที่ไม่มีอำนาจควบคุมของบริษัทย่อย,ส่วนที่เป็นของผู้มีส่วนได้เสียที่ไม่มีอำนาจควบคุมของบริษัทย่อย,460200,,"['(229,541)', '']"
ส่วนที่เป็นของผู้ถือหุ้นของบริษัทฯ,ส่วนที่เป็นของผู้ถือหุ้นของบริษัทฯ,470100,,"['(924,690)', '(1,690,802)']"
ส่วนที่เป็นของผู้มีส่วนได้เสียที่ไม่มีอำนาจควบคุมของบริษัทย่อย,ส่วนที่เป็นของผู้มีส่วนได้เสียที่ไม่มีอำนาจควบคุมของบริษัทย่อย,470200,,"['(336,174)', '']"
ขาดทุนส่วนที่เป็นของผู้ถือหุ้นบริษัทฯ,กำไร (ขาดทุน) ต่อหุ้นขั้นพื้นฐาน (บาท/หุ้น),480100,,"['(0.03)', '(0.10)']"
ขาดทุนก่อนภาษี,กำไร (ขาดทุน) สุทธิสำหรับงวด / ของบริษัทใหญ่,510100,519997,"['(140,986)', '(1,312,156)']"
ค่าเสื่อมราคาและค่าตัดจำหน่าย,ค่าเสื่อมราคาและค่าตัดจำหน่าย,510300,519997,"['380,351', '49,735']"
ขาดทุนจากอัตราแลกเปลี่ยนที่ยังไม่เกิดขึ้นจริง,(กำไร) ขาดทุนจากอัตราแลกเปลี่ยน,510800,519997,"['23,753', '22,808']"
ขาดทุนจากการประมาณการหนี้สิน,ขาดทุนจากการประมาณการหนี้สิน,514920,519997,"['106,942', '-']"
การปรับลดสินค้าคงเหลือเป็นมูลค่าสุทธิที่จะได้รับ,การปรับลดสินค้าคงเหลือเป็นมูลค่าสุทธิที่จะได้รับ,510500,519997,"['3,468', '-']"
ส่วนแบ่งกำไรจากเงินลงทุนในการร่วมค้า,ส่วนแบ่งกำไรจากเงินลงทุนในการร่วมค้า,510600,519997,"['(57,379)', '-']"
ส่วนแบ่งขาดทุน(กำไร)จากเงินลงทุนในบริษัทร่วม,ส่วนแบ่งขาดทุน(กำไร)จากเงินลงทุนในบริษัทร่วม,510600,519997,"['(142,113)', '-']"
ค่าเผื่อการด้อยค่าของสินทรัพย์(โอนกลับ),ค่าเผื่อการด้อยค่าของสินทรัพย์(โอนกลับ),511700,519997,"['47,783', '(110)']"
สำรองผลประโยชน์ระยะยาวของพนักงาน,สำรองผลประโยชน์ระยะยาวของพนักงาน,514910,519997,"['46,396', '4,727']"
ขาดทุนจากการจำหน่ายสินทรัพย์/ตัดจำหน่ายสินทรัพย์,ขาดทุนจากการจำหน่ายสินทรัพย์/ตัดจำหน่ายสินทรัพย์,511520,511500,"['618', '-']"
รายได้เงินปันผล,รายได้เงินปันผล,514710,514700,"['(46,644)', '(77,289)']"
รายจ่ายโดยใช้หุ้นเป็นเกณฑ์,รายจ่ายโดยใช้หุ้นเป็นเกณฑ์,510700,519997,"['1,224', '394']"
ขาดทุน(กำไร)จากการขายและเปลี่ยนสถานะเงินลงทุนในบริษัทย่อยและบริษัทร่วม,ขาดทุน(กำไร)จากการขายและเปลี่ยนสถานะเงินลงทุนในบริษัทย่อยและบริษัทร่วม,510900,519997,"['-', '(1,306)']"
กำไรจากการให้บริการรับเหมารอตัดบัญชี,รายการปรับปรุงอื่น ๆ,515000,519997,"['18,682', '']"
ขาดทุนจากตราสารทางการเงิน,ขาดทุนจากตราสารทางการเงิน,511400,519997,"['304,186', '249,149']"
รับรู้รายได้รับล่วงหน้า,รับรู้รายได้รับล่วงหน้า,515000,519997,"['(9,196)', '-']"
ดอกเบี้ยรับ,ดอกเบี้ยรับ,514720,514700,"['(1,403,571)', '(119,695)']"
ค่าใช้จ่ายดอกเบี้ย,ค่าใช้จ่ายดอกเบี้ย,514800,519997,"['1,697,043', '927,393']"
กำไร(ขาดทุน)จากการดำเนินงานก่อนการเปลี่ยนแปลงในสินทรัพย์และหนี้สินดำเนินงาน,กำไร(ขาดทุน)จากการดำเนินงานก่อนการเปลี่ยนแปลงในสินทรัพย์และหนี้สินดำเนินงาน,519997,519998,"['830,557', '(256,350)']"
เงินฝากธนาคารสำหรับเงินรับล่วงหน้าจากผู้ถือบัตร,เงินฝากธนาคารสำหรับเงินรับล่วงหน้าจากผู้ถือบัตร,516600,519998,"['(18,460)', '-']"
เงินฝากธนาคารที่มีข้อจำกัดในการใช้,เงินฝากธนาคารที่มีข้อจำกัดในการใช้,516600,519998,"['19,622', '-']"
ลูกหนี้การค้าและลูกหนี้อื่น,ลูกหนี้การค้าและลูกหนี้อื่น,515800,519998,"['87,669', '(10,999)']"
ลูกหนี้จากการขายที่ดิน,ลูกหนี้การค้าและลูกหนี้อื่น (เพิ่มขึ้น) ลดลง,515800,519998,"['508,086', '508,086']"
เงินให้สินเชื่อแก่ลูกหนี้และดอกเบี้ยค้างรับ,เงินให้สินเชื่อแก่ลูกหนี้และดอกเบี้ยค้างรับ,516600,519998,"['(104,862)', '-']"
ภายใต้สัญญากับหน่วยงานของรัฐ,ภายใต้สัญญากับหน่วยงานของรัฐ,515810,519998,"['(1,444,708)', '-']"
ลูกหนี้ภายใต้สัญญาซื้อขายพร้อมติดตั้งระบบการเดินรถ,ลูกหนี้ภายใต้สัญญาซื้อขายพร้อมติดตั้งระบบการเดินรถ,515800,519998,"['23,312,577', '-']"
รายได้ค้างรับ,รายได้ค้างรับ,516600,519998,"['19,433', '(8,773)']"
เงินจ่ายล่วงหน้าแก่ผู้รับเหมาและเพื่อซื้อสินทรัพย์,สินทรัพย์ดำเนินงานอื่น (เพิ่มขึ้น) ลดลง,516600,519998,"['(38,809)', '-']"
สินทรัพย์หมุนเวียนอื่น,สินทรัพย์หมุนเวียนอื่น,516600,519998,"['(182,443)', '(15,282)']"
สินทรัพย์ไม่หมุนเวียนอื่น,สินทรัพย์ไม่หมุนเวียนอื่น,516600,519998,"['(39,465)', '(3,283)']"
เจ้าหนี้การค้าและเจ้าหนี้อื่น,เจ้าหนี้การค้าและเจ้าหนี้อื่น,517600,519998,"['(147,064)', '(15,730)']"
เงินรับล่วงหน้าจากผู้ถือบัตร,เงินรับล่วงหน้าจากผู้ถือบัตร,518300,519998,"['12,042', '-']"
เงินรับล่วงหน้าและรายได้รับล่วงหน้า,เงินรับล่วงหน้าและรายได้รับล่วงหน้า,518300,519998,"['(61,109)', '-']"
เจ้าหนี้เงินประกันผลงาน,เจ้าหนี้เงินประกันผลงาน,518300,519998,"['14,679', '-']"
รายได้ค่าโดยสารรอนำส่ง,รายได้ค่าโดยสารรอนำส่ง,518300,519998,"['1,992', '-']"
สำรองผลประโยชน์ระยะยาวของพนักงาน,สำรองผลประโยชน์ระยะยาวของพนักงาน,518700,519998,"['(2,637)', '-']"
ประมาณการหนี้สิน,ประมาณการหนี้สิน,518000,519998,"['(1,600)', '-']"
หนี้สินหมุนเวียนอื่น,หนี้สินหมุนเวียนอื่น,518300,519998,"['(49,225)', '26,013']"
เงินสดจาก(ใช้ไปใน)กิจกรรมดำเนินงาน,เงินสดรับ (จ่าย) จากการดำเนินงาน,519998,519999,"['22,716,275', '223,682']"
จ่ายภาษีเงินได้,จ่ายภาษีเงินได้,519900,519999,"['(282,412)', '(1,410)']"
เงินสดสุทธิจาก(ใช้ไปใน)กิจกรรมดำเนินงาน,เงินสดสุทธิได้มาจาก (ใช้ไปใน) กิจกรรมดำเนินงาน,519999,509999,"['22,433,863', '222,272']"
เงินฝากที่มีภาระผูกพันลดลง(เพิ่มขึ้น),เงินฝากที่มีภาระผูกพันลดลง(เพิ่มขึ้น),522400,529999,"['715', '-']"
เงินให้กู้ยืมระยะสั้นแก่กิจการที่เกี่ยวข้องกันเพิ่มขึ้น,เงินให้กู้ยืมระยะสั้นแก่กิจการที่เกี่ยวข้องกันเพิ่มขึ้น,521320,521300,"['(1,500)', '-']"
รับชำระเงินให้กู้ยืมระยะสั้นแก่กิจการที่เกี่ยวข้องกัน,รับชำระเงินให้กู้ยืมระยะสั้นแก่กิจการที่เกี่ยวข้องกัน,521511,521510,"['3,000', '-']"
เงินให้กู้ยืมระยะยาวแก่กิจการที่เกี่ยวข้องกันเพิ่มขึ้น,เงินให้กู้ยืมระยะยาวแก่กิจการที่เกี่ยวข้องกันเพิ่มขึ้น,521421,521420,"['-', '(1,021,869)']"
รับชำระเงินให้กู้ยืมระยะยาวแก่กิจการที่เกี่ยวข้องกัน,รับชำระเงินให้กู้ยืมระยะยาวแก่กิจการที่เกี่ยวข้องกัน,521521,521520,"['-', '13,548,437']"
ดอกเบี้ยรับ,ดอกเบี้ยรับ,529500,529999,"['159,918', '80,162']"
เงินปันผลรับ,เงินปันผลรับ,529700,529999,"['101,164', '86,573']"
เงินสดจ่ายซื้อเงินลงทุนในสินทรัพย์ทางการเงิน,เงินสดจ่ายซื้อเงินลงทุนในสินทรัพย์ทางการเงิน,520300,529999,"['(6,184,095)', '(1,321,735)']"
เงินสดรับจากการขายเงินลงทุนในสินทรัพย์ทางการเงิน,เงินสดรับจากการขายเงินลงทุนในสินทรัพย์ทางการเงิน,520210,520200,"['7,228,750', '1,435,061']"
เงินสดรับจากเงินคืนทุนของบริษัทร่วม,เงินสดรับจากเงินคืนทุนของบริษัทร่วม,529900,529999,"['347,220', '347,220']"
เงินสดจ่ายเพื่อซื้อเงินลงทุนในบริษัทย่อย,เงินสดจ่ายเพื่อซื้อเงินลงทุนในบริษัทย่อย,521200,529999,"['-', '(264,894)']"
เงินสดจ่ายซื้อเงินลงทุนในการร่วมค้า,เงินสดจ่ายซื้อเงินลงทุนในการร่วมค้า,521200,529999,"['(10,275)', '(10,000)']"
เงินจ่ายล่วงหน้าแก่ผู้รับเหมาและเพื่อซื้อสินทรัพย์,รายการอื่น ๆ (กิจกรรมลงทุน),529900,529999,"['-', '(12,148)']"
เงินสดจ่ายซื้อที่ดินอาคารและอุปกรณ์,เงินสดจ่ายซื้อที่ดินอาคารและอุปกรณ์,521710,521700,"['(87,797)', '(15,326)']"
เงินสดรับจากการจำหน่ายที่ดินอาคารและอุปกรณ์,เงินสดรับจากการจำหน่ายที่ดินอาคารและอุปกรณ์,521610,521600,"['508', '-']"
ต้นทุนโครงการรถไฟฟ้าเพิ่มขึ้น,ต้นทุนโครงการรถไฟฟ้าเพิ่มขึ้น,522300,529999,"['(318,729)', '-']"
เงินสดจ่ายซื้ออสังหาริมทรัพย์เพื่อการลงทุน,เงินสดจ่ายซื้ออสังหาริมทรัพย์เพื่อการลงทุน,521730,521700,"['(681,097)', '-']"
เงินสดจ่ายซื้อสินทรัพย์ไม่มีตัวตน,เงินสดจ่ายซื้อสินทรัพย์ไม่มีตัวตน,521720,521700,"['(97,660)', '-']"
เงินสดรับจากการขายสินทรัพย์ไม่มีตัวตน,สินทรัพย์ไม่มีตัวตน,521620,521600,"['1,176', '-']"
เงินสดสุทธิจาก(ใช้ไปใน)กิจกรรมลงทุน,เงินสดสุทธิจาก(ใช้ไปใน)กิจกรรมลงทุน,529999,509999,"['461,298', '12,851,481']"
เงินกู้ยืมระยะสั้นจากสถาบันการเงินเพิ่มขึ้น,เงินกู้ยืมระยะสั้นจากสถาบันการเงินเพิ่มขึ้น,530100,539999,"['5,000,000', '5,000,000']"
เงินสดจ่ายชำระเงินกู้ยืมระยะสั้นจากสถาบันการเงิน,เงินสดจ่ายชำระเงินกู้ยืมระยะสั้นจากสถาบันการเงิน,530413,530410,"['(8,500,000)', '(6,500,000)']"
เจ้าหนี้ตั๋วแลกเงินเพิ่มขึ้น,เจ้าหนี้ตั๋วแลกเงินเพิ่มขึ้น,530700,539999,"['4,027,781', '4,027,781']"
เงินสดจ่ายชำระเจ้าหนี้ตั๋วแลกเงิน,เงินสดจ่ายชำระเจ้าหนี้ตั๋วแลกเงิน,530800,539999,"['(8,600,000)', '(8,600,000)']"
เงินกู้ยืมระยะยาวจากสถาบันการเงินเพิ่มขึ้น,เงินกู้ยืมระยะยาวจากสถาบันการเงินเพิ่มขึ้น,530333,530320,"['699,598', '-']"
เงินกู้ยืมระยะยาวจากบริษัทอื่นเงินเพิ่มขึ้น,เงินกู้ยืมระยะยาวจากบริษัทอื่นเงินเพิ่มขึ้น,530322,530320,"['340,623', '-']"
เงินสดจ่ายชำระเงินกู้ยืมระยะสั้นจากกิจการที่เกี่ยวข้องกัน,เงินสดจ่ายชำระเงินกู้ยืมระยะสั้นจากกิจการที่เกี่ยวข้องกัน,530411,530410,"['(761,000)', '(769,087)']"
เงินสดรับจากเงินกู้ยืมระยะสั้นจากกิจการที่เกี่ยวข้องกัน,เงินสดรับจากเงินกู้ยืมระยะสั้น - บุคคลหรือกิจการที่เกี่ยวข้องกัน,530311,530310,"['70,000', '2,100,000']"
เงินสดจ่ายจากการไถ่ถอนหุ้นกู้,เงินสดจ่ายจากการไถ่ถอนหุ้นกู้,530800,539999,"['(3,155,600)', '(3,000,000)']"
เงินสดจ่ายค่าใช้จ่ายในการกู้เงิน,เงินสดจ่ายค่าใช้จ่ายในการกู้เงิน,539900,539999,"['(1,921)', '-']"
เงินสดจ่ายคืนหนี้สินตามสัญญาเช่า,เงินสดจ่ายคืนหนี้สินตามสัญญาเช่า,530500,539999,"['(78,197)', '(23,517)']"
จ่ายดอกเบี้ย,จ่ายดอกเบี้ย,539600,539999,"['(2,131,916)', '(1,289,785)']"
จ่ายเงินปันผล,จ่ายเงินปันผล,539800,539999,"['1,503', '1,503']"
เงินสดจ่ายซื้อเงินลงทุนในบริษัทย่อย,เงินสดจ่ายซื้อเงินลงทุนในบริษัทย่อย,531800,539999,"['(27,900)', '-']"
เงินสดรับจากการขายใบสำคัญแสดงสิทธิซื้อหุ้นสามัญของบริษัทย่อย,เงินสดรับจากการขายใบสำคัญแสดงสิทธิซื้อหุ้นสามัญของบริษัทย่อย,530900,539999,"['1,306', '1,306']"
เงินสดสุทธิจาก(ใช้ไปใน)กิจกรรมจัดหาเงิน,เงินสดสุทธิจาก(ใช้ไปใน)กิจกรรมจัดหาเงิน,539999,509999,"['(13,115,723)', '(9,051,799)']"
เงินสดและรายการเทียบเท่าเงินสดเพิ่มขึ้น(ลดลง)สุทธิ,เงินสดและรายการเทียบเท่าเงินสดเพิ่มขึ้น(ลดลง)สุทธิ,509999,599999,"['9,779,438', '4,021,954']"
ผลกระทบจากอัตราแลกเปลี่ยนสำหรับรายการเงินสดและรายการเทียบเท่าเงินสด,ผลกระทบจากอัตราแลกเปลี่ยนสำหรับรายการเงินสดและรายการเทียบเท่าเงินสด,540100,599999,"['(24,065)', '(24,065)']"
เงินสดและรายการเทียบเท่าเงินสดต้นงวด,เงินสดและรายการเทียบเท่าเงินสดต้นงวด,599998,599999,"['6,221,622', '965,848']"
เงินสดและรายการเทียบเท่าเงินสดปลายงวด,เงินสดและรายการเทียบเท่าเงินสดปลายงวด,599999,,"['15,976,995', '4,963,737']"
