account_name,taxonomy_account_name,account_code,values
เงินให้สินเชื่อจากการซื้อลูกหนี้,ลูกหนี้การค้า และลูกหนี้เงินให้สินเชื่อ (เพิ่มขึ้น) ลดลง,515800,"['(11,720)', '-']"
สินทรัพย์หมุนเวียนอื่น,สินทรัพย์หมุนเวียนอื่น,516600,"['(24,133)', '(1,052)']"
สินทรัพย์ไม่หมุนเวียนอื่น,สินทรัพย์ไม่หมุนเวียนอื่น,516600,"['2,789', '3,059']"
เจ้าหนี้การค้าและเจ้าหนี้หมุนเวียนอื่น,เจ้าหนี้การค้าและเจ้าหนี้หมุนเวียนอื่น,517600,"['(44,955)', '(24,901)']"
หนี้สินหมุนเวียนอื่น,หนี้สินหมุนเวียนอื่น,518300,"['(24,831)', '(40,572)']"
หนี้สินไม่หมุนเวียนอื่น,หนี้สินไม่หมุนเวียนอื่น,518300,"['(1,792)', '(1,799)']"
ดอกเบี้ยรับ,ดอกเบี้ยรับ,519500,"['6,804,208', '6,128,186']"
เงินปันผลรับ,เงินปันผลรับ,519700,"['-', '158,600']"
จ่ายต้นทุนทางการเงิน,จ่ายต้นทุนทางการเงิน,519600,"['(897,177)', '(941,805)']"
ภาษีเงินได้จ่ายออก,ภาษีเงินได้จ่ายออก,519900,"['(405,156)', '(364,437)']"
จ่ายผลประโยชน์พนักงาน,จ่ายผลประโยชน์พนักงาน,518700,"['(22,960)', '(13,915)']"
เงินสดรับจากเงินฝากประจำธนาคารที่มีภาระผูกพัน,เงินสดรับจากเงินฝากประจำธนาคารที่มีภาระผูกพัน,529900,"['3,000', '-']"
เงินสดจ่ายเพื่อซื้อส่วนปรับปรุงอาคารเช่าและอุปกรณ์,เงินสดจ่ายเพื่อซื้อส่วนปรับปรุงอาคารเช่าและอุปกรณ์,521710,"['(92,319)', '(84,301)']"
เงินสดรับจากการขายส่วนปรับปรุงอาคารเช่าและอุปกรณ์,เงินสดรับจากการขายส่วนปรับปรุงอาคารเช่าและอุปกรณ์,521610,"['978', '654']"
เงินสดจ่ายเพื่อซื้อสินทรัพย์ไม่มีตัวตนอื่นนอกจากค่าความนิยม,เงินสดจ่ายเพื่อซื้อสินทรัพย์ไม่มีตัวตนอื่นนอกจากค่าความนิยม,521720,"['(240,851)', '(220,037)']"
มูลค่ายุติธรรมผ่านกำไรขาดทุนเบ็ดเสร็จอื่น,มูลค่ายุติธรรมผ่านกำไรขาดทุนเบ็ดเสร็จอื่น,520300,"['-', '(24,500)']"
เงินสดรับจากเงินเบิกเกินบัญชีและเงินกู้ยืมระยะสั้นจากสถาบันการเงิน,เงินสดรับจากเงินเบิกเกินบัญชีและเงินกู้ยืมระยะสั้นจากสถาบันการเงิน,530313,"['45,940,020', '44,612,203']"
เงินสดจ่ายชำระคืนเงินเบิกเกินบัญชีและเงินกู้ยืมระยะสั้นจากสถาบันการเงิน,เงินสดจ่ายชำระคืนเงินเบิกเกินบัญชีและเงินกู้ยืมระยะสั้นจากสถาบันการเงิน,530413,"['(49,790,879)', '(48,263,443)']"
เงินสดรับจากเงินกู้ยืมระยะยาว,เงินสดรับจากเงินกู้ยืมระยะยาว,530320,"['10,948,421', '9,329,662']"
เงินสดจ่ายชำระคืนเงินกู้ยืมระยะยาว,เงินสดจ่ายชำระคืนเงินกู้ยืมระยะยาว,530420,"['(5,558,505)', '(3,771,125)']"
เงินสดรับจากเงินกู้ยืมระยะยาวภายใต้โครงการแปลงสินทรัพย์เป็นหลักทรัพย์,เงินสดรับจากเงินกู้ยืมระยะยาวภายใต้โครงการแปลงสินทรัพย์เป็นหลักทรัพย์,530700,"['-', '286,485']"
เงินสดจ่ายชำระคืนเงินกู้ยืมระยะยาวภายใต้โครงการแปลงสินทรัพย์เป็นหลักทรัพย์,เงินสดจ่ายชำระคืนเงินกู้ยืมระยะยาวภายใต้โครงการแปลงสินทรัพย์เป็นหลักทรัพย์,530800,"['-', '(286,485)']"
เงินสดจ่ายชำระหนี้สินตามสัญญาเช่า,เงินสดจ่ายชำระหนี้สินตามสัญญาเช่า,530500,"['(273,747)', '(239,720)']"
เงินสดรับจากการขายลูกหนี้ที่ตัดจำหน่ายแล้ว,เงินสดรับจากการขายลูกหนี้ที่ตัดจำหน่ายแล้ว,539900,"['104,979', '104,979']"
เงินปันผลจ่าย,เงินปันผลจ่าย,539800,"['(665,588)', '(662,496)']"
ก่อนผลกระทบของอัตราแลกเปลี่ยน,ก่อนผลกระทบของอัตราแลกเปลี่ยน,509999,"['(83,150)', '(204,805)']"
ผลกระทบของอัตราแลกเปลี่ยนต่อเงินสดและรายการเทียบเท่าเงินสด,ผลกระทบของอัตราแลกเปลี่ยนต่อเงินสดและรายการเทียบเท่าเงินสด,540200,"['23,783', '-']"
เงินสดและรายการเทียบเท่าเงินสดเพิ่มขึ้น(ลดลง)สุทธิ,,,"['(59,367)', '(204,805)']"
เงินสดและรายการเทียบเท่าเงินสดณวันต้นงวด,เงินสดและรายการเทียบเท่าเงินสดณวันต้นงวด,599998,"['4,235,603', '2,639,136']"
เงินสดและรายการเทียบเท่าเงินสดณวันสิ้นงวด,เงินสดและรายการเทียบเท่าเงินสดณวันสิ้นงวด,599999,"['4,176,236', '2,434,331']"
