account_name,taxonomy_account_name,account_code,parent_account_code,values
ประมาณการหนี้สินผลประโยชน์ของพนักงาน,ประมาณการหนี้สินผลประโยชน์ของพนักงาน,514910,519997,"['29,334', '3,916']"
ประมาณการหนี้สินสำหรับคดีความ,ประมาณการหนี้สินสำหรับคดีความ,515000,519997,"['422', '-']"
ขาดทุนจากเครื่องมือทางการเงินที่วัดมูลค่าด้วยมูลค่ายุติธรรมผ่านกำไรหรือขาดทุน,ขาดทุนจากเครื่องมือทางการเงินที่วัดมูลค่าด้วยมูลค่ายุติธรรมผ่านกำไรหรือขาดทุน,512300,519997,"['181,674', '-']"
กำไรจากการจำหน่าย/ตัดจำหน่ายส่วนปรับปรุงอาคารเช่าและอุปกรณ์,กำไรจากการจำหน่าย/ตัดจำหน่ายส่วนปรับปรุงอาคารเช่าและอุปกรณ์,511500,519997,"['(238)', '(14)']"
(กำไร)ขาดทุนจากการเปลี่ยนแปลงสัญญาเช่า,(กำไร)ขาดทุนจากการเปลี่ยนแปลงสัญญาเช่า,515000,519997,"['(145)', '-']"
กำไรจากการจำหน่ายเงินลงทุน,กำไรจากการจำหน่ายเงินลงทุน,511000,519997,"['(10,856)', '-']"
(รายได้)ค่าใช้จ่ายดอกเบี้ยสุทธิ,(รายได้)ค่าใช้จ่ายดอกเบี้ยสุทธิ,514500,519997,"['(3,364,292)', '79,554']"
รายได้เงินปันผล,รายได้เงินปันผล,514710,519997,"['(626,089)', '(298,370)']"
เงินสดรับจากดอกเบี้ย,เงินสดรับจากดอกเบี้ย,519500,519999,"['4,450,764', '20']"
เงินสดจ่ายดอกเบี้ย,เงินสดจ่ายดอกเบี้ย,519600,519999,"['(1,746,558)', '(62,253)']"
เงินสดรับคืนภาษีเงินได้,เงินสดรับคืนภาษีเงินได้,519900,519999,"['29,917', '-']"
เงินสดจ่ายภาษีเงินได้,เงินสดจ่ายภาษีเงินได้,519900,519999,"['(236,652)', '(3,690)']"
รายการระหว่างธนาคารและตลาดเงิน,รายการระหว่างธนาคารและตลาดเงิน,515200,519998,"['17,245,043', '2,744']"
สินทรัพย์ทางการเงินที่วัดมูลค่าด้วยมูลค่ายุติธรรมผ่านกำไรหรือขาดทุน,สินทรัพย์ทางการเงินที่วัดมูลค่าด้วยมูลค่ายุติธรรมผ่านกำไรหรือขาดทุน,515300,519998,"['29,781', '-']"
เงินให้สินเชื่อแก่ลูกหนี้,เงินให้สินเชื่อแก่ลูกหนี้,515800,519998,"['(9,632,977)', '-']"
ทรัพย์สินรอการขาย,ทรัพย์สินรอการขาย,516400,519998,"['10,859', '-']"
ลูกหนี้ซื้อขายหลักทรัพย์ด้วยเงินสด,ลูกหนี้ซื้อขายหลักทรัพย์ด้วยเงินสด,518400,519998,"['(102,974)', '-']"
สินทรัพย์อื่น,สินทรัพย์อื่น,516600,519998,"['858,002', '(6,968)']"
เงินรับฝาก,เงินรับฝาก,516800,519998,"['(1,177,476)', '-']"
รายการระหว่างธนาคารและตลาดเงิน,รายการระหว่างธนาคารและตลาดเงิน,516900,519998,"['(9,707,547)', '(343,699)']"
หนี้สินจ่ายคืนเมื่อทวงถาม,หนี้สินจ่ายคืนเมื่อทวงถาม,517000,519998,"['780,068', '-']"
ตราสารหนี้ที่ออกและเงินกู้ยืมระยะสั้น,ตราสารหนี้ที่ออกและเงินกู้ยืมระยะสั้น,518500,519998,"['1,247,416', '198,863']"
ค่าใช้จ่ายค้างจ่าย,ค่าใช้จ่ายค้างจ่าย,518300,519998,"['(134,106)', '(24,390)']"
ประมาณการหนี้สิน,ประมาณการหนี้สิน,518000,519998,"['8,566', '-']"
รายได้รับล่วงหน้า,รายได้รับล่วงหน้า,518300,519998,"['32,005', '-']"
เจ้าหนี้ธุรกิจหลักทรัพย์,เจ้าหนี้สำนักหักบัญชีและธุรกิจหลักทรัพย์ และสัญญาซื้อขายล่วงหน้า เพิ่มขึ้น (ลดลง),518600,519998,"['(478,471)', '-']"
หนี้สินอื่น,หนี้สินอื่น,518300,519998,"['(158,985)', '(16,962)']"
เงินสดสุทธิได้มาจาก(ใช้ไปใน)กิจกรรมดำเนินงาน,เงินสดสุทธิได้มาจาก(ใช้ไปใน)กิจกรรมดำเนินงาน,519999,509999,"['237,304', '(272,249)']"
เงินสดรับจากการจำหน่ายเงินลงทุนในตราสารหนี้ที่วัดมูลค่าด้วยราคาทุนตัดจำหน่าย,เงินสดรับจากการจำหน่ายเงินลงทุนในตราสารหนี้ที่วัดมูลค่าด้วยราคาทุนตัดจำหน่าย,520210,520200,"['30,800', '-']"
เงินสดรับจากการจำหน่ายเงินลงทุนในตราสารหนี้ที่วัดมูลค่าด้วยมูลค่ายุติธรรมผ่านกำไรขาดทุนเบ็ดเสร็จอื่น,เงินสดรับจากการจำหน่ายเงินลงทุนในตราสารหนี้ที่วัดมูลค่าด้วยมูลค่ายุติธรรมผ่านกำไรขาดทุนเบ็ดเสร็จอื่น,520210,520200,"['2,843,461', '-']"
เงินสดรับจากการจำหน่าย/รับคืนทุนจากเงินลงทุนในตราสารทุนที่กำหนดให้วัดมูลค่าด้วยมูลค่ายุติธรรมผ่านกำไรขาดทุนเบ็ดเสร็จอื่น,เงินสดรับจากการจำหน่าย/รับคืนทุนจากเงินลงทุนในตราสารทุนที่กำหนดให้วัดมูลค่าด้วยมูลค่ายุติธรรมผ่านกำไรขาดทุนเบ็ดเสร็จอื่น,520210,520200,"['339,493', '189,903']"
เงินสดรับจากดอกเบี้ยของเงินลงทุน,เงินสดรับจากดอกเบี้ยของเงินลงทุน,529900,529999,"['429,569', '-']"
เงินสดรับเงินปันผลจากเงินลงทุน,เงินสดรับเงินปันผลจากเงินลงทุน,529700,529999,"['586,377', '232,888']"
เงินปันผลรับจากเงินลงทุนในบริษัทย่อย,เงินปันผลรับจากเงินลงทุนในบริษัทย่อย,529700,529999,"['-', '65,482']"
ลงทุนในเงินลงทุนในตราสารหนี้ที่วัดมูลค่าด้วยราคาทุนตัดจำหน่าย,ลงทุนในเงินลงทุนในตราสารหนี้ที่วัดมูลค่าด้วยราคาทุนตัดจำหน่าย,520300,529999,"['(558,250)', '-']"
ลงทุนในเงินลงทุนในตราสารหนี้ที่วัดมูลค่าด้วยมูลค่ายุติธรรมผ่านกำไรขาดทุนเบ็ดเสร็จอื่น,ลงทุนในเงินลงทุนในตราสารหนี้ที่วัดมูลค่าด้วยมูลค่ายุติธรรมผ่านกำไรขาดทุนเบ็ดเสร็จอื่น,520300,529999,"['(3,608,582)', '-']"
เงินสดรับจากการจำหน่ายอุปกรณ์,เงินสดรับจากการจำหน่ายอุปกรณ์,521610,521600,"['518', '15']"
เงินสดจ่ายซื้อส่วนปรับปรุงอาคารเช่าและอุปกรณ์,เงินสดจ่ายซื้อส่วนปรับปรุงอาคารเช่าและอุปกรณ์,521710,521700,"['(63,590)', '-']"
เงินสดจ่ายซื้อสินทรัพย์ไม่มีตัวตน,เงินสดจ่ายซื้อสินทรัพย์ไม่มีตัวตน,521720,521700,"['(24,874)', '(913)']"
เงินสดสุทธิได้มาจาก(ใช้ไปใน)กิจกรรมลงทุน,เงินสดสุทธิได้มาจาก(ใช้ไปใน)กิจกรรมลงทุน,529999,509999,"['(25,078)', '487,375']"
เงินสดจ่ายชำระหนี้สินตามสัญญาเช่า,เงินสดจ่ายชำระหนี้สินตามสัญญาเช่า,530500,539999,"['(127,250)', '(3,295)']"
จ่ายเงินปันผล,จ่ายเงินปันผล,539800,539999,"['(211,862)', '(211,836)']"
เงินสดสุทธิใช้ไปในกิจกรรมจัดหาเงิน,เงินสดสุทธิใช้ไปในกิจกรรมจัดหาเงิน,539999,509999,"['(339,112)', '(215,131)']"
เงินสดและรายการเทียบเท่าเงินสดลดลงสุทธิ,เงินสดและรายการเทียบเท่าเงินสดลดลงสุทธิ,509999,599999,"['(126,886)', '(5)']"
เงินสดและรายการเทียบเท่าเงินสดณวันที่{{number}}{{month_one}},เงินสดและรายการเทียบเท่าเงินสดณวันที่{{number}}{{month_one}},599998,599999,"['705,065', '10']"
เงินสดและรายการเทียบเท่าเงินสดณวันที่{{number}}{{month_six}},เงินสดและรายการเทียบเท่าเงินสดณวันที่{{number}}{{month_six}},599999,,"['578,179', '5']"
