account_name,taxonomy_account_name,account_code,values
เงินสดจ่ายเงินให้กู้ยืมกิจการที่เกี่ยวข้องกัน,เงินสดจ่ายเงินให้กู้ยืมกิจการที่เกี่ยวข้องกัน,521400,"['(250,000)', '(18,010,000)']"
เงินสดรับจากการขายอุปกรณ์,เงินสดรับจากการขายอุปกรณ์,521610,"['4,614', '-']"
เงินสดจ่ายเพื่อซื้ออุปกรณ์,เงินสดจ่ายเพื่อซื้ออุปกรณ์,521710,"['(93,607)', '-']"
เงินสดจ่ายเพื่อซื้อสินทรัพย์ไม่มีตัวตน,เงินสดจ่ายเพื่อซื้อสินทรัพย์ไม่มีตัวตน,521720,"['(7,784)', '-']"
เงินสดจ่ายจากการซื้อเงินลงทุนในบริษัทย่อย,เงินสดจ่ายซื้อเงินลงทุนในบริษัทย่อย บริษัทร่วม และการร่วมค้า,521200,"['(991,906)', '(1,499,400)']"
เงินสดรับจากเงินปันผล,เงินสดรับจากเงินปันผล,529700,"['29,417', '1,529,475']"
เงินสดรับจากเงินกู้ยืมระยะสั้นจากกิจการที่เกี่ยวข้องกัน,เงินสดรับจากเงินกู้ยืมระยะสั้น - บุคคลหรือกิจการที่เกี่ยวข้องกัน,530311,"['100,000', '-']"
เงินสดรับจากเงินกู้ยืมระยะสั้นจากสถาบันการเงิน,เงินสดรับจากเงินกู้ยืมระยะสั้นจากสถาบันการเงิน,530313,"['29,088,007', '29,088,007']"
เงินสดจ่ายเงินกู้ยืมระยะสั้นจากสถาบันการเงิน,เงินสดจ่ายเงินกู้ยืมระยะสั้นจากสถาบันการเงิน,530413,"['(25,070,000)', '(25,070,000)']"
เงินสดรับจากเงินกู้ยืมระยะยาวจากสถาบันการเงิน,เงินสดรับจากเงินกู้ยืมระยะยาวจากสถาบันการเงิน,530333,"['2,000,000', '2,000,000']"
เงินสดจ่ายเงินกู้ยืมระยะยาวจากสถาบันการเงิน,เงินสดจ่ายเงินกู้ยืมระยะยาวจากสถาบันการเงิน,530423,"['(984,360)', '(658,694)']"
เงินสดรับจากการออกหุ้นกู้ไม่ด้อยสิทธิ,เงินสดรับจากการออกหุ้นกู้ไม่ด้อยสิทธิ,530700,"['19,190,207', '19,190,207']"
เงินสดจ่ายหุ้นกู้ไม่ด้อยสิทธิ,เงินสดจ่ายหุ้นกู้ไม่ด้อยสิทธิ,530800,"['(5,053,100)', '(5,053,100)']"
เงินปันผลจ่ายให้แก่ส่วนได้เสียที่ไม่มีอำนาจควบคุม,เงินปันผลจ่ายให้แก่ส่วนได้เสียที่ไม่มีอำนาจควบคุม,539800,"['(581,921)', '-']"
เงินปันผลจ่ายให้แก่ผู้ถือหุ้นของกลุ่มกิจการ,เงินปันผลจ่ายให้แก่ผู้ถือหุ้นของกลุ่มกิจการ,539800,"['(2,471,245)', '(2,471,245)']"
จ่ายคืนเงินต้นของสัญญาเช่า,จ่ายคืนเงินต้นของสัญญาเช่า,530500,"['(363,373)', '(1,296)']"
เงินสดสุทธิได้มาจากกิจกรรมจัดหาเงิน,เงินสดสุทธิได้มาจากกิจกรรมจัดหาเงิน,539999,"['15,854,215', '17,023,879']"
เงินสดและรายการเทียบเท่าเงินสดเพิ่มขึ้น(ลดลง)สุทธิ,เงินสดและรายการเทียบเท่าเงินสดเพิ่มขึ้น(ลดลง)สุทธิ,509999,"['637,546', '(585,156)']"
เงินสดและรายการเทียบเท่าเงินสดต้นงวด,เงินสดและรายการเทียบเท่าเงินสดต้นงวด,599998,"['2,822,634', '1,033,646']"
กำไร(ขาดทุน)จากอัตราแลกเปลี่ยนของเงินสดและรายการเทียบเท่าเงินสด,กำไร(ขาดทุน)จากอัตราแลกเปลี่ยนของเงินสดและรายการเทียบเท่าเงินสด,540100,"['16,003', '-']"
เงินสดและรายการเทียบเท่าเงินสดปลายงวด,เงินสดและรายการเทียบเท่าเงินสดปลายงวด,599999,"['3,476,183', '448,490']"
