account_name,taxonomy_account_name,account_code,values
เงินสดและรายการเทียบเท่าเงินสด,เงินสดและรายการเทียบเท่าเงินสด,110100,"['3,476,183', '448,490']"
สินทรัพย์ทางการเงินอื่นที่วัดมูลค่าด้วยวิธีราคาทุนตัดจำหน่าย,สินทรัพย์ทางการเงินอื่นที่วัดมูลค่าด้วยวิธีราคาทุนตัดจำหน่าย,111630,"['528', '-']"
ส่วนของเงินให้สินเชื่อแก่ลูกหนี้และดอกเบี้ยค้างรับที่ถึงกำหนดชำระภายในหนึ่งปี-สุทธิ,ส่วนของเงินให้สินเชื่อแก่ลูกหนี้และดอกเบี้ยค้างรับที่ถึงกำหนดชำระภายในหนึ่งปี-สุทธิ,112050,"['50,618,259', '-']"
เงินให้กู้ยืมระยะสั้นแก่กิจการที่เกี่ยวข้องกันและดอกเบี้ยค้างรับ,เงินให้กู้ยืมระยะสั้นแก่กิจการที่เกี่ยวข้องกันและดอกเบี้ยค้างรับ,112320,"['-', '40,420,200']"
ที่ถึงกำหนดชำระภายในหนึ่งปีและดอกเบี้ยค้างรับ,ที่ถึงกำหนดชำระภายในหนึ่งปีและดอกเบี้ยค้างรับ,112420,"['-', '4,048,727']"
ลูกหนี้อื่น,ลูกหนี้อื่น,113130,"['3,292,478', '20,127']"
ทรัพย์สินรอการขาย-สุทธิ,ทรัพย์สินรอการขาย-สุทธิ,113500,"['1,248,734', '-']"
สินทรัพย์หมุนเวียนอื่น,สินทรัพย์หมุนเวียนอื่น,119990,"['383,259', '7,646']"
รวมสินทรัพย์หมุนเวียน,รวมสินทรัพย์หมุนเวียน,119999,"['59,019,441', '44,945,190']"
ผ่านกำไรหรือขาดทุน,ผ่านกำไรหรือขาดทุน,121600,"['30,176', '5,893']"
ผ่านกำไรขาดทุนเบ็ดเสร็จอื่น,ผ่านกำไรขาดทุนเบ็ดเสร็จอื่น,121620,"['36,475', '-']"
เงินลงทุนในบริษัทย่อย-สุทธิ,เงินลงทุนในบริษัทย่อย-สุทธิ,122710,"['-', '14,408,537']"
เงินให้สินเชื่อแก่ลูกหนี้และดอกเบี้ยค้างรับ-สุทธิ,เงินให้สินเชื่อแก่ลูกหนี้และดอกเบี้ยค้างรับ-สุทธิ,122050,"['38,679,055', '-']"
เงินให้กู้ยืมระยะยาวแก่กิจการที่เกี่ยวข้องกัน,เงินให้กู้ยืมระยะยาวแก่กิจการที่เกี่ยวข้องกัน,122420,"['-', '3,570,000']"
ที่ดินอาคารและอุปกรณ์-สุทธิ,ที่ดินอาคารและอุปกรณ์-สุทธิ,123800,"['625,556', '13,121']"
สินทรัพย์สิทธิการใช้-สุทธิ,สินทรัพย์สิทธิการใช้-สุทธิ,123900,"['1,463,207', '22,449']"
สินทรัพย์ไม่มีตัวตน-สุทธิ,สินทรัพย์ไม่มีตัวตน-สุทธิ,124190,"['1,182,687', '1,648']"
สินทรัพย์ภาษีเงินได้รอการตัดบัญชี,สินทรัพย์ภาษีเงินได้รอการตัดบัญชี,124400,"['179,666', '-']"
สินทรัพย์ไม่หมุนเวียนอื่น,สินทรัพย์ไม่หมุนเวียนอื่น,129990,"['247,399', '3,287']"
รวมสินทรัพย์ไม่หมุนเวียน,รวมสินทรัพย์ไม่หมุนเวียน,129999,"['42,444,221', '18,024,935']"
รวมสินทรัพย์,รวมสินทรัพย์,109999,"['101,463,662', '62,970,125']"
เงินกู้ยืมระยะสั้นจากกิจการที่เกี่ยวข้องกัน,บุคคลหรือกิจการที่เกี่ยวข้องกัน,211720,"['100,000', '-']"
เงินกู้ยืมระยะสั้นจากสถาบันการเงิน,เงินกู้ยืมระยะสั้นจากสถาบันการเงิน,210500,"['11,438,163', '11,438,163']"
ส่วนของเงินกู้ยืมระยะยาวจากสถาบันการเงินที่ถึงกำหนดชำระภายในหนึ่งปี,ส่วนของเงินกู้ยืมระยะยาวจากสถาบันการเงินที่ถึงกำหนดชำระภายในหนึ่งปี,211860,"['11,153,421', '1,609,720']"
หนี้สินตามสัญญาเช่าส่วนที่ถึงกำหนดชำระภายในหนึ่งปี,หนี้สินตามสัญญาเช่าส่วนที่ถึงกำหนดชำระภายในหนึ่งปี,212400,"['694,880', '1,347']"
เจ้าหนี้อื่น,เจ้าหนี้อื่น,211160,"['2,276,161', '297,948']"
ส่วนของหุ้นกู้ไม่ด้อยสิทธิที่ถึงกำหนดชำระภายในหนึ่งปี,ส่วนของหุ้นกู้ไม่ด้อยสิทธิที่ถึงกำหนดชำระภายในหนึ่งปี,211830,"['5,792,303', '5,792,303']"
ภาษีเงินได้ค้างจ่าย,ภาษีเงินได้ค้างจ่าย,213000,"['580,433', '10,472']"
หนี้สินหมุนเวียนอื่น,หนี้สินหมุนเวียนอื่น,219900,"['214,800', '8,634']"
รวมหนี้สินหมุนเวียน,รวมหนี้สินหมุนเวียน,219999,"['32,250,161', '19,158,587']"
เงินกู้ยืมระยะยาวจากสถาบันการเงิน,เงินกู้ยืมระยะยาวจากสถาบันการเงิน,221860,"['8,703,251', '2,071,840']"
หนี้สินภาษีเงินได้รอตัดบัญชี,หนี้สินภาษีเงินได้รอตัดบัญชี,223200,"['499,394', '114,401']"
หนี้สินตามสัญญาเช่า,หนี้สินตามสัญญาเช่า,222400,"['869,431', '23,770']"
หุ้นกู้ไม่ด้อยสิทธิ,หุ้นกู้ไม่ด้อยสิทธิ,221830,"['30,403,128', '30,403,128']"
ภาระผูกพันผลประโยชน์พนักงาน,ภาระผูกพันผลประโยชน์พนักงาน,222700,"['73,764', '23,793']"
ประมาณการค่ารื้อถอน,ประมาณการค่ารื้อถอน,229900,"['51,971', '436']"
รวมหนี้สินไม่หมุนเวียน,รวมหนี้สินไม่หมุนเวียน,229999,"['40,600,939', '32,637,368']"
รวมหนี้สิน,รวมหนี้สิน,209999,"['72,851,100', '51,795,955']"
หุ้นสามัญจำนวน{{number}}หุ้นมูลค่าที่ตราไว้หุ้นละ{{number}}บาท(พ.ศ.{{number}}:จำนวน{{number}}หุ้น),หุ้นสามัญจำนวน{{number}}หุ้นมูลค่าที่ตราไว้หุ้นละ{{number}}บาท(พ.ศ.{{number}}:จำนวน{{number}}หุ้น),310120,"['1,430,383', '1,430,383']"
หุ้นสามัญจำนวน{{number}}หุ้นมูลค่าที่ได้รับชำระแล้วหุ้นละ{{number}}บาท(พ.ศ.{{number}}:จำนวน{{number}}หุ้น),หุ้นสามัญจำนวน{{number}}หุ้นมูลค่าที่ได้รับชำระแล้วหุ้นละ{{number}}บาท(พ.ศ.{{number}}:จำนวน{{number}}หุ้น),310220,"['1,373,152', '1,373,152']"
ส่วนเกินมูลค่าหุ้นสามัญ,ส่วนเกินมูลค่าหุ้นสามัญ,310420,"['6,207,179', '6,207,179']"
ส่วนเกินมูลค่าหุ้นจากการจ่ายโดยใช้หุ้นเป็นเกณฑ์,ส่วนเกินมูลค่าหุ้นจากการจ่ายโดยใช้หุ้นเป็นเกณฑ์,319920,"['36,190', '36,190']"
จัดสรรแล้ว-ทุนสำรองตามกฎหมาย,จัดสรรแล้ว-ทุนสำรองตามกฎหมาย,310619,"['142,900', '142,900']"
ยังไม่ได้จัดสรร,ยังไม่ได้จัดสรร,310620,"['19,155,230', '3,414,749']"
ส่วนต่ำกว่าทุนจากการเปลี่ยนแปลงสัดส่วนการถือหุ้นในบริษัทย่อย,ส่วนต่ำกว่าทุนจากการเปลี่ยนแปลงสัดส่วนการถือหุ้นในบริษัทย่อย,319921,"['(1,348,755)', '-']"
องค์ประกอบอื่นของส่วนของเจ้าของ,องค์ประกอบอื่นของส่วนของเจ้าของ,319990,"['(11,980)', '-']"
ส่วนได้เสียที่ไม่มีอำนาจควบคุม,ส่วนได้เสียที่ไม่มีอำนาจควบคุม,320130,"['3,058,646', '-']"
รวมส่วนของเจ้าของ,รวมส่วนของเจ้าของ,309998,"['28,612,562', '11,174,170']"
รวมหนี้สินและส่วนของเจ้าของ,รวมหนี้สินและส่วนของเจ้าของ,309999,"['101,463,662', '62,970,125']"
รายได้ดอกเบี้ย,รายได้ดอกเบี้ย,410108,"['3,443,697', '475,486']"
เงินปันผลรับ,เงินปันผลรับ,410202,"['14', '779,437']"
รายได้อื่น,รายได้อื่น,410200,"['946,054', '8,520']"
รวมรายได้,รวมรายได้,419999,"['4,389,765', '1,263,443']"
ค่าใช้จ่ายในการบริการ,ค่าใช้จ่ายในการบริการ,422200,"['340,275', '22']"
ค่าใช้จ่ายในการบริหาร,ค่าใช้จ่ายในการบริหาร,422120,"['1,436,179', '23,405']"
ผลขาดทุนด้านเครดิตที่คาดว่าจะเกิดขึ้น,ผลขาดทุนด้านเครดิตที่คาดว่าจะเกิดขึ้น,430700,"['575,440', '-']"
รวมค่าใช้จ่าย,รวมค่าใช้จ่าย,429999,"['2,351,894', '23,427']"
ต้นทุนทางการเงิน,ต้นทุนทางการเงิน,429900,"['(482,375)', '(442,329)']"
ส่วนแบ่งกำไรจากเงินลงทุนในบริษัทร่วมตามวิธีส่วนได้เสีย,ส่วนแบ่งกำไรจากเงินลงทุนในบริษัทร่วมตามวิธีส่วนได้เสีย,431100,"['9,532', '-']"
(ค่าใช้จ่าย)รายได้ภาษีเงินได้,(ค่าใช้จ่าย)รายได้ภาษีเงินได้,439800,"['(342,236)', '(3,650)']"
กำไรสุทธิสำหรับงวด,กำไร (ขาดทุน) สุทธิ สำหรับงวด,409996,"['1,222,792', '794,037']"
การวัดมูลค่าใหม่ของภาระผูกพันผลประโยชน์หลังออกจากงาน,กำไร (ขาดทุน) จากการประมาณการตามหลักคณิตศาสตร์ประกันภัยสำหรับโครงการผลประโยชน์พนักงาน,450600,"['6,072', '-']"
ภาษีเงินได้ที่เกี่ยวกับรายการจะไม่จัดประเภทรายการใหม่เข้าไปไว้ในกำไรหรือขาดทุนในภายหลัง,ภาษีเงินได้ของรายการที่จะไม่จัดประเภทรายการใหม่เข้าไปไว้ในกำไรหรือขาดทุนในภายหลัง,459900,"['(1,214)', '-']"
ผลต่างของอัตราแลกเปลี่ยนจากการแปลงค่างบการเงิน,ผลต่างของอัตราแลกเปลี่ยนจากการแปลงค่างบการเงิน,440500,"['10,451', '-']"
กำไรเบ็ดเสร็จรวมสำหรับงวด,กำไรเบ็ดเสร็จรวมสำหรับงวด,409999,"['1,238,101', '794,037']"
ส่วนของผู้เป็นเจ้าของของบริษัท,ส่วนของผู้เป็นเจ้าของของบริษัท,460100,"['1,146,344', '794,037']"
ส่วนที่เป็นของส่วนได้เสียที่ไม่มีอำนาจควบคุม,ส่วนที่เป็นของส่วนได้เสียที่ไม่มีอำนาจควบคุม,460200,"['76,448', '-']"
ส่วนของผู้เป็นเจ้าของของบริษัท,ส่วนของผู้เป็นเจ้าของของบริษัท,470100,"['1,157,079', '794,037']"
ส่วนที่เป็นของส่วนได้เสียที่ไม่มีอำนาจควบคุม,ส่วนที่เป็นของส่วนได้เสียที่ไม่มีอำนาจควบคุม,470200,"['81,022', '-']"
กำไรต่อหุ้นขั้นพื้นฐาน(บาทต่อหุ้น),กำไรต่อหุ้นขั้นพื้นฐาน(บาทต่อหุ้น),480100,"['0.83', '0.58']"
รายได้ดอกเบี้ย,รายได้ดอกเบี้ย,410108,"['6,551,404', '827,574']"
เงินปันผลรับ,เงินปันผลรับ,410202,"['17', '1,529,475']"
รายได้อื่น,รายได้อื่น,410200,"['1,798,189', '22,419']"
รวมรายได้,รวมรายได้,419999,"['8,349,610', '2,379,468']"
ค่าใช้จ่ายในการบริการ,ค่าใช้จ่ายในการบริการ,422200,"['676,455', '149']"
ค่าใช้จ่ายในการบริหาร,ค่าใช้จ่ายในการบริหาร,422120,"['2,878,295', '43,500']"
ผลขาดทุนด้านเครดิตที่คาดว่าจะเกิดขึ้น,ผลขาดทุนด้านเครดิตที่คาดว่าจะเกิดขึ้น,430700,"['783,115', '-']"
รวมค่าใช้จ่าย,รวมค่าใช้จ่าย,429999,"['4,337,865', '43,649']"
ต้นทุนทางการเงิน,ต้นทุนทางการเงิน,429900,"['(826,782)', '(744,613)']"
ส่วนแบ่งกำไรจากเงินลงทุนในบริษัทร่วมตามวิธีส่วนได้เสีย,ส่วนแบ่งกำไรจากเงินลงทุนในบริษัทร่วมตามวิธีส่วนได้เสีย,431100,"['25,811', '-']"
(ค่าใช้จ่าย)รายได้ภาษีเงินได้,(ค่าใช้จ่าย)รายได้ภาษีเงินได้,439800,"['(667,104)', '(12,346)']"
กำไรสำหรับงวด,กำไรสำหรับงวด,409996,"['2,543,670', '1,578,860']"
การวัดมูลค่าใหม่ของภาระผูกพันผลประโยชน์หลังออกจากงาน,การวัดมูลค่าใหม่ของภาระผูกพันผลประโยชน์หลังออกจากงาน,450600,"['5,407', '(1,050)']"
ภาษีเงินได้ที่เกี่ยวกับรายการจะไม่จัดประเภทรายการใหม่เข้าไปไว้ในกำไรหรือขาดทุนในภายหลัง,ภาษีเงินได้ที่เกี่ยวกับรายการจะไม่จัดประเภทรายการใหม่เข้าไปไว้ในกำไรหรือขาดทุนในภายหลัง,459900,"['(1,081)', '210']"
ผลต่างของอัตราแลกเปลี่ยนจากการแปลงค่างบการเงิน,ผลต่างของอัตราแลกเปลี่ยนจากการแปลงค่างบการเงิน,440500,"['19,422', '-']"
กำไรเบ็ดเสร็จรวมสำหรับงวด,กำไรเบ็ดเสร็จรวมสำหรับงวด,409999,"['2,567,418', '1,578,020']"
ส่วนของผู้เป็นเจ้าของของบริษัท,ส่วนของผู้เป็นเจ้าของของบริษัท,460100,"['2,346,764', '1,578,860']"
ส่วนที่เป็นของส่วนได้เสียที่ไม่มีอำนาจควบคุม,ส่วนที่เป็นของส่วนได้เสียที่ไม่มีอำนาจควบคุม,460200,"['196,906', '-']"
ส่วนของผู้เป็นเจ้าของของบริษัท,ส่วนของผู้เป็นเจ้าของของบริษัท,470100,"['2,363,249', '1,578,020']"
ส่วนที่เป็นของส่วนได้เสียที่ไม่มีอำนาจควบคุม,ส่วนที่เป็นของส่วนได้เสียที่ไม่มีอำนาจควบคุม,470200,"['204,169', '-']"
กำไรต่อหุ้นขั้นพื้นฐาน(บาทต่อหุ้น),กำไรต่อหุ้นขั้นพื้นฐาน(บาทต่อหุ้น),480100,"['1.71', '1.15']"
กำไรก่อนค่าใช้จ่ายภาษีเงินได้,กำไรก่อนค่าใช้จ่ายภาษีเงินได้,510200,"['3,210,774', '1,591,206']"
ขาดทุน(กำไร)จากมูลค่ายุติธรรมของสินทรัพย์ทางการเงิน,(กำไร) ขาดทุนจากการเปลี่ยนแปลงมูลค่ายุติธรรมของเงินลงทุน,511400,"['4,914', '(27)']"
ส่วนแบ่งกําไรของบริษัทร่วมตามวิธีส่วนได้เสีย,ส่วนแบ่งกําไรของบริษัทร่วมตามวิธีส่วนได้เสีย,510600,"['(25,811)', '-']"
ค่าเสื่อมราคาและค่าตัดจำหน่าย,ค่าเสื่อมราคาและค่าตัดจำหน่าย,510300,"['437,623', '1,519']"
ค่าตัดจำหน่ายต้นทุนในการออกหุ้นกู้,ค่าตัดจำหน่ายต้นทุนในการออกหุ้นกู้,515000,"['25,693', '25,693']"
ขาดทุนจากการตัดจำหน่ายอุปกรณ์,ขาดทุนจากการตัดจำหน่ายอุปกรณ์,511520,"['1,441', '-']"
กำไรจากการจำหน่ายอุปกรณ์,กำไรจากการจำหน่ายอุปกรณ์,511510,"['(2,597)', '-']"
กำไรจากการยกเลิกสัญญาเช่า,กำไรจากการยกเลิกสัญญาเช่า,515000,"['(9,749)', '-']"
ขาดทุน(กลับรายการ)จากการด้อยค่าของทรัพย์สินรอการขาย,ขาดทุน(กลับรายการ)จากการด้อยค่าของทรัพย์สินรอการขาย,512000,"['93,220', '-']"
ขาดทุนจากการขายทรัพย์สินรอการขาย,ขาดทุนจากการขายทรัพย์สินรอการขาย,511200,"['206,836', '-']"
ผลขาดทุนด้านเครดิตที่คาดว่าจะเกิดขึ้น,ผลขาดทุนด้านเครดิตที่คาดว่าจะเกิดขึ้น,510400,"['783,115', '-']"
ภาระผูกพันผลประโยชน์พนักงาน,ภาระผูกพันผลประโยชน์พนักงาน,514910,"['4,817', '1,923']"
ต้นทุนค่ารื้อถอน,ต้นทุนค่ารื้อถอน,514920,"['904', '11']"
เงินปันผลรับ,เงินปันผลรับ,514710,"['(17)', '(1,529,475)']"
รายได้ดอกเบี้ย,รายได้ดอกเบี้ย,514720,"['(8,030,602)', '(834,524)']"
ดอกเบี้ยจ่าย,ดอกเบี้ยจ่าย,514800,"['784,380', '718,911']"
เงินให้สินเชื่อแก่ลูกหนี้และดอกเบี้ยค้างรับ,เงินให้สินเชื่อแก่ลูกหนี้และดอกเบี้ยค้างรับ,515800,"['(16,744,160)', '-']"
ลูกหนี้อื่น,ลูกหนี้อื่น,516600,"['(438,068)', '(3,177)']"
ทรัพย์สินรอการขาย-สุทธิ,ทรัพย์สินรอการขาย-สุทธิ,516400,"['(527,392)', '-']"
สินทรัพย์หมุนเวียนอื่น,สินทรัพย์หมุนเวียนอื่น,516600,"['229,875', '(1)']"
สินทรัพย์ไม่หมุนเวียนอื่น,สินทรัพย์ไม่หมุนเวียนอื่น,516600,"['(20,217)', '-']"
เจ้าหนี้อื่น,เจ้าหนี้อื่น,517600,"['(946,449)', '3,661']"
หนี้สินหมุนเวียนอื่น,หนี้สินหมุนเวียนอื่น,518300,"['7,496', '2,743']"
เงินสดใช้ไปในกิจกรรมดำเนินงาน,เงินสดใช้ไปในกิจกรรมดำเนินงาน,519998,"['(20,953,974)', '(21,537)']"
ดอกเบี้ยรับ,ดอกเบี้ยรับ,519500,"['7,899,675', '267,277']"
ดอกเบี้ยจ่าย,ดอกเบี้ยจ่าย,519600,"['(558,310)', '(514,242)']"
จ่ายภาษีเงินได้,จ่ายภาษีเงินได้,519900,"['(544,794)', '(10,608)']"
เงินสดรับจากเงินให้กู้ยืมกิจการที่เกี่ยวข้องกัน,เงินสดรับจากเงินให้กู้ยืมกิจการที่เกี่ยวข้องกัน,521500,"['250,000', '650,000']"
