account_name,taxonomy_account_name,account_code,values
ค่าจ้างและค่าบำเหน็จจากการรับประกันภัยโดยตรง,ค่าจ้างและค่าบำเหน็จจากการรับประกันภัยโดยตรง,550021,"['(1,445,587,245)', '-']"
ค่าใช้จ่ายในการรับประกันภัยอื่น,ค่าใช้จ่ายในการรับประกันภัยอื่น,550025,"['(676,946,742)', '-']"
เงินจ่ายจากค่าบริการอื่น,เงินจ่ายจากค่าบริการอื่น,550029,"['(146,283,271)', '-']"
ดอกเบี้ยรับ,ดอกเบี้ยรับ,559500,"['71,487,972', '244,312']"
เงินปันผลรับ,เงินปันผลรับ,559700,"['337,235,625', '594,282,336']"
รายได้อื่น,รายได้อื่น,550019,"['41,173,361', '-']"
ค่าใช้จ่ายในการดำเนินงาน,ค่าใช้จ่ายในการดำเนินงาน,550028,"['(1,231,010,838)', '(35,860,718)']"
ภาษีเงินได้,ภาษีเงินได้,559900,"['(137,779,436)', '(2,443)']"
เงินรับเกี่ยวกับสินทรัพย์ทางการเงิน,เงินรับเกี่ยวกับสินทรัพย์ทางการเงิน,550030,"['3,830,658,790', '-']"
เงินจ่ายเกี่ยวกับสินทรัพย์ทางการเงิน,เงินจ่ายเกี่ยวกับสินทรัพย์ทางการเงิน,550040,"['(5,705,052,892)', '-']"
อื่นๆ,อื่นๆ,555000,"['69,951,832', '247,259']"
เงินสดสุทธิได้มา(ใช้ไป)จากกิจกรรมดำเนินงาน,เงินสดสุทธิได้มา(ใช้ไป)จากกิจกรรมดำเนินงาน,559999,"['(583,771,796)', '558,910,746']"
เงินสดรับจากการขายที่ดินอาคารและอุปกรณ์,เงินสดรับจากการขายที่ดินอาคารและอุปกรณ์,521610,"['573,662', '-']"
เงินสดจ่ายเพื่อซื้อที่ดินอาคารและอุปกรณ์,เงินสดจ่ายเพื่อซื้อที่ดินอาคารและอุปกรณ์,521710,"['(66,068,258)', '-']"
เงินสดจ่ายเพื่อซื้อสินทรัพย์ไม่มีตัวตน,เงินสดจ่ายเพื่อซื้อสินทรัพย์ไม่มีตัวตน,521720,"['(8,356,405)', '-']"
เงินสดสุทธิใช้ไปจากกิจกรรมลงทุน,เงินสดสุทธิใช้ไปจากกิจกรรมลงทุน,529999,"['(73,851,001)', '-']"
เงินสดจ่ายเงินยืมบริษัทที่เกี่ยวข้องกัน,เงินสดจ่ายเงินยืมบริษัทที่เกี่ยวข้องกัน,539900,"['-', '(11,500,000)']"
เงินสดรับจากเงินกู้ยืมจากสถาบันการเงิน,รายการอื่น ๆ (กิจกรรมจัดหาเงิน),539900,"['300,000,000', '300,000,000']"
เงินสดจ่ายคืนเงินกู้ยืมจากสถาบันการเงิน,รายการอื่น ๆ (กิจกรรมจัดหาเงิน),539900,"['(240,000,000)', '(240,000,000)']"
เงินสดรับจากเงินกู้ยืมจากกิจการที่เกี่ยวข้องกัน,รายการอื่น ๆ (กิจกรรมจัดหาเงิน),539900,"['385,000,000', '385,000,000']"
เงินสดจ่ายคืนเงินกู้ยืมจากกิจการที่เกี่ยวข้องกัน,เงินสดจ่ายคืนเงินกู้ยืมจากกิจการที่เกี่ยวข้องกัน,539900,"['(532,000,000)', '(532,000,000)']"
ต้นทุนทางการเงิน,ต้นทุนทางการเงิน,539600,"['(9,545,160)', '(9,545,159)']"
จ่ายชำระหนี้ตามสัญญาเช่า,จ่ายชำระหนี้ตามสัญญาเช่า,530500,"['(24,058,391)', '(159,216)']"
จ่ายเงินปันผล,จ่ายเงินปันผล,539800,"['(458,291,941)', '(445,709,277)']"
เงินสดสุทธิใช้ไปจากกิจกรรมจัดหาเงิน,เงินสดสุทธิใช้ไปจากกิจกรรมจัดหาเงิน,539999,"['(578,895,492)', '(553,913,652)']"
เงินสดและรายการเทียบเท่าเงินสดเพิ่มขึ้น(ลดลง)สุทธิ,เงินสดและรายการเทียบเท่าเงินสดเพิ่มขึ้น(ลดลง)สุทธิ,509999,"['(1,236,518,289)', '4,997,094']"
เงินสดและรายการเทียบเท่าเงินสดณวันต้นงวด,เงินสดและรายการเทียบเท่าเงินสดณวันต้นงวด,599998,"['3,110,863,748', '71,302,688']"
เงินสดและรายการเทียบเท่าเงินสดณวันสิ้นงวด,เงินสดและรายการเทียบเท่าเงินสดณวันสิ้นงวด,599999,"['1,874,345,459', '76,299,782']"
