account_name,taxonomy_account_name,account_code,values
เงินสดและรายการเทียบเท่าเงินสด,เงินสดและรายการเทียบเท่าเงินสด,100100,"['1,874,345,459', '76,299,782']"
เบี้ยประกันภัยค้างรับสุทธิ,เบี้ยประกันภัยค้างรับสุทธิ,101200,"['7,636,008,993', '-']"
รายได้จากการลงทุนค้างรับ,รายได้จากการลงทุนค้างรับ,101300,"['65,785,472', '-']"
สินทรัพย์จากการประกันภัยต่อสุทธิ,สินทรัพย์จากการประกันภัยต่อสุทธิ,101400,"['19,417,541,890', '-']"
ลูกหนี้จากสัญญาประกันภัยต่อสุทธิ,ลูกหนี้จากสัญญาประกันภัยต่อสุทธิ,101500,"['4,860,508,523', '-']"
ลูกหนี้การค้าสุทธิ,ลูกหนี้การค้าสุทธิ,109900,"['6,036,983', '-']"
เงินลงทุนในหลักทรัพย์สุทธิ,เงินลงทุนในหลักทรัพย์สุทธิ,101910,"['16,103,023,779', '-']"
เงินลงทุนในบริษัทร่วม,เงินลงทุนในบริษัทร่วม,102620,"['303,163,656', '-']"
เงินลงทุนในบริษัทย่อย,เงินลงทุนในบริษัทย่อย,102710,"['-', '9,889,387,290']"
อสังหาริมทรัพย์เพื่อการลงทุนสุทธิ,อสังหาริมทรัพย์เพื่อการลงทุนสุทธิ,103700,"['149,306,737', '-']"
ที่ดินอาคารและอุปกรณ์สุทธิ,ที่ดินอาคารและอุปกรณ์สุทธิ,103800,"['1,455,056,821', '1,846,676']"
ค่าความนิยม,ค่าความนิยม,104200,"['248,455,378', '-']"
สินทรัพย์ไม่มีตัวตนสุทธิ,สินทรัพย์ไม่มีตัวตนสุทธิ,104100,"['61,802,751', '-']"
ภาษีเงินได้ค้างรับ,ภาษีเงินได้นิติบุคคลค้างรับ,104500,"['-', '5,530']"
สินทรัพย์ภาษีเงินได้รอการตัดบัญชี,สินทรัพย์ภาษีเงินได้รอการตัดบัญชี,104400,"['1,363,383,223', '-']"
เบี้ยประกันภัยต่อจ่ายล่วงหน้าสุทธิ,เบี้ยประกันภัยต่อจ่ายล่วงหน้าสุทธิ,104300,"['1,782,836,159', '-']"
ค่านายหน้าประกันภัยจ่ายล่วงหน้า,ค่านายหน้าประกันภัยจ่ายล่วงหน้า,104300,"['973,297,585', '-']"
สินทรัพย์อื่น,สินทรัพย์อื่น,109900,"['901,294,098', '12,195,449']"
รวมสินทรัพย์,รวมสินทรัพย์,109999,"['57,201,847,507', '9,979,734,727']"
หนี้สินจากสัญญาประกันภัย,หนี้สินจากสัญญาประกันภัย,201200,"['26,191,054,921', '-']"
เจ้าหนี้บริษัทประกันภัยต่อ,เจ้าหนี้บริษัทประกันภัยต่อ,201400,"['10,610,547,133', '-']"
ค่านายหน้าประกันภัยค้างจ่าย,ค่านายหน้าประกันภัยค้างจ่าย,201600,"['1,129,176,783', '-']"
เงินกู้ยืมจากสถาบันการเงิน,เงินกู้ยืมจากสถาบันการเงิน,201900,"['300,000,000', '300,000,000']"
เงินกู้ยืมจากกิจการที่เกี่ยวข้องกัน,เงินกู้ยืมจากกิจการที่เกี่ยวข้องกัน,201900,"['385,000,000', '385,000,000']"
ค่าเบี้ยประกันภัยรับล่วงหน้า,ค่าเบี้ยประกันภัยรับล่วงหน้า,201500,"['7,317,723,571', '-']"
บัญชีตั้งพักค่าเบี้ยประกันภัย,บัญชีตั้งพักค่าเบี้ยประกันภัย,201500,"['136,228,322', '-']"
ภาษีเงินได้ค้างจ่าย,ภาษีเงินได้ค้างจ่าย,204010,"['243,093,159', '-']"
ภาระผูกพันผลประโยชน์พนักงาน,ภาระผูกพันผลประโยชน์พนักงาน,202700,"['507,257,442', '5,824,229']"
หนี้สินอื่น,หนี้สินอื่น,209900,"['1,172,198,735', '7,652,008']"
รวมหนี้สิน,รวมหนี้สิน,209999,"['47,992,280,066', '698,476,237']"
หุ้นสามัญจำนวน{{number}}หุ้นมูลค่าที่ตราไว้หุ้นละ{{number}}บาท,หุ้นสามัญจำนวน{{number}}หุ้นมูลค่าที่ตราไว้หุ้นละ{{number}}บาท,310120,"['600,010,000', '600,010,000']"
หุ้นสามัญจำนวน{{number}}หุ้นมูลค่าที่ได้รับชำระแล้วหุ้นละ{{number}}บาท,หุ้นสามัญจำนวน{{number}}หุ้นมูลค่าที่ได้รับชำระแล้วหุ้นละ{{number}}บาท,310220,"['594,292,336', '594,292,336']"
ส่วนเกินมูลค่าหุ้นสามัญ,ส่วนเกินมูลค่าหุ้นสามัญ,310420,"['895,385,444', '8,541,105,044']"
ส่วนเกินทุนจากการเปลี่ยนแปลงส่วนได้เสียในบริษัทย่อย,ส่วนเกินทุนจากการเปลี่ยนแปลงส่วนได้เสียในบริษัทย่อย,319921,"['1,354,834', '-']"
สำรองตามกฎหมาย,สำรองตามกฎหมาย,310611,"['118,962,325', '59,429,234']"
สำรองทั่วไป,สำรองทั่วไป,310619,"['1,197,602,141', '-']"
ยังไม่ได้จัดสรร,ยังไม่ได้จัดสรร,310620,"['8,800,528,570', '86,184,060']"
องค์ประกอบอื่นของส่วนของเจ้าของ,องค์ประกอบอื่นของส่วนของเจ้าของ,319990,"['(2,540,216,372)', '247,816']"
รวมส่วนของผู้เป็นเจ้าของของบริษัท,รวมส่วนของผู้เป็นเจ้าของของบริษัท,319999,"['9,067,909,278', '9,281,258,490']"
ส่วนได้เสียที่ไม่มีอำนาจควบคุม,ส่วนได้เสียที่ไม่มีอำนาจควบคุม,320130,"['141,658,163', '-']"
รวมส่วนของเจ้าของ,รวมส่วนของเจ้าของ,309998,"['9,209,567,441', '9,281,258,490']"
รวมหนี้สินและส่วนของเจ้าของ,รวมหนี้สินและส่วนของเจ้าของ,309999,"['57,201,847,507', '9,979,734,727']"
เบี้ยประกันภัยรับ,เบี้ยประกันภัยรับ,410126,"['7,865,426,187', '-']"
หักเบี้ยประกันภัยจ่ายจากการเอาประกันภัยต่อ,หักเบี้ยประกันภัยจ่ายจากการเอาประกันภัยต่อ,420200,"['(5,770,285,652)', '-']"
เบี้ยประกันภัยรับสุทธิ,เบี้ยประกันภัยรับสุทธิ,400299,"['2,095,140,535', '-']"
จากงวดก่อน,จากงวดก่อน,420300,"['62,485,965', '-']"
เบี้ยประกันภัยที่ถือเป็นรายได้สุทธิ,เบี้ยประกันภัยที่ถือเป็นรายได้สุทธิ,400399,"['2,157,626,500', '-']"
รายได้ค่าจ้างและค่าบำเหน็จ,รายได้ค่าจ้างและค่าบำเหน็จ,410127,"['1,368,001,694', '-']"
รายได้จากการลงทุนสุทธิ,รายได้จากการลงทุนสุทธิ,410128,"['236,712,772', '244,305']"
กำไรจากเงินลงทุน,กำไรจากเงินลงทุน,431630,"['27,691,113', '-']"
กำไร(ขาดทุน)จากการปรับมูลค่ายุติธรรมของเงินลงทุน,กำไร(ขาดทุน)จากการปรับมูลค่ายุติธรรมของเงินลงทุน,431640,"['3,301,002', '-']"
ส่วนแบ่งกำไรจากเงินลงทุนในบริษัทร่วม,ส่วนแบ่งกำไร (ขาดทุน) จากเงินลงทุนตามวิธีส่วนได้เสีย,431100,"['1,628,233', '-']"
รายได้ค่าบริการอื่น,รายได้ค่าบริการอื่น,410200,"['8,818,645', '-']"
รายได้อื่น,รายได้อื่น,410200,"['38,262,671', '-']"
รวมรายได้,รวมรายได้,419999,"['3,842,042,630', '244,305']"
ค่าสินไหมทดแทนและค่าใช้จ่ายในการจัดการค่าสินไหมทดแทน,ค่าสินไหมทดแทนและค่าใช้จ่ายในการจัดการค่าสินไหมทดแทน,420900,"['3,073,008,792', '-']"
หักค่าสินไหมทดแทนและค่าใช้จ่ายในการจัดการค่าสินไหมทดแทนรับคืนจากการประกันภัยต่อ,หักค่าสินไหมทดแทนและค่าใช้จ่ายในการจัดการค่าสินไหมทดแทนรับคืนจากการประกันภัยต่อ,421000,"['(1,505,946,359)', '-']"
ค่าจ้างและค่าบำเหน็จ,ค่าจ้างและค่าบำเหน็จ,421100,"['826,386,890', '-']"
ค่าใช้จ่ายในการรับประกันภัยอื่น,ค่าใช้จ่ายในการรับประกันภัยอื่น,421200,"['451,709,225', '-']"
ต้นทุนทางการเงิน,ต้นทุนทางการเงิน,429900,"['4,424,483', '4,424,483']"
ต้นทุนบริการ,ต้นทุนบริการ,429800,"['71,155,394', '-']"
ค่าใช้จ่ายในการดำเนินงาน,ค่าใช้จ่ายในการดำเนินงาน,422100,"['516,960,908', '19,193,681']"
(กลับรายการ)ผลขาดทุนด้านเครดิตที่คาดว่าจะเกิดขึ้น,(กลับรายการ)ผลขาดทุนด้านเครดิตที่คาดว่าจะเกิดขึ้น,430700,"['550,443', '-']"
รวมค่าใช้จ่าย,รวมค่าใช้จ่าย,429999,"['3,438,249,776', '23,618,164']"
กำไร(ขาดทุน)ก่อนภาษีเงินได้,กำไร(ขาดทุน)ก่อนภาษีเงินได้,409994,"['403,792,854', '(23,373,859)']"
รายได้(ค่าใช้จ่าย)ภาษีเงินได้,รายได้(ค่าใช้จ่าย)ภาษีเงินได้,439800,"['(76,568,717)', '-']"
กำไร(ขาดทุน)สุทธิสำหรับงวด,กำไร(ขาดทุน)สุทธิสำหรับงวด,409996,"['327,224,137', '(23,373,859)']"
มูลค่ายุติธรรมผ่านกำไรขาดทุนเบ็ดเสร็จอื่น,มูลค่ายุติธรรมผ่านกำไรขาดทุนเบ็ดเสร็จอื่น,441000,"['(474,258,099)', '-']"
(กำไร)ขาดทุนจากการขายเงินลงทุนที่วัดมูลค่ายุติธรรมผ่านกำไรขาดทุนเบ็ดเสร็จอื่นและการด้อยค่าที่โอนเข้าไปยังกำไรหรือขาดทุน,(กำไร)ขาดทุนจากการขายเงินลงทุนที่วัดมูลค่ายุติธรรมผ่านกำไรขาดทุนเบ็ดเสร็จอื่นและการด้อยค่าที่โอนเข้าไปยังกำไรหรือขาดทุน,441000,"['(291,058)', '-']"
ภาษีเงินได้ที่เกี่ยวกับรายการที่จะจัดประเภทรายการใหม่เข้าไปไว้ในกำไรหรือขาดทุนในภายหลัง,ภาษีเงินได้ที่เกี่ยวกับรายการที่จะจัดประเภทรายการใหม่เข้าไปไว้ในกำไรหรือขาดทุนในภายหลัง,449900,"['94,893,388', '-']"
กำไร(ขาดทุน)เบ็ดเสร็จอื่นสำหรับงวดสุทธิจากภาษี,กำไร(ขาดทุน)เบ็ดเสร็จอื่นสำหรับงวดสุทธิจากภาษี,409998,"['(379,655,769)', '-']"
ขาดทุนเบ็ดเสร็จรวมสำหรับงวด,กำไร (ขาดทุน) เบ็ดเสร็จรวม สำหรับงวด,409999,"['(52,431,632)', '(23,373,859)']"
ส่วนของผู้เป็นเจ้าของของบริษัท,ส่วนของผู้เป็นเจ้าของของบริษัท,460100,"['321,403,350', '(23,373,859)']"
ส่วนของส่วนได้เสียที่ไม่มีอำนาจควบคุม,ส่วนของส่วนได้เสียที่ไม่มีอำนาจควบคุม,460200,"['5,820,787', '-']"
ส่วนของผู้เป็นเจ้าของของบริษัท,ส่วนของผู้เป็นเจ้าของของบริษัท,470100,"['(54,461,179)', '(23,373,859)']"
ส่วนของส่วนได้เสียที่ไม่มีอำนาจควบคุม,ส่วนของส่วนได้เสียที่ไม่มีอำนาจควบคุม,470200,"['2,029,547', '-']"
กำไร(ขาดทุน)ต่อหุ้นขั้นพื้นฐาน(บาท),กำไร(ขาดทุน)ต่อหุ้นขั้นพื้นฐาน(บาท),480100,"['0.54', '(0.04)']"
เบี้ยประกันภัยรับ,เบี้ยประกันภัยรับ,410126,"['16,268,263,526', '-']"
หักเบี้ยประกันภัยจ่ายจากการเอาประกันภัยต่อ,หักเบี้ยประกันภัยจ่ายจากการเอาประกันภัยต่อ,420200,"['(10,979,023,328)', '-']"
เบี้ยประกันภัยรับสุทธิ,เบี้ยประกันภัยรับสุทธิ,400299,"['5,289,240,198', '-']"
จากงวดก่อน,จากงวดก่อน,420300,"['(768,852,093)', '-']"
เบี้ยประกันภัยที่ถือเป็นรายได้สุทธิ,เบี้ยประกันภัยที่ถือเป็นรายได้สุทธิ,400399,"['4,520,388,105', '-']"
รายได้ค่าจ้างและค่าบำเหน็จ,รายได้ค่าจ้างและค่าบำเหน็จ,410127,"['2,699,945,745', '-']"
รายได้จากการลงทุนสุทธิ,รายได้จากการลงทุนสุทธิ,410128,"['412,216,339', '244,312']"
กำไรจากเงินลงทุน,กำไรจากเงินลงทุน,431630,"['69,321,008', '-']"
กำไร(ขาดทุน)จากการปรับมูลค่ายุติธรรมของเงินลงทุน,กำไร(ขาดทุน)จากการปรับมูลค่ายุติธรรมของเงินลงทุน,431640,"['3,298,397', '-']"
ส่วนแบ่งกำไร(ขาดทุน)จากเงินลงทุนในบริษัทร่วม,ส่วนแบ่งกำไร(ขาดทุน)จากเงินลงทุนในบริษัทร่วม,431100,"['(1,102,524)', '-']"
รายได้ค่าบริการอื่น,รายได้ค่าบริการอื่น,410200,"['13,825,311', '-']"
รายได้อื่น,รายได้อื่น,410200,"['47,935,912', '-']"
รวมรายได้,รวมรายได้,419999,"['7,765,828,293', '244,312']"
ค่าสินไหมทดแทนและค่าใช้จ่ายในการจัดการค่าสินไหมทดแทน,ค่าสินไหมทดแทนและค่าใช้จ่ายในการจัดการค่าสินไหมทดแทน,420900,"['6,809,053,505', '-']"
หักค่าสินไหมทดแทนและค่าใช้จ่ายในการจัดการค่าสินไหมทดแทนรับคืนจากการประกันภัยต่อ,หักค่าสินไหมทดแทนและค่าใช้จ่ายในการจัดการค่าสินไหมทดแทนรับคืนจากการประกันภัยต่อ,421000,"['(3,789,455,933)', '-']"
ค่าจ้างและค่าบำเหน็จ,ค่าจ้างและค่าบำเหน็จ,421100,"['1,556,885,631', '-']"
ค่าใช้จ่ายในการรับประกันภัยอื่น,ค่าใช้จ่ายในการรับประกันภัยอื่น,421200,"['830,332,049', '-']"
ต้นทุนทางการเงิน,ต้นทุนทางการเงิน,429900,"['7,834,789', '7,834,789']"
ต้นทุนบริการ,ต้นทุนบริการ,429800,"['139,616,115', '-']"
ค่าใช้จ่ายในการดำเนินงาน,ค่าใช้จ่ายในการดำเนินงาน,422100,"['995,894,302', '31,764,057']"
(กลับรายการ)ผลขาดทุนด้านเครดิตที่คาดว่าจะเกิดขึ้น,(กลับรายการ)ผลขาดทุนด้านเครดิตที่คาดว่าจะเกิดขึ้น,430700,"['721,162', '-']"
รวมค่าใช้จ่าย,รวมค่าใช้จ่าย,429999,"['6,550,881,620', '39,598,846']"
กำไร(ขาดทุน)ก่อนภาษีเงินได้,กำไร(ขาดทุน)ก่อนภาษีเงินได้,409994,"['1,214,946,673', '(39,354,534)']"
ค่าใช้จ่ายภาษีเงินได้,ค่าใช้จ่ายภาษีเงินได้,439800,"['(240,156,431)', '-']"
กำไร(ขาดทุน)สุทธิสำหรับงวด,กำไร(ขาดทุน)สุทธิสำหรับงวด,409996,"['974,790,242', '(39,354,534)']"
นักคณิตศาสตร์ประกันภัย,นักคณิตศาสตร์ประกันภัย,450600,"['161,256', '-']"
ใหม่เข้าไปไว้ในกำไรหรือขาดทุนในภายหลัง,ใหม่เข้าไปไว้ในกำไรหรือขาดทุนในภายหลัง,459900,"['(32,251)', '-']"
มูลค่ายุติธรรมผ่านกำไรขาดทุนเบ็ดเสร็จอื่น,มูลค่ายุติธรรมผ่านกำไรขาดทุนเบ็ดเสร็จอื่น,441000,"['(833,966,642)', '-']"
และการด้อยค่าที่โอนเข้าไปยังกำไรหรือขาดทุน,และการด้อยค่าที่โอนเข้าไปยังกำไรหรือขาดทุน,441000,"['4,304,803', '-']"
ภาษีเงินได้ที่เกี่ยวกับรายการที่จะจัดประเภทรายการใหม่เข้าไปไว้ในกำไรหรือขาดทุนในภายหลัง,ภาษีเงินได้ที่เกี่ยวกับรายการที่จะจัดประเภทรายการใหม่เข้าไปไว้ในกำไรหรือขาดทุนในภายหลัง,449900,"['165,916,667', '-']"
กำไร(ขาดทุน)เบ็ดเสร็จอื่นสำหรับงวดสุทธิจากภาษี,กำไร(ขาดทุน)เบ็ดเสร็จอื่นสำหรับงวดสุทธิจากภาษี,409998,"['(663,616,167)', '-']"
กำไร(ขาดทุน)เบ็ดเสร็จรวมสำหรับงวด,กำไร(ขาดทุน)เบ็ดเสร็จรวมสำหรับงวด,409999,"['311,174,075', '(39,354,534)']"
ส่วนของผู้เป็นเจ้าของของบริษัท,ส่วนของผู้เป็นเจ้าของของบริษัท,460100,"['960,269,321', '(39,354,534)']"
ส่วนของส่วนได้เสียที่ไม่มีอำนาจควบคุม,ส่วนของส่วนได้เสียที่ไม่มีอำนาจควบคุม,460200,"['14,520,921', '-']"
ส่วนของผู้เป็นเจ้าของของบริษัท,ส่วนของผู้เป็นเจ้าของของบริษัท,470100,"['303,118,921', '(39,354,534)']"
ส่วนของส่วนได้เสียที่ไม่มีอำนาจควบคุม,ส่วนของส่วนได้เสียที่ไม่มีอำนาจควบคุม,470200,"['8,055,154', '-']"
กำไร(ขาดทุน)ต่อหุ้นขั้นพื้นฐาน(บาท),กำไร(ขาดทุน)ต่อหุ้นขั้นพื้นฐาน(บาท),480100,"['1.62', '(0.07)']"
เบี้ยประกันภัยรับจากการรับประกันภัยโดยตรง,เบี้ยประกันภัยรับจากการรับประกันภัยโดยตรง,550010,"['15,040,331,903', '-']"
เงินรับ(จ่าย)เกี่ยวกับการประกันภัยต่อ,เงินรับ(จ่าย)เกี่ยวกับการประกันภัยต่อ,550022,"['(3,198,342,418)', '-']"
ค่าสินไหมทดแทนจากการรับประกันภัยโดยตรง,ค่าสินไหมทดแทนจากการรับประกันภัยโดยตรง,550024,"['(7,195,334,268)', '-']"
ค่าใช้จ่ายในการจัดการค่าสินไหมทดแทนจากการรับประกันภัยโดยตรง,ค่าใช้จ่ายในการจัดการค่าสินไหมทดแทนจากการรับประกันภัยโดยตรง,550024,"['(238,274,169)', '-']"
