form_no,set_code,dm_code,running_number,reference_no,indent,item_in_taxonomy,item_in_taxonomy_en,parent_code,parent_code_operation,formating,data_type,symbol,financial_statement_type,fs_category,description_th,description_en,opposite_code_short,mandatory_mapping,zone_code,warning_mapping_msg_th,warning_mapping_msg_en,meaning_of_taxonomy,historical_name
F6,124190,142,94,91,1,สินทรัพย์ไม่มีตัวตน - อื่น ๆ,Intangible Assets - Others,124100,1,,N,23,BS_A,สินทรัพย์ไม่หมุนเวียน,รวมถึง ลิขสิทธิ์ สิทธิบัตร สิทธิในสัมปทาน ,"Include license, patents, concession rights",,,,,,หมายถึง สินทรัพย์ไม่มีตัวตนประเภทอื่น ๆ ที่นอกเหนือจากเลขอ้างอิงที่ 90 ถึง 91,สิทธิในการดำเนินการผลิตและจำหน่ายไฟฟ้าจากขยะชุมชน หรือ สินทรัพย์ไม่มีตัวตน-สุทธิ หรือ สินทรัพย์ไม่มีตัวตนสุทธิ หรือ สินทรัพย์ไม่มีตัวตน หรือ สินทรัพย์ไม่มีตัวตนอื่น
F6,124130,140,95,92,0,สินทรัพย์ที่เกิดจากการสํารวจและการประเมินค่า,Exploration And Evaluation Assets,129999,1,,N,23,BS_A,สินทรัพย์ไม่หมุนเวียน,,,,,,,,หมายถึง สินทรัพย์ที่เกิดจากการสํารวจและการประเมินค่า ซึ่งอยู่ระหว่างการพิสูจน์ความเป็นไปได้ทางเทคนิคและความเป็นไปได้ในเชิงพาณิชย์ของการนำเอาทรัพยากรแร่มาใช้ หลังจากที่บริษัทได้รับสิทธิทางกฎหมายให้ทำการสำรวจในพื้นที่ที่ระบุไว้ ซึ่งกิจกรรมการสำรวจในพื้นที่ที่จะก่อให้เกิดประโยชน์ยังไม่ถึงขั้นที่สามารถประเมินถึงความมีอยู่จริงของปริมาณสำรองในเชิงพาณิชย์ได้อย่างสมเหตุสมผล และกิจกรรมการสำรวจยังดำเนินอยู่โดยต่อเนื่อง  ซึ่งบริษัทได้รับรู้เป็นสินทรัพย์ตามนโยบายการบัญชีของบริษัท ซึ่งบริษัทจะพิจารณาเพื่อรับรู้เป็นสินทรัพย์ภายใต้ ที่ดิน อาคารและอุปกรณ์หรือสินทรัพย์ไม่มีตัวตนตามลักษณะของสินทรัพย์ที่ได้มา ในภายหลังหากเข้าเงื่อนไขและมีความเป็นไปได้ค่อนข้างแน่ว่าจะสามารถก่อให้เกิดประโยชน์เชิงเศรษฐกิจในอนาคต,
F6,124200,144,96,93,0,ค่าความนิยม - สุทธิ,Goodwill - Net,129999,1,,N,23,BS_A,สินทรัพย์ไม่หมุนเวียน,,,,,,,,หมายถึง สินทรัพย์ที่แสดงถึงประโยชน์เชิงเศรษฐกิจในอนาคตอื่นที่บริษัทคาดว่าจะได้รับจากการรวมธุรกิจ ซึ่งประโยชน์ในอนาคตอื่นนั้นไม่สามารถระบุและรับรู้เป็นรายการแยกต่างหากได้ เช่น ต้นทุนที่ประหยัดได้จากการรวมธุรกิจ การได้มาซึ่งบุคลากรที่มีความรู้ความสามารถในธุรกิจ เป็นต้น โดยแสดงด้วยมูลค่าสุทธิจากค่าเผื่อการด้อยค่า,ค่าความนิยม
F6,124400,147,97,94,0,สินทรัพย์ภาษีเงินได้รอตัดบัญชี,Deferred Tax Assets,129999,1,,N,23,BS_A,สินทรัพย์ไม่หมุนเวียน,,,,,,,,หมายถึง สินทรัพย์ภาษีเงินได้รอตัดบัญชีที่บริษัทจะได้ใช้ประโยชน์ในอนาคต ซึ่งเกิดจากผลแตกต่างชั่วคราว เช่น บริษัทสามารถนำจำนวนดังกล่าวหักเป็นค่าใช้จ่ายทางภาษีในอนาคต ขาดทุนทางภาษีที่บริษัทคาดว่าจะนำไปใช้ประโยชน์ในการลดจำนวนภาษีที่ต้องชำระ รวมทั้งเครดิตภาษีที่บริษัทคาดว่าจะได้รับประโยชน์ในการลดจำนวนภาษีที่ต้องจ่ายชำระ,สินทรัพย์ภาษีเงินได้รอตัดบัญชี-สุทธิ หรือ สินทรัพย์ภาษีเงินได้รอการตัดบัญชี-สุทธิ หรือ สินทรัพย์ภาษีเงินได้รอการตัดบัญชี
F6,124500,149,98,95,0,ภาษีเงินได้นิติบุคคลค้างรับ - ไม่หมุนเวียน,Income Tax Receivable - Non-Current,129999,1,,N,23,BS_A,สินทรัพย์ไม่หมุนเวียน,,,,,,,,หมายถึง จำนวนภาษีเงินได้นิติบุคคลที่บริษัทขอคืนหรือสามารถขอคืนได้และบริษัทคาดว่าจะได้รับคืน ไม่ว่าจะเป็นในรูปเงินคืนภาษีหรือเครดิตเพื่อลดจำนวนภาษีที่ต้องชำระ เป็นระยะเวลาเกินกว่า 12 เดือนนับจากวันสิ้นรอบระยะเวลารายงาน,ภาษีเงินได้ถูกหักณที่จ่ายรอรับคืน หรือ ภาษีเงินได้จ่ายล่วงหน้า หรือ ภาษีเงินได้หักณที่จ่าย หรือ ภาษีเงินได้รอขอคืน หรือ ภาษีรอเรียกคืน หรือ ภาษีเงินได้ถูกหักณที่จ่าย
F6,125000,156,99,96,0,ลูกหนี้ที่เกิดจากภาษีอื่นหรือรายการอื่นภายใต้กฎหมาย - ไม่หมุนเวียน,Other Tax Or Other Receivables Under Law And Regulations - Non-Current,129999,1,,R,23,BS_A,สินทรัพย์ไม่หมุนเวียน,,,,,,,,"หมายถึง ลูกหนี้ที่เกิดจากภาษีอื่นหรือรายการอื่นภายใต้กฎหมายซึ่งบังคับใช้กับบริษัท ที่บริษัทสามารถขอคืนได้และคาดว่าจะได้คืน หรือจะได้รับประโยชน์เป็นเครดิตทางภาษี ในระยะเวลาเกินกว่า 12 เดือนนับจากวันสิ้นรอบระยะเวลารายงาน นอกเหนือจากเลขอ้างอิงที่ 95

ลูกหนี้ที่เกิดจากภาษีอื่นหรือรายการอื่นภายใต้กฎหมาย - ไม่หมุนเวียน ประกอบด้วยเลขอ้างอิงที่ 97 ถึง 100",
F6,125010,158,100,97,1,ลูกหนี้ภาษีค้างรับ,Other Tax Receivables,125000,1,,N,23,BS_A,สินทรัพย์ไม่หมุนเวียน,รวมถึง ภาษีมูลค่าเพิ่มที่รอขอคืน เครดิตอากรนำเข้าจากกรมศุลกากร ภาษีสรรพสามิต,"Include claimable value added tax refund, custom duty credit and excise tax",,,,,,หมายถึง ค่าภาษีหรืออากรค้างรับ หรือเครดิตทางภาษีที่จะได้รับจากหน่วยงานจัดเก็บ เช่น ภาษีสรรพสามิต เครดิตภาษีอากรนำเข้าจากกรมศุลกากร ภาษีมูลค่าเพิ่มที่รอขอคืน ที่บริษัทคาดว่าจะได้รับชำระคืนหรือได้รับประโยชน์ในระยะเวลาเกินกว่า 12 เดือนนับจากวันสิ้นรอบระยะเวลารายงาน,ลูกหนี้กรมสรรพากรไม่หมุนเวียน
F6,125020,160,101,98,1,ลูกหนี้กองทุนน้ำมันเชื้อเพลิง,Receivables From Oil Fuel Fund,125000,1,,N,23,BS_A,สินทรัพย์ไม่หมุนเวียน,,,,,,,,หมายถึง ลูกหนี้เงินชดเชยและ/หรือเงินคืนจากกองทุนน้ำมันเชื้อเพลิงตามพระราชบัญญัติกองทุนน้ำมันเชื้อเพลิง ซึ่งจะถึงกำหนดรับชำระในระยะเวลาเกินกว่า 12 เดือนนับจากวันสิ้นรอบระยะเวลารายงาน,
F6,125030,162,102,99,1,ลูกหนี้กองทุนพัฒนาไฟฟ้า,Receivables From Power Fund,125000,1,,N,23,BS_A,สินทรัพย์ไม่หมุนเวียน,,,,,,,,หมายถึง ลูกหนี้เงินชดเชยและ/หรือเงินอุดหนุนจากกองทุนพัฒนาไฟฟ้าตามพระราชบัญญัติการประกอบกิจการพลังงาน ซึ่งจะถึงกำหนดรับชำระในระยะเวลาเกินกว่า 12 เดือนนับจากวันสิ้นรอบระยะเวลารายงาน,
F6,125090,164,103,100,1,ลูกหนี้ที่เกิดจากภาษีอื่นหรือรายการอื่นภายใต้กฎหมาย - อื่น ๆ,Other Tax Or Other Receivables Under Law And Regulations - Others,125000,1,,N,23,BS_A,สินทรัพย์ไม่หมุนเวียน,รวมถึง สิ่งที่คาดว่าจะได้คืนหรือจะได้รับประโยชน์ในอนาคตจากหน่วยงานที่จัดตั้งขึ้นตามกฎหมาย เช่น เงินชดเชยจากสำนักงานกองทุนอ้อยและน้ำตาลทราย,Include items that will be received or benefited in the future from institution established under law such as receivables from Sugar Cane and Sugar Fund ,,,,,,หมายถึง ลูกหนี้ที่เกิดจากภาษีอื่นหรือรายการอื่นภายใต้กฎหมายซึ่งบังคับใช้กับบริษัท โดยจะถึงกำหนดรับชำระในระยะเวลาเกินกว่า 12 เดือนนับจากวันสิ้นรอบระยะเวลารายงาน นอกเหนือจากเลขอ้างอิงที่ 97 ถึง 99,
F6,124800,153,104,101,0,สินทรัพย์ดิจิทัล - ไม่หมุนเวียน,Digital Assets - Non-Current,129999,1,,N,23,BS_A,สินทรัพย์ไม่หมุนเวียน,รวมถึง สกุลเงินดิจิทัล (Cryptocurrency หรือ Digital currency) หรือ เหรียญดิจิทัล (Digital token),Include cryptocurrency or digital currency or digital token,,,,,,หมายถึง สินทรัพย์ดิจิทัลที่บริษัทคาดว่าจะได้รับชำระ หรือสามารถเปลี่ยนไปเป็นสินทรัพย์ทางการเงินอื่นได้ภายในระยะเวลาเกินกว่า 12 เดือน ทั้งนี้ การได้รับชำระอาจเป็นการได้รับสินค้าหรือบริการในอนาคต เช่น สกุลเงินดิจิทัล (Cryptocurrency หรือ Digital currency) ซึ่งเป็นสื่อกลางในการแลกเปลี่ยนที่ต้องใช้วิทยาการเข้ารหัสลับเป็นการรับประกันการทำธุรกรรม หรือ เหรียญดิจิทัล (Digital token) ซึ่งสินทรัพย์ดังกล่าวอาจไม่สามารถนำไปชำระหนี้สินได้ตามกฎหมาย หรือไม่อาจรับประกันในสภาพคล่องได้ อีกทั้งมูลค่าของสินทรัพย์ดิจิทัลดังกล่าวอาจมีความผันผวนและมีความไม่แน่นอนได้,
F6,129900,166,105,102,0,สินทรัพย์ไม่หมุนเวียนอื่น,Other Non-Current Assets,129999,1,,R,23,BS_A,สินทรัพย์ไม่หมุนเวียน,,,,,,,,"หมายถึง สินทรัพย์ไม่หมุนเวียนอื่นนอกเหนือจากเลขอ้างอิงที่ 53 ถึง 101

สินทรัพย์ไม่หมุนเวียนอื่น ประกอบด้วยเลขอ้างอิงที่ 103 ถึง 105",
F6,129910,168,106,103,1,ค่าใช้จ่ายจ่ายล่วงหน้า,Prepayments,129900,1,,N,23,BS_A,สินทรัพย์ไม่หมุนเวียน,ค่าใช้จ่ายจ่ายล่วงหน้าเพื่อบริการ,Prepayments for services,,,,,,หมายถึง ค่าใช้จ่ายที่บริษัทจ่ายล่วงหน้าเพื่อบริการที่บริษัทคาดว่าจะได้รับประโยชน์ภายในระยะเวลา 12 เดือนนับจากวันสิ้นรอบระยะเวลารายงาน,ค่าใช้จ่ายจ่ายล่วงหน้า-ไม่หมุนเวียน
F6,129920,170,107,104,1,เงินจ่ายล่วงหน้าค่าซื้อสินทรัพย์,Advance Payment For Purchases Of Assets,129900,1,,N,23,BS_A,สินทรัพย์ไม่หมุนเวียน,ค่าใช้จ่ายจ่ายล่วงหน้าเพื่อซื้อสินทรัพย์ถาวร วัสดุอุปกรณ์ หรือสินทรัพย์ไม่หมุนเวียนอื่น เงินจ่ายล่วงหน้าค่าอสังหาริมทรัพย์สำหรับธุรกิจพัฒนาอสังหาริมทรัพย์,"Prepayments for fixed assets, supplies or other non-current assets Include property for the real estate developer",,,,,,หมายถึง ค่าใช้จ่ายที่บริษัทจ่ายล่วงหน้าเพื่อซื้อสินทรัพย์ถาวรหรือสินทรัพย์ไม่หมุนเวียนอื่นที่บริษัทคาดว่าจะได้รับประโยชน์ในระยะเวลาเกินกว่า 12 เดือนนับจากวันสิ้นรอบระยะเวลารายงาน,เงินจ่ายล่วงหน้าค่าเงินลงทุนในตราสารทุน
F6,129990,172,108,105,1,สินทรัพย์ไม่หมุนเวียนอื่น - อื่น ๆ,Other Non-Current Assets - Others,129900,1,,N,23,BS_A,สินทรัพย์ไม่หมุนเวียน,,,,,,,,หมายถึง สินทรัพย์ไม่หมุนเวียนอื่นประเภทอื่น ๆ นอกเหนือจากเลขอ้างอิงที่ 103 ถึง 104,ที่ดินรอการพัฒนา หรือ สินทรัพย์ไม่หมุนเวียนอื่น หรือ สินทรัพย์ที่เกิดจากสัญญา-ไม่หมุนเวียน หรือ ค่าเปิดหน้าเหมืองรอตัดจ่าย-สุทธิ หรือ ต้นทุนของสัญญา-ไม่หมุนเวียน หรือ สินทรัพย์ทางการเงินไม่หมุนเวียนอื่น หรือ ค่าฟื้นฟูสภาพเหมืองรอตัดจ่าย-สุทธิ หรือ อื่นๆ หรือ สินทรัพย์ไม่หมุนเวียนอื่นสุทธิ
F6,129999,198,109,106,0,รวมสินทรัพย์ไม่หมุนเวียน,Total Non-Current Assets,109999,1,B,NV,23,BS_A,สินทรัพย์ไม่หมุนเวียน,,,,,Y,,,รวมสินทรัพย์ไม่หมุนเวียน เป็นผลรวมของเลขอ้างอิงที่ 53 ถึง 105,
F6,109999,199,110,107,0,รวมสินทรัพย์,Total Assets,No,,BU,NV,23,BS_A,สินทรัพย์,"ใช้ในการคำนวณ Total Asset Turnover, Return on Asset"," For calculation of Total Asset Turnover, Return on Asset",,Y,Y,,,รวมสินทรัพย์ เป็นผลรวมของเลขอ้างอิงที่ 51 และ 106,
F6,200000,T4,111,108,0,หนี้สิน,Liabilities,No,,B Fix,T,,BS_L,หนี้สิน,,,,,,,,หนี้สิน ประกอบด้วยเลขอ้างอิงที่ 109 ถึง 183,
F6,210000,T5,112,109,0,หนี้สินหมุนเวียน,Current Liabilities,No,,B Fix,T,,BS_L,หนี้สินหมุนเวียน,,,,,,,,หนี้สินหมุนเวียน ประกอบด้วยเลขอ้างอิงที่ 110 ถึง 147,
F6,210500,207,113,110,0,เงินเบิกเกินบัญชีและเงินกู้ยืมระยะสั้นจากสถาบันการเงิน,Bank Overdrafts And Short-Term Borrowings From Financial Institutions,219999,1,,N,23,BS_L,หนี้สินหมุนเวียน,"- รวมถึง หนี้สินที่เกิดจากการขายลดหรือขายช่วงตั๋วเงินกับสถาบันการเงิน หนี้สินที่เกิดจากการชำระคืนเจ้าหนี้ก่อนกำหนดตามสัญญา Supplier finance กับทางสถาบันการเงิน
- แสดงผลใน Company Highlight & Fact Sheet
- ใช้ในการคำนวณ Interest Bearing Debt / Equity Ratio","- Include liabilities arising from discounting and rediscounting of the bills with financial institutions, liabilities arising from early repayment to creditors in supplier finance agreements with financial institutions
- Displayed in the Company Highlight & Fact Sheet
- For calculation of Interest Bearing Debt / Equity Ratio",,,,,,หมายถึง เงินเบิกเกินบัญชีธนาคาร หนี้สินที่เกิดจากการกู้ยืมระยะสั้นจากธนาคารพาณิชย์หรือสถาบันการเงินอื่น รวมถึง หนี้สินที่เกิดจากการขายลดหรือขายช่วงตั๋วเงินกับสถาบันการเงิน หนี้สินที่เกิดจากการชำระคืนเจ้าหนี้ก่อนกำหนดตามสัญญา Supplier finance กับทางสถาบันการเงิน ซึ่งจัดเป็นหนี้สินประเภทหมุนเวียน,เงินเบิกเกินบัญชีจากสถาบันการเงิน หรือ เงินเบิกเกินบัญชีและเงินกู้ยืมระยะสั้นจากธนาคาร หรือ เงินกู้ยืมระยะสั้นจากสถาบันการเงิน หรือ เงินเบิกเกินบัญชีธนาคารและเงินกู้ยืมระยะสั้นจากสถาบันการเงิน หรือ เงินกู้ยืมระยะสั้นจากธนาคาร
