form_no,set_code,dm_code,running_number,reference_no,indent,item_in_taxonomy,item_in_taxonomy_en,parent_code,parent_code_operation,formating,data_type,symbol,financial_statement_type,fs_category,description_th,description_en,opposite_code_short,mandatory_mapping,zone_code,warning_mapping_msg_th,warning_mapping_msg_en,meaning_of_taxonomy,historical_name
F6,480100,595,317,312,0,กำไร (ขาดทุน) ต่อหุ้นขั้นพื้นฐาน (บาท/หุ้น),Basic Earnings (Loss) Per Share (Baht/Share),No,,B,N,123,PL,กำไรต่อหุ้น,"- แสดงผลใน Company Highlight & Fact Sheet
- ใช้ในการคำนวณ EPS","- Displayed in the Company Highlight & Fact Sheet
- For calculation of EPS",,,,,,หมายถึง ส่วนกำไรหรือขาดทุนต่อหุ้นขั้นพื้นฐานที่เป็นของผู้ถือหุ้นสามัญของบริษัทใหญ่ โดยวิธีการคำนวณให้เป็นไปตามที่กำหนดในมาตรฐานการรายงานทางการเงินที่เกี่ยวข้อง,ส่วนที่เป็นของบริษัทใหญ่(บาท) หรือ กำไรส่วนที่เป็นของผู้ถือหุ้นบริษัทฯ หรือ กำไรต่อหุ้นขั้นพื้นฐาน(บาทต่อหุ้น) หรือ กำไร(ขาดทุน)ต่อหุ้นส่วนที่เป็นของบริษัทใหญ่(บาทต่อหุ้น) หรือ กำไร(ขาดทุน)ส่วนที่เป็นของผู้ถือหุ้นของบริษัทใหญ่(บาท) หรือ กำไรต่อหุ้นขั้นพื้นฐาน(บาท) หรือ กำไร(ขาดทุน)ต่อหุ้นขั้นพื้นฐาน(บาท/หุ้น) หรือ กำไร(ขาดทุน)ต่อหุ้นขั้นพื้นฐาน(บาท)ต่อหุ้น หรือ กำไรส่วนที่เป็นของผู้ถือหุ้นของบริษัทฯ(บาท) หรือ กำไร(ขาดทุน)ต่อหุ้นขั้นพื้นฐาน(บาท) หรือ กำไร(ขาดทุน)สำหรับงวด(บาท) หรือ ขาดทุนต่อหุ้นส่วนที่เป็นของบริษัทใหญ่(บาทต่อหุ้น) หรือ กำไรส่วนที่เป็นของผู้ถือหุ้น หรือ กำไรต่อหุ้นขั้นพื้นฐาน(บาท/หุ้น) หรือ กำไรสำหรับงวด(บาท) หรือ กำไร(ขาดทุน)ส่วนที่เป็นของผู้ถือหุ้นของบริษัท หรือ กำไรส่วนที่เป็นของผู้ถือหุ้นของบริษัท หรือ กำไรสำหรับงวด หรือ กำไรต่อหุ้นขั้นพื้นฐานกำไรส่วนที่เป็นของผู้ถือหุ้นของบริษัทฯ หรือ กำไรต่อหุ้น(บาท) หรือ กำไร(ขาดทุน)ส่วนที่เป็นส่วนของผู้ถือหุ้นของบริษัทฯ หรือ กำไร(ขาดทุน)ส่วนที่เป็นของผู้ถือหุ้นของบริษัทฯ หรือ ส่วนที่เป็นของบริษัทใหญ่ หรือ ขาดทุนต่อหุ้นขั้นพื้นฐาน หรือ กำไรต่อหุ้นขั้นพื้นฐาน หรือ กำไร หรือ กำไรต่อหุ้นขั้นพื้นฐาน(หน่วย:บาท) หรือ ส่วนที่เป็นของผู้ถือหุ้นบริษัทใหญ่ หรือ กำไร(ขาดทุน)ต่อหุ้นขั้นพื้นฐาน หรือ ขาดทุนต่อหุ้นขั้นพื้นฐาน(บาท) หรือ กำไรส่วนที่เป็นของผู้ถือหุ้นของบริษัท(บาทต่อหุ้น) หรือ กำไรส่วนที่เป็นของผู้ถือหุ้นของบริษัทฯ หรือ รวมกำไร(ขาดทุน)ต่อหุ้นขั้นพื้นฐาน
F6,480200,594,318,313,0,กำไร (ขาดทุน) ต่อหุ้นปรับลด (บาท/หุ้น),Diluted Earnings (Loss) Per Share (Baht/Share),No,,B,N,123,PL,กำไรต่อหุ้น,,,,,,,,หมายถึง ส่วนกำไรหรือขาดทุนต่อหุ้นปรับลดที่เป็นของผู้ถือหุ้นสามัญของบริษัทใหญ่ ซึ่งมีการปรับปรุงกำไรหรือขาดทุนที่เป็นของผู้ถือหุ้นสามัญของบริษัทใหญ่และจำนวนถัวเฉลี่ยถ่วงน้ำหนักของหุ้นสามัญที่ถือโดยผู้ถือหุ้น ด้วยผลกระทบที่เกี่ยวข้องกับตราสารที่อาจเปลี่ยนเป็นหุ้นสามัญ ที่อาจก่อให้เกิดการลดลงของกำไรต่อหุ้น โดยวิธีการคำนวณให้เป็นไปตามที่กำหนดในมาตรฐานการรายงานทางการเงินที่เกี่ยวข้อง,กำไรต่อหุ้นปรับลดกำไรส่วนที่เป็นของผู้ถือหุ้นของบริษัทฯ หรือ ขาดทุนต่อหุ้นปรับลด หรือ กำไร(ขาดทุน)ต่อหุ้นปรับลด
F6,510000,T16,319,314,0,เงินสดสุทธิจากกิจกรรมดำเนินงาน,Net Cash From Operating Activities,No,,B Fix,T,,CF,กระแสเงินสดจากการดำเนินงาน,,,,,,,,,
F6,510100,600,320,315,0,กำไร (ขาดทุน) สุทธิสำหรับงวด / ของบริษัทใหญ่,Net Profit (Loss) Attributable To Owners Of The Parent For The Period,519997,1,,N,123,CF,กระแสเงินสดจากการดำเนินงาน,,,,,,,,,กำไรสำหรับงวด หรือ ขาดทุนสำหรับงวด หรือ กำไรก่อนภาษีเงินได้ หรือ กำไร(ขาดทุน)สำหรับงวด หรือ กำไรก่อนภาษี หรือ กำไร(ขาดทุน)สำหรับงวดจากการดำเนินงานต่อเนื่อง หรือ กำไร(ขาดทุน)ก่อนภาษีเงินได้
F6,510200,601,321,316,0,กำไร (ขาดทุน) ก่อนต้นทุนทางการเงิน และ/หรือ ภาษีเงินได้,Profit (Loss) Before Finance Costs And/Or Income Tax Expense,519997,1,,N,123,CF,กระแสเงินสดจากการดำเนินงาน,,,,,,,,,กำไร(ขาดทุน)ก่อนภาษีเงินได้ หรือ กำไร(ขาดทุน)ก่อนภาษี หรือ กำไรก่อนภาษีเงินได้ หรือ กำไรก่อนภาษีเงินได้สำหรับงวด หรือ ขาดทุนก่อนภาษี หรือ กำไร(ขาดทุน)ก่อนรายได้(ค่าใช้จ่าย)ภาษีเงินได้ หรือ กำไรก่อนภาษี หรือ ขาดทุนก่อนรายได้(ค่าใช้จ่าย)ภาษีเงินได้
F6,510300,625,322,317,0,ค่าเสื่อมราคาและค่าตัดจำหน่าย,Depreciation And Amortisation,519997,1,,N,123,CF,รายการปรับกระทบกำไรจากการดำเนินงานก่อนภาษีเงินได้,"- แสดงผลใน Company Highlight & Fact Sheet
- ใช้ในการคำนวณ EBITDA","- Displayed in the Company Highlight & Fact Sheet
- For calculation of EBITDA",,,,,,,
F6,510310,626,323,318,1,ค่าเสื่อมราคา,Depreciation,510300,1,,N,123,CF,รายการปรับกระทบกำไรจากการดำเนินงานก่อนภาษีเงินได้,รวมถึง ค่าสูญสิ้น,Include depletion,,,,,,,-ค่าเสื่อมราคา
F6,510320,627,324,319,1,ค่าตัดจำหน่าย,Amortisation,510300,1,,N,123,CF,รายการปรับกระทบกำไรจากการดำเนินงานก่อนภาษีเงินได้,เฉพาะสินทรัพย์ไม่มีตัวตน,Only for intangible assets,,,,,,,ค่าตัดจำหน่ายสวนไม้เศรษฐกิจ หรือ -ค่าตัดจำหน่าย หรือ ค่าใช้จ่ายตัดบัญชี หรือ ค่าตัดจำหน่ายสินทรัพย์ไม่มีตัวตน
F6,510400,628,325,320,0,(โอนกลับ) ผลขาดทุนด้านเครดิตที่คาดว่าจะเกิดขึ้น,(Reversal Of) Expected Credit Losses,519997,1,,N,123,CF,รายการปรับกระทบกำไรจากการดำเนินงานก่อนภาษีเงินได้,,,,,,,,,(กลับรายการ)ผลขาดทุนด้านเครดิตที่คาดว่าจะเกิดขึ้น หรือ ค่าเผื่อการด้อยค่าของเงินมัดจำ หรือ ค่าเผื่อผลขาดทุนด้านเครดิตที่คาดว่าจะเกิดขึ้น(โอนกลับ) หรือ ลูกหนี้สัญญาเช่าเงินทุน(โอนกลับ) หรือ ค่าเผื่อผลขาดทุนด้านเครดิตที่คาดว่าจะเกิดขึ้น หรือ กลับรายการค่าเผื่อผลขาดทุนด้านเครดิตลูกหนี้การค้า-สุทธิ หรือ โอนกลับค่าเผื่อผลขาดทุนด้านเครดิตที่คาดว่าจะเกิดขึ้น หรือ โอนกลับผลขาดทุนด้านเครดิตที่คาดว่าจะเกิดขึ้น หรือ ค่าเผื่อการด้อยค่าของเงินมัดจำ(โอนกลับ) หรือ หนี้สูญและผลขาดทุนด้านเครดิต(กลับรายการ) หรือ (โอนกลับ)ขาดทุนด้านเครดิตที่คาดว่าจะเกิดขึ้นของลูกหนี้ หรือ หนี้สูญ หรือ ค่าเผื่อผลขาดทุนด้านเครดิตที่คาดว่าจะเกิดขึ้นสำหรับลูกหนี้การค้า(โอนกลับ) หรือ ของลูกหนี้การค้าและลูกหนี้อื่น หรือ ผลขาดทุนด้านเครดิตที่คาดว่าจะเกิดขึ้น หรือ ค่าเผื่อผลขาดทุนที่คาดว่าจะเกิดขึ้นเพิ่มขึ้น(โอนกลับ) หรือ กลับรายการค่าเผื่อผลขาดทุนด้านเครดิต หรือ ลูกหนี้ตามสัญญาเช่าเงินทุน หรือ ค่าเผื่อผลขาดทุนด้านเครดิตที่คาดว่าจะเกิดขึ้นเพิ่มขึ้น(กลับรายการ) หรือ ที่คาดว่าจะเกิดขึ้น(กลับรายการ) หรือ ผลขาดทุนด้านเครดิตที่คาดว่าจะเกิดขึ้น(โอนกลับ) หรือ ค่าเผื่อผลขาดทุนด้านเครดิตที่คาดว่าจะเกิดขึ้นสำหรับเงินให้กู้ยืมระยะยาว หรือ (กลับรายการ)ค่าเผื่อผลขาดทุนด้านเครดิตที่คาดว่าจะเกิดขึ้น หรือ ผลขาดทุนด้านเครดิตของลูกหนี้
F6,510500,629,326,321,0,(โอนกลับ) ขาดทุนจากการลดมูลค่าของสินค้าคงเหลือ,(Reversal Of) Loss From Diminution In Value Of Inventories,519997,1,,N,123,CF,รายการปรับกระทบกำไรจากการดำเนินงานก่อนภาษีเงินได้,,,,,,,,,ค่าเผื่อการปรับลดเป็นมูลค่าสุทธิที่จะได้รับของสินค้าคงเหลือ(โอนกลับ) หรือ การปรับลดสินค้าเป็นมูลค่าสุทธิที่จะได้รับ หรือ การปรับลดสินค้าคงเหลือเป็นมูลค่าสุทธิที่จะได้รับ หรือ ผลขาดทุนจากการลดมูลค่าสินค้าคงเหลือ(โอนกลับ) หรือ (กลับรายการ)ผลขาดทุนจากค่าเผื่อด้านเครดิตและค่าเผื่อการด้อยค่า หรือ -(กลับรายการ)ค่าเผื่อสินค้าเสื่อมสภาพและล้าสมัย หรือ (กำไร)ขาดทุนจากการปรับมูลค่าสินค้าคงเหลือ หรือ ขาดทุนจากการลดมูลค่าของสินค้าคงเหลือ หรือ กลับรายการค่าเผื่อมูลค่าสินค้าลดลง หรือ ขาดทุน(กลับรายการ)จากการปรับมูลค่าสินค้า หรือ ค่าเผื่อการลดมูลค่าสินค้าเสื่อมสภาพ หรือ ขาดทุนจากการปรับมูลค่าสินค้า หรือ ขาดทุนจากการลดมูลค่าสินค้า(โอนกลับ) หรือ (โอนกลับ)ขาดทุนจากการปรับมูลค่าสินค้า หรือ -ค่าเผื่อการลดมูลค่าสินค้าคงเหลือ(กลับรายการ) หรือ กลับรายการขาดทุนจากการปรับลดมูลค่าสินค้าคงเหลือ หรือ ขาดทุน(กลับรายการ)จากสินค้าและวัสดุอื่นล้าสมัย หรือ (กลับรายการ)ค่าเผื่อการลดมูลค่าของสินค้าคงเหลือ หรือ (กลับรายการ)ขาดทุนจากการปรับลดมูลค่าสินค้าคงเหลือ หรือ กลับรายการขาดทุนจากการลดมูลค่าสินค้าคงเหลือ หรือ การปรับลดสินค้าคงเหลือเป็นมูลค่าสุทธิที่จะได้รับ(โอนกลับ) หรือ สินค้าคงเหลือ หรือ การปรับลดมูลค่าสินค้าคงเหลือเป็นมูลค่าสุทธิที่จะได้รับ(กลับรายการ) หรือ เป็นมูลค่าสุทธิที่จะได้รับ(โอนกลับ) หรือ ค่าเผื่อการลดมูลค่าของสินค้า หรือ ขาดทุนจากการปรับลดมูลค่าสินค้า(กลับรายการ) หรือ ค่าเผื่อการลดลงของมูลค่าสินค้าคงเหลือ(โอนกลับ) หรือ ค่าเผื่อมูลค่าสินค้าลดลง(กลับรายการ) หรือ การปรับลดราคาทุนของสินค้าคงเหลือเป็นมูลค่าสุทธิที่จะได้รับ(โอนกลับ) หรือ (กลับรายการ)ขาดทุนจากการปรับมูลค่าสินค้า
F6,510600,630,327,322,0,ส่วนแบ่ง (กำไร) ขาดทุนจากเงินลงทุนตามวิธีส่วนได้เสีย,Share Of (Profit) Loss From Investments Accounted For Using The Equity Method,519997,1,,N,123,CF,รายการปรับกระทบกำไรจากการดำเนินงานก่อนภาษีเงินได้,,,,,,,,,ส่วนแบ่งกำไรจากบริษัทร่วม หรือ ส่วนแบ่งกำไรของบริษัทร่วมที่ใช้วิธีส่วนได้เสีย หรือ โอนกลับผลขาดทุนด้านเครดิตที่คาดว่าจะเกิดขึ้น หรือ ส่วนแบ่ง(กำไร)ขาดทุนจากเงินลงทุนในบริษัทร่วม หรือ -ส่วนแบ่งผลกำไรจากเงินลงทุนในบริษัทร่วมและการร่วมค้า หรือ ส่วนแบ่งขาดทุน(กำไร)จากเงินลงทุนในการร่วมค้า หรือ (สุทธิจากภาษี) หรือ ส่วนแบ่งกำไรของเงินลงทุนในบริษัทร่วมที่ใช้วิธีส่วนได้เสีย(สุทธิจากภาษีเงินได้) หรือ ส่วนแบ่งผลกำไร(ขาดทุน)ของส่วนได้เสียที่ไม่มีอำนาจควบคุม หรือ ส่วนแบ่งขาดทุน(กำไร)จากเงินลงทุนในบริษัทร่วม หรือ ส่วนแบ่ง(กำไร)ขาดทุนจากเงินลงทุนในบริษัทร่วมและการร่วมค้า หรือ ส่วนแบ่งขาดทุนจากเงินลงทุนในบริษัทร่วม หรือ ส่วนแบ่งกำไรของบริษัทร่วมที่ใช้วิธีส่วนได้เสีย(สุทธิจากภาษี) หรือ ส่วนแบ่งขาดทุนจากเงินลงทุนในการร่วมค้า หรือ และการร่วมค้า หรือ ส่วนแบ่งกำไรจากเงินลงทุนในบริษัทย่อยและบริษัทร่วม หรือ ส่วนแบ่ง(กำไร)ขาดทุนของการร่วมค้าและบริษัทร่วม หรือ ส่วนแบ่งกำไรของเงินลงทุนในบริษัทร่วม หรือ ส่วนแบ่งกำไรจากเงินลงทุนในบริษัทร่วม หรือ ส่วนแบ่ง(กำไร)จากเงินลงทุนในบริษัทร่วมและการร่วมค้า หรือ ส่วนแบ่งกำไรจากเงินลงทุนในการร่วมค้า
F6,510700,631,328,323,0,การจ่ายโดยใช้หุ้นเป็นเกณฑ์,Share-Based Payments,519997,1,,N,123,CF,รายการปรับกระทบกำไรจากการดำเนินงานก่อนภาษีเงินได้,,,,,,,,,
F6,510800,632,329,324,0,(กำไร) ขาดทุนจากอัตราแลกเปลี่ยน,(Gains) Losses On Foreign Currency Exchange,519997,1,,N,123,CF,รายการปรับกระทบกำไรจากการดำเนินงานก่อนภาษีเงินได้,,,,,,,,,ขาดทุนจากการแปลงค่าเงินตราต่างประเทศ
F6,510900,633,330,325,0,(กำไร) ขาดทุนจากการขายเงินลงทุนในบริษัทย่อย บริษัทร่วม และการร่วมค้า,"(Gains) Losses On Disposal Of Investment In Subsidiaries, Associates And Joint Ventures",519997,1,,N,123,CF,รายการปรับกระทบกำไรจากการดำเนินงานก่อนภาษีเงินได้,,,,,,,,,ขาดทุนจากการชำระบัญชีของบริษัทย่อย หรือ กำไรจากการเปลี่ยนสถานะเงินลงทุนในบริษัทย่อยเป็นเงินลงทุนในการร่วมค้า หรือ กำไรจากการจำหน่ายเงินลงทุนในบริษัทย่อย
F6,511000,634,331,326,0,(กำไร) ขาดทุนจากการขายเงินลงทุนอื่น,(Gains) Losses On Disposal Of Other Investments,519997,1,,N,123,CF,รายการปรับกระทบกำไรจากการดำเนินงานก่อนภาษีเงินได้,,,,,,,,,กำไรจากการจำหน่ายสินทรัพย์ทางการเงินหมุนเวียนอื่น หรือ กำไรจากการจำหน่ายเงินลงทุน หรือ กำไรจากการขายสินทรัพย์ทางการเงินหมุนเวียนอื่น หรือ ขาดทุน(กำไร)จากการจำหน่ายสินทรัพย์ทางการเงินหมุนเวียนอื่น หรือ กำไรจากการจำหน่ายสินทรัพย์ทางการเงินไม่หมุนเวียนอื่น
