form_no,set_code,dm_code,running_number,reference_no,indent,item_in_taxonomy,item_in_taxonomy_en,parent_code,parent_code_operation,formating,data_type,symbol,financial_statement_type,fs_category,description_th,description_en,opposite_code_short,mandatory_mapping,zone_code,warning_mapping_msg_th,warning_mapping_msg_en,meaning_of_taxonomy,historical_name
F6,319911,376,210,206,2,ส่วนเกิน (ต่ำกว่า) ทุนจากหุ้นทุนซื้อคืน,Surplus (Deficits) From Treasury Shares,319910,1,,N,123,BS_OE,ส่วนของผู้ถือหุ้น,,,,,,,,หมายถึง ผลต่างจากการที่บริษัทสามารถจำหน่ายหรือออกหุ้นทุนซื้อคืนในมูลค่าที่สูงกว่า (ต่ำกว่า) ราคาทุนที่บริษัทซื้อหุ้นทุนกลับคืนมา ทั้งนี้ ส่วนเกิน (ต่ำกว่า) ทุน หุ้นทุนซื้อคืนต้องเป็นยอดสุทธิจากส่วนต่ำกว่า (ส่วนเกิน) ทุนจากหุ้นทุนซื้อคืนประเภทเดียวกัน,ส่วนเกินทุนหุ้นทุนซื้อคืนของบริษัทร่วม หรือ ส่วนเกินทุนหุ้นทุนซื้อคืน
F6,319912,377,211,207,2,ส่วนเกินทุนจากการตีราคาสินทรัพย์ถาวร,Surplus From Revaluation Of Fixed Assets,319910,1,,N,23,BS_OE,ส่วนของผู้ถือหุ้น,,,,,,,,หมายถึง ส่วนเกินทุนจากการตีราคาของสินทรัพย์ถาวร ซึ่งแสดงเป็นยอดสุทธิจากจำนวนที่ลดลงจากส่วนเกินทุนจากการตีราคา,องค์ประกอบอื่นของส่วนของผู้ถือหุ้น
F6,319913,378,212,208,2,ส่วนเกิน (ต่ำกว่า) ทุนจากการวัดมูลค่าเงินลงทุนในตราสารหนี้ด้วยมูลค่ายุติธรรมผ่านกำไรขาดทุนเบ็ดเสร็จอื่น,Surplus (Deficits) From Measurement Of Investment In Debt Instruments Through Other Comprehensive Income,319910,1,,N,123,BS_OE,ส่วนของผู้ถือหุ้น,,,,,,,,หมายถึง ส่วนต่างระหว่างมูลค่าที่คำนวณตามวิธีราคาทุนตัดจำหน่ายกับมูลค่ายุติธรรมของเงินลงทุนในตราสารหนี้ที่รับรู้ผ่านกำไรขาดทุนเบ็ดเสร็จอื่น,
F6,319914,379,213,209,2,ส่วนเกิน (ต่ำกว่า) ทุนจากการวัดมูลค่าเงินลงทุนในตราสารทุนด้วยมูลค่ายุติธรรมผ่านกำไรขาดทุนเบ็ดเสร็จอื่น,Surplus (Deficits) From Measurement Of Investment In Equity Instruments Through Other Comprehensive Income,319910,1,,N,123,BS_OE,ส่วนของผู้ถือหุ้น,,,,,,,,หมายถึง ส่วนต่างระหว่างราคาทุนกับมูลค่ายุติธรรมของเงินลงทุนในตราสารทุนที่วัดมูลค่าด้วยมูลค่ายุติธรรมผ่านกำไรขาดทุนเบ็ดเสร็จอื่น,
F6,319915,380,214,210,2,ส่วนเกิน (ต่ำกว่า) ทุนจากหนี้สินทางการเงินที่กำหนดให้วัดมูลค่ายุติธรรมผ่านกำไรขาดทุนอันเนื่องมาจากความเสี่ยงด้านเครดิต,Surplus (Deficits) From Changes In Own Credit Risk Of Financial Liabilities Designated At Fair Value Through Profit Or Loss,319910,1,,N,123,BS_OE,ส่วนของผู้ถือหุ้น,เฉพาะในส่วนที่เกิดจากการเปลี่ยนแปลงด้านเครดิต,Only the portion of changes in own credit risk,,,,,,หมายถึง ส่วนที่เกิดจากการเปลี่ยนแปลงในมูลค่ายุติธรรมของหนี้สินทางการเงิน เฉพาะในส่วนที่เกิดจากการเปลี่ยนแปลงด้านเครดิต,
F6,319916,381,215,211,2,ส่วนเกิน (ต่ำกว่า) ทุนจากการรวมธุรกิจภายใต้การควบคุมเดียวกัน,Surplus (Deficits) From Business Combinations Under Common Control,319910,1,,N,123,BS_OE,ส่วนของผู้ถือหุ้น,,,,,,,,หมายถึง ส่วนต่างระหว่างจำนวนที่จ่ายไปเพื่อการรวมธุรกิจภายใต้การควบคุมเดียวกัน (ซึ่งคือผลรวมของมูลค่ายุติธรรมของสินทรัพย์ที่ให้ไป หนี้สินที่เกิดขึ้นหรือรับมา และตราสารทุนที่ออกโดยผู้ซื้อ ณ วันที่มีการแลกเปลี่ยนเพื่อให้ได้มาซึ่งการควบคุม) กับส่วนได้เสียของผู้ซื้อในมูลค่าตามบัญชีของกิจการที่ถูกนำมารวม ซึ่งรับรู้โดยตรงในส่วนของเจ้าของ,ส่วนต่ำจากการรวมธุรกิจภายใต้การควบคุมเดียวกัน หรือ ผลต่างจากการรวมธุรกิจภายใต้การควบคุมเดียวกัน หรือ ส่วนต่ำกว่าทุนจากการรวมธุรกิจภายใต้การควบคุมเดียวกัน หรือ ภายใต้การควบคุมเดียวกัน หรือ ส่วนต่างจากการรวมธุรกิจภายใต้การควบคุมเดียวกัน
F6,319917,382,216,212,2,ส่วนเกิน (ต่ำกว่า) ทุนจากการทำสัญญาป้องกันความเสี่ยงจากกระแสเงินสด,Surplus (Deficits) From Cash Flow Hedges,319910,1,,N,123,BS_OE,ส่วนของผู้ถือหุ้น,เฉพาะส่วนที่มีประสิทธิผล,Only effective portion,,,,,,หมายถึง ผลสะสมของกำไร (ขาดทุน) จากการวัดมูลค่ายุติธรรมเครื่องมือที่ใช้ในการป้องกันความเสี่ยงในกระแสเงินสด เฉพาะส่วนที่มีประสิทธิผล,
F6,319921,386,217,213,2,ส่วนเกิน (ต่ำกว่า) ทุนจากการเปลี่ยนแปลงส่วนได้เสียในความเป็นเจ้าของในบริษัทย่อย,Surplus (Deficits) From Changes In Interest In Subsidiaries,319910,1,,N,123,BS_OE,ส่วนของผู้ถือหุ้น,สำหรับรายการที่บริษัทใหญ่ไม่ได้สูญเสียการควบคุมในบริษัทย่อย (รายการกับเจ้าของในฐานะที่เป็นเจ้าของ),For the transaction that the parent company does not lose control in the subsidiary (transaction with equity owners),,,,,,หมายถึง ส่วนต่างระหว่างมูลค่ายุติธรรมของจำนวนที่จ่ายไปหรือรับมา  และสัดส่วนของส่วนได้เสียที่ไม่มีอำนาจควบคุมที่ลดลงหรือเพิ่มขึ้น สำหรับรายการที่บริษัทใหญ่ไม่ได้สูญเสียการควบคุมในบริษัทย่อย (รายการกับเจ้าของในฐานะที่เป็นเจ้าของ) ,ส่วนเกินทุนจากการเปลี่ยนแปลงส่วนได้เสียในบริษัทย่อย หรือ ในบริษัทย่อย หรือ ส่วนเกินกว่าทุนจากการเปลี่ยนแปลงสัดส่วนการถือหุ้นในบริษัทย่อย หรือ ส่วนเกินทุนจากการเปลี่ยนแปลงสัดส่วนการถือหุ้นในบริษัทย่อย หรือ ส่วนต่ำจากการเปลี่ยนแปลงสัดส่วนการถือหุ้นในบริษัทย่อย
F6,319919,384,218,214,2,ส่วนเกิน (ต่ำกว่า) ทุน - อื่น ๆ,Surplus (Deficits) - Others,319910,1,,N,123,BS_OE,ส่วนของผู้ถือหุ้น,,,,,,,,หมายถึง ส่วนเกิน (ต่ำกว่า) ทุน รายการอื่น ๆ นอกเหนือจากเลขอ้างอิงที่ 206 ถึง 213,ส่วนเกิน(ต่ำกว่า)ทุนอื่น หรือ ส่วนเกินทุนจากการควบบริษัท
F6,319920,385,219,215,1,ส่วนของทุนที่เกิดจากรายการจ่ายโดยใช้หุ้นเป็นเกณฑ์,Share-Based Payment Transactions,319900,1,,N,23,BS_OE,ส่วนของผู้ถือหุ้น,,,,,,,,หมายถึง การเพิ่มขึ้นของส่วนของเจ้าของสำหรับการจ่ายโดยใช้หุ้นเป็นเกณฑ์ประเภทการจ่ายชำระด้วยตราสารทุน (Equity-settled share-based payments),ส่วนเกินจากการจ่ายโดยใช้หุ้นเป็นเกณฑ์ หรือ ส่วนเกินทุนจากการจ่ายโดยใช้หุ้นเป็นเกณฑ์ หรือ ส่วนทุนจากการจ่ายโดยใช้หุ้นเป็นเกณฑ์
F6,319930,387,220,216,1,ส่วนของทุนที่เกิดจากรายการการซื้อธุรกิจแบบย้อนกลับ,Reverse Acquisitions,319900,1,,N,123,BS_OE,ส่วนของผู้ถือหุ้น,,,,,,,,หมายถึง ส่วนของทุนที่เกิดจากการที่บริษัทมีการซื้อธุรกิจแบบย้อนกลับ (ซึ่งคือผู้ซื้อตามกฎหมาย ซึ่งในหลายกรณีคือบริษัทที่จัดทำงบการเงินรวมนั้นเอง จะรับรู้รายการประหนึ่งว่า บริษัทที่เป็นผู้ซื้อนั้นคือบริษัทผู้ถูกซื้อตามกฎหมาย หรือเป็นบริษัทผู้ซื้อทางบัญชี ทำรายการซื้อกิจการของผู้ซื้อทางกฎหมาย หรือผู้ถูกซื้อทางบัญชี) ส่วนต่างที่เกิดขึ้นจะรับรู้เป็นส่วนของทุนที่เกิดจากรายการการซื้อธุรกิจแบบย้อนกลับ,
F6,319940,388,221,217,1,เงินรับล่วงหน้าค่าหุ้น,Share Subscription Received In Advance,319900,1,,N,23,BS_OE,ส่วนของผู้ถือหุ้น,,,,,,,,หมายถึง เงินหรือมูลค่าของสิ่งตอบแทนที่ได้รับล่วงหน้าจากผู้ลงทุนเพื่อจ่ายชำระค่าหุ้น,
F6,319950,389,222,218,1,ผลต่างอัตราแลกเปลี่ยนจากการแปลงค่างบการเงิน,Currency Translation Adjustments,319900,1,,N,123,BS_OE,ส่วนของผู้ถือหุ้น,รวมผลจากการป้องกันความเสี่ยงในเงินลงทุนสุทธิในหน่วยงานต่างประเทศ เฉพาะส่วนที่มีประสิทธิผลในหน่วยงานในต่างประเทศ,Include effective portion of net investment hedge of foreign operations,,,,,,หมายถึง ผลต่างของอัตราแลกเปลี่ยนจากการแปลงค่างบการเงินที่เป็นเงินตราต่างประเทศของหน่วยงานในต่างประเทศ ซึ่งรวมผลจากการป้องกันความเสี่ยงในเงินลงทุนสุทธิในหน่วยงานต่างประเทศ เฉพาะส่วนที่มีประสิทธิผลในหน่วยงานในต่างประเทศ หมายถึง บริษัทย่อย บริษัทร่วม การร่วมค้า หรือสาขาของบริษัทที่เสนอรายงาน ซึ่งมีกิจกรรมหรือการประกอบกิจกรรมในประเทศอื่น หรือในสกุลเงินอื่น นอกจากประเทศหรือสกุลเงินของบริษัทที่เสนอรายงาน,
F6,319990,390,223,219,1,องค์ประกอบอื่นของส่วนของผู้ถือหุ้น - อื่นๆ,Other Components Of Equity - Others,319900,1,,N,123,BS_OE,ส่วนของผู้ถือหุ้น,,,,,,,,หมายถึง ส่วนได้เสียอื่นในความเป็นเจ้าของในบริษัทของผู้ลงทุน และส่วนของทุนอื่น ๆ นอกเหนือจากเลขอ้างอิงที่ 205 ถึง 219,ในบริษัทย่อย หรือ องค์ประกอบอื่นของส่วนของผู้ถือหุ้น หรือ องค์ประกอบอื่นของส่วนของเจ้าของ หรือ โดยไม่สูญเสียการควบคุม หรือ โดยไม่สูญเสียอำนาจควบคุม หรือ รวมองค์ประกอบอื่นของส่วนของผู้ถือหุ้น
F6,319999,397,224,220,0,รวมส่วนของผู้ถือหุ้นของบริษัทใหญ่,Equity Attributable To Owners Of The Parent,309998,1,B,NV,123,BS_OE,ส่วนของผู้ถือหุ้น,,,,,,,,รวมส่วนของผู้ถือหุ้นของบริษัทใหญ่ เป็นรายการสุทธิของเลขอ้างอิงที่ 185 ถึง 219,ส่วนของผู้ถือหุ้นของบริษัทใหญ่ หรือ รวมส่วนของผู้เป็นเจ้าของของบริษัท หรือ ส่วนของผู้ถือหุ้นของบริษัทฯ หรือ รวมส่วนของผู้ถือหุ้นบริษัทใหญ่ หรือ รวมส่วนของผู้ถือหุ้นของบริษัท หรือ ส่วนของผู้ถือหุ้นของบริษัท หรือ ส่วนของผู้ถือหุ้นบริษัท หรือ รวมส่วนของบริษัทใหญ่ หรือ รวมส่วนของผู้ถือหุ้น
F6,320130,355,225,221,0,ส่วนได้เสียที่ไม่มีอำนาจควบคุม,Non-Controlling Interests,309998,1,,N,123,BS_OE,ส่วนของผู้ถือหุ้น,ใช้ในการคำนวณ Enterprise Value: EV,For calculation of Enterprise Value: EV,,,,งบการเงินเฉพาะกิจการไม่ควรมีค่า,Should have no value in Separate financial statements.,หมายถึง ส่วนได้เสียในบริษัทย่อยที่ไม่ได้เป็นส่วนได้เสียของบริษัทใหญ่ ทั้งทางตรงและทางอ้อม เช่น บริษัทย่อยในลำดับถัดไป,ส่วนของส่วนได้เสียที่ไม่มีอำนาจควบคุม หรือ ส่วนได้เสียที่ไม่อยู่ในอำนาจควบคุมในบริษัทย่อย หรือ ของบริษัทย่อย หรือ ส่วนของผู้มีส่วนได้เสียที่ไม่มีอำนาจควบคุมของบริษัทย่อย
F6,309998,398,226,222,0,รวมส่วนของผู้ถือหุ้น,Total Equity,309999,1,BU,NV,123,BS_OE,ส่วนของผู้ถือหุ้น,"ใช้ในการคำนวณ Debt/Equity Ratio, Return on Equity, BVPS","For calculation of Debt/Equity Ratio, Return on Equity, BVPS",,,Y,,,รวมส่วนของผู้ถือหุ้น เป็นผลรวมของเลขอ้างอิงที่ 220 ถึง 221,รวมส่วนของเจ้าของ
F6,309999,399,227,223,0,รวมหนี้สินและส่วนของผู้ถือหุ้น,Total Liabilities And Equity,No,,BU,NV,23,BS_OE,หนี้สินและส่วนของผู้ถือหุ้น,,,,,,,,รวมหนี้สินและส่วนของผู้ถือหุ้น เป็นผลรวมของเลขอ้างอิงที่ 183 และ 223,รวมหนี้สินและส่วนของเจ้าของ
F6,400000,T8,228,224,0,งบกำไรขาดทุนเบ็ดเสร็จ,Statement Of Comprehensive Income,No,,B Fix,T,,PL,กำไร (ขาดทุน),,,,,,,,งบกำไรขาดทุนเบ็ดเสร็จ ประกอบด้วยเลขอ้างอิงที่ 225 ถึง 313,
F6,410000,T9,229,225,0,รายได้,Revenue,No,,B Fix,T,,PL,กำไร (ขาดทุน),,,,,,,,รายได้ ประกอบด้วยเลขอ้างอิงที่ 226 ถึง 240,
F6,410100,400,230,226,0,รายได้จากการดำเนินธุรกิจ,Revenue From Operations,419999,1,,R,23,PL,กำไร (ขาดทุน),"ใช้ในการคำนวณ Account Receivable Turnover, Gross Profit Margin","For calculation of Account Receivable Turnover, Gross Profit Margin",,,,,,"หมายถึง รายได้ซึ่งเกิดจากกิจกรรมตามปกติธุรกิจของบริษัท เช่น รายได้ที่เกิดจากการขายสินค้าหรือการให้บริการซึ่งเป็นธุรกิจหลักของบริษัทเพื่อแลกเปลี่ยนกับเงินสด หรือสิทธิเรียกร้องให้ชำระเงิน หรือสิ่งอื่นใดที่มีมูลค่าคิดเป็นเงินได้ โดยให้แยกแสดงเป็นรายได้หลักแต่ละประเภท เช่น รายได้จากการขายสินค้า รายได้จากการให้บริการ รายได้ค่าสิทธิ เป็นต้น 

รายได้จากการดำเนินธุรกิจ ประกอบด้วยเลขอ้างอิงที่ 227 ถึง 235",
F6,410101,401,231,227,1,รายได้จากการขายและให้บริการ,Revenue From Sales And Rendering Services,410100,1,,N,23,PL,กำไร (ขาดทุน),,,,,,,,หมายถึง รายได้ที่เกิดจากการขายสินค้าและให้บริการของบริษัท,รายได้จากการขายสินค้าและการให้บริการ หรือ ขายและรายได้จากงานติดตั้ง-สุทธิ หรือ รายได้จากการขายและการให้บริการ หรือ รายได้จากการขายสินค้า หรือ รายได้จากสัญญาที่ทำกับลูกค้า หรือ รายได้จากการขายและบริการ
F6,410102,402,232,228,1,รายได้จากการขาย,Revenue From Sales,410100,1,,N,23,PL,กำไร (ขาดทุน),,,,,,,,หมายถึง รายได้ที่เกิดจากการขายสินค้า,รายได้จากการขายสินค้า หรือ รายได้จากการขายอสังหาริมทรัพย์ หรือ รายได้จากการจำหน่ายสินค้า หรือ รายได้จากการขาย-ยานยนต์ไฟฟ้า หรือ เงินชดเชยจากการจำหน่ายก๊าซปิโตรเลียมเหลวและน้ำมัน หรือ รายได้จากการขาย-น้ำมัน หรือ รายได้จากการจำหน่ายสินค้าอุตสาหกรรม
F6,410103,403,233,229,1,รายได้จากการให้บริการ,Revenue From Rendering Services,410100,1,,N,23,PL,กำไร (ขาดทุน),,,,,,,,หมายถึง รายได้ที่เกิดจากการให้บริการ,รายได้จากการบริหารจัดการ หรือ รายได้จากการก่อสร้าง หรือ รายได้จากธุรกิจไฟฟ้าและโทรคมนาคม หรือ รายได้ค่าบริการ หรือ รายได้จากการรับจ้างผลิต หรือ รายได้จากธุรกิจโทรคมนาคมในต่างประเทศ หรือ รายได้ค่าก่อสร้าง หรือ รายได้จากการขนส่ง หรือ รายได้ค่าบริการตัดเหล็ก หรือ รายได้ตามสัญญาก่อสร้าง หรือ รายได้จากการรับเหมาก่อสร้าง หรือ รายได้จากการบริการ หรือ รายได้จากสัญญาก่อสร้าง หรือ รายได้ค่าสาธารณูปโภครับ
