account_name,taxonomy_account_name,account_code,parent_account_code,values
เงินสดและรายการเทียบเท่าเงินสด,เงินสดและรายการเทียบเท่าเงินสด,100100,109999,"['266,716', '266,716']"
เบี้ยประกันภัยค้างรับ,เบี้ยประกันภัยค้างรับ,101200,109999,"['367,614', '367,614']"
รายได้จากการลงทุนค้างรับ,รายได้จากการลงทุนค้างรับ,101300,109999,"['1,323', '1,323']"
สินทรัพย์จากการประกันภัยต่อ,สินทรัพย์จากการประกันภัยต่อ,101400,109999,"['447,974', '447,974']"
ลูกหนี้จากสัญญาประกันภัยต่อ,ลูกหนี้จากสัญญาประกันภัยต่อ,101500,109999,"['1,474', '1,474']"
เงินลงทุนในหลักทรัพย์,เงินลงทุนในหลักทรัพย์,101910,101900,"['704,432', '704,432']"
อสังหาริมทรัพย์เพื่อการลงทุน,อสังหาริมทรัพย์เพื่อการลงทุน,103700,101900,"['60,537', '60,537']"
เงินลงทุนในบริษัทร่วม,เงินลงทุนในบริษัทร่วม,102720,102700,"['42,928', '46,816']"
ที่ดินอาคารและอุปกรณ์,ที่ดินอาคารและอุปกรณ์,103800,109999,"['303,065', '303,065']"
สินทรัพย์ไม่มีตัวตน,สินทรัพย์ไม่มีตัวตน,104100,109999,"['3,431', '3,431']"
สินทรัพย์ภาษีเงินได้รอการตัดบัญชี,สินทรัพย์ภาษีเงินได้รอการตัดบัญชี,104400,109999,"['4,280', '4,280']"
สินทรัพย์อื่น,สินทรัพย์อื่น,109900,109999,"['12,923', '12,923']"
รวมสินทรัพย์,รวมสินทรัพย์,109999,,"['2,216,697', '2,220,585']"
หนี้สินจากสัญญาประกันภัย,หนี้สินจากสัญญาประกันภัย,201200,209999,"['1,053,084', '1,053,084']"
เจ้าหนี้บริษัทประกันภัยต่อ,เจ้าหนี้บริษัทประกันภัยต่อ,201400,209999,"['182,852', '182,852']"
ภาระผูกพันผลประโยชน์พนักงาน,ภาระผูกพันผลประโยชน์พนักงาน,202700,209999,"['17,263', '17,263']"
ค่านายหน้าค้างจ่าย,ค่านายหน้าค้างจ่าย,201600,209999,"['46,984', '46,984']"
หนี้สินตามสัญญาเช่า,หนี้สินตามสัญญาเช่า,202400,209999,"['53,670', '53,670']"
ค่าใช้จ่ายค้างจ่าย,ค่าใช้จ่ายค้างจ่าย,202500,209999,"['64,991', '64,991']"
ภาษีเงินได้ค้างจ่าย,ภาษีเงินได้ค้างจ่าย,203000,209999,"['10,668', '10,668']"
หนี้สินอื่น,หนี้สินอื่น,209900,209999,"['32,294', '32,294']"
รวมหนี้สิน,รวมหนี้สิน,209999,309999,"['1,461,806', '1,461,806']"
หุ้นสามัญ{{number}}หุ้นมูลค่าหุ้นละ{{number}}บาท,หุ้นสามัญ{{number}}หุ้นมูลค่าหุ้นละ{{number}}บาท,310120,310100,"['300,000', '300,000']"
หุ้นสามัญ{{number}}หุ้นมูลค่าหุ้นละ{{number}}บาท,หุ้นสามัญ{{number}}หุ้นมูลค่าหุ้นละ{{number}}บาท,310220,310200,"['299,998', '299,998']"
ส่วนเกินมูลค่าหุ้นสามัญ,ส่วนเกินมูลค่าหุ้นสามัญ,310420,310400,"['86,593', '86,593']"
ทุนสำรองตามกฎหมาย,ทุนสำรองตามกฎหมาย,310611,310610,"['25,541', '25,541']"
ยังไม่ได้จัดสรร,ยังไม่ได้จัดสรร,310620,310600,"['108,363', '113,851']"
องค์ประกอบอื่นของส่วนของเจ้าของ,องค์ประกอบอื่นของส่วนของเจ้าของ,319990,319900,"['234,396', '232,796']"
รวมส่วนของเจ้าของ,รวมส่วนของเจ้าของ,309998,309999,"['754,891', '758,779']"
รวมหนี้สินและส่วนของเจ้าของ,รวมหนี้สินและส่วนของเจ้าของ,309999,,"['2,216,697', '2,220,585']"
เบี้ยประกันภัยรับ,เบี้ยประกันภัยรับ,410126,400299,"['524,112', '524,112']"
หักเบี้ยประกันภัยจ่ายจากการเอาประกันภัยต่อ,หัก เบี้ยประกันภัยจ่ายจากการเอาประกันภัยต่อ,420200,400299,"['(154,262)', '(154,262)']"
เบี้ยประกันภัยรับสุทธิ,,,,"['369,850', '369,850']"
หักสำรองเบี้ยประกันภัยที่ยังไม่ถือเป็นรายได้เพิ่มจากงวดก่อน,หัก สำรองเบี้ยประกันภัยที่ยังไม่ถือเป็นรายได้เพิ่ม (ลด) จากงวดก่อน,420300,400399,"['(103,363)', '(103,363)']"
เบี้ยประกันภัยที่ถือเป็นรายได้สุทธิจากการประกันภัยต่อ,,,,"['266,487', '266,487']"
รายได้ค่าจ้างและค่าบำเหน็จ,รายได้ค่าจ้างและค่าบำเหน็จ,410127,419999,"['16,372', '16,372']"
รายได้จากการลงทุนสุทธิ,รายได้จากการลงทุนสุทธิ,410128,419999,"['8,415', '8,415']"
รายได้อื่น,รายได้อื่น,410200,419999,"['37', '37']"
รายได้ค่าเช่าและค่าบริการ,รายได้ค่าเช่าและค่าบริการ,410200,419999,"['17,030', '17,030']"
รวมรายได้,,,,"['307,283', '308,341']"
ค่าสินไหมทดแทน,ค่าสินไหมทดแทน,420900,429999,"['199,701', '199,701']"
หักค่าสินไหมทดแทนรับคืนจากการประกันภัยต่อ,หักค่าสินไหมทดแทนรับคืนจากการประกันภัยต่อ,421000,429999,"['(67,232)', '(67,232)']"
ค่าจ้างและค่าบำเหน็จ,ค่าจ้างและค่าบำเหน็จ,421100,429999,"['67,373', '67,373']"
ค่าใช้จ่ายในการรับประกันภัยอื่น,ค่าใช้จ่ายในการรับประกันภัยอื่น,421200,429999,"['94,162', '94,162']"
ค่าใช้จ่ายในการดำเนินงาน,ค่าใช้จ่ายในการดำเนินงาน,422100,429999,"['20,164', '20,164']"
ผลขาดทุนด้านเครดิตที่คาดว่าจะเกิดขึ้น(กลับรายการ),(กลับรายการ) ผลขาดทุนด้านเครดิตที่คาดว่าจะเกิดขึ้น,430700,429999,"['(346)', '(346)']"
ค่าใช้จ่ายอื่น-ค่าใช้จ่ายเกี่ยวกับการให้เช่าและบริการ,ค่าใช้จ่ายอื่น-ค่าใช้จ่ายเกี่ยวกับการให้เช่าและบริการ,429800,429999,"['12,145', '12,145']"
รวมค่าใช้จ่าย,,,,"['325,967', '325,967']"
กำไร(ขาดทุน)ก่อนภาษีเงินได้,,,,"['(18,684)', '(17,626)']"
ค่าใช้จ่าย(รายได้)ภาษีเงินได้,ภาษีเงินได้,439800,409995,"['(4,604)', '(4,604)']"
กำไร(ขาดทุน)สุทธิ,กำไร (ขาดทุน) สุทธิ สำหรับงวด,409996,,"['(14,080)', '(13,022)']"
วัดมูลค่ายุติธรรมผ่านกำไรขาดทุนเบ็ดเสร็จอื่น,วัดมูลค่ายุติธรรมผ่านกำไรขาดทุนเบ็ดเสร็จอื่น,441000,409998,"['(14,205)', '(14,205)']"
ภาษีเงินได้เกี่ยวกับองค์ประกอบของกำไรเบ็ดเสร็จอื่นสำหรับรายการที่จัดประเภทรายการใหม่เข้าไปไว้ในกำไรหรือขาดทุนในภายหลัง,ภาษีเงินได้เกี่ยวกับองค์ประกอบของกำไรเบ็ดเสร็จอื่นสำหรับรายการที่จัดประเภทรายการใหม่เข้าไปไว้ในกำไรหรือขาดทุนในภายหลัง,449900,409998,"['2,843', '2,841']"
ประกันภัยสำหรับโครงการผลประโยชน์พนักงาน,ประกันภัยสำหรับโครงการผลประโยชน์พนักงาน,450600,409998,"['374', '374']"
เข้าไปไว้ในกำไรหรือขาดทุนในภายหลัง,เข้าไปไว้ในกำไรหรือขาดทุนในภายหลัง,459900,409998,"['(75)', '(75)']"
ขาดทุนเบ็ดเสร็จอื่นสำหรับงวด-สุทธิจากภาษีเงินได้,กำไร (ขาดทุน) เบ็ดเสร็จอื่น - สุทธิจากภาษี,409998,409999,"['(11,075)', '(11,065)']"
กำไร(ขาดทุน)เบ็ดเสร็จรวมสำหรับงวด,การแบ่งปันกำไร (ขาดทุน) เบ็ดเสร็จรวม : ผู้ถือหุ้นบริษัทใหญ่,470100,,"['(25,155)', '(24,087)']"
กำไร(ขาดทุน)ต่อหุ้นขั้นพื้นฐาน,กำไร(ขาดทุน)ต่อหุ้นขั้นพื้นฐาน,480100,,"['(0.47)', '(0.43)']"
เบี้ยประกันภัยรับ,เบี้ยประกันภัยรับ,410126,400299,"['809,491', '809,491']"
หักเบี้ยประกันภัยจ่ายจากการเอาประกันภัยต่อ,หักเบี้ยประกันภัยจ่ายจากการเอาประกันภัยต่อ,420200,400299,"['(211,738)', '(211,738)']"
เบี้ยประกันภัยรับสุทธิ,เบี้ยประกันภัยรับสุทธิ,400299,400399,"['597,753', '597,753']"
หักสำรองเบี้ยประกันภัยที่ยังไม่ถือเป็นรายได้เพิ่มจากงวดก่อน,หักสำรองเบี้ยประกันภัยที่ยังไม่ถือเป็นรายได้เพิ่มจากงวดก่อน,420300,400399,"['(88,125)', '(88,125)']"
เบี้ยประกันภัยที่ถือเป็นรายได้สุทธิจากการประกันภัยต่อ,เบี้ยประกันภัยที่ถือเป็นรายได้สุทธิจากการประกันภัยต่อ,400399,419999,"['509,628', '509,628']"
รายได้ค่าจ้างและค่าบำเหน็จ,รายได้ค่าจ้างและค่าบำเหน็จ,410127,419999,"['31,535', '31,535']"
รายได้จากการลงทุนสุทธิ,รายได้จากการลงทุนสุทธิ,410128,419999,"['11,332', '11,332']"
ส่วนแบ่งกำไร(ขาดทุน)จากเงินลงทุนในบริษัทร่วม,,,,"['(427)', '-']"
รายได้อื่น,รายได้อื่น,410200,419999,"['641', '641']"
รายได้ค่าเช่าและค่าบริการ,รายได้ค่าเช่าและค่าบริการ,410200,419999,"['34,471', '34,471']"
รวมรายได้,รวมรายได้,419999,409994,"['587,180', '587,607']"
ค่าสินไหมทดแทน,ค่าสินไหมทดแทน,420900,429999,"['342,874', '342,874']"
หักค่าสินไหมทดแทนรับคืนจากการประกันภัยต่อ,หักค่าสินไหมทดแทนรับคืนจากการประกันภัยต่อ,421000,429999,"['(118,007)', '(118,007)']"
ค่าจ้างและค่าบำเหน็จ,ค่าจ้างและค่าบำเหน็จ,421100,429999,"['108,344', '108,344']"
ค่าใช้จ่ายในการรับประกันภัยอื่น,ค่าใช้จ่ายในการรับประกันภัยอื่น,421200,429999,"['164,393', '164,393']"
ค่าใช้จ่ายในการดำเนินงาน,ค่าใช้จ่ายในการดำเนินงาน,422100,429999,"['37,914', '37,914']"
ผลขาดทุนด้านเครดิตที่คาดว่าจะเกิดขึ้น(กลับรายการ),ผลขาดทุนด้านเครดิตที่คาดว่าจะเกิดขึ้น(กลับรายการ),430700,429999,"['(352)', '(352)']"
ค่าใช้จ่ายอื่น-ค่าใช้จ่ายเกี่ยวกับการให้เช่าและบริการ,ค่าใช้จ่ายอื่น-ค่าใช้จ่ายเกี่ยวกับการให้เช่าและบริการ,421200,429999,"['24,979', '24,979']"
รวมค่าใช้จ่าย,รวมค่าใช้จ่าย,429999,409994,"['560,145', '560,145']"
กำไรก่อนภาษีเงินได้,กำไรก่อนภาษีเงินได้,409994,409995,"['27,035', '27,462']"
ค่าใช้จ่ายภาษีเงินได้,ค่าใช้จ่ายภาษีเงินได้,439800,409995,"['4,390', '4,390']"
กำไรสุทธิ,กำไรสุทธิ,460100,,"['22,645', '23,072']"
วัดมูลค่ายุติธรรมผ่านกำไรขาดทุนเบ็ดเสร็จอื่น,วัดมูลค่ายุติธรรมผ่านกำไรขาดทุนเบ็ดเสร็จอื่น,441000,409998,"['(23,218)', '(23,218)']"
ส่วนแบ่งกำไร(ขาดทุน)เบ็ดเสร็จอื่นในบริษัทร่วม,,,,"['(1,253)', '-']"
ภาษีเงินได้เกี่ยวกับองค์ประกอบของกำไร(ขาดทุน)เบ็ดเสร็จอื่นสำหรับรายการที่จัดประเภทรายการใหม่เข้าไปไว้ในกำไรหรือขาดทุนในภายหลัง,ภาษีเงินได้เกี่ยวกับองค์ประกอบของกำไร(ขาดทุน)เบ็ดเสร็จอื่นสำหรับรายการที่จัดประเภทรายการใหม่เข้าไปไว้ในกำไรหรือขาดทุนในภายหลัง,449900,409998,"['4,895', '4,644']"
ประกันภัยสำหรับโครงการผลประโยชน์พนักงาน,ประกันภัยสำหรับโครงการผลประโยชน์พนักงาน,450600,409998,"['419', '419']"
ภาษีเงินได้เกี่ยวกับองค์ประกอบของขาดทุนเบ็ดเสร็จอื่นสำหรับรายการที่ไม่จัดประเภทรายการใหม่เข้าไปไว้ในกำไรหรือขาดทุนในภายหลัง,ภาษีเงินได้เกี่ยวกับองค์ประกอบของขาดทุนเบ็ดเสร็จอื่นสำหรับรายการที่ไม่จัดประเภทรายการใหม่เข้าไปไว้ในกำไรหรือขาดทุนในภายหลัง,459900,409998,"['(84)', '(84)']"
กำไร(ขาดทุน)เบ็ดเสร็จอื่นสำหรับงวด-สุทธิจากภาษีเงินได้,กำไร(ขาดทุน)เบ็ดเสร็จอื่นสำหรับงวด-สุทธิจากภาษีเงินได้,409998,409999,"['(19,241)', '(18,239)']"
กำไรเบ็ดเสร็จรวมสำหรับงวด,กำไร (ขาดทุน) เบ็ดเสร็จรวม สำหรับงวด,409999,,"['3,404', '4,833']"
กำไรต่อหุ้นขั้นพื้นฐาน,กำไรต่อหุ้นขั้นพื้นฐาน,480100,,"['0.75', '0.77']"
เบี้ยประกันภัยรับจากการรับประกันโดยตรง,เบี้ยประกันภัยรับจากการรับประกันโดยตรง,550010,559999,"['572,162', '572,162']"
เงินสดจ่ายเกี่ยวกับการประกันภัยต่อ,เงินสดจ่ายเกี่ยวกับการประกันภัยต่อ,550022,559999,"['(34,615)', '(34,615)']"
ดอกเบี้ยรับ,ดอกเบี้ยรับ,559500,559999,"['5,931', '5,931']"
เงินปันผลรับ,เงินปันผลรับ,559700,559999,"['5,660', '5,660']"
รายได้อื่น,รายได้อื่น,550019,559999,"['640', '640']"
ค่าสินไหมทดแทนจ่ายจากการรับประกันภัยโดยตรง,ค่าสินไหมทดแทนจ่ายจากการรับประกันภัยโดยตรง,550024,559999,"['(194,858)', '(194,858)']"
ค่าจ้างและค่าบำเหน็จจากการรับประกันภัยโดยตรง,ค่าจ้างและค่าบำเหน็จจากการรับประกันภัยโดยตรง,550021,559999,"['(79,174)', '(79,174)']"
ค่าใช้จ่ายในการรับประกันภัยอื่น,ค่าใช้จ่ายในการรับประกันภัยอื่น,550025,559999,"['(152,798)', '(152,798)']"
ค่าใช้จ่ายในการดำเนินงาน,ค่าใช้จ่ายในการดำเนินงาน,550028,559999,"['(45,445)', '(45,445)']"
ค่าใช้จ่าย(รายได้)ภาษีเงินได้,ค่าใช้จ่าย(รายได้)ภาษีเงินได้,555000,559999,"['(4,569)', '(4,569)']"
เงินสดรับจากสินทรัพย์ทางการเงิน,เงินสดรับจากสินทรัพย์ทางการเงิน,550030,559999,"['5,000', '5,000']"
เงินสดจ่ายจากสินทรัพย์ทางการเงิน,เงินสดจ่ายจากสินทรัพย์ทางการเงิน,550040,559999,"['(8,900)', '(8,900)']"
เงินฝากธนาคารที่มีกำหนดจ่ายคืนเกินกว่า{{number}}เดือน,เงินฝากธนาคารที่มีกำหนดจ่ายคืนเกินกว่า{{number}}เดือน,550031,550030,"['11,000', '11,000']"
อสังหาริมทรัพย์เพื่อการลงทุน,อสังหาริมทรัพย์เพื่อการลงทุน,550050,559999,"['19,892', '19,892']"
เงินสดสุทธิได้มาจากกิจกรรมดำเนินงาน,เงินสดสุทธิได้มาจากกิจกรรมดำเนินงาน,559999,509999,"['99,926', '99,926']"
ที่ดินอาคารและอุปกรณ์,ที่ดินอาคารและอุปกรณ์,521710,521700,"['(6,092)', '(6,092)']"
เงินสดสุทธิใช้ไปในกิจกรรมลงทุน,เงินสดสุทธิใช้ไปในกิจกรรมลงทุน,529999,509999,"['(6,092)', '(6,092)']"
เงินสดจ่ายจากสัญญาเช่า,เงินสดจ่ายจากสัญญาเช่า,530500,539999,"['(1,852)', '(1,852)']"
จ่ายปันผล,จ่ายปันผล,539800,539999,"['(30,000)', '(30,000)']"
เงินสดสุทธิใช้ไปในกิจกรรมจัดหาเงิน,เงินสดสุทธิใช้ไปในกิจกรรมจัดหาเงิน,539999,509999,"['(31,852)', '(31,852)']"
เงินสดและรายการเทียบเท่าเงินสดเพิ่มขึ้นสุทธิ,เงินสดและรายการเทียบเท่าเงินสดเพิ่มขึ้นสุทธิ,509999,599999,"['61,982', '61,982']"
เงินสดและรายการเทียบเท่าเงินสดณวันที่{{number}}{{month_one}},เงินสดและรายการเทียบเท่าเงินสดณวันที่{{number}}{{month_one}},599998,599999,"['204,734', '204,734']"
เงินสดและรายการเทียบเท่าเงินสดณวันที่{{number}}{{month_six}},เงินสดและรายการเทียบเท่าเงินสดณวันที่{{number}}{{month_six}},599999,,"['266,716', '266,716']"
