account_name,taxonomy_account_name,account_code,parent_account_code,values
เงินสดและรายการเทียบเท่าเงินสด,เงินสดและรายการเทียบเท่าเงินสด,100100,109999,"['186,255,982', '182,751,329']"
รายได้ค่าธรรมเนียมและบริการค้างรับจากธุรกิจจัดการลงทุน,รายได้ค่าธรรมเนียมและบริการค้างรับจากธุรกิจจัดการลงทุน,101100,109999,"['114,601,760', '114,601,760']"
เงินลงทุนที่ไม่ได้วางเป็นประกัน,เงินลงทุนที่ไม่ได้วางเป็นประกัน,101660,109999,"['979,019,339', '579,283,494']"
เงินลงทุนที่วางเป็นประกัน,เงินลงทุนที่วางเป็นประกัน,101670,109999,"['1,160,000', '1,160,000']"
เงินลงทุนในบริษัทย่อย,เงินลงทุนในบริษัทย่อย,102710,102700,"['-', '500,074,930']"
อาคารและอุปกรณ์,อาคารและอุปกรณ์,103800,109999,"['22,059,515', '22,059,513']"
สินทรัพย์สิทธิการใช้,สินทรัพย์สิทธิการใช้,103900,109999,"['57,186,674', '57,186,674']"
สินทรัพย์ไม่มีตัวตน,สินทรัพย์ไม่มีตัวตน,104100,109999,"['13,580,466', '13,580,464']"
สินทรัพย์ภาษีเงินได้รอการตัดบัญชี,สินทรัพย์ภาษีเงินได้รอการตัดบัญชี,104400,109999,"['65,857,950', '54,989,862']"
สินทรัพย์อื่น,สินทรัพย์อื่น,109900,109999,"['47,313,941', '50,706,991']"
รวมสินทรัพย์,รวมสินทรัพย์,109999,,"['1,487,035,627', '1,576,395,017']"
หนี้สินตามสัญญาเช่า,หนี้สินตามสัญญาเช่า,202400,209999,"['61,678,145', '61,678,145']"
ภาษีเงินได้ค้างจ่าย,ภาษีเงินได้ค้างจ่าย,203000,209999,"['16,090,247', '14,975,477']"
ภาระผูกพันหนี้สินผลประโยชน์พนักงาน,ภาระผูกพันหนี้สินผลประโยชน์พนักงาน,202700,209999,"['109,937,768', '109,937,768']"
ประมาณการหนี้สิน,ประมาณการหนี้สิน,202800,209999,"['1,995,073', '1,995,073']"
ค่าใช้จ่ายค้างจ่าย,ค่าใช้จ่ายค้างจ่าย,202500,209999,"['85,720,052', '85,629,797']"
หนี้สินอื่น,หนี้สินอื่น,209900,209999,"['44,433,100', '44,456,027']"
รวมหนี้สิน,รวมหนี้สิน,209999,309999,"['319,854,385', '318,672,287']"
ทุนจดทะเบียนหุ้นสามัญ{{number}}หุ้นมูลค่าหุ้นละ{{number}}บาท,ทุนจดทะเบียนหุ้นสามัญ{{number}}หุ้นมูลค่าหุ้นละ{{number}}บาท,310120,310100,"['125,615,708', '125,615,708']"
ทุนที่ออกและชำระแล้วหุ้นสามัญ{{number}}หุ้นชำระเต็มมูลค่าแล้ว,ทุนที่ออกและชำระแล้วหุ้นสามัญ{{number}}หุ้นชำระเต็มมูลค่าแล้ว,310220,310200,"['125,615,708', '125,615,708']"
ส่วนเกินมูลค่าหุ้น,ส่วนเกินมูลค่าหุ้น,310420,310400,"['775,201,216', '775,201,216']"
องค์ประกอบอื่นของส่วนของเจ้าของ,องค์ประกอบอื่นของส่วนของเจ้าของ,319990,319900,"['(169,928,724)', '(126,435,086)']"
สำรองตามกฎหมาย,สำรองตามกฎหมาย,310611,310610,"['18,000,000', '18,000,000']"
สำรองเพื่อรักษาระดับราคาหลักทรัพย์,สำรองเพื่อรักษาระดับราคาหลักทรัพย์,310619,310610,"['5,000,000', '5,000,000']"
สำรองเพื่อขยายกิจการ,สำรองเพื่อขยายกิจการ,310619,310610,"['10,000,000', '10,000,000']"
สำรองทั่วไป,สำรองทั่วไป,310619,310610,"['50,000,000', '50,000,000']"
ยังไม่ได้จัดสรร,ยังไม่ได้จัดสรร,310620,310600,"['353,292,983', '400,340,892']"
รวมส่วนของบริษัทใหญ่,รวมส่วนของบริษัทใหญ่,319999,309998,"['1,167,181,183', '1,257,722,730']"
ส่วนได้เสียที่ไม่มีอำนาจควบคุม,ส่วนได้เสียที่ไม่มีอำนาจควบคุม,320130,309998,"['59', '-']"
รวมส่วนของเจ้าของ,รวมส่วนของเจ้าของ,309998,309999,"['1,167,181,242', '1,257,722,730']"
รวมหนี้สินและส่วนของเจ้าของ,รวมหนี้สินและส่วนของเจ้าของ,309999,,"['1,487,035,627', '1,576,395,017']"
รายได้ค่าธรรมเนียมและบริการ,รายได้ค่าธรรมเนียมและบริการ,410113,410100,"['287,587,740', '287,594,750']"
รายได้ดอกเบี้ย,รายได้ดอกเบี้ย,410108,410100,"['3,257,092', '459,659']"
กำไรและผลตอบแทนจากเครื่องมือทางการเงิน,กำไรและผลตอบแทนจากเครื่องมือทางการเงิน,430190,430100,"['6,654,752', '5,464,656']"
รายได้อื่น,รายได้อื่น,410200,419999,"['278,008', '276,750']"
รวมรายได้,รวมรายได้,419999,409994,"['297,777,592', '293,795,815']"
ค่าใช้จ่ายผลประโยชน์พนักงาน,ค่าใช้จ่ายผลประโยชน์พนักงาน,422400,429999,"['124,279,978', '124,279,979']"
ค่าธรรมเนียมและบริการจ่าย,ค่าธรรมเนียมและบริการจ่าย,422200,429999,"['53,573,288', '53,573,288']"
ค่าใช้จ่ายดอกเบี้ย,ค่าใช้จ่ายดอกเบี้ย,429900,429999,"['959,721', '959,722']"
ค่าใช้จ่ายอื่น,ค่าใช้จ่ายอื่น,429800,429999,"['31,310,212', '31,263,043']"
รวมค่าใช้จ่าย,รวมค่าใช้จ่าย,429999,409994,"['210,123,199', '210,076,032']"
กำไรก่อนภาษีเงินได้,กำไรก่อนภาษีเงินได้,409994,409995,"['87,654,393', '83,719,783']"
ภาษีเงินได้,ภาษีเงินได้,439800,409995,"['16,540,613', '15,763,396']"
กำไรสำหรับงวด,กำไรสำหรับงวด,409991,409999,"['71,113,780', '67,956,387']"
ด้วยมูลค่ายุติธรรมผ่านกำไรขาดทุนเบ็ดเสร็จอื่น,ด้วยมูลค่ายุติธรรมผ่านกำไรขาดทุนเบ็ดเสร็จอื่น,450200,409998,"['(28,283,187)', '(32,848,836)']"
ภาษีเงินได้ของรายการที่จะไม่ถูกจัดประเภทรายการใหม่เข้าไปไว้ในกำไรหรือขาดทุนในภายหลัง,ภาษีเงินได้ของรายการที่จะไม่ถูกจัดประเภทรายการใหม่เข้าไปไว้ในกำไรหรือขาดทุนในภายหลัง,459900,409998,"['5,656,637', '6,569,767']"
กำไร(ขาดทุน)เบ็ดเสร็จอื่นรวม-สุทธิจากภาษี,กำไร(ขาดทุน)เบ็ดเสร็จอื่นรวม-สุทธิจากภาษี,409998,409999,"['(22,626,550)', '(26,279,069)']"
กำไรเบ็ดเสร็จรวมสำหรับงวด,กำไรเบ็ดเสร็จรวมสำหรับงวด,409999,,"['48,487,230 ', '41,677,318 ']"
ส่วนที่เป็นของบริษัทใหญ่,ส่วนที่เป็นของบริษัทใหญ่,460100,,"['71,113,780', '67,956,387 ']"
ส่วนที่เป็นของบริษัทใหญ่,ส่วนที่เป็นของบริษัทใหญ่,470100,,"['48,487,230 ', '41,677,318 ']"
กำไรต่อหุ้นขั้นพื้นฐาน,กำไรต่อหุ้นขั้นพื้นฐาน,480100,,"['0.57 ', '0.54 ']"
รายได้ค่าธรรมเนียมและบริการ,รายได้ค่าธรรมเนียมและบริการ,410113,410100,"['568,701,549', '568,715,568']"
รายได้ดอกเบี้ย,รายได้ดอกเบี้ย,410108,410100,"['6,375,548', '832,915']"
กำไรและผลตอบแทนจากเครื่องมือทางการเงิน,กำไรและผลตอบแทนจากเครื่องมือทางการเงิน,430190,430100,"['10,151,932', '7,892,989']"
รายได้อื่น,รายได้อื่น,410200,419999,"['624,152', '622,894']"
รวมรายได้,รวมรายได้,419999,409994,"['585,853,181', '578,064,366']"
ค่าใช้จ่ายผลประโยชน์พนักงาน,ค่าใช้จ่ายผลประโยชน์พนักงาน,422400,429999,"['248,932,291', '248,932,291']"
ค่าธรรมเนียมและบริการจ่าย,ค่าธรรมเนียมและบริการจ่าย,422200,429999,"['102,297,413', '102,297,413']"
ค่าใช้จ่ายดอกเบี้ย,ค่าใช้จ่ายดอกเบี้ย,429900,429999,"['2,063,457', '2,063,457']"
ค่าใช้จ่ายอื่น,ค่าใช้จ่ายอื่น,429800,429999,"['61,596,322', '61,499,863']"
รวมค่าใช้จ่าย,รวมค่าใช้จ่าย,429999,409994,"['414,889,483', '414,793,024']"
กำไรก่อนภาษีเงินได้,กำไรก่อนภาษีเงินได้,409994,409995,"['170,963,698', '163,271,342']"
ภาษีเงินได้,ภาษีเงินได้,439800,409995,"['32,919,404 ', '31,495,752']"
กำไรสำหรับงวด,กำไรสำหรับงวด,409991,409999,"['138,044,294', '131,775,590']"
ด้วยมูลค่ายุติธรรมผ่านกำไรขาดทุนเบ็ดเสร็จอื่น,ด้วยมูลค่ายุติธรรมผ่านกำไรขาดทุนเบ็ดเสร็จอื่น,450200,409998,"['6,301,594 ', '(19,124,610)']"
ภาษีเงินได้ของรายการที่จะไม่ถูกจัดประเภทรายการใหม่เข้าไปไว้ในกำไรหรือขาดทุนในภายหลัง,ภาษีเงินได้ของรายการที่จะไม่ถูกจัดประเภทรายการใหม่เข้าไปไว้ในกำไรหรือขาดทุนในภายหลัง,459900,409998,"['(1,260,319)', '3,824,922']"
กำไร(ขาดทุน)เบ็ดเสร็จอื่นรวม-สุทธิจากภาษี,กำไร(ขาดทุน)เบ็ดเสร็จอื่นรวม-สุทธิจากภาษี,409998,409999,"['5,041,275 ', '(15,299,688)']"
กำไรเบ็ดเสร็จรวมสำหรับงวด,กำไรเบ็ดเสร็จรวมสำหรับงวด,409999,,"['143,085,569 ', '116,475,902 ']"
ส่วนที่เป็นของบริษัทใหญ่,ส่วนที่เป็นของบริษัทใหญ่,460100,,"['138,044,293 ', '131,775,590']"
ส่วนที่เป็นของส่วนได้ส่วนเสียที่ไม่มีอำนาจควบคุม,ส่วนที่เป็นของส่วนได้ส่วนเสียที่ไม่มีอำนาจควบคุม,460200,,"['1', '-']"
ส่วนที่เป็นของบริษัทใหญ่,ส่วนที่เป็นของบริษัทใหญ่,470100,,"['143,085,565 ', '116,475,902 ']"
ส่วนที่เป็นของส่วนได้ส่วนเสียที่ไม่มีอำนาจควบคุม,การแบ่งปันกำไร (ขาดทุน) เบ็ดเสร็จรวม : ส่วนได้เสียที่ไม่มีอำนาจควบคุม,470200,,"['4 ', '-']"
กำไรต่อหุ้นขั้นพื้นฐาน,กำไรต่อหุ้นขั้นพื้นฐาน,480100,,"['1.10 ', '1.05 ']"
กำไรก่อนภาษีเงินได้,กำไรก่อนภาษีเงินได้,510200,519997,"['170,963,698', '163,271,342']"
ค่าเสื่อมราคาและรายจ่ายตัดบัญชี,ค่าเสื่อมราคาและรายจ่ายตัดบัญชี,510300,519997,"['26,103,920', '26,103,920']"
(กำไร)ขาดทุนจากการเปลี่ยนแปลงในมูลค่ายุติธรรมในเงินลงทุน,(กำไร) ขาดทุนจากการเปลี่ยนแปลงมูลค่ายุติธรรมของเงินลงทุน,511400,519997,"['268,396', '279,056']"
(กำไร)ขาดทุนจากการขายเงินลงทุน,(กำไร)ขาดทุนจากการขายเงินลงทุน,511000,519997,"['(383,848)', '(383,848)']"
ขาดทุนจากการด้อยค่าการตัดจำหน่ายและการจำหน่ายสินทรัพย์,ขาดทุนจากการด้อยค่าการตัดจำหน่ายและการจำหน่ายสินทรัพย์,511520,511500,"['245,141', '245,131']"
ภาระผูกพันหนี้สินผลประโยชน์พนักงาน,ภาระผูกพันหนี้สินผลประโยชน์พนักงาน,514910,519997,"['7,127,089', '7,127,089']"
ค่าใช้จ่ายดอกเบี้ย,ค่าใช้จ่ายดอกเบี้ย,514800,519997,"['2,063,457', '2,063,457']"
รายได้ดอกเบี้ย,รายได้ดอกเบี้ย,514720,514700,"['(6,375,548)', '(832,915)']"
รายได้เงินปันผล,รายได้เงินปันผล,514710,514700,"['(10,036,480)', '(7,788,197)']"
กำไรจากการดำเนินงานก่อนการเปลี่ยนแปลงในสินทรัพย์และหนี้สินดำเนินงาน,กำไรจากการดำเนินงานก่อนการเปลี่ยนแปลงในสินทรัพย์และหนี้สินดำเนินงาน,519997,519998,"['189,975,825', '190,085,035']"
รายได้ค่าธรรมเนียมและบริการค้างรับจากธุรกิจจัดการลงทุน,รายได้ค่าธรรมเนียมและบริการค้างรับจากธุรกิจจัดการลงทุน,515700,519998,"['53,117,633', '53,117,633']"
เงินลงทุนที่ไม่ได้วางเป็นประกัน,เงินลงทุนที่ไม่ได้วางเป็นประกัน,516100,519998,"['120,633,090', '141,487,505']"
เงินลงทุนที่วางเป็นประกัน,เงินลงทุนที่วางเป็นประกัน,516600,519998,"['60,000', '60,000']"
สินทรัพย์อื่น,สินทรัพย์อื่น,516600,519998,"['(3,749,553)', '(3,805,955)']"
จ่ายชำระหนี้สินผลประโยชน์พนักงาน,จ่ายชำระหนี้สินผลประโยชน์พนักงาน,518700,519998,"['(1,198,405)', '(1,198,405)']"
ค่าใช้จ่ายค้างจ่าย,ค่าใช้จ่ายค้างจ่าย,518900,519998,"['(75,984,776)', '(75,962,775)']"
หนี้สินอื่น,หนี้สินอื่น,518300,519998,"['(7,220,961)', '(7,205,170)']"
เงินสดรับจากการดำเนินงาน,เงินสดรับจากการดำเนินงาน,519998,519999,"['275,632,853', '296,577,868']"
ภาษีเงินได้จ่ายออก,ภาษีเงินได้จ่ายออก,519900,519999,"['(34,301,242)', '(32,734,331)']"
เงินสดสุทธิได้มาจากกิจกรรมดำเนินงาน,เงินสดสุทธิได้มาจากกิจกรรมดำเนินงาน,519999,509999,"['241,331,611', '263,843,537']"
เงินสดจ่ายซื้ออุปกรณ์,เงินสดจ่ายซื้ออุปกรณ์,521710,521700,"['(260,772)', '(260,772)']"
เงินสดจ่ายซื้อสินทรัพย์ไม่มีตัวตน,เงินสดจ่ายซื้อสินทรัพย์ไม่มีตัวตน,521720,521700,"['(898,150)', '(898,150)']"
ดอกเบี้ยรับ,ดอกเบี้ยรับ,529500,529999,"['464,373', '344,125']"
เงินปันผลรับ,เงินปันผลรับ,529700,529999,"['10,036,480', '18,789,845']"
เงินสดสุทธิได้มาจากกิจกรรมลงทุน,เงินสดสุทธิได้มาจากกิจกรรมลงทุน,529999,509999,"['9,341,931', '17,975,048']"
จ่ายเงินปันผล,จ่ายเงินปันผล,539800,539999,"['(270,073,772)', '(270,073,772)']"
จ่ายชำระหนี้สินตามสัญญาเช่า,จ่ายชำระหนี้สินตามสัญญาเช่า,530500,539999,"['(22,111,752)', '(22,111,752)']"
จ่ายดอกเบี้ย,จ่ายดอกเบี้ย,539600,539999,"['(2,062,443)', '(2,062,443)']"
เงินสดสุทธิใช้ไปในกิจกรรมจัดหาเงิน,เงินสดสุทธิใช้ไปในกิจกรรมจัดหาเงิน,539999,509999,"['(294,247,967)', '(294,247,967)']"
เงินสดและรายการเทียบเท่าเงินสดเพิ่มขึ้น(ลดลง)สุทธิ,เงินสดและรายการเทียบเท่าเงินสดเพิ่มขึ้น(ลดลง)สุทธิ,509999,599999,"['(43,574,425)', '(12,429,382)']"
เงินสดและรายการเทียบเท่าเงินสดณวันต้นงวด,เงินสดและรายการเทียบเท่าเงินสดณวันต้นงวด,599998,599999,"['229,830,407', '195,180,711']"
เงินสดและรายการเทียบเท่าเงินสดณวันปลายงวด,เงินสดและรายการเทียบเท่าเงินสดณวันปลายงวด,599999,,"['186,255,982', '182,751,329']"
