account_name,taxonomy_account_name,account_code,parent_account_code,values
ขาดทุน(กำไร)จากการปรับมูลค่ายุติธรรมและอื่นๆ,ขาดทุน(กำไร)จากการปรับมูลค่ายุติธรรมและอื่นๆ,515000,519997,"['(623,744)']"
ลูกหนี้การค้าและลูกหนี้หมุนเวียนอื่น,ลูกหนี้การค้าและลูกหนี้หมุนเวียนอื่น,515800,519998,"['(10,709,558)']"
สินค้าคงเหลือ,สินค้าคงเหลือ,516300,519998,"['(3,320,322)']"
สินทรัพย์อื่น,สินทรัพย์อื่น,516600,519998,"['(541,707)']"
เจ้าหนี้การค้าและเจ้าหนี้หมุนเวียนอื่น,เจ้าหนี้การค้าและเจ้าหนี้หมุนเวียนอื่น,517600,519998,"['691,494']"
ประมาณการหนี้สินไม่หมุนเวียนสำหรับผลประโยชน์พนักงาน,ประมาณการหนี้สินไม่หมุนเวียนสำหรับผลประโยชน์พนักงาน,518700,519998,"['(262,934)']"
หนี้สินอื่น,หนี้สินอื่น,518300,519998,"['12,603']"
กระแสเงินสดสุทธิได้มาจากการดำเนินงาน,กระแสเงินสดสุทธิได้มาจากการดำเนินงาน,519998,519999,"['15,906,610']"
จ่ายภาษีเงินได้,จ่ายภาษีเงินได้,519900,519999,"['(4,007,578)']"
กระแสเงินสดสุทธิได้มาจากกิจกรรมดำเนินงาน,กระแสเงินสดสุทธิได้มาจากกิจกรรมดำเนินงาน,519999,509999,"['11,899,032']"
เงินสดจ่ายเพื่อซื้อบริษัทย่อยสุทธิจากเงินสดที่ได้มา,เงินสดจ่ายเพื่อซื้อบริษัทย่อยสุทธิจากเงินสดที่ได้มา,521200,529999,"['(514,096)']"
เงินสดจ่ายเพื่อซื้อส่วนได้เสียในการร่วมค้าและบริษัทร่วม,เงินสดจ่ายเพื่อซื้อส่วนได้เสียในการร่วมค้าและบริษัทร่วม,521200,529999,"['(1,200,605)']"
เงินสดรับจากการขายตราสารทุนและตราสารหนี้ของกิจการอื่น,เงินสดรับจากการขายตราสารทุนและตราสารหนี้ของกิจการอื่น,520210,520200,"['19,603,216']"
เงินสดจ่ายเพื่อซื้อตราสารทุนและตราสารหนี้ของกิจการอื่น,เงินสดจ่ายเพื่อซื้อตราสารทุนและตราสารหนี้ของกิจการอื่น,520300,529999,"['(11,769,155)']"
เงินสดรับจากการขายที่ดินอาคารและอุปกรณ์,เงินสดรับจากการขายที่ดินอาคารและอุปกรณ์,521610,521600,"['310,106']"
เงินสดจ่ายเพื่อซื้อที่ดินอาคารและอุปกรณ์และสินทรัพย์ไม่มีตัวตน,เงินสดจ่ายเพื่อซื้อที่ดินอาคารและอุปกรณ์และสินทรัพย์ไม่มีตัวตน,521700,529999,"['(20,187,124)']"
เงินสดจ่ายจากเงินให้กู้ยืม,เงินสดจ่ายจากเงินให้กู้ยืม,521400,529999,"['(9,739)']"
รับเงินปันผล,รับเงินปันผล,529700,529999,"['7,642,711']"
รับดอกเบี้ย,รับดอกเบี้ย,529500,529999,"['528,160']"
กระแสเงินสดสุทธิใช้ไปในกิจกรรมลงทุน,กระแสเงินสดสุทธิใช้ไปในกิจกรรมลงทุน,529999,509999,"['(5,596,526)']"
เงินสดรับจากการเปลี่ยนแปลงส่วนได้เสียในบริษัทย่อยที่ไม่ได้มีผลทำให้สูญเสียการควบคุม,เงินสดรับจากการเปลี่ยนแปลงส่วนได้เสียในบริษัทย่อยที่ไม่ได้มีผลทำให้สูญเสียการควบคุม,531700,539999,"['599,000']"
เงินสดจ่ายจากการเปลี่ยนแปลงส่วนได้เสียในบริษัทย่อยที่ไม่ได้มีผลทำให้สูญเสียการควบคุม,เงินสดจ่ายจากการเปลี่ยนแปลงส่วนได้เสียในบริษัทย่อยที่ไม่ได้มีผลทำให้สูญเสียการควบคุม,531800,539999,"['(22,715)']"
เงินเบิกเกินบัญชีและเงินกู้ยืมระยะสั้นเพิ่มขึ้น,เงินเบิกเกินบัญชีและเงินกู้ยืมระยะสั้นเพิ่มขึ้น,530100,539999,"['22,248,244']"
เงินสดรับจากเงินกู้ยืมระยะยาว,เงินสดรับจากเงินกู้ยืมระยะยาว,530320,530300,"['1,526,097']"
เงินสดจ่ายเพื่อชำระเงินกู้ยืมระยะยาว,เงินสดจ่ายเพื่อชำระเงินกู้ยืมระยะยาว,530420,530400,"['(3,290,731)']"
เงินสดจ่ายเพื่อชำระหนี้สินตามสัญญาเช่า,เงินสดจ่ายเพื่อชำระหนี้สินตามสัญญาเช่า,530500,539999,"['(1,520,443)']"
เงินสดรับจากการออกหุ้นกู้,เงินสดรับจากการออกหุ้นกู้,530700,539999,"['29,949,167']"
เงินสดจ่ายเพื่อไถ่ถอนหุ้นกู้,เงินสดจ่ายเพื่อไถ่ถอนหุ้นกู้,530800,539999,"['(29,944,631)']"
จ่ายเงินปันผลให้ผู้ถือหุ้นของบริษัท,จ่ายเงินปันผล,539800,539999,"['(11,999,516)']"
จ่ายเงินปันผลให้ส่วนได้เสียที่ไม่มีอำนาจควบคุม,จ่ายเงินปันผลให้ส่วนได้เสียที่ไม่มีอำนาจควบคุม,539800,539999,"['(1,932,650)']"
จ่ายดอกเบี้ยและต้นทุนทางการเงินอื่น,จ่ายดอกเบี้ยและต้นทุนทางการเงินอื่น,539600,539999,"['(4,377,060)']"
กระแสเงินสดสุทธิได้มาจาก(ใช้ไปใน)กิจกรรมจัดหาเงิน,กระแสเงินสดสุทธิได้มาจาก(ใช้ไปใน)กิจกรรมจัดหาเงิน,539999,509999,"['1,234,762']"
เงินสดและรายการเทียบเท่าเงินสดเพิ่มขึ้น(ลดลง)-สุทธิ,เงินสดและรายการเทียบเท่าเงินสดเพิ่มขึ้น(ลดลง)-สุทธิ,509999,599999,"['7,537,268']"
ผลกระทบของอัตราแลกเปลี่ยนที่มีต่อเงินสดและรายการเทียบเท่าเงินสด,ผลกระทบของอัตราแลกเปลี่ยนที่มีต่อเงินสดและรายการเทียบเท่าเงินสด,540100,599999,"['916,508']"
เงินสดและรายการเทียบเท่าเงินสดณวันต้นงวด,เงินสดและรายการเทียบเท่าเงินสดณวันต้นงวด,599998,599999,"['35,992,841']"
เงินสดและรายการเทียบเท่าเงินสดณวันสิ้นงวด,เงินสดและรายการเทียบเท่าเงินสดณวันสิ้นงวด,599999,,"['44,446,617']"
